en_text,pl_text,dialog_prototype,chrf_dialog_prototype,bleu_dialog_prototype,bertscore_dialog_prototype,comet_dialog_prototype
"Take what you want, I'm just here for some placards.","Bierz, co chcesz, ja przyszedłem tu tylko po plakaty.","Weź co chcesz, ja tu jestem tylko po plakaty.",0.5429985640106584,0.20744432576282615,0.8920625448226929,0.9325230717658997
The fight is done! Geralt of Rivia wins! Behold our new champion!,Walka skończona! Zwycięzcą został Geralt z Rivii! Nowy mistrz!,Walka skończona! Geralt z Rivii zwycięża! Oto nasz nowy mistrz!,0.6392415965472358,0.06674094719041482,0.8861642479896545,0.9592489004135132
Don't like secrets?,Nie lubisz tajemnic?,Nie lubisz tajemnic?,1.0,0.5623413251903491,0.9999999403953552,0.9952998757362366
…is a witch and she's to burn!,Znaczy się wiedźma i ją trza spalić!,To czarownica i trzeba ją spalić!,0.28615450012570964,0.045480190470279055,0.8082006573677063,0.8504639267921448
So I thought to meself… Maybe you…?,Więc pomyślałam... Że może wy...?,Pomyślałam sobie... Może ty...?,0.4163378687604891,0.0,0.8827669620513916,0.9324036836624146
Thought you'd give up this nonsense once I put a ring on your finger!,"Myślałem, że jak ci się oświadczę, to zrezygnujesz z tych głupot!","Myślałem, że rzucisz te głupoty, gdy tylko włożę ci pierścionek na palec.",0.3288446804267409,0.03986357128268015,0.7584635615348816,0.7695346474647522
"Come, now… It was surely your belly growling. You must have sat there too long on an empty stomach. Speaking of… shall we dine?","E, tam. W brzuchu miałeś pomruki, boś za długo o pustym żołądku siedział. Właśnie... Zjemy coś?","No cóż... Byłem w saunie... I usłyszałem coś w rodzaju pomrukiwania dochodzącego spod spodu. ""Maaaargh. Buerrgh"" - coś w tym stylu.",0.23938334805840644,0.0,0.6726016402244568,0.5910323262214661
Mhm. Some werebbubbs.,Mhm. Na bobołaki.,"Tak, były pewne komplikacje.",0.1048611111111112,0.0,0.6319250464439392,0.5727660655975342
Where's that damned katakan?,Gdzie jest ten przeklęty katakan?,Gdzie jest ten cholerny katakan?,0.6174856083385661,0.28574404296988,0.9067450165748596,0.92463219165802
I always keep my word.,Zawsze dotrzymuję słowa.,Zawsze dotrzymuję słowa.,1.0,0.5623413251903491,1.0,0.9933733344078064
"Here, put this on.",Masz. Załóż ten naszyjnik.,"Daj, załóż to na siebie.",0.20691221290042963,0.0,0.7809830904006958,0.6213974356651306
"Huh? To the swamp, gonna dig up some peat. Where else would I be goin'?","Jak to gdzie? Nie na grzyby przecie. Na bagna idę, torfu nakopać.","Huh? Do bagien, idę wykopać trochę torfu. Gdzie indziej mógłbym iść?",0.2335361872677526,0.0,0.7348097562789917,0.6573835611343384
So will you visit your mum after all?,Czyli jednak jedziesz do matki w odwiedziny?,"No cóż, to może odwiedzisz mamę po tym wszystkim?",0.24402111545877317,0.0,0.7165359854698181,0.8273003101348877
"By the way, that spectacle with the coin - what was that?",À propos: o co chodziło z tymi pieniędzmi?,"Przy okazji, ten spektakl z monetą - co to było?",0.1135418035299786,0.025098621243978974,0.7217819690704346,0.670505702495575
Oh my?!,Ejże?!,O mój Boże!,0.13726664670060904,0.0,0.7808682918548584,0.7290093898773193
I haven't strength for anything.,Nie mam na nic siły.,Nie mam siły na nic.,0.5408841158841159,0.12574334296829354,0.9347580671310425,0.9822095036506653
Yes. Be quiet and try not to disturb me.,Tak. Stój cicho i nie przeszkadzaj.,Tak. Bądź cicho i spróbuj mnie nie rozpraszać.,0.29039788114287074,0.06985342056580097,0.8358397483825684,0.920677661895752
What's he doing here?,A ten co tu robi?,Co on tutaj robi?,0.2924603502104,0.06257106818159155,0.779556930065155,0.8980897665023804
What here you for?,Co tu szukasz?,Po co tu jesteś?,0.11540220361102455,0.08034284189446518,0.7998494505882263,0.9141333103179932
"You know, can you defeat yourself? Are you willing to?",No wiesz: czy jesteś w stanie pokonać samego siebie?,"Wiesz, czy możesz pokonać samą siebie? Czy jesteś gotowa spróbować?",0.4931752867614601,0.02984745896009824,0.8305280208587646,0.9311925768852234
Uh-oh.,Ocho.,Ups!,1.0000000000000001e-16,0.0,0.6781240701675415,0.6075502038002014
"Scoia'tael, you say? And I thought we'd exterminated the last of those vermin. And the nonhumans left had wised up. Well, seems we'll need to pacify 'em again. Make a list of all the long-ears around, hang every tenth one… that should do it.","Scoia'tael, powiadasz? A myślałem, że już żeśmy wybili te szkodniki do ostatniego. Że nieludzie zmądrzały. No, to trzeba będzie ich usadzić. Zrobi się spis długouchych w okolicy, powiesi co dziesiątego, to się uspokoją.","Scoia'tael, mówisz? Myślałem, że wyeliminowaliśmy już cały ten plugastwo. A pozostałe nie-ludzkie stworzenia najwyraźniej zmądrzały. Cóż, chyba będziemy musieli ich ponownie uspokoić. Sporządźcie listę wszystkich długouchych w okolicy, powiesić co dziesiątego... To powinno załatwić sprawę.",0.4935395714132702,0.03551851328486764,0.8029811382293701,0.6861544847488403
Anything new in Fyresdal?,Co nowego w Fyresdal?,Czy coś nowego wydarzyło się we Fyresdal?,0.6428090979497717,0.039281465090051315,0.8656299710273743,0.9348583817481995
Got me break now.,Tera mam przerwę.,Mam teraz przerwę.,0.5291852265564337,0.11362193664674995,0.8607011437416077,0.9706215858459473
Keep out of this. The witcher'll be paid from the coffers of the Temple Guard. Just as soon as he kills the monster…,Nie wtrącaj się. Wiedźmin dostanie nagrodę z pieniędzy straży. Jak tylko zabije potwora...,Nie mieszaj się w to. Wiedźmin zostanie opłacony ze skarbca Straży Świątynnej. Jak tylko zabije potwora...,0.5539089773646598,0.16943571815930883,0.8377775549888611,0.8211473226547241
Your beard. Why'd you decide to grow it out?,Twoja broda. Skąd ten pomysł?,Dlaczego postanowiłeś zapuścić brodę?,0.15095888644678096,0.0,0.7359115481376648,0.7000523805618286
How was I not to? I was a soldier! I had no choice.,Jak mogłem jej nie zostawiać samej? Byłem żołnierzem! Nie miałem wyboru...,Jak miałem nie? Byłem żołnierzem! Nie miałem wyboru.,0.5792844620002785,0.2512421854739509,0.8657501935958862,0.7600612044334412
I haven't even got the coin for the journey home. And with each day's delay I draw closer to bankruptcy!,"Nie mam nawet za co wrócić do domu, a każdy dzień opóźnienia zbliża mnie do bankructwa...",Nie mam nawet pieniędzy na podróż do domu. A z każdym dniem zwłoki zbliżam się do bankructwa!,0.46660493718960266,0.06468490584192432,0.8085041046142578,0.7520890831947327
"Out of my way, old man… And I shall spare your life.","Zejdź z drogi, dziadku... A daruję ci życie.","Z drogi, stary człowieku... I oszczędzę twoje życie.",0.3202625967631662,0.03303164318013808,0.7975737452507019,0.6175276041030884
"He is intent on my gift not falling into the wrong hands, not spinning out of control. It's why he teaches me, protects me.","Jemu zależy na tym, żeby mój dar nie wpadł w niepowołane ręce, nie wymknął się spod kontroli. Dlatego mnie uczy i chroni.","On chce mieć pewność, że mój dar nie trafi w niewłaściwe ręce i nie wymknie się spod kontroli. Dlatego mnie uczy, chroni.",0.546167974383229,0.23933115010284958,0.8830686211585999,0.9427668452262878
"Once, I told me brother that uncle… did bad things to me. Yorg flew in a rage and killed him. Then they caught 'im and tied 'im to the rocks.","Raz powiedziałam mojemu bratu, że wujek... mi robił złe rzeczy. I Yorg się wściekł i go zabił. A potem go złapali i przykuli do skały.","Raz powiedziałam bratu, że wuj... robił mi złe rzeczy. Jorg wpadł we wściekłość i go zabił. Potem go złapali i przywiązali do skał.",0.6151732644640573,0.09139872434573212,0.9137355089187622,0.9147077202796936
We must activate it quickly. I've a feeling another golem's about to surprise us.,"Aktywujmy go szybko, bo mam wrażenie, że zaraz wyleci na nas następny golem.","Musimy to szybko aktywować. Czuję, że kolejny golem zaraz nas zaskoczy.",0.30176624817675957,0.02068408840048898,0.7832578420639038,0.7652392983436584
Never mind. Take care.,Nieważne. Bywaj.,Nieważne. Dbaj o siebie.,0.5308264095438714,0.08034284189446518,0.8624493479728699,0.8196297883987427
"Make offerings to the temples and chapels of the Eternal Fire, and the horror of war will bypass our fair city!","Wasza ofiara na świątynie i kaplice Wiecznego Ognia sprawi, że pożoga wojenna oszczędzi Novigrad!","Składajmy ofiary w świątyniach i kapliczkach Wiecznego Ognia, aby okropności wojny ominęły nasze piękne miasto!",0.3804575926828715,0.015718877363021206,0.7615821957588196,0.8012054562568665
Shouldn't be hard. He were the only lad in a group o' women.,"No, to nie powinno być za trudne, bo był jedynym chłopem w całej grupie.",Nie powinno być trudno. Był jedynym chłopakiem w grupie kobiet.,0.5218502981792782,0.035578658668572044,0.847930908203125,0.8608416318893433
Go yerself. You know only Miss Tammy could calm his rages.,"Sam se idź, wiesz, że tylko córka umiała go udobruchać.",Idź sam. Tylko panna Tammy potrafi uspokoić jego gniew.,0.14575386536264215,0.0,0.7520567178726196,0.7315205931663513
This shall haunt you forever.,Nigdy się od tego nie uwolnisz.,To będzie cię prześladować przez całą wieczność.,0.10914968580872479,0.0,0.6774578094482422,0.7781595587730408
"C'mon, thump 'im!",No przywal mu!,"Chodź, uderz go!",0.08318696330991421,0.0,0.7814909219741821,0.7107903957366943
So it ended well.,Czyli wszystko dobrze się skończyło?,"Tak, skończyło się dobrze.",0.38196677368292287,0.06257106818159155,0.7669383883476257,0.9417885541915894
From now on assume your every move's observed.,"Od teraz, każdy twój ruch jest obserwowany.","Od teraz zakładaj, że każdy twój ruch jest obserwowany.",0.8750071791867459,0.4671379777282001,0.9238525629043579,0.9459782242774963
"Maybe he'll make an exception, share them with me?",Może dla mnie zrobi wyjątek.,Może zrobi wyjątek i podzieli się nimi ze mną?,0.5771985408086475,0.028517539529041507,0.8306458592414856,0.918809175491333
Wanna hop over the village? Remind the bumpkins who we are?,Chcesz ze mną do wsi wyskoczyć? Chłopom się przypomnieć?,Chcesz przejechać przez wieś? Przypomnieć kmiotkom kim jesteśmy?,0.32031293398189203,0.024512401940754224,0.7943304181098938,0.8214002847671509
You know the kids from the clearing well?,Dobrze znasz dzieciaki z polany?,Czy dobrze znasz dzieci z polany?,0.7728657105106381,0.09554427922043669,0.896465003490448,0.9724363684654236
How'd you even wind up out here?,To po co właściwie się tu zapuszczałeś?,Jak się tu w ogóle znalazłeś?,0.17657805505938326,0.07308015504567583,0.811204195022583,0.8653455972671509
"Mhm. A she-elf. Claimed you hate Ciri. So how's that fit you trying to protect her, whatever the cost?","Tak. Elfkę, która twierdziła, że nienawidzisz Ciri. I jak to się ma do chronienia jej za wszelką cenę?","Mhm. Elfka. Twierdziła, że nienawidzisz Ciri. Więc jak to się ma do twoich prób jej ochrony, bez względu na koszty?",0.5591634266208403,0.24688498672025874,0.8199735879898071,0.745649516582489
Oomph!,Uch!,Uff!,0.08333333333333343,0.0,0.9289565086364746,0.9238156080245972
Took 'em down? To hang a golden sun there now?,Zdjęłaś? Może złote słońce zawiesisz?,Zdjęła ich? Żeby teraz powiesić tam złote słońce?,0.4837347277475559,0.02777619034011792,0.856813907623291,0.7615388035774231
"Guardsh, 'e's a killer…","Straż, mordujo!","Strażnik, on to zabójca...",0.23069418591699012,0.0,0.7578974366188049,0.7294221520423889
All right… You'll want to see Madame Irina to get the details.,Skoro tak... Zgłoście się do madame Iriny po szczegóły.,"Chcesz zobaczyć się z Madame Iraną, żeby uzyskać szczegóły.",0.3143561151599949,0.028517539529041507,0.719265878200531,0.6674777865409851
Wait for me a minute.,Zaczekaj jeszcze chwilę.,Poczekaj chwilę.,0.41235031420008067,0.09069748827745895,0.9366248846054077,0.9688528776168823
"Eternal Fire, hear our prayer.",Niechaj Wieczny Ogień wysłucha próśb naszych.,"Wieczny Ognia, wysłuchaj naszej modlitwy.",0.40478371802104296,0.0439891724758422,0.7801235318183899,0.7513008117675781
They say where they were headed?,"Mówili, dokąd pójdą?","Czy wiesz, dokąd zmierzali?",0.27215206384226437,0.08034284189446518,0.8378289341926575,0.8751978278160095
"Tan, marvorae, cynnaeu!","Tan, marvorae, cynnaeu!","Tan, marvorae, cynnaeu!",1.0,0.5623413251903491,1.0,0.9805666208267212
Getting better by the minute.,Coraz lepiej.,Poprawiając się z minuty na minutę.,0.10963919082125612,0.0,0.6991062164306641,0.6506037712097168
I don't smell nothin'.,Ja tam nic nie czuję.,Nic nie czuję.,0.6011415558648395,0.12336445138236939,0.8979633450508118,0.9295138120651245
And the Fourth - who were she?,A kim była Czwarta?,Kim była czwarta?,0.5735633657964004,0.0814136751754278,0.8519513607025146,0.9719021320343018
What?! That's against every law!,Co?! To wbrew wszelkim prawom!,Co?! To jest sprzeczne ze wszystkimi prawami!,0.3188407845265216,0.06985342056580097,0.8388633131980896,0.9709488749504089
"You know… perhaps it's not my concern, but… I'm glad you and Yennefer have ended up together.","Wiesz... Może to nie moja sprawwa, ale... Cieszę się, że w końcu zeszliście się z Yennefer.","Może nie powinnam się wtrącać, ale cieszę się, że ty i Yennefer... jesteście razem.",0.3677001593469021,0.03292600974922131,0.7737798690795898,0.815427303314209
Comin' to get you.,Idę po ciebie.,Idę po ciebie.,1.0,0.5623413251903491,1.0000001192092896,0.9832398891448975
"You'll die, scum.","Zginiesz, łajzo.","Umrzesz, szumowino.",0.1949270661042918,0.0,0.7502097487449646,0.7650316953659058
Death awaits us all. All.,Wszystkich nas czeka śmierć. Wszystkich.,Śmierć czeka nas wszystkich. Nas wszystkich.,0.5859816790075824,0.048549177170732344,0.7539951801300049,0.914031445980072
Ah! You may know about wine… but you remain quite unsophisticated otherwise.,"No, znasz się może na winach... Ale z manierami już gorzej.",Ach! Możesz coś wiedzieć o winie... ale pozostajesz dość niewyrafinowany w innych sprawach.,0.20068894224356404,0.0,0.7466739416122437,0.8490554690361023
"Someone chased them, they fought. Ciri was wounded but managed to escape.","Ktoś ich gonił, doszło do walki. Ciri została raniona, ale uciekła.","Ktoś ich gonił, walczyli. Ciri została ranna, ale udało jej się uciec.",0.5893223291989307,0.11094660471566163,0.906539797782898,0.9495301246643066
Known Dudu long?,Jak długo znasz Dudu?,Znasz Dudu od dawna?,0.3863081881594513,0.0,0.7566834688186646,0.9217028021812439
I'll answer it. From very far south indeed. From a land called Nilfgaard.,"Ja wam odpowiem. Z bardzo dalekiego południa. Z krainy, którą zowią Nilfgaard.",Odpowiem na pytanie. Z bardzo dalekiego południa rzeczywiście. Z krainy zwanej Nilfgaard.,0.6320023692142183,0.09578464408619825,0.8388943672180176,0.9110378623008728
"Well, well, guess this cabaret's the real thing.","No, no, widzę, że z tym kabaretem to poważna sprawa.","No cóż, no cóż, chyba ten kabaret to nie żarty.",0.2175200210569087,0.021105340631872645,0.7682985663414001,0.7409021854400635
Arrrgh!,Arghh!,Ach!,0.12092911877394645,0.0,0.8826702833175659,0.872160792350769
"Good to see you again, master.",Dobrze cię znów wiedzieć.,"Dobrze cię widzieć ponownie, mistrzu.",0.4916082120528773,0.11362193664674995,0.8652404546737671,0.8733574748039246
Just… sorta happened.,Tak jakoś wyszło.,Po prostu... tak jakoś wyszło.,0.8430846579645858,0.11362193664674995,0.8800299763679504,0.9418016672134399
"Control yourself, fiery one.","Opanuj się, gwałtowniku.","Uspokój się, porywcza jedna.",0.17946801191092174,0.08034284189446518,0.7753065824508667,0.45380502939224243
We're here. From this spot you must reach the top of that mount.,Jesteśmy na miejscu. Stąd ruszycie na szczyt tamtej góry.,Jesteśmy tutaj. Stąd musisz dotrzeć na szczyt tej góry.,0.4751279279834903,0.06376715693797415,0.8958876729011536,0.9222196340560913
Why do you think the kids from the meadow are in danger?,"Dlaczego uważasz, że dzieci na polanie są w niebezpieczeństwie?","Dlaczego myślisz, że dzieci z łąki są w niebezpieczeństwie?",0.6465618946268611,0.1561969968460128,0.9327160716056824,0.9660236239433289
"Is that something you'd consider, witcher? Care to partake of some sophisticated diversion?","Co o tym sądzisz, wiedźminie? Masz ochotę zakosztować wielkomiejskich rozrywek?","Czy byłbyś skłonny nam towarzyszyć, czarodzieju? Chciałbyś skorzystać z nieco bardziej wyrafinowanej rozrywki?",0.21731361979532463,0.0,0.6881546974182129,0.7070659399032593
"My dear sister, I would never spend time alone with a man for whom you burn with a secret passion.","Siostrzyczko, nie ważyłabym się umawiać z kimś, do kogo pałasz skrytym uczuciem.","Moja droga siostro, nigdy nie spędziłabym czasu sam na sam z mężczyzną, dla którego ty płoniesz tajemną namiętnością.",0.23568425606796417,0.01284618972676772,0.772514820098877,0.7856785655021667
"So, uh… do I… spoon-feed you?",Czyli... mam cię... nakarmić?,Więc... czy mam cię karmić łyżeczką?,0.35337536249125184,0.040824829046386304,0.7618416547775269,0.8216405510902405
Where?,Dokąd?,Gdzie?,0.05555555555555564,0.0,0.9077975153923035,0.8795561194419861
"No, I'm more likely to.",Już prędzej ja bym się rozmyślił.,"Nie, ja raczej zmienię zdanie.",0.11549212556369348,0.0439891724758422,0.6922522187232971,0.6828638911247253
Oh...! And who is that!,Och! A któż to?,Och...! A kto to jest!,0.269785438031209,0.05372849659117709,0.8672707676887512,0.9573814272880554
Nooooooo!,Nieeeee!,Noooooo!,0.04166666666666676,0.0,0.9014685750007629,0.9590204358100891
Very well… We seek the corpse of a dwarven woodcarver.,Dobra... Szukamy trupa krasnoludzkiego cieśli...,Bardzo dobrze... Szukamy ciała gnomiego rzeźbiarza drzewnego.,0.2981277997962565,0.033031643180138064,0.7627449631690979,0.6738247871398926
"Charm the lasses, not an old gran like me.","Młodsze czaruj, a nie mnie, starą babę.","Czaruj dziewczyny, nie starą babę jak ja.",0.3741358547600215,0.039281465090051315,0.7740252614021301,0.6849316954612732
"Well, we dug up a chest of Nilfgaardian gold out by your boundary line. Would you wager your grain's dearer?","Na pewno mniej niż skrzynka nilfgaardzkiego złota, którąśmy wykopali tuż przy miedzy.","Cóż, wykopaliśmy skrzynię nilfgaardzkiego złota nieopodal twojej granicy. Czy sądzisz, że twoje zboże jest cenniejsze?",0.4588418676684718,0.013217947626377298,0.7374144792556763,0.783224880695343
Mutant.,Mutant.,Mutant.,1.0,0.1778279410038923,1.0,0.9880003929138184
"But he became confused. Instead of signing up for necromancy, he chose tyromancy… Then he sort of stuck with it.",Ale coś źle przeczytał i zamiast na nekromancję zapisał się na zajęcia z tyromancji... I tak jakoś zostało.,"Ale on się pomylił. Zamiast zapisać się na nekromancję, wybrał tyromancję... Potem jakoś się tego trzymał.",0.4012862749698838,0.02729967835246154,0.8061452507972717,0.8406266570091248
Stop wavin' that in me face.,Nie machaj mi tym przed nosem.,Przestań mi tym machać przed nosem.,0.5800596265426756,0.12209471671615688,0.8739344477653503,0.8828232288360596
I saw it! Cover me!,Widziałam! Osłaniaj mnie!,Zauważyłam to!,0.06966089466089471,0.0,0.7906376123428345,0.6667518019676208
You know shite! His tongue was black and twisted. Whoresons poisoned 'im!,"Gówno wiesz! Jęzor miał czarny a wykręcony. Otruli go, skurwysyny!",Ty gówno wiesz! Jego język był czarny i skręcony. Te sukinsyny go otruły!,0.43410681129714584,0.018476860420522198,0.8334465622901917,0.7702457308769226
A temple: to Svalblod.,Świątynia Svalbloda.,Świątynia: dla Svalbloda.,0.867417717166639,0.11362193664674995,0.8954375982284546,0.802132248878479
What now?,I co teraz?,Co teraz?,0.6789466197421153,0.09069748827745895,0.9212464094161987,0.9857943058013916
See you soon.,Do zobaczenia niedługo.,Do zobaczenia wkrótce.,0.5280230761679446,0.24028114141347542,0.9017359018325806,0.981713593006134
Is this a curse? You trapped in the tapestry?,Jesteście zaklęte w tym gobelinie?,Czy to klątwa? Jesteś uwięziona w gobelinie?,0.4424926746596293,0.039281465090051315,0.8019067049026489,0.9053950309753418
Hmm… I wasn't supposed to rain.,Hmm... Opadów nie przewidywano.,Hmm... Nie miałem padać deszczem.,0.22907598602880316,0.05372849659117709,0.7615549564361572,0.5634626746177673
"So, essentially… you buy a pig in a poke? Hm, thanks but no thanks.","Czyli, no... Kupujesz kota w worku? To ja dziękuję za taki interes.","Haha, nie, to są narzędzia finansowe. W skrócie płacisz za towary przed ich wyprodukowaniem.",0.14068228705894129,0.01428363257865929,0.6634108424186707,0.5299330353736877
"What mood would you be in if you'd lost your son…? So, I'm askin' - what d'ye want?","Ciekawe, w jakim ty byś był nastroju, jakbyś syna stracił... Czego chcesz, pytam?","Co byś chciał? Jakbyś się czuł, gdybyś stracił syna...? Więc, pytam ponownie - czego chcesz?",0.380563379599389,0.013217947626377298,0.8191389441490173,0.8580866456031799
Hjalmar! Hjalmar!,Hjalmar! Hjalmar!,Hjalmar! Hjalmar!,1.0,0.316227766016838,1.0,0.9925744533538818
"That's altogether different. Sit, ye stupid mutts, lie down! C'mon, come on in. Slowly now, lest they bite ye.","A... Chyba że tak. Siad, głupie kundle, spokój! No, wchodź pan. Tylko powoli, bo jeszcze pogryzą.",To zupełnie co innego.,0.044092412509276875,0.0,0.6416153311729431,0.392355352640152
Why would you?,Bo co?,Dlaczego miałbyś to robić?,0.0980392156862746,0.0,0.6562934517860413,0.762933611869812
"You must see Donar, ask him to whom exactly he sold the… thing.","Musisz iść do Donara, wypytać go, komu konkretnie sprzedał to... coś.","Musisz zobaczyć Donara, zapytaj go, komu dokładnie sprzedał... to coś.",0.4697000926837214,0.050781487573685676,0.9030277132987976,0.8511946201324463
"Back by the tree, you said you know another way to stop the leshen.","Gdy staliśmy przy drzewie, powiedziałeś, że znasz jakiś sposób na powstrzymanie leszego.","Wracając do drzewa, powiedziałeś, że znasz inny sposób, aby powstrzymać leszego.",0.5341770686427884,0.0915397843152513,0.8860573172569275,0.749588668346405
"But I'll not dress like a Novigrad doll. I'll stick with wool, thank you very much.",Ja się nie muszę stroić jak te novigradzkie lalki. Wełna mi wystarczy.,"Ale nie zamierzam ubierać się jak lalka z Novigradu. Zostanę przy wełnie, dziękuję bardzo.",0.2810956045328202,0.018798317647335087,0.7518877387046814,0.8226560950279236
Must we return to the boat right away?,Musimy od razu wracać na statek?,Czy musimy od razu wracać na łódź?,0.6752814360542194,0.41113361690051975,0.9061824679374695,0.9332577586174011
Nature stinks.,Natura śmierdzi.,Natura cuchnie.,0.31372603685912787,0.1495348781221221,0.8095571994781494,0.42910489439964294
"What can you know about saving the world, silly? You're but a witcher.","Co ty wiesz o ratowaniu świata, głuptasie? Jesteś tylko wiedźminem.","Co ty możesz wiedzieć o ratowaniu świata, głupcze? Jesteś tylko wiedźminem.",0.776803222639836,0.17827531042796255,0.9238259792327881,0.9556639790534973
Hmmm?,Hmmm?,Hmmm?,0.8333333333333334,0.1778279410038923,1.0,0.9935795664787292
The fight is done! Olaf retains his title!,Walka skończona! Tytuł mistrza zostaje przy Olafie!,Walka została zakończona! Olaf zachował swój tytuł!,0.39154341881936894,0.033031643180138064,0.8195263743400574,0.9586454033851624
And how.,"Jest, a jakże.",I owszem.,0.04310344827586216,0.0,0.5835252404212952,0.7506971955299377
A man! Hah! Am I ever pleased to see you!,"Człowiek! Ha! Nawet nie wiesz, jak się cieszę!","Ach, człowiek! Ha ha! Jak miło cię widzieć!",0.2965355856785657,0.0,0.8239384293556213,0.8064466714859009
But… How's that?,Ale... Jak to?,Ale... Jak to?,1.0,0.5623413251903491,1.0,0.9950024485588074
Don't forget turning your cows' milk sour straight out of the udder.,I mleko przez nas krowom kwaśnieje.,"Nie zapominaj o tym, że czarownice potrafią zamieniać mleko krów w ocet prosto z wymion.",0.2373485320097375,0.013217947626377298,0.6863898038864136,0.5788487792015076
"Mhm. A bay, eighteen hands at the withers and stronger than an ox. Could plow through stone with that'un.","Mhm. Gniadosz, pięć stóp w kłębie, a silny, że hej. I skałę byś z takim u pługa zaorał.","Tak, widziałem. To gniady, osiemnastoręczny przy kłębie i silniejszy od wołu. Mógłby orać kamienie tym koniem.",0.2345417132090666,0.0,0.6826508045196533,0.5371716618537903
"But you, you was cast in a different mould than us. More like the hero that lies in the tomb 'neath Crookback Hills.",Ale wyście są ulepieni z innej gliny niż my. Jak ten bohater pochowany w grobowcu pod Krzywuchowymi Wzgórzami.,"Ale ty, ty byłeś odlany w innym kształcie niż my. Bardziej przypominasz bohatera, który leży w grobie pod Wzgórzami Kruczego Grzbietu.",0.35002125230345177,0.024289783953423513,0.7791121006011963,0.7139852643013
"Was? Mean to say it's dead already? Made quick work o' that, you did.",Była? Znaczy się: już ubita? A to żeście się szybko uwinęli.,"Co? Chcesz powiedzieć, że już nie żyje? Szybko się z tym uporałeś.",0.1838328420616786,0.020255986027125642,0.7444855570793152,0.6642205715179443
Seemed like you'd told her quite a lot about me.,"Mam wrażenie, że ty powiedziałaś jej o mnie całkiem sporo.","Wydawało się, że opowiedziałaś jej całkiem sporo o mnie.",0.5658479597898208,0.03034691922392704,0.8555392622947693,0.9459471106529236
