en_text,pl_text,dialog_prototype,chrf_dialog_prototype,bleu_dialog_prototype,bertscore_dialog_prototype,comet_dialog_prototype
"Geralt. You're here, good.","Geralt, jesteś.","Jesteś tu, dobrze.",0.2549613231241575,0.0,0.7967816591262817,0.785469651222229
Radovid is holding mages captive. He'll force them to extract more from the crystal.,"Radowid więzi czarodziejów. Zmusi ich, żeby wydobyli z kryształu więcej szczegółów.",Radovid przetrzymuje magów jako zakładników. Zmusi ich do wydobycia więcej energii z kryształu.,0.4242222912139823,0.020448007360218394,0.8250579833984375,0.8585527539253235
"And when I say all, I mean all.","A kiedy mówię wszyscy, naprawdę mam na myśli wszystkich.","I kiedy mówię ""wszystko"", mam na myśli absolutnie wszystko.",0.4926969051074914,0.14923729480049117,0.8460835814476013,0.883760392665863
"Greetings, master.","Uszanowania, mistrzu.","Witaj, panie.",0.09744938524008295,0.0,0.7371427416801453,0.6101710200309753
Think I'll let your host introduce me.,Niech nasz gospodarz o mnie opowie.,Pozwolę gospodarzowi przedstawić mnie.,0.41043365926982295,0.0,0.6989368796348572,0.8988906741142273
Huh. Very true. Others claim it's inappropriate in a time of war…,"Istotnie. Inni mówią, że podczas wojny to nie wypada...","Hmm. To prawda. Inni twierdzą, że to nieodpowiednie w czasie wojny...",0.3499238914949061,0.024808415001701823,0.8272329568862915,0.9215808510780334
You sure this mage actually had a djinn?,"Skąd wiesz, że ten czarodziej w ogóle miał jakiegoś dżinna?",Czy na pewno ten czarodziej miał dżina?,0.33693964212746935,0.05035983350735684,0.8357962965965271,0.8935042023658752
"Hmm… spruce wood. Smells of juniper incense. Some sort of folk talisman, protective.",Hm... Świerczyna... Do tego okadzona dymem jałowca. Wygląda jak ludowy talizman ochronny.,Hmm... świerkowe drewno. Pachnie kadzidłem jałowcowym. Jakiś rodzaj ludowego talizmanu ochronnego.,0.3717220987474152,0.0,0.7885948419570923,0.8687330484390259
Thanks. Good enough to start with. Farewell.,"Dzięki, to mi wystarczy. Bywaj.",Dzięki.,0.15730801806888764,0.0,0.6772783994674683,0.6711228489875793
"I believe we're done for the day, my tulip. Be a dear and leave us alone.","Chyba skończymy na dziś, moja słodka. Bądź tak dobra i zostaw nas samych.","Myślę, że skończyliśmy na dzisiaj, moja tulipanko. Bądź tak miła i zostaw nas samych.",0.5658375820577312,0.22718709780542318,0.8383091688156128,0.9206731915473938
"Well, I must admit, you have great taste!","Nooo, trzeba przyznać, że masz gust!","Muszę przyznać, masz świetny gust!",0.3827629885869855,0.05789300674674099,0.8156547546386719,0.9653352499008179
Veloë! Take him from behind!,Veloë! Zajdź go od tyłu!,Veloë! Zajdź go od tyłu!,1.0,1.0,1.0,0.9656204581260681
"Now you must do me a favor. Since you're so lucky, you must fleece Sigi Reuven in Novigrad and Stjepan in Oxenfurt. I found both exceedingly aggravating last time I was on the Continent. Best of luck.","I zrób coś dla mnie. Skoro jesteś taki dobry, to ograj Sigiego Reuvena z Novigradu i Stjepana z Oxenfurtu. Obaj zaleźli mi za skórę, gdy bawiłem na kontynencie.","Teraz musisz mi wyświadczyć przysługę. Skoro masz takie szczęście, musisz obrobić Sigi Reuvena w Novigradzie i Stjepana w Oxenfurcie. Obaj okazali się niezwykle irytujący, kiedy byłem ostatnio na Kontynencie. Powodzenia!",0.40040256840413463,0.01806193387447607,0.765292227268219,0.6765910387039185
Careful! Watch out!,Uważaj! Uważaj!,Uważaj! Bądź ostrożny!,0.38177000184046234,0.11362193664674995,0.8260583877563477,0.9314455389976501
"Oh, you're definitely no boy. You're a strong, poised witcher who will surely help a woman in need.","O, z pewnością nie jesteś chłopcem, tylko silnym wiedźminem, który z pewnością pomoże kobiecie w potrzebie...","No cóż, nie jesteś chłopcem.",0.1827532586767587,0.0125896694397049,0.7412232756614685,0.5439680218696594
Hard-headed men…,Twardzi zawodnicy...,Twardogłowi mężczyźni...,0.2703247320947429,0.0,0.7935439348220825,0.90694659948349
None know how he does it. But I've my suspicions.,"Nikt nie wie, jak to robi. Ale ja mam swoje podejrzenia.","Nikt nie wie, jak on to robi. Ale mam swoje podejrzenia.",0.8357407562209159,0.43361890903486755,0.9715133905410767,0.9777361750602722
Huh…,Ta...,Hmm...,0.23310346955461966,0.0,0.8974020481109619,0.8718037009239197
"Something not normal. Something strange. Maybe you saw, felt, heard something…?","Coś innego, niż zwykle. Mogłeś to zobaczyć, poczuć, usłyszeć...","Coś nienormalnego. Coś dziwnego. Może widziałeś, poczułeś, usłyszałeś coś...?",0.298728071597055,0.023980296761827107,0.7890143394470215,0.8860124945640564
"I don't know, Geralt. I'd rather not find out.","Nie wiem, Geralt. I nie chcę się dowiedzieć.","Nie wiem, Geralt. Wolałabym się nie dowiadywać.",0.484149346526949,0.16102307266026747,0.8887547850608826,0.9077177047729492
Matter for king. Dirgelech. You not know.,To rzecz króla. Dirgelech. Ty nie możesz wiedzieć.,Sprawa dla króla. Dirgelech. Nie musisz wiedzieć.,0.5681168562176563,0.0670144447096575,0.9129787087440491,0.8201833367347717
"Ah well, perhaps another time.","Cóż, może innym razem.","Ach no cóż, może innym razem.",0.910858332660335,0.20205155046766235,0.9159106612205505,0.9332998991012573
Thank ye… Farewell.,Dziękuję... Żegnaj.,Dziękuję... Żegnaj.,1.0,0.316227766016838,1.0,0.9853937029838562
Good day!,Cześć!,Dzień dobry!,0.07692307692307702,0.0,0.8213124871253967,0.9312204122543335
I think so.,"Wydaje mi się, że tak.","Myślę, że tak.",0.370224367665529,0.12336445138236939,0.8574590086936951,0.9378074407577515
Hoo-ah!,U-ha!,Hoo-ah!,0.1282051282051283,0.0,0.8593328595161438,0.9411312937736511
"If you miss us, look for us at the camp.","Gdybyś za nami zatęsknił, będziemy w obozie.","Jeśli za nami zatęsknicie, szukajcie nas w obozie.",0.49485994470924616,0.08307018474412793,0.8494683504104614,0.9399775862693787
"Aye, a beauty, but wasn't that sword I had in mind.","No, rzeczywiście ładny, ale nie o ten mieczyk mi chodziło.","Tak, piękne to, ale nie o tym mieczu myślałam.",0.24802246337242564,0.10620315618312248,0.7903146147727966,0.8401339054107666
Argh… Hmpf... Mmf… Hm.,Hmpf.,Ach... Phh... Mmm... Hm.,0.10551948051948058,0.0,0.7035717368125916,0.7406324744224548
And the storm?,A burza?,A co ze sztormem?,0.08658008658008669,0.08034284189446518,0.7370801568031311,0.8481584191322327
Wanted to ask you…,Chciałem zapytać...,Chciałem cię o coś zapytać...,0.788898320891187,0.06389431042462725,0.8993265628814697,0.9738728404045105
Woo. Damn.,"Uuu, nieźle.",Ach. Cholera.,0.061546695210061626,0.0,0.6634520888328552,0.6268092393875122
How'd you do.,Czołem.,Jak się masz?,0.04504504504504513,0.0,0.7425685524940491,0.5525525808334351
"When the king o' the whales was dyin', Hemdall himself guided him here, so he could die lookin' at the settin' sun.","Kiedy król wielorybów umierał, sam Hemdall przywiódł go tu, żeby skonał, patrząc na zachód słońca.","Gdy król wielorybów umierał, sam Hemdall poprowadził go tutaj, żeby mógł umrzeć patrząc na zachodzące słońce.",0.6396979382335681,0.2803950119994003,0.8955346941947937,0.901818573474884
Ye tryin' to hurt someone?,Chcesz komuś krzywdę tym zrobić?,Czy próbujesz kogoś skrzywdzić?,0.31154871028059433,0.0,0.7694395780563354,0.904752254486084
Answer's a whale.,Chodzi o wieloryba.,Odpowiedź to wieloryb.,0.4700804156372922,0.0,0.7707805633544922,0.8368476629257202
Takes a real genius to notice. Where is he?,Jesteś strasznie bystry. Gdzie Junior?,Trudno nie zauważyć. Gdzie on jest?,0.21029282513506553,0.040824829046386304,0.7396094799041748,0.6952123045921326
Guessed it. It's love.,Zgadłeś. To miłość.,Domyśliłem się. To miłość.,0.5285534062032077,0.16990442448471224,0.8627825379371643,0.8602967262268066
"In fact, I'd been meaning to ask you…",Właśnie chciałam cię zapytać...,W rzeczywistości chciałam cię o coś zapytać...,0.6222202993509348,0.07730551756939454,0.9208114743232727,0.9574118852615356
What happened? You get the jitters?,Co się stało? Strach cię obleciał?,Co się stało? Masz pietra?,0.38626884768356584,0.21771262023986562,0.8123904466629028,0.49364668130874634
"I'll, uh, look in on you tomorrow, Francis. Finish our talk.","No... Zajrzę do ciebie jutro, dokończymy rozmowę.","Będę, eh, zajrzeć do ciebie jutro, Francis. Skończmy naszą rozmowę.",0.5248051775543084,0.1122444464861146,0.7982596158981323,0.5838980078697205
"Moon's arisin', owl's hootin', fire's just a gleam.","Słońce zaszło, słowik umilkł, światło już się mroczy.","Księżyc wschodzi, sowa pohukuje, ogień to tylko błysk.",0.14525809532876435,0.0,0.7337186336517334,0.45994144678115845
Geralt… So unfortunate. I'd hoped you wouldn't have to witness this.,"Geralt... Szkoda. Miałem nadzieję, że nie będziesz musiał tego oglądać.","Tak niefortunne. Miałem nadzieję, że nie będziesz musiał być świadkiem tego.",0.596059671518593,0.4617366309441026,0.8336423635482788,0.8118175864219666
"Come on, Hussar. Can you smell Bastien, boy? Eh… still nothin'.","No i co, Huzar? Czujesz pana? Ech... Ciągle nic.","Chodź, Husarze. Czy czujesz Bastiena, chłopcze? Eh... nadal nic.",0.29521288184117805,0.023980296761827107,0.7726346850395203,0.6579354405403137
"Indeed, it is what the elves would title Ciri. But what was the bit about the sign of her sword? A riddle?","Rzeczywiście, elfy tak nazwałyby Ciri. Ale co z tym znakiem miecza? To jakaś zagadka?","Rzeczywiście, tak nazywają ją elfy. Ale co miało znaczyć odniesienie do znaku jej miecza? To była zagadka?",0.5044876915897368,0.039567167294524315,0.8339256644248962,0.9199211001396179
Commissioned a portrait artist to paint your placards?,Zamówiłeś plakaty reklamowe u portrecisty?,"Zamówiłeś portrecistę, żeby malował twoje transparenty?",0.4867165832788913,0.040824829046386304,0.820295512676239,0.8834872841835022
Know where I can find her - Dandelion's sister?,"Wiesz, gdzie znajdę tę jego siostrę?","Czy wiesz, gdzie mogę znaleźć jego siostrę?",0.6169076176975855,0.07730551756939454,0.8681882619857788,0.9696571230888367
I don't generally poke my nose in other people's business.,Nie wtrącam się w nie swoje sprawy.,Nie zwykłem wtrącać się w cudze sprawy.,0.4384057707053482,0.08307018474412793,0.8789021372795105,0.9149198532104492
Grab him!,Trzymać go!,Chwyć go!,0.20909704208023536,0.1495348781221221,0.9001798033714294,0.826113760471344
Funny you mention that. I went to see Vivaldi. Know what he said? Witchers are no good as guarantors - risk of premature death is way too high.,"Zabawne, że o tym wspominasz. Byłem u Vivaldiego, ale powiedział, że wiedźmini nie nadają się na poręczycieli. Zbyt duże ryzyko przedwczesnego zgonu.","Zabawne, że wspomniałeś o tym. Spotkałem się z Vivaldim. Wiesz, co powiedział? Czarodzieje nie są dobrzy jako poręczyciele - ryzyko przedwczesnej śmierci jest zbyt duże.",0.4848493980655683,0.021084454569051277,0.8058093786239624,0.8852971196174622
Dead man! Dead man!,Trup! Trup!,Dead man! Dead man!,0.03144654088050324,0.0,0.8034719824790955,0.5268588066101074
"On the other hand, I'd not 'ave recovered my pile if not for you…","Z drugiej strony gdyby nie ty, nie odzyskałbym skarbu...","Z drugiej strony, nie odzyskałbym swojej kupki, gdyby nie ty...",0.7478505209436359,0.07730551756939458,0.8822049498558044,0.8966485857963562
Heard mages pay top coin for the special bits of rare creatures.,"Słyszałem, że czarownicy dobrze płacą za składniki z rzadkich istot.","Słyszałem, że magowie płacą grube pieniądze za specjalne części rzadkich stworzeń.",0.4234603375012198,0.05012578715739066,0.8465439677238464,0.8902601599693298
There are more and more!,Jest ich coraz więcej!,Tam są coraz więcej!,0.5870186925911337,0.16990442448471224,0.9036340713500977,0.9180202484130859
Strangled its prey. Then started feeding.,"Ofiara została uduszona, zanim potwór zaczął ją pożerać.",Geralt - Zdusiło swoją ofiarę. Potem zaczęło jeść.,0.18142609479942348,0.0,0.7012057900428772,0.5954225659370422
"Oh, it's getting cold.",Zimno jakoś się zrobiło.,"Och, robi się coraz zimniej.",0.21849193884551746,0.05372849659117709,0.7684439420700073,0.9030570387840271
"Thanks for your help, Geralt.","Dzięki za pomoc, Geralt.","Dziękuję za pomoc, Geralcie.",0.6925390140081724,0.16990442448471224,0.7546766996383667,0.9725556969642639
Who?,Kogo?,Kto?,0.14477585906157342,0.0,0.8602806925773621,0.8329406380653381
Morkvarg? What's that?,Morkvarg? Co to?,Co to jest Morkvarg?,0.6671465569952147,0.09554427922043669,0.8024990558624268,0.7486668229103088
Glory be to the Eternal Fire.,Cześć Wiecznemu Ogniowi.,Chwała wiecznemu ogniowi.,0.5062835844854099,0.0,0.8117507100105286,0.905994713306427
Wild guess - not what you had in mind…,"Zgaduję, że to nie był twój pomysł?",Dziki strzał - nie to miałaś na myśli...,0.1154039286116421,0.03303164318013808,0.6992377042770386,0.670473039150238
"Agh, me willy needs a wettin'.",Zakisiłbym ogóra.,"Ach, moja wilga potrzebuje zwilżenia.",0.11412203840905766,0.0,0.6600207090377808,0.5482139587402344
"Except if you are talking bollocks, and I swallow it whole, well… it'll be too late.","Tylko, że jeżeli opowiadasz bzdury, a ja w nie uwierzę, to będzie za późno.","Chyba że mówisz bzdury, a ja je przełknę w całości... Wtedy będzie już za późno.",0.38433214699718493,0.0925159978069645,0.7984973788261414,0.8619818091392517
You were gonna explain why you murdered the supervisor.,Miałeś wytłumaczyć się z morderstwa nadzorcy.,"Miałeś mi wyjaśnić, dlaczego zamordowałeś nadzorcę.",0.33120854428142615,0.040824829046386304,0.8009400963783264,0.8871995210647583
Nilfgaardian mutts.,Nilfgaardzkie psy.,Nefgardzkie świnie.,0.37899743705480476,0.0,0.7268738746643066,0.6990106105804443
"A king by the grace of votes is no ruler, but a debtor. This must end. We must start by placing Bran's first-born son on the throne. I hope the jarls will see the wisdom of it.","Król z wyboru nie jest władcą, tylko dłużnikiem. Trzeba z tym skończyć... Zaczynając od osadzenia na tronie pierworodnego syna Brana. Mam nadzieję, że jarlowie to dostrzegą.","Król przez łaskę głosów nie jest władcą, ale dłużnikiem. To musi się skończyć. Musimy zacząć od umieszczenia pierworodnego syna Brana na tronie. Mam nadzieję, że jarlowie dostrzegą mądrość tego posunięcia.",0.6152332935300219,0.13733894353973464,0.8756422996520996,0.8168402314186096
"Something strange happened on Ard Skellig a time ago. A disaster brought about by a burst of magic. Extraordinary, really, a natural anomaly. Never seen anything like it.","Jakiś czas temu na Ard Skellig doszło do katastrofy wywołanej przez magię. Bardzo niezwykłe wydarzenie, nigdy wcześniej nie spotkałam się z czymś takim.","Coś dziwnego wydarzyło się na Ard Skellig jakiś czas temu. Katastrofa spowodowana nagłym wybuchem magii. Naprawdę niezwykłe, prawdziwa naturalna anomalia. Nigdy czegoś takiego nie widziałam.",0.42787680781643606,0.044588192733265836,0.7865336537361145,0.8945519924163818
You did the right thing with the murderer. We'll have peace now.,Dobrześ się sprawił z tym mordercą. Spokój będzie.,Postąpiłeś słusznie z tym mordercą. Teraz będziemy mieć spokój.,0.46356164339981004,0.11868405219520975,0.8174104690551758,0.9238551259040833
I'm looking for Hendrik.,"Chcę tylko wiedzieć, gdzie jest Hendrik.",Szukam Hendrika.,0.16000513437248698,0.0,0.6549143195152283,0.660372257232666
"For fuck's sake, Geralt. Don't know that I'll be able to forgive you.","Kurwa, Geralt. Nie wiem, czy ci to wybaczę.","Dla świętego spokoju, Geralt. Nie wiem, czy będę potrafił ci wybaczyć.",0.6016839411605927,0.24808415001701817,0.821154773235321,0.8567191958427429
"Been through a lot, eh? Got some nasty fresh-lookin' scars…","Sporo chyba przeszłaś, co? Cała jesteś w świeżych bliznach...","Przeszedłeś przez sporo, co? Masz parę świeżo wyglądających blizn...",0.34044273232425826,0.023980296761827107,0.7964237928390503,0.8462439775466919
"No, haven't met 'em.","Nie, nie spotkałem ich.","Nie, nie spotkałem go.",0.7820413065637563,0.3976353643835253,0.9745241403579712,0.9743813276290894
Where'd you get this cabaret idea?,Co ci przyszło do głowy z kabaretem?,Skąd ci to przyszło do głowy?,0.502393278229284,0.0808764862779457,0.8576619625091553,0.8931786417961121
"Oh, yes!",O tak!,"Tak, tak!",0.4155391024154975,0.1495348781221221,0.8550140857696533,0.8923844695091248
"Go. I should contact the buyer, agree on a place to make the transaction. See you, Geralt.","Idź. Ja muszę skontaktować się z klientem i ustalić, gdzie dokonamy wymiany. Do zobaczenia.","Idź. Powinienem skontaktować się z kupującym i uzgodnić miejsce transakcji. Do widzenia, Geralt.",0.36756557842385845,0.08467568581043113,0.8064660429954529,0.9049186706542969
"She brought death down on others. The sooner you start thinking of it that way, the better off you'll be.","Sprowadzała na innych śmierć. Im szybciej zaczniesz o niej myśleć w ten sposób, tym dla ciebie lepiej.",Ona sprowadziła śmierć na innych.,0.19089102259163995,0.004874139244068762,0.7563431262969971,0.5395926833152771
"Triss… These last few months, they've really taught you nothing?",Triss... Ostatnie miesiące naprawdę nic cię nie nauczyły?,Triss... Te ostatnie miesiące naprawdę niczego cię nie nauczyły?,0.8600856749801634,0.1561969968460128,0.967050313949585,0.97745281457901
Statue's hand looks like it should be holding something.,"Ręka człowieka z tej rzeźby wygląda, jakby miała coś trzymać.","Dłoń posągu wygląda tak, jakby powinna coś trzymać.",0.3922226976501326,0.05062667121584364,0.8546549081802368,0.8707101941108704
My husband's a supervisor by trade.,Mój mąż jest z zawodu dyrektorem.,Mój mąż to człowiek interesu.,0.24410681244169843,0.09302577375697234,0.7714744806289673,0.8215406537055969
"And if you can't find the slimy bastard, come and see me. I know him well, might figure something out.","Aha, gdybyś miał problemy ze znalezieniem Skurwiela, wróć do mnie. Znam tę kanalię i może coś wymyślę.","Jeśli nie uda ci się znaleźć tego śliskiego drania, przyjdź do mnie. Znam go dobrze, może coś mi się skojarzy.",0.29937281281704614,0.0599303148053787,0.7762677669525146,0.7606079578399658
Rid the isles of this fearsome foe.,Wypędził z Undvik potwory krwiożercze!,Oczyść wyspy z tego straszliwego wroga.,0.0932857991681522,0.040824829046386304,0.6741024851799011,0.7931460738182068
Geralt of Rivia has earned the right to fight the title holder! You may begin!,Geralt z Rivii zdobył prawo do walki i zmierzy się z obrońcą tytułu! Zaczynajcie!,Geralt z Rivii zasłużył sobie na prawo walki z mistrzem! Możesz zaczynać!,0.38035521543763906,0.08486112554897568,0.8073534965515137,0.8410025835037231
I won fair and square.,Wygrałem uczciwie.,Wygrałem uczciwie.,1.0,0.316227766016838,1.0,0.9899304509162903
"Is that nice, lying to your elders? My eyes aren't what they once were, but I can see you're three feet tall and walk around barefoot!","Ładnie tak kłamać starszej osobie? Oczy nie te, co kiedyś, ale widzę przecie, że masz trzy stopy wzrostu i boso biegasz!","Czy to miło oszukiwać starszych? Moje oczy nie są już takie jak dawniej, ale widzę, że masz trzy stopy wzrostu i chodzisz boso!",0.46973871277068907,0.21800193956058223,0.8257556557655334,0.7649837136268616
Wanna talk to you.,Chcę z tobą porozmawiać.,Chciałbym z tobą porozmawiać.,0.8092801310044645,0.3976353643835253,0.9257091879844666,0.9777910113334656
Need to see your pass.,Glejt okażcie.,Muszę zobaczyć pański paszport.,0.08045977011494261,0.0,0.6647459268569946,0.6637915372848511
By what right're you givin' me orders? Eh?,A jakem prawem chcesz nam rozkazy dawać? Co?,Po jakim prawie mi rozkazujesz?,0.2542604052862592,0.0,0.8010172247886658,0.6084800958633423
Damn… Dead… has been for a while.,Zaraza... Nie żyje... I to od dłuższego czasu.,Cholera... Martwy... Od jakiegoś czasu.,0.24850257637515286,0.029486824119076216,0.8411948084831238,0.8064484596252441
What happened to the woman?,Co się potem stało z dziewczyną?,Co się stało z tą kobietą?,0.29303804384152793,0.12209471671615688,0.8873054385185242,0.9642763733863831
"Brought friends? Hm. They all pledge to defend Maid Bilberry's honor, too?",Bo przyprowadziłeś kolegów? A oni co – wszyscy pannie Jagódce ślubowali?,"Przyniosłeś przyjaciół? Hm. Wszyscy obiecali bronić honoru Panny Borówki, co?",0.22393994267627526,0.0,0.7471556067466736,0.772038996219635
Isengrim Faoiltiarna from the Scoia'tael deck. Wonder how much this card's worth.,"Isengrim Faoiltiarna z talii Wiewiórek. Ciekawe, ile dokładnie ta karta jest warta.","Geralt: Isengrim Faoiltiarna z talii Scoia'tael. Ciekawe, ile ta karta jest warta.",0.6946244936701036,0.46595384151899627,0.8376112580299377,0.7972114086151123
"We must report to the emperor, after all.",Musimy przecież złożyć raport cesarzowi.,"Musimy zameldować się u cesarza, w końcu.",0.25607923446236186,0.033031643180138064,0.7709605693817139,0.7647252678871155
"Oh, wise words. You're not from here, you can't understand.","I słusznie. Nie jesteś stąd, nie rozumiesz naszych spraw.","Ach, mądre słowa. Nie jesteś stąd, nie możesz zrozumieć.",0.48727530865329327,0.2984745896009823,0.8275490999221802,0.7727161049842834
The emperor's ship lies at anchor near Undvik - still!,Okręt cesarza dalej kotwiczy przy Undvik.,Statek cesarza stoi na kotwicy niedaleko Undvik - cicho!,0.38443789602520506,0.023980296761827107,0.7280177474021912,0.5891106724739075
A handprint…,Odcisk dłoni...,Ślad dłoni...,0.4865931347488069,0.1495348781221221,0.9335506558418274,0.9183019995689392
Curdled codfish.,Kurcze flak.,Śmierdzący śledź.,0.08695652173913053,0.0,0.6989750862121582,0.6566388010978699
It's a lead worth following. Any idea what his name was?,"Warto byłoby jeszcze zbadać ten trop. Wiesz, jak on miał na imię?",To trop warty sprawdzenia.,0.09936362314326345,0.0,0.672265350818634,0.6983565092086792
"Hah, why wouldn't I? Be back before you know it.","Co ma się nie udać. Ani się obejrzysz, a będę z powrotem.","Haha, dlaczego by nie? Wrócę zanim się obejrzysz.",0.3037500459706428,0.016847111051295396,0.7663038969039917,0.7566266655921936
I will.,Tak zrobię.,Przekażę mu twoje gratulacje.,0.10057471264367825,0.0,0.6871801018714905,0.6727988123893738
Ceiling would've caved in if not for this support.,"Gdyby nie ta podpora, sklepienie pewnie już by się zawaliło.","Gdyby nie ta podpora, sufit by się zawalił.",0.5613778183810615,0.3201911827891037,0.8876165747642517,0.9063206911087036
"Ohh, you wouldn't know a good tale from a runny fart.","A tam, kurwa, nie znasz się.","Ohh, nie potrafiłbyś odróżnić dobrej historii od śmierdzącego bąka.",0.13412849480002545,0.023980296761827107,0.6858659982681274,0.5086520910263062
Why'd the giant spare you?,Czemu gigant cię oszczędził?,Dlaczego olbrzym cię oszczędził?,0.5390266865787692,0.16990442448471224,0.8718642592430115,0.9346587061882019
Eternal Fire be with you.,Wieczny Ogień z tobą.,Niech wieczny ogień będzie z tobą.,0.4970418239155617,0.08633400213704504,0.864517867565155,0.9410646557807922
And? Did you yield?,"I co, uległaś mu?",I co z tego? Poddałaś się?,0.1891147860949081,0.040824829046386304,0.8016378879547119,0.9086718559265137
"What? Geralt, what're you saying?","Jak to? Geralt, co ty gadasz!","Co? Geralt, co ty mówisz?",0.5133771875699636,0.21771262023986562,0.8259199261665344,0.895288348197937
"But there is more. My lieutenant demanded we defecate on command. Ballista bolts landing all around, and all he could say was ""A soldier with a full stomach will not step onto the battlefield. Now shit - that is an order."" Can you believe it?! The cretin!","...to jeszcze nic. Mój porucznik kazał nam na komendę chodzić do latryny. Ostrzeliwują nas balisty, a on tylko „żołnierz z pełnym żołądkiem do bitwy iść nie może. Macie siedzieć, aż wysiedzicie”. Wyobrażasz sobie? Bałwan!",ERROR,0.000982125319190812,0.0,0.5643220543861389,0.23195108771324158
Wouldn't you rather play war? It's like to be near dawn 'fore you get your game in me noggin.,"A nie lepiej zagrać w wojnę? Bo nim tę swoją grę mi wyłożycie, to ćma będzie.",Czy nie wolałbyś zagrać w wojnę? To trochę jak być blisko świtu przed rozpoczęciem gry w mojej głowie.,0.3099371045260725,0.05744990696182412,0.7363166213035583,0.585698127746582
Hm. You are and you do.,"No, jesteś.",Hm. Jesteś i robisz.,0.303399719797949,0.0,0.768877387046814,0.7107359766960144
At last…,Nareszcie...,Nareszcie...,1.0,0.1778279410038923,1.0000001192092896,0.9949492812156677
"Thanks again for your help, witcher!",Jeszcze raz dziękuję za pomoc!,"Dzięki raz jeszcze za pomoc, wiedźminie!",0.44079364369349405,0.048549177170732344,0.7692586183547974,0.7899373769760132
Dieter…,Dieter...,Czy go znasz?,1.0000000000000001e-16,0.0,0.5783625841140747,0.6419468522071838
Or will you stay to welcome Radovid's men?!,Czy może wolicie tu zostać i Radowidowych powitać?,"Czy może zostaniesz, żeby powitać ludzi Radovida?!",0.37719357480617277,0.0605543865104477,0.7876850962638855,0.8184858560562134
