en_text,pl_text,default,dialog,dialog2,dialog3,dialog4,chrf_default,bleu_default,bertscore_default,comet_default,chrf_dialog,bleu_dialog,bertscore_dialog,comet_dialog,chrf_dialog2,bleu_dialog2,bertscore_dialog2,comet_dialog2,chrf_dialog3,bleu_dialog3,bertscore_dialog3,comet_dialog3,chrf_dialog4,bleu_dialog4,bertscore_dialog4,comet_dialog4
Are you mad? Had your fill of hemlock?,Szaleju się najadłeś?,Czyś ty oszalał? Czyś się już struł ciemiężycą?,Czyś ty oszalał? Napiłeś się cykuty do syta?,Czyś ty oszalał? Napiłeś się cykuty?,Czy jesteś wściekły? Czy już nasyciłeś się cykutą?,Czyżbyś był wściekły? Nasyciłeś się już ciemiężycą?,0.16159700081101988,0.02777619034011792,0.7153007984161377,0.5447801351547241,0.18928028236538874,0.02777619034011792,0.753831684589386,0.6526578068733215,0.18681658687846805,0.040824829046386304,0.7754110097885132,0.6337265372276306,0.17523600634010228,0.02777619034011792,0.7223779559135437,0.5612106323242188,0.15005246974733805,0.033031643180138064,0.7296169996261597,0.6844258904457092
Will you run away from home with me?,"Uciekam z domu, uciekasz ze mną?",Czy uciekniesz ze mną z domu?,Czy uciekniesz ze mną z domu?,Uciekniesz ze mną z domu?,Czy uciekniesz ze mną z domu?,Czy uciekniesz ze mną z domu?,0.40467472432157353,0.048549177170732344,0.8467879891395569,0.9270101189613342,0.40467472432157353,0.048549177170732344,0.8467879891395569,0.9270101189613342,0.4095831970548547,0.05231223689135342,0.8882571458816528,0.9308650493621826,0.40467472432157353,0.048549177170732344,0.8467879891395569,0.9270101189613342,0.40467472432157353,0.048549177170732344,0.8467879891395569,0.9270101189613342
Just go.,Idźcie już.,Po prostu idź.,Po prostu idź.,Po prostu idź.,Po prostu idź.,"Po prostu: ""Dziękujemy.""",0.09981528843421435,0.0,0.7457008361816406,0.8813145160675049,0.09981528843421435,0.0,0.7457008361816406,0.8813143372535706,0.09981528843421435,0.0,0.7457008361816406,0.8813143372535706,0.09981528843421435,0.0,0.7457008361816406,0.8813143372535706,0.07440476190476199,0.0,0.7263023257255554,0.5880554914474487
He needs a worthy successor.,I potrzebuje godnego następcy.,On potrzebuje godnego następcy.,On potrzebuje godnego następcy.,On potrzebuje godnego następcy.,On potrzebuje godnego następcy.,On potrzebuje godnego następcy.,0.9550672237048103,0.3976353643835253,0.9590857028961182,0.9724552631378174,0.9550672237048103,0.3976353643835253,0.9590857028961182,0.9724552631378174,0.9550672237048103,0.3976353643835253,0.9590857028961182,0.9724552631378174,0.9550672237048103,0.3976353643835253,0.9590857028961182,0.9724552631378174,0.9550672237048103,0.3976353643835253,0.9590857028961182,0.9724552631378174
Thank ye! Was a hair away from givin' up my soul out of fright itself…,"Dziękuję! Mało brakowało, a z samego strachu bym ducha wyzionął...",Dziękuję! Byłem o włos od oddania mojej duszy ze strachu...,Dzięki! Byłem o włos od oddania duszy ze strachu...,Dzięki! Byłem o włos od oddania swojej duszy ze strachu...,"Dzięki! Było blisko, żebym oddał swoją duszę ze strachu...",Dzięki ci! Byłem o włos od oddania swojej duszy ze strachu...,0.30383704313024357,0.021105340631872645,0.7955067753791809,0.7233078479766846,0.22631021435236656,0.0,0.7636685967445374,0.7701497077941895,0.2327409433871569,0.0,0.7570275068283081,0.7377534508705139,0.2534203385912074,0.0,0.7873433232307434,0.7725680470466614,0.23485436244395985,0.0,0.7547845244407654,0.7230403423309326
"Only blood can clear one of shame. Words change nothin'. Not his, not yours.","Hańbę można zmazać tylko krwią. Słowa niczego nie zmienią. Ani jego, ani twoje.","Tylko krew może zmyć wstyd. Słowa niczego nie zmienią. Nie jego, nie twoje.","Tylko krew może oczyścić z hańby. Słowa niczego nie zmienią. Nie jego, nie twoje.","Tylko krew może oczyścić z hańby. Słowa niczego nie zmieniają. Nie jego, nie twoje.","Tylko krew może zmyć hańbę. Słowa niczego nie zmienią. Ani jego, ani twoich.","Tylko krew może zmyć hańbę. Słowa niczego nie zmienią. Ani jego, ani twoje.",0.5239309047890156,0.21401603033752975,0.8504331111907959,0.9239726662635803,0.529914384811259,0.19674979811155635,0.8516919016838074,0.9129310250282288,0.5073479870308958,0.08032276872815308,0.840294361114502,0.9047821760177612,0.6670376266577306,0.4703709593866897,0.8964622020721436,0.9398770332336426,0.7074023504491306,0.5593684915933074,0.9075924754142761,0.9501590728759766
What?,Co?,Co?,Co?,Co?,"To powiedziała coś, co sprawiło, że myślę, że nie jest całkiem normalna.

Co?

Że ty masz stopy mocno osadzone na ziemi.","Powiedziała coś, co sprawiło, że pomyślałem, że nie jest całkiem normalna.",0.5,0.1778279410038923,0.9999998211860657,0.9946805834770203,0.5,0.1778279410038923,0.9999998211860657,0.9946804642677307,0.5,0.1778279410038923,0.9999998211860657,0.9946804642677307,0.08485852311939274,0.009134423666564471,0.6048871278762817,0.420655757188797,0.018315018315018396,0.0,0.611875057220459,0.5307945609092712
Temeria!,Za Temerię!,Temeria!,Temeria!,Temeria!,Temeria!,Temeria!,0.4819443752905068,0.0,0.8187553882598877,0.9125389456748962,0.4819443752905068,0.0,0.8187553882598877,0.9125389456748962,0.4819443752905068,0.0,0.8187553882598877,0.9125389456748962,0.4819443752905068,0.0,0.8187553882598877,0.9125389456748962,0.4819443752905068,0.0,0.8187553882598877,0.9125389456748962
Strange bird. Who's that?,Co to za jeden?,Dziwny ptak. Kto to jest?,Dziwny ptak. Kto to jest?,Dziwny ptak. Kto to?,Dziwny ptak. Kto to jest?,Dziwny ptak. Kto to?,0.1735863963678068,0.05372849659117709,0.7470843195915222,0.7533248662948608,0.1735863963678068,0.05372849659117709,0.7470843195915222,0.7533248662948608,0.13819185645272605,0.0,0.7407757043838501,0.7500982284545898,0.1735863963678068,0.05372849659117709,0.7470843195915222,0.7533247470855713,0.13819185645272605,0.0,0.7407757043838501,0.7500981092453003
"Begone, witcher. And you can keep your coin.","Odejdź stąd, wiedźminie. Możesz zatrzymać pieniądze.","Odejdź, wiedźminie. I zatrzymaj swoją monetę.","Odejdź, wiedźminie. I możesz zatrzymać swoją monetę.","""Idź precz, czarowniku. A monetę możesz zatrzymać.""","- Precz, czarodzieju. I zatrzymaj sobie swoją monetę.","Idź precz, czarowniku. I możesz zatrzymać swoją monetę.",0.443643218512441,0.040824829046386304,0.8645557761192322,0.8756557106971741,0.5694922989484239,0.039281465090051315,0.8982720375061035,0.8532963991165161,0.31918726610916975,0.0,0.768122673034668,0.7897341251373291,0.2153565733349493,0.0,0.7476918697357178,0.7516241073608398,0.3276814846486785,0.02777619034011792,0.8002918362617493,0.6994780898094177
The Wild Hunt? Are you certain? So… you've found Ciri?,Dziki Gon? Jesteś tego pewien? Czyli... Znalazłeś Ciri?,Dziki Gon? Jesteś pewien? Więc... znalazłeś Ciri?,Dziki Gon? Jesteś pewien? Więc... znalazłeś Ciri?,"""Wild Hunt? Jesteś pewien? Więc... znalazłeś Ciri?""",Dziki Gon zaatakuje Kaer Morhen wkrótce. Będę potrzebował twojej pomocy.,Ermion: Dziki Gon? Jesteś pewien? Więc... znalazłeś Ciri?,0.6360370414328088,0.16102307266026747,0.9058370590209961,0.9470187425613403,0.6360370414328088,0.16102307266026747,0.9058370590209961,0.9470187425613403,0.46997117290376095,0.034052233956373766,0.8123744130134583,0.9069063663482666,0.18999625481835236,0.021105340631872645,0.6546971201896667,0.5752325654029846,0.6298097053152905,0.1561969968460128,0.8620852828025818,0.9227352738380432
"Hear that? I'll give 'em hell, I will!",Słyszysz? Ja im dam szurać!,"Słyszysz to? Dam im piekło, dam!","Słyszysz? Dam im popalić, dam!","Słyszysz to? Dam im popalić, zrobię to!","Słyszysz to? Dam im popalić, dam!","Słyszysz to? Dam im popalić, zrobię piekło!",0.3452698572357396,0.040824829046386304,0.857867956161499,0.7641300559043884,0.402434280141813,0.06389431042462725,0.886093258857727,0.6937615871429443,0.3350035992484505,0.033031643180138064,0.8571186661720276,0.7126081585884094,0.35786268215275824,0.040824829046386304,0.8706164360046387,0.6857631802558899,0.3290899853247799,0.033031643180138064,0.8475284576416016,0.7023385763168335
And?,No i?,A co z tym?,I co dalej?,I co dalej?,"Ach, temat na inną rozmowę.","Ach, temat na inną rozmowę.",0.07575757575757584,0.0,0.7320166230201721,0.775800347328186,0.07407407407407417,0.0,0.7879499197006226,0.8219113945960999,0.07407407407407417,0.0,0.7879499197006226,0.8219113945960999,0.05649717514124303,0.0,0.6431860327720642,0.5766953825950623,0.05649717514124303,0.0,0.6431860327720642,0.5766952037811279
Our lads would return from the Continent with captive wenches. I took no interest in 'em. At my age one woman under me roof is too much already.,"Młodzi wrócili z Kontynentu z jakimiś brankami... Ale ja się nie interesowałem, w moim wieku i jedna baba pod dachem to już nadto.",Nasi chłopcy wracali z kontynentu z pojmanymi dziewczynami. Nie interesowało mnie to wcale. W moim wieku jedna kobieta pod moim dachem to już za dużo.,Nasi chłopcy wracali z Kontynentu z brankami. Nie interesowały mnie one. W moim wieku jedna kobieta pod moim dachem to już za dużo.,Nasi chłopcy wracali z Kontynentu z pojmanymi dziewkami. Nie interesowało mnie to. W moim wieku jedna baba w domu to już za dużo.,Nasi chłopcy wracali z Kontynentu z brankami. Nie interesowałem się nimi. W moim wieku jedna baba w domu to już za dużo.,"Nasi chłopcy wracali z Kontynentu z pojmanymi dziewkami. Nie interesowało mnie to. Na moim dachu jedna baba to już za dużo, zwłaszcza w moim wieku.",0.456310728184441,0.05460916037468706,0.8120332360267639,0.7826918363571167,0.5100303614458869,0.08282282660969602,0.844671905040741,0.8291781544685364,0.4648780541075834,0.06964541799727335,0.8286635875701904,0.7675381898880005,0.516585346773543,0.07148972411046324,0.8482851386070251,0.8426102995872498,0.47657966742613467,0.062047985604249,0.8257171511650085,0.7556771039962769
"Silver, pearl-encrusted cutlery… Ship belonged to someone awfully wealthy.","Srebra, sztućce wysadzane perłami... Ten statek należał do kogoś majętnego.","Srebrne, perłami zdobione sztućce... Statek należał do kogoś okropnie bogatego.","Srebrne, perłami inkrustowane sztućce... Statek należał do kogoś bardzo bogatego.","Srebrne, perłami zdobione naczynia... Statek należał do kogoś bardzo bogatego.","Srebrne, perłami inkrustowane sztućce... Statek należał do kogoś bardzo bogatego.",Amos nie był biedakiem. To mogła być jego łódź.,0.5065396913027108,0.10445522730720382,0.858970046043396,0.9252597093582153,0.5251845294086231,0.10445522730720382,0.870144248008728,0.9278059005737305,0.4576484197473947,0.10445522730720382,0.8318368792533875,0.9287565350532532,0.5251845294086231,0.10445522730720382,0.870144248008728,0.9278059005737305,0.09512621014639822,0.0,0.673134446144104,0.4620802402496338
"Its armies, I'd wager.","Wojsko, jak mniemam.","Jego armie, zaryzykuję.","Jej tłumaczenie na język polski:

Jego armie, zaryzykuję.","Tłumaczenie:

""Jego armie, zaryzykuję.""","- A zatem jego armie, jak sądzę.","And you'd bloody lose, you idiot. Mass mobilization, inciting peasants to take up their scythes, straighten them - where's the art in that? Much harder to build a strong state with healthy commerce, manufacturing, solid alliances, progressive science, and fair, independent courts that hand down just judgments.",0.10070859260663116,0.0,0.7070664167404175,0.48152604699134827,0.16827580582155763,0.0,0.6673946380615234,0.424748957157135,0.13767700641090627,0.0,0.6469805240631104,0.49306565523147583,0.19245449939912454,0.033031643180138064,0.7511086463928223,0.6447243690490723,0.07843842022400824,0.0,0.5885739922523499,0.27726075053215027
Everyone's got their style.,Każdy ma swój styl.,Każdy ma swój styl.,Każdy ma swój styl.,Każdy ma swój styl.,Każdy ma swój styl.,Każdy ma swój styl.,1.0,1.0,1.0,0.9928410649299622,1.0,1.0,1.0,0.9928410649299622,1.0,1.0,1.0,0.9928410053253174,1.0,1.0,1.0,0.9928410053253174,1.0,1.0,1.0,0.9928410053253174
Happiness will come today.,Szczeście przyjdzie dziś.,Szczęście przyjdzie dziś.,Szczęście przyjdzie dzisiaj.,Szczęście nadejdzie dzisiaj.,Szczęście przyjdzie dzisiaj.,Szczęście nadejdzie dzisiaj.,0.8303033054749304,0.24028114141347542,0.931973934173584,0.9139299988746643,0.7286909795133961,0.11362193664674995,0.8971746563911438,0.9046972393989563,0.42349854943644866,0.0,0.8551329374313354,0.8892430663108826,0.7286909795133961,0.11362193664674995,0.8971746563911438,0.9046972393989563,0.42349854943644866,0.0,0.8551329374313354,0.8892430663108826
"Skidi, see how little ye know of the world? But don't fret, you're safe with me.","Widzisz, Skidi, jak ty mało wiesz o świecie! Ale bez obaw, ze mną nie zginiesz.","Skidi, widzisz, jak mało wiesz o świecie? Ale nie martw się, jesteś bezpieczny ze mną.","Skidi, widzisz jak mało znasz świata? Ale nie martw się, jesteś bezpieczny ze mną.","Skidi, widzisz jak mało wiesz o świecie? Ale nie martw się, jesteś bezpieczny ze mną.","Skidi, zobacz, jak mało wiesz o świecie? Ale nie martw się, jesteś bezpieczny ze mną.","Skidi, widzisz jak mało wiesz o świecie? Ale nie martw się, jesteś bezpieczny ze mną.",0.497893293540955,0.08359764098433711,0.8406504988670349,0.899537205696106,0.3186436788125493,0.020813995118775932,0.8049819469451904,0.8613839745521545,0.4775313285783526,0.08359764098433711,0.8349509239196777,0.8883135318756104,0.4640868462504577,0.08359764098433711,0.823549211025238,0.8913406133651733,0.4775313285783526,0.08359764098433711,0.8349509239196777,0.8883135318756104
What about upstairs? Anything unusual happen in the bathhouse the day of the break-in?,"A czy w dniu ataku działo się coś podejrzanego na górze, w samych łaźniach?",A co z górą? Czy w łaźni zdarzyło się coś dziwnego w dzień włamania?,A co z górą? Czy w łaźni zdarzyło się coś niezwykłego w dzień włamania?,A co z górą? Czy w łaźni dzień włamania wydarzyło się coś nietypowego?,- Co z górą? Czy dzień przed włamaniem wydarzyło się coś nietypowego w łaźni?,"Co do góry? W łaźni dzień włamania nic niezwykłego się nie wydarzyło. Happen przysięga, że było spokojnie jak zawsze. Zwyczajni klienci, bez incydentów. Cholerna sielanka.",0.28542902983665325,0.03798229226827674,0.7808669805526733,0.7900383472442627,0.2783264156569787,0.03798229226827674,0.7779296040534973,0.7783398032188416,0.2810320433626064,0.0361808203044872,0.7624950408935547,0.7216492295265198,0.2674196155503353,0.03342866121562732,0.7789950370788574,0.7928884625434875,0.24573495547723204,0.007575731225158965,0.6757841110229492,0.548515260219574
"Eh, uhm...",Hmpf.,"Eh, uhm...","Eh, eh...","'Eh, eh...'","Eh, eh...","Eh, uhm...",0.061728395061728496,0.0,0.675586462020874,0.8476498126983643,0.03144654088050324,0.0,0.5859972834587097,0.7090379595756531,0.0303030303030304,0.0,0.555611252784729,0.7263945937156677,0.03144654088050324,0.0,0.5859972834587097,0.7090379595756531,0.061728395061728496,0.0,0.675586462020874,0.8476498126983643
"Sir, what don't I got! Somethin' for everyone, seek and ye shall find! Cheap, too!",Czego ja nie mam! U mnie każdy coś dla siebie znajdzie! I tanio!,"Panie, czego ja nie mam! Coś dla każdego, szukajcie a znajdziecie! I to tanio!","Panie, czego ja nie mam! Coś dla każdego, szukajcie a znajdziecie! I to tanio!","""Panie, czego ja nie mam! Coś dla każdego, szukajcie a znajdziecie! A do tego tanie!""","- Panie, czego ja tu nie mam! Coś dla każdego, szukajcie a znajdziecie! A przy tym tanio!","Szlachetny panie, co ja nie mam! Coś dla każdego, szukajcie a znajdziecie! A do tego tanio!",0.5437444772811241,0.08406863224415036,0.8443196415901184,0.813697874546051,0.5437444772811241,0.08406863224415036,0.8443196415901184,0.813697874546051,0.48241026776069434,0.07029695662739609,0.7887011170387268,0.8424384593963623,0.47597291775717165,0.03058760346458022,0.8131263852119446,0.8242966532707214,0.4738351243229386,0.06917184228205472,0.8047910928726196,0.7305718064308167
"Oh, fuck!",O kurwa!,"Och, kurwa!","Och, kurwa!","Och, kurwa!",Cholera!,Cholera!,0.7076315862888033,0.1495348781221221,0.9099725484848022,0.7374169230461121,0.7076315862888033,0.1495348781221221,0.9099725484848022,0.7374169230461121,0.7076315862888033,0.1495348781221221,0.9099725484848022,0.7374169230461121,0.09774493958285237,0.0,0.7673431634902954,0.7781392931938171,0.09774493958285237,0.0,0.7673431634902954,0.7781392931938171
"Note that I said ""almost."" Now don't interrupt.","Zwróć uwagę, że powiedziałam „prawie”. I nie przerywaj.","Zauważ, że powiedziałem ""prawie"". Teraz nie przerywaj.","Zwróć uwagę, że powiedziałem ""prawie."" Teraz nie przerywaj.","Zauważ, że powiedziałam ""prawie."" Teraz nie przerywaj.","Zauważ, że powiedziałem ""prawie."" Teraz nie przerywaj.","Zauważ, że powiedziałam ""prawie"". Teraz nie przerywaj.",0.573478287670573,0.0670144447096575,0.827522337436676,0.9217231869697571,0.7588444472079526,0.17286039232097053,0.8924150466918945,0.9446375966072083,0.6105519660313886,0.08563683466425753,0.8299468159675598,0.9270476698875427,0.573478287670573,0.0670144447096575,0.8281728029251099,0.9237087965011597,0.6105519660313886,0.08563683466425753,0.8330402374267578,0.9254850149154663
Fine… I can't force you.,Cóż... Ja cię do tego nie zmuszę.,Dobrze... Nie mogę cię zmusić.,Dobrze... Nie mogę cię zmusić.,Dobrze... Nie mogę cię zmusić.,Dobrze... Nie mogę cię zmusić.,"Dobrze... Nie mogę cię zmusić. Lepiej mieć jakikolwiek pomysł, gdzie szukać, niż nie mieć go wcale.",0.2029472643246274,0.036015288308423515,0.8423635363578796,0.9236783385276794,0.2029472643246274,0.036015288308423515,0.8423635363578796,0.9236783385276794,0.2029472643246274,0.036015288308423515,0.8423635363578796,0.9236783385276794,0.2029472643246274,0.036015288308423515,0.8423635363578796,0.9236783385276794,0.2078172586881093,0.014628063653657535,0.7654309272766113,0.7102145552635193
The wraiths of Mörhogg? Hjalmar and I've bested worse buggers than that.,Upiory z Mörhoggu? Nie takich czynów dokonywaliśmy z Hjalmarem.,Upiory Mörhogga? Hjalmar i ja pokonaliśmy gorsze szkodniki niż to.,Widma Mörhogga? Ja i Hjalmar pokonaliśmy gorsze paskudztwa niż to.,"""Widma Mörhogga? Ja i Hjalmar pokonaliśmy gorsze paskudztwa niż to.""","- Cóż, Hjalmar i ja poradziliśmy sobie z gorszymi rzeczami niż to.","Folan: No to Ragh nar Roog jest nad nami.
Folan: Czyżby widma Mörhogga? Ja i Hjalmar poradziliśmy sobie z gorszymi szkaradztwami.
Geralt: Przygotuj się, Folanie. Dziki Gon się zbliża.

Tłumaczenie drugiej wypowiedzi:

""Ja i Hjalmar poradziliśmy sobie z gorszymi szkaradztwami.""",0.36978415767985,0.021105340631872645,0.7939642667770386,0.6755648255348206,0.32856301618049627,0.0,0.776287853717804,0.6161506175994873,0.3273444207016119,0.0,0.7544626593589783,0.5958362221717834,0.2224879557214,0.017033186037639283,0.709431529045105,0.6461787819862366,0.25727149664831145,0.005495155913866061,0.6620302200317383,0.5986213088035583
"Ah well. It seems I shall need a new trade anyway. I'm compromised in Novigrad, so… Ehh.","No cóż. Chyba będę musiała się przekwalifikować, bo jeśli jestem spalona w Novigradzie, to... ehh.","No cóż. Wydaje się, że i tak będę potrzebować nowego fachu. Jestem spalony w Novigradzie, więc... Ech.","Ach tak. Wygląda na to, że będę potrzebował nowego fachu. Jestem spalony w Novigradzie, więc... Ech.","Ach no cóż. Wygląda na to, że będę potrzebować nowego fachu. Jestem spalony w Novigradzie, więc... Ech.","- Cóż, chyba będę musiał znaleźć nowe zajęcie. Jestem spalony w Novigradzie, więc... Ech.","Ach no cóż. Wydaje się, że będę potrzebować nowego fachu. Jestem spalony w Novigradzie, więc... Eh.",0.40378047255222954,0.036374995670960676,0.8346335887908936,0.7054938673973083,0.3595978731449802,0.02878787818101127,0.8043521046638489,0.6547134518623352,0.381080064850528,0.028927969316143217,0.8206952214241028,0.7046896815299988,0.44712425844422105,0.03112418223320603,0.8452569246292114,0.7257894277572632,0.38851788178877594,0.030934588294313718,0.8381032347679138,0.6897574067115784
"Aye, who built you a monument more lasting than any of bronze. When next you see him, White Wolf, please convey the great esteem in which I, Sigurd, hold his many achievements.","Ano, pomnik zbudował trwalszy niż ze spiżu. Jak go spotkasz, Biały Wilku, przekaż wyrazy uznania od Sigurda, największego wielbiciela jego twórczości.","Tak, kto zbudował ci pomnik trwalszy niż jakikolwiek z brązu. Kiedy następnym razem go zobaczysz, Biały Wilku, przekaż mu wielki szacunek, jaki ja, Sigurd, mam dla jego licznych osiągnięć.","Tak, ten, który zbudował ci pomnik trwalszy niż ze spiżu. Kiedy następnym razem go spotkasz, Biały Wilku, proszę przekaż mu, jak wielkim szacunkiem darzę jego liczne osiągnięcia.","Tak, ten, który zbudował ci pomnik trwalszy niż jakikolwiek z brązu. Kiedy następnym razem go zobaczysz, Biały Wilku, proszę przekaż mu wielki szacunek, jakim ja, Sigurd, darzę jego liczne osiągnięcia.","Tak, ten, który zbudował ci pomnik trwalszy niż ze spiżu. Kiedy następnym razem go zobaczysz, Biały Wilku, proszę przekaż mu wielki szacunek, jakim ja, Sigurd, darzę jego liczne osiągnięcia.","Tak, ten, który zbudował ci pomnik trwalszy niż jakikolwiek z brązu. Kiedy następnym razem go zobaczysz, Biały Wilku, proszę przekaż mu wielki szacunek, jakim ja, Sigurd, darzę jego liczne osiągnięcia.",0.44541461093233664,0.046651719499116846,0.7560410499572754,0.8247837424278259,0.5025387800810509,0.19230188007838597,0.7854523658752441,0.8493763208389282,0.42975486780168,0.022872196013470604,0.7530118227005005,0.826180636882782,0.4779257305883327,0.11146727460890443,0.7801010012626648,0.8283588886260986,0.42975486780168,0.022872196013470604,0.7530118227005005,0.826180636882782
There are more and more!,Jest ich coraz więcej!,Jest ich coraz więcej!,Jest ich coraz więcej!,Jest ich coraz więcej!,Jest ich coraz więcej!,Tam jest coraz więcej!,1.0,1.0,1.0,0.99537593126297,1.0,1.0,1.0,0.99537593126297,1.0,1.0,1.0,0.99537593126297,1.0,1.0,1.0,0.99537593126297,0.6257646772159156,0.16990442448471224,0.910919725894928,0.9353644847869873
Wanted you to visit him.,"Chciał, żebyś do niego przyjechała.","Chciałem, żebyś go odwiedził.","Chciała, żebyś go odwiedził.","Chciałem, żebyś go odwiedziła.","Chciała, żebyś go odwiedził.","Chciałem, żebyś go odwiedziła.",0.30939157962833386,0.06257106818159155,0.8619757890701294,0.8515098690986633,0.3219993168184278,0.06257106818159155,0.8979196548461914,0.8773965835571289,0.33086408646397375,0.06257106818159155,0.8757014870643616,0.8995983004570007,0.3219993168184278,0.06257106818159155,0.8979196548461914,0.8773965835571289,0.33086408646397375,0.06257106818159155,0.8757014870643616,0.8995980024337769
No need to worry. I'm not out to hurt your witch.,"Nic nie zrobię waszej czarownicy, możecie być spokojni.",Nie ma się czym martwić. Nie zamierzam skrzywdzić twojej wiedźmy.,Nie ma potrzeby się martwić. Nie zamierzam skrzywdzić twojej czarownicy.,Nie ma potrzeby się martwić. Nie zamierzam skrzywdzić twojej czarownicy.,Nie musisz się martwić. Nie zamierzam skrzywdzić twojej czarownicy.,Nie musisz się martwić. Nie zamierzam skrzywdzić twojej czarownicy.,0.1546204254294659,0.0,0.6987459063529968,0.7187850475311279,0.3333626652092121,0.0,0.7741458415985107,0.8539654612541199,0.3333626652092121,0.0,0.7741458415985107,0.8539654612541199,0.3120508490435809,0.0,0.7801823616027832,0.8644565343856812,0.3120508490435809,0.0,0.7801823616027832,0.8644565343856812
Because it suits Radovid. You've not heard the story?,Bo Radowidowi tak było na rękę. Nie słyszałeś tej historii?,Ponieważ to pasuje do Radovida. Nie słyszałeś tej historii?,Bo tak jest na rękę Radovidowi. Nie słyszałeś tej historii?,Bo tak jest na rękę Radovidowi. Nie słyszałeś tej historii?,"Ponieważ odpowiada to Radovidowi. Nie słyszałeś tej historii? Rektor chciał przyznać mu doktorat honoris causa. Wydział się sprzeciwiał. Niemniej jednak Radovid pojawił się na ceremonii, założył togę, odebrał dyplom... a gdy było po wszystkim, uwięził dziekanów i cały senat akademicki - aby ""nie robili zamieszania"".",Ponieważ tak jest na rękę Radovidowi. Nie słyszałeś tej historii?,0.5667574739625104,0.26708679784499234,0.8189108967781067,0.7698209881782532,0.6612614742165753,0.30213753973567675,0.9433138966560364,0.9580646753311157,0.6612614742165753,0.30213753973567675,0.9433138966560364,0.9580646753311157,0.4576200609480603,0.056328721113585126,0.6803309917449951,0.5777202248573303,0.6530689667725589,0.2907153684841096,0.900675892829895,0.9207823276519775
