en_text,pl_text,default,dialog,dialog2,dialog3,dialog4,chrf_default,bleu_default,bertscore_default,comet_default,chrf_dialog,bleu_dialog,bertscore_dialog,comet_dialog,chrf_dialog2,bleu_dialog2,bertscore_dialog2,comet_dialog2,chrf_dialog3,bleu_dialog3,bertscore_dialog3,comet_dialog3,chrf_dialog4,bleu_dialog4,bertscore_dialog4,comet_dialog4
Right on that count - I don't like this.,"Rzeczywiście, nie podoba mi się to...",Dokładnie w tym punkcie - nie podoba mi się to.,Dokładnie co do tego - nie podoba mi się to.,"Dobrze, oto tłumaczenie drugiej wypowiedzi:

""Właśnie co do tego się zgadzam - nie podoba mi się to.""","Dokładne tłumaczenie drugiej wypowiedzi:

""Masz rację co do tego - nie lubię tego.""","Dobrze, oto tłumaczenie drugiej wypowiedzi Geralta:

""Właśnie w tej kwestii - ja tego nie lubię.""",0.5318322375650842,0.2626909894424158,0.8165208101272583,0.7577433586120605,0.516170712122149,0.2626909894424158,0.8319090604782104,0.7939502596855164,0.4978391433998619,0.1431712315455507,0.7330528497695923,0.7214686870574951,0.19796248779844647,0.01553712569276035,0.6678063869476318,0.728375256061554,0.18181395681395682,0.013217947626377298,0.6743401885032654,0.6782155632972717
May Modron Freya watch us and keep us…,Niech Modron Freyja ma nas w opiece…,Może Modron Freya obserwować nas i chronić nas...,Niech nas Modron Freya strzeże i chroni...,Niech Modron Freya czuwa nad nami i strzeże nas...,Niech nas Modron Freya strzeże...,Niech Modron Freya czuwa nad nami i strzeże nas...,0.35591952028763935,0.03303164318013808,0.6383519768714905,0.7679012417793274,0.4158680421809923,0.043472087194499145,0.7319987416267395,0.9439474940299988,0.5257802537415036,0.050712153369465586,0.7182478308677673,0.9195665717124939,0.4095209632836623,0.04739878501170794,0.7488507032394409,0.9411777257919312,0.5257802537415036,0.050712153369465586,0.7182478308677673,0.9195665717124939
It worth anything? The metal on your back?,Warte coś? Te żelaza na plecach?,Czy cokolwiek jest warte? Metal na twoich plecach?,Czy to cokolwiek warte? Metal na twoich plecach?,Czy to coś warte? Metal na twoich plecach?,Czy to warte czegokolwiek? Metal na twoich plecach?,Czy to warte czegokolwiek? Metal na twoich plecach?,0.3381434212849544,0.03303164318013808,0.8284263610839844,0.6754621863365173,0.34066573693489827,0.03303164318013808,0.8136313557624817,0.8037772178649902,0.3611434001288271,0.03303164318013808,0.8517903685569763,0.8011249303817749,0.35637118997633044,0.03303164318013808,0.8250038027763367,0.7172040343284607,0.35637118997633044,0.03303164318013808,0.8250038027763367,0.7172040343284607
"Sorry… Wasn't expecting to see you. To be honest, this isn't at all how I imagined we'd meet.","Wybacz... Nie spodziewałem się ciebie. Szczerze mówiąc, to w ogóle nie tak wyobrażałem sobie to spotkanie.","Przepraszam... Nie spodziewałem się ciebie zobaczyć. Szczerze mówiąc, to zupełnie nie tak wyobrażałem sobie nasze spotkanie.","Przepraszam... Nie spodziewałem się ciebie zobaczyć. Szczerze mówiąc, to zupełnie nie tak wyobrażałem sobie nasze spotkanie.","Przepraszam... Nie spodziewałem się ciebie zobaczyć. Szczerze mówiąc, to zupełnie nie tak wyobrażałem sobie nasze spotkanie.","Przepraszam... Nie spodziewałem się ciebie zobaczyć. Szczerze mówiąc, to zupełnie nie tak wyobrażałem sobie nasze spotkanie.","Przepraszam... Nie spodziewałem się ciebie zobaczyć. Szczerze mówiąc, zupełnie inaczej wyobrażałem sobie nasze spotkanie.",0.7736328025470772,0.28977907494497107,0.9066898226737976,0.956558346748352,0.7736328025470772,0.28977907494497107,0.9066898226737976,0.956558346748352,0.7736328025470772,0.28977907494497107,0.9066898226737976,0.956558346748352,0.7736328025470772,0.28977907494497107,0.9066898226737976,0.956558346748352,0.690954697255556,0.093128819084355,0.8839884996414185,0.9481529593467712
"Tell us, please. Absolutely love elven legends.",Opowiedz koniecznie. Uwielbiam elfie legendy.,"Powiedz nam, proszę. Absolutnie uwielbiam legendy elfickie.","Opowiedz nam, proszę. Uwielbiamy legendy o elfach.","Opowiedz nam, proszę. Uwielbiam absolutnie elfickie legendy.","Opowiedz nam, proszę. Uwielbiamy legendy o elfach.","Opowiedz nam, proszę. Uwielbiam legendy o elfach.",0.45545063010290715,0.0,0.8233529925346375,0.9106364846229553,0.49500780932987304,0.033031643180138064,0.8537063002586365,0.944564163684845,0.5986275149559385,0.043472087194499145,0.8726641535758972,0.946433961391449,0.49500780932987304,0.033031643180138064,0.8537063002586365,0.944564163684845,0.4962698549560099,0.039281465090051315,0.8704454898834229,0.9499320983886719
"They threw stones at us, Geralt.","One rzucały w nas kamieniami, Geralt.","Rzucali w nas kamieniami, Geralt.","Rzucali w nas kamieniami, Geralt.","Rzucali w nas kamieniami, Geralcie.","Rzucali w nas kamieniami, Geralt.","Rzucali w nas kamieniami, Geralcie.",0.7210127831294493,0.5475182535069453,0.9195744395256042,0.8776541352272034,0.7210127831294493,0.5475182535069453,0.9195744395256042,0.8776541352272034,0.6583087239402019,0.21771262023986562,0.8955432176589966,0.8868412971496582,0.7210127831294493,0.5475182535069453,0.9195744395256042,0.877654492855072,0.6583087239402019,0.21771262023986562,0.8955432176589966,0.8868412971496582
I'll take Stuttering Matt.,Niech będzie Maciek Jąkała.,Wezmę Jąkającego się Mata.,Wezmę Jąkającego się Matta.,Wezmę Jąkającego się Matta.,"Zobaczysz, że będę się ścigać ze Stuttering Mattem.","Zobaczysz, że będę się ścigał z Jąkającym się Mattem.",0.1572142934660855,0.0,0.7455019354820251,0.546619713306427,0.1565421293682164,0.0,0.7494092583656311,0.5943304896354675,0.1565421293682164,0.0,0.7494092583656311,0.5943305492401123,0.1492521367521368,0.0,0.6700586676597595,0.43690261244773865,0.2154367721744801,0.0,0.6859725713729858,0.4988161027431488
Think I'll join Ermion. Need to talk to him.,Dołączę do Myszowora. Mam do niego sprawę.,"Myślę, że dołączę do Ermiona. Muszę z nim porozmawiać.","Myślę, że dołączę do Ermiona. Muszę z nim porozmawiać.","Myślę, że dołączę do Ermiona. Muszę z nim porozmawiać.","Myślę, że dołączę do Ermiona. Muszę z nim porozmawiać.","Myślę, że dołączę do Ermiona. Muszę z nim porozmawiać.",0.30738387117063587,0.023980296761827107,0.7732905745506287,0.837131917476654,0.30738387117063587,0.023980296761827107,0.7732905745506287,0.837131917476654,0.30738387117063587,0.023980296761827107,0.7732905745506287,0.837131917476654,0.30738387117063587,0.023980296761827107,0.7732905745506287,0.837131917476654,0.30738387117063587,0.023980296761827107,0.7732905745506287,0.837131917476654
"Uma - the, uh, deformed midget? What will you do with him?",Uma to ten brzydki człowieczek? Co chcesz z nim zrobić?,Uma - ten zdeformowany karzeł? Co zamierzasz z nim zrobić?,"Uma - ten, eh, zdeformowany karzeł? Co zamierzasz z nim zrobić?","Uma - ten, eh, zdeformowany karzeł? Co zamierzasz z nim zrobić?",Uma - ten zdeformowany karzeł? Co zamierzasz z nim zrobić?,Uma - ten zdeformowany karzeł? Co z nim zrobisz?,0.37303863523779723,0.1242188995129533,0.8441029191017151,0.726297914981842,0.3732927246701154,0.10600313379512592,0.8145565986633301,0.7095667719841003,0.3732927246701154,0.10600313379512592,0.8145565986633301,0.7095667719841003,0.37303863523779723,0.1242188995129533,0.8441029191017151,0.7262980341911316,0.2873307800762477,0.05706135914957148,0.8187344670295715,0.6977490186691284
"More than a restless ghost. A plague maiden, a powerful wraith filled with grief and hatred that drive her, give her the power to sow disease and death.","Nie jest zwykłym niespokojnym duchem, tylko potężnym upiorem. Żal i nienawiść dają jej energię do siania śmierci i zarazy.","Więcej niż niespokojny duch. Zaraza dziewica, potężna zjawa przepełniona żalem i nienawiścią, które ją napędzają, dają jej moc szerzenia choroby i śmierci.","Więcej niż niespokojny duch. Zaraza, potężna zjawa przepełniona smutkiem i nienawiścią, które ją napędzają, dając jej moc szerzenia choroby i śmierci.","Więcej niż niespokojny duch. Zaraza dziewica, potężna zjawa przepełniona smutkiem i nienawiścią, które ją napędzają, dając jej moc szerzenia choroby i śmierci.","Więcej niż niespokojny duch. Zaraza, potężna zjawa przepełniona żalem i nienawiścią, które ją napędzają, dają jej moc rozprzestrzeniania choroby i śmierci.","Więcej niż niespokojny duch. Dziewica morowa, potężna zjawa przepełniona żalem i nienawiścią, które ją napędzają, dają jej moc rozprzestrzeniania choroby i śmierci.",0.3792466883050068,0.021847844937497602,0.762866199016571,0.7114671468734741,0.3691992671755228,0.012021577610863726,0.7591229677200317,0.8004805445671082,0.36641180289380637,0.011433361115787456,0.7501607537269592,0.7391443848609924,0.3931612226142786,0.02297185935845028,0.7634046673774719,0.7483763098716736,0.38545232629286535,0.021847844937497602,0.7547197341918945,0.7807549834251404
"Slandering servants of the Eternal Fire and his majesty, was he?","Sługi Wiecznego Ognia oczerniał, majestat królewski obrażał?","Oczerniał sług wiecznego ognia i jego wysokości, czyżby?","Oczerniał sługi Wiecznego Ognia i jego wysokości, prawda?","Oczerniał sługi Wiecznego Ognia i jego królewskiej mości, prawda?","- Oskarżał sługi Wiecznego Ognia i jego wysokości, tak?","Szkalował sługi Wiecznego Ognia i Jego Królewskiej Mości, prawda?",0.31427402911784197,0.0,0.7647475004196167,0.5163063406944275,0.4590500122681427,0.05873949094699214,0.7858148217201233,0.7112962007522583,0.5682160115084979,0.050712153369465586,0.7929795980453491,0.7801907062530518,0.38917982696700887,0.050712153369465586,0.7467966675758362,0.6374456286430359,0.46824071607145995,0.050712153369465586,0.7600827217102051,0.7841779589653015
"No lookin', and you have to count out loud - all your fingers. Toes, too.",Nie podglądaj i licz głośno wszystkie palce. U nóg też.,Nie patrz i musisz głośno liczyć - wszystkie swoje palce. Palce u stóp też.,"Bez patrzenia, a musisz liczyć na głos - wszystkie palce. Stóp też.","Nie patrz, a musisz liczyć na głos - wszystkie palce. Stóp też.","Nie patrz, a musisz liczyć na głos - wszystkie palce. Też u stóp.","Nie patrzysz, a musisz liczyć na głos - wszystkie palce. U rąk i nóg też.",0.4649509569548546,0.0223550930962921,0.8382753729820251,0.7624397277832031,0.40229268910829913,0.03986357128268015,0.766441285610199,0.5064864158630371,0.42815451938130766,0.0428361950754725,0.777899980545044,0.5337400436401367,0.4086339597917721,0.036362270465000714,0.7769970297813416,0.6024124026298523,0.5070294523463642,0.08947853200770763,0.817066490650177,0.6432590484619141
Umblest regards.,"A kłaniam się, kłaniam.","Umblest regards.

Nie otrzymałem żadnego tekstu do przetłumaczenia poza ""Umblest regards."" Ponieważ jest to angielskie wyrażenie, które może być używane jako pozdrowienie lub zakończenie wiadomości, tłumaczenie na język polski brzmi:

""Serdeczne pozdrowienia.""

To tłumaczenie oddaje ogólny ton i znaczenie oryginalnego wyrażenia.","Umblest regards.

Tłumaczenie: Najlepsze życzenia.",'Szacunek dla umblersów.',Umblest regards → Pozdrowienia umblest (brak jednoznacznego znaczenia w języku polskim),"Umblest regards.

Niski ukłon.",0.10079464070354666,0.0,0.5759022831916809,0.33897462487220764,0.12768219155059776,0.0,0.5402305126190186,0.26537299156188965,0.05747126436781617,0.0,0.6316028237342834,0.40395843982696533,0.13833151550678394,0.0,0.5950378179550171,0.32299789786338806,0.0894095502278582,0.0,0.5872355699539185,0.35922732949256897
I got a tetter!,Mam liszaja!,Dostałem gęsiej skórki!,Mam dreszcze!,Mam pchłę!,Mam dreszcze.,Mam dreszcze!,0.08333333333333341,0.0,0.7275057435035706,0.4632558226585388,0.157910058900158,0.1495348781221221,0.8702620267868042,0.6482408046722412,0.11468139444329926,0.1495348781221221,0.7959581017494202,0.8087303638458252,0.14289504388514299,0.1495348781221221,0.772167980670929,0.6471827030181885,0.157910058900158,0.1495348781221221,0.8702620267868042,0.6482409834861755
No.,Nie.,Nie.,Nie.,'Nie.',Nie.,Nie.,0.6666666666666666,0.1778279410038923,1.0,0.975537121295929,0.6666666666666666,0.1778279410038923,1.0,0.9755370020866394,0.6053841991341992,0.0,0.7658098340034485,0.8412235379219055,0.6666666666666666,0.1778279410038923,1.0,0.9755370020866394,0.6666666666666666,0.1778279410038923,1.0,0.975537121295929
"We're done talking, Geralt. Get out of my sight.","Koniec rozmowy, Geralt. Zejdź mi z oczu.","Skończyliśmy rozmawiać, Geralt. Wynoś się z moich oczu.","Skonczyliśmy rozmawiać, Geralt. Idź sobie z oczu.","Skonczyliśmy rozmawiać, Geralt. Idź sobie z oczu.","- Jesteśmy skończeni, Geralt. Wynoś się z moich oczu.","Jesteśmy skończeni, Geralt. Wynoś się z moich oczu.",0.3438122121205789,0.03655552228545124,0.8065477013587952,0.869551956653595,0.39423327157843674,0.07730551756939454,0.8432361483573914,0.7415289282798767,0.39423327157843674,0.07730551756939454,0.8432361483573914,0.7415289282798767,0.326735128616478,0.03155984539112946,0.7856018543243408,0.8326523303985596,0.3277106504869787,0.03655552228545124,0.7922043800354004,0.8174452781677246
Geralt of Rivia.,Geralt z Rivii.,Geralt z Rivii.,Geralt z Rivii.,Geralt z Rivii.,Jestem Jutta an Dimun. Nikt nie może mi dorównać w walce.,Jestem Jutta an Dimun. Żaden mężczyzna nie był w stanie dorównać mi w walce.,1.0,0.5623413251903491,1.0000001192092896,0.9849526882171631,1.0,0.5623413251903491,1.0000001192092896,0.9849526882171631,1.0,0.5623413251903491,1.0000001192092896,0.9849526882171631,0.10228592545665725,0.0,0.6445024013519287,0.4750320315361023,0.10239651416122013,0.0,0.6398292183876038,0.46012964844703674
True enough. Just like I can tell right off if a punter'll pay or try to wriggle out of it.,"W sumie racja. Ja z kolei od razu widzę po kliencie, czy zapłaci, czy będzie cwaniaczył.","To prawda. Tak jak potrafię od razu poznać, czy klient zapłaci, czy będzie próbował się wymigać.","Prawda. Podobnie jak potrafię od razu stwierdzić, czy klient zapłaci, czy będzie próbował się wykręcić z płatności.","Prawda. Podobnie jak potrafię od razu poznać, czy klient zapłaci, czy będzie próbował się wykręcić.","- Potrafię od razu rozpoznać, czy klient zapłaci, czy będzie próbował się wykręcić z płatności.","Prawda. Tak jak potrafię od razu poznać, czy klient zapłaci, czy będzie próbował się wykręcić.",0.3813113982769159,0.08012120435729668,0.8012180924415588,0.868004560470581,0.400918257874467,0.07786777655685517,0.788317084312439,0.8439011573791504,0.38825316065265664,0.08054325699278696,0.8062343001365662,0.8571531176567078,0.37673264369816134,0.08370779170358567,0.779718279838562,0.8394911289215088,0.3818411382531164,0.08054325699278696,0.8017947673797607,0.8319596648216248
For Mahakam!,Za Mahakam!,Dla Mahakam!,Dla Mahakamu!,Dla Mahakam!,Dla Mahakam!,Dla Mahakam!,0.8472439663448195,0.1495348781221221,0.9468656778335571,0.898368239402771,0.7152431058595224,0.0,0.9022409319877625,0.8166324496269226,0.8472439663448195,0.1495348781221221,0.9468656778335571,0.8983682990074158,0.8472439663448195,0.1495348781221221,0.9468656778335571,0.8983684778213501,0.8472439663448195,0.1495348781221221,0.9468656778335571,0.8983682990074158
Good. Ville doesn't like cock-ups.,Dobrze. Ville nie lubi fuszerki.,Dobre. Wioska nie lubi niedoróbek.,Dobre. Ville nie lubi niedopatrzeń.,Dobre. Ville nie lubi niedopatrzeń.,Dobre. Wieś nie lubi niedoróbek.,Dobrze. Ville nie lubi niedoróbek.,0.29801500325327096,0.11362193664674995,0.8323978185653687,0.590005099773407,0.5524167902135173,0.26591479484724945,0.8622193932533264,0.7912185192108154,0.5524167902135173,0.26591479484724945,0.8622193932533264,0.7912188172340393,0.29430722927099734,0.11362193664674995,0.8414637446403503,0.6240339279174805,0.6699811865046922,0.668740304976422,0.9152914881706238,0.788535475730896
Begone.,Odejdź.,Odejdź.,Odejdź.,Odejdź.,Odejdź.,Odejdź.,1.0,0.1778279410038923,1.0,0.9844475388526917,1.0,0.1778279410038923,1.0,0.9844475984573364,1.0,0.1778279410038923,1.0,0.9844476580619812,1.0,0.1778279410038923,1.0,0.9844475984573364,1.0,0.1778279410038923,1.0,0.9844476580619812
"Almost there… But I need a little more time. I'd rather not deliver something unfinished, or worse yet botched.","Właśnie się robi... Ale potrzebuję jeszcze trochę czasu. Wiesz, nie chcę odstawiać fuszerki.","Prawie tam... Ale potrzebuję trochę więcej czasu. Wolałbym nie dostarczać czegoś niedokończonego, a jeszcze gorzej - spartaczonego.","Prawie gotowe... Ale potrzebuję trochę więcej czasu. Wolałbym nie dostarczać czegoś nieskończonego, lub co gorsza spartaczonego.","Już prawie gotowe... Ale potrzebuję jeszcze trochę czasu. Wolałabym nie dostarczać czegoś nieskończonego, a tym bardziej spartaczonego.","Prawie gotowe... Ale potrzebuję trochę więcej czasu. Wolałbym nie dostarczać czegoś niedokończonego, lub co gorsza spartaczonego.","Już prawie skończyłam… Ale potrzebuję jeszcze trochę czasu. Wolałabym nie dostarczać czegoś niedokończonego, lub co gorsza spartaczonego.",0.42981354795944443,0.03201406061582137,0.777553915977478,0.6907851099967957,0.4059310641953721,0.032709344708772174,0.7813435196876526,0.6661592125892639,0.527378526661972,0.2240750868020436,0.7910916805267334,0.7059739828109741,0.3951940484744358,0.032709344708772174,0.7793206572532654,0.7148219347000122,0.4871814450257097,0.2240750868020436,0.7527924180030823,0.686826765537262
"If he's such a drunk, why don't you leave him?","Jak chleje tyle, to może go zostawisz?","Jeśli jest takim pijakiem, dlaczego go nie zostawisz?","Jeśli jest takim pijakiem, dlaczego go nie zostawisz?","Jeśli jest takim pijakiem, dlaczego go nie zostawisz?","Jeśli jest takim pijakiem, dlaczego go nie zostawisz?","Jeśli jest takim pijakiem, dlaczego go nie zostawisz?",0.3560972089320451,0.03303164318013808,0.7863785028457642,0.7964446544647217,0.3560972089320451,0.03303164318013808,0.7863785028457642,0.7964446544647217,0.3560972089320451,0.03303164318013808,0.7863785028457642,0.7964446544647217,0.3560972089320451,0.03303164318013808,0.7863785028457642,0.7964446544647217,0.3560972089320451,0.03303164318013808,0.7863785028457642,0.7964446544647217
Thief!,Złodziej!,Złodziej!,Złodziej!,Złodziej!,Złodziej!,Złodziej!,1.0,0.1778279410038923,1.0,0.9922850131988525,1.0,0.1778279410038923,1.0,0.9922850131988525,1.0,0.1778279410038923,1.0,0.9922850131988525,1.0,0.1778279410038923,1.0,0.9922850131988525,1.0,0.1778279410038923,1.0,0.9922850131988525
"So, wanna play?","To co, gramy?",No to gramy?,No to zagrajmy.,"No to dobrze, chcesz zagrać?",No to gramy.,Oczywiście.,0.42125451579277856,0.11362193664674995,0.8366830348968506,0.7414593696594238,0.17130221653878944,0.0,0.6981374025344849,0.6347723007202148,0.15408083885804927,0.0,0.7225108742713928,0.6367409229278564,0.29690216396368196,0.0,0.7655737400054932,0.6476051211357117,0.03030303030303039,0.0,0.6232472658157349,0.6211615204811096
"Sorry, but - your life story? Just not interested. This isn't a social call. I'm here on business.","Wybacz, ale nie interesuje mnie historia twojego życia. Jestem tu w konkretnej sprawie, zapomniałeś?","Przykro mi, ale - twoja historia życia? Po prostu nie jestem zainteresowany. To nie jest rozmowa towarzyska. Jestem tu w interesach.","Przepraszam, ale - twoja historia życia? Po prostu nie jestem zainteresowany. To nie jest rozmowa towarzyska. Jestem tu w interesach.","Przepraszam, ale - twoja historia życia? Zupełnie mnie nie interesuje. To nie jest spotkanie towarzyskie. Jestem tu w interesach.","Przepraszam, ale - twoje życie? Nie jestem zainteresowany. To nie jest rozmowa towarzyska. Jestem tu w interesach.","Przepraszam, ale - twoja historia życia? Po prostu nie jestem zainteresowany. To nie jest wizyta towarzyska. Jestem tu w interesach.",0.3860498967478974,0.0537621294693616,0.7241510152816772,0.8347561359405518,0.3851963681679356,0.05667859235210572,0.7189048528671265,0.8422144651412964,0.46334074704761785,0.062284969540134474,0.7397379279136658,0.875357449054718,0.33408347458191573,0.06468490584192432,0.7113328576087952,0.8271572589874268,0.3874935163181646,0.05667859235210572,0.718281090259552,0.8321154117584229
Kaer Morhen. Can't imagine this place without Vesemir.,Nie wyobrażam sobie Kaer Morhen bez Vesemira.,Kaer Morhen. Nie mogę sobie wyobrazić tego miejsca bez Vesemira.,Kaer Morhen. Nie mogę sobie wyobrazić tego miejsca bez Vesemira.,Kaer Morhen. Nie mogę sobie wyobrazić tego miejsca bez Vesemira.,Kaer Morhen. Nie mogę sobie wyobrazić tego miejsca bez Vesemira.,Kaer Morhen. Nie mogę sobie wyobrazić tego miejsca bez Vesemira.,0.6702676875960846,0.056122223243057295,0.8675171136856079,0.8991629481315613,0.6702676875960846,0.056122223243057295,0.8675171136856079,0.8991629481315613,0.6702676875960846,0.056122223243057295,0.8675171136856079,0.8991629481315613,0.6702676875960846,0.056122223243057295,0.8675171136856079,0.8991629481315613,0.6702676875960846,0.056122223243057295,0.8675171136856079,0.8991629481315613
What is it?,O co chodzi?,Co to jest?,Co takiego?,Czego chcesz?,"- Co to za sprawa?
- Zamówiłem kilka substancji z Novigradu. Kupiec miał przybyć wczoraj, ale jeszcze się nie pojawił.","Może... może zostaniesz trochę dłużej? Jest jedna mała przysługa, którą mógłbyś mi jeszcze wyświadczyć.",0.0505050505050506,0.0,0.8468917012214661,0.9102230668067932,0.06666666666666678,0.0,0.8111760020256042,0.9051140546798706,0.1545963029962781,0.0,0.8137390613555908,0.8094066977500916,0.07054673721340399,0.0,0.6214296221733093,0.6271097660064697,0.11335784313725498,0.0,0.603895902633667,0.46588924527168274
Somebody oughta see to the baron before he burns the castle down.,"Trzeba się raczej zająć Baronem, nim puści z dymem cały kasztel.","Ktoś powinien zająć się baronem, zanim spali zamek.","Ktoś powinien zająć się baronem, zanim spali zamek do szczętu.","Ktoś powinien zająć się baronem, zanim spali cały zamek.","Ktoś powinien zająć się baronem, zanim spali cały zamek.","Ktoś powinien zająć się baronem, zanim spali cały zamek.",0.23777969775234722,0.022702294218557836,0.7596843242645264,0.614285945892334,0.2554833009720469,0.022710171642664416,0.7504169344902039,0.5119333267211914,0.2645963993959955,0.025271148634948993,0.7704896330833435,0.736047625541687,0.2645963993959955,0.025271148634948993,0.7704896330833435,0.736047625541687,0.2645963993959955,0.025271148634948993,0.7704896330833435,0.736047625541687
"They treat me like I'm nobody, the menial labor. Truth is, the Nilfgaardian, the one Fergus is kissing up to - I'll have to craft his armor. Yours, too, for that matter.","Tego, że wszyscy traktują mnie jak popychadło! A prawda jest taka, że tę zbroję dla Nilfgaardczyka, któremu Fergus tak fachowo wchodzi w tyłek, to ja zrobię. I twój pancerz zresztą też.","Traktują mnie jak nikogo, jakby praca fizyczna była poniżej mojej godności. Prawda jest taka, że ten Nilfgaardczyk, którego całuje Fergus - będę musiał wykuć jego zbroję. Twoją też, przy okazji.","Traktują mnie jak nikogo, jakby praca fizyczna była poniżej mojej godności. Prawda jest taka, że Nilfgaardczyka, tego, którego Fergus się podlizuje - będę musiał wykuć jego zbroję. Twoją też, dla ścisłości.","Traktują mnie jak nikogo, jakby praca fizyczna była poniżej mojej godności. Prawda jest taka, że Nilfgaardczyka, tego, którego Fergus się podlizuje - będę musiała wykuć jego zbroję. Twoją też, przy okazji.","Traktują mnie jak nikogo, zlecają mi pracę fizyczną. Prawda jest taka, że ten Nilfgaardczyk, którego Fergus tak się ubiega - będę musiał wykuć jego zbroję. Twoją też, dla porównania.","Traktują mnie jak nikogo, zlecają mi najgorsze prace. Prawda jest taka, że muszę wykuć zbroję dla tego Nilfgaardczyka, którego Fergus tak się stara przypodobać. Twoją też, Geralcie.",0.4115158354162715,0.039339730598886416,0.7571128606796265,0.6530038118362427,0.4204174250695942,0.04222241460226927,0.7565037608146667,0.6006476879119873,0.42067446974705275,0.04083617715840545,0.7624899744987488,0.6076071262359619,0.4233917705517564,0.04543210565542702,0.770890474319458,0.6414337754249573,0.4603862315537237,0.0506151452187588,0.7751131653785706,0.6977419853210449
Ready?,Gotowi?,Gotowy?,Gotowy?,'Gotowy?',Gotowy?,Gotowy?,0.4928571428571429,0.0,0.9197662472724915,0.9745092391967773,0.4928571428571429,0.0,0.9197662472724915,0.9745087027549744,0.47401802946157784,0.0,0.848706841468811,0.9343615770339966,0.4928571428571429,0.0,0.9197662472724915,0.9745091795921326,0.4928571428571429,0.0,0.9197662472724915,0.9745091795921326
"But, does no good to wallow in misfortune. How can I be of service?","No, ale dość o nieszczęściach. Czym mogę służyć?","Ale, nie ma sensu użalać się nad nieszczęściem. W czym mogę być pomocny?",Ale nie ma sensu użalać się nad nieszczęściem. W czym mogę pomóc?,Ale nie ma sensu użalać się nad sobą. W czym mogę pomóc?,"Ależ proszę, oto tłumaczenie drugiej wypowiedzi:

""Ale nie ma sensu użalać się nad sobą. W czym mogę być pomocny?""","Ależ oczywiście, oto tłumaczenie drugiej wypowiedzi na język polski:

""Ale nie ma sensu użalać się nad sobą. Jak mogę być pomocny?""",0.4007298593279965,0.01553712569276035,0.8052462935447693,0.848670482635498,0.38687013602972753,0.017033186037639283,0.8144736289978027,0.8383157849311829,0.2274946824500307,0.017033186037639283,0.770002007484436,0.7897307276725769,0.25311712822806126,0.010182425646195498,0.6922053694725037,0.7523878812789917,0.20383527651249644,0.009134423666564471,0.6909782290458679,0.7145657539367676
