en_text,pl_text,dialog_extracted,chrf_dialog_extracted,bleu_dialog_extracted,bertscore_dialog_extracted,comet_dialog_extracted
Where are they?,Gdzie się podziały?,Gdzie oni są?,0.20779216225201289,0.11362193664674995,0.8451359272003174,0.8907118439674377
"Then all a-sudden lightnin' started poundin' down, as if the Naglfar itself were sailin' in. Hasn't stopped to this day.","No i od razu zaczęło prać piorunami, jakby sam Naglfar przypłynął. Do tej pory nie przestaje.","Nagle zaczęło się błyskawicznie piorunować, jakby sam Naglfar żeglował w pobliżu. Nie ustało to do dziś.",0.37465946714225057,0.06541868941754436,0.806980550289154,0.684802234172821
"Expect me to? What, coulda dyed my hair black. The Black Wolf… How's that sound?","Myślałaś, że ufarbuję włosy na czarno? Czarny Wilk... Niezłe, co?","Spodziewasz się, że się zmienię? Co, mogłem ufarbować włosy na czarno. Czarny Wilk... Jak to brzmi?",0.47489533184291055,0.03889818545474848,0.843543529510498,0.8149744868278503
A basin of water…?,Woda w misce...,Czara wody...?,0.1604506604506605,0.0,0.7921088337898254,0.7501901388168335
The Crones sent them. To punish me.,"Wiedźmy je nasłały, za karę.",Wiedźmy ich wysłały. Żeby mnie ukarać.,0.37067000576539666,0.040824829046386304,0.8182833790779114,0.8548468947410583
"Argh, some people!",Co za ludzie!,"Ach, niektórzy ludzie!",0.47446970639397623,0.11362193664674995,0.7901977896690369,0.8507422804832458
Only that she seemed tired. Very tired. And… and her hair was wet.,"Tyle, że wyglądała na zmęczoną... Bardzo zmęczoną. I... Miała mokre włosy.","Tylko to, że wydawała się zmęczona. Bardzo zmęczona. I... i jej włosy były mokre.",0.4731258014567152,0.018798317647335087,0.8382566571235657,0.9337875247001648
Don't think you have anything to fear. Brought your new friends with you.,"Chyba nie musisz się martwić, skoro są z tobą twoi nowi przyjaciele.","Nie myśl, że masz się czego bać. Przyprowadziłeś ze sobą nowych przyjaciół.",0.2623471840180594,0.017033186037639283,0.7521132230758667,0.8940941691398621
Consider it a gesture of goodwill… almost. I'll expect you to return the favor.,Bo chcę zademonstrować dobrą wolę i liczę na wzajemność.,"Uważaj to za gest dobrej woli... prawie. Oczekuję, że odwzajemnisz przysługę.",0.23208303931643406,0.0,0.7054274678230286,0.6699463129043579
"When those sons of bitches severed heads, then catapulted 'em at us!",Kiedy te skurwysyny łby trupom użynały i nimi miotali z katapult!,"Kiedy te skurwysyny odcięły głowy, a potem wystrzeliły je w naszą stronę!",0.35896269642509315,0.08430118946484098,0.7699758410453796,0.6611409783363342
"He must be a mage, that barber. To heal your daughter in a day?",Ten cyrulik to chyba jakis czarownik... Córę ci w jeden wieczór wyleczył...,"Musi być magiem ten barber, żeby uleczyć twoją córkę w jeden dzień?",0.17934519651119288,0.03602080288207364,0.6888647079467773,0.7149931192398071
Ugh. Dandelion. Hey! Hear me?,"Jaskier, halo, słyszysz mnie?","Geralt, jestem w trakcie pisania, tworzenia. Przypadkiem, co myślisz o tym fragmencie?",0.18036360112718378,0.0,0.6413457989692688,0.5277475714683533
Bury her bones. Anabelle should be laid to rest by one who loved her. It's the only way to lift the curse that holds Fyke Isle.,"Musisz pochować jej kości. Anabelle powinien pożegnać ktoś, kto ją kochał. Tylko tak można odczynić klątwę ciążącą na Kłomnicy.","Pochowaj jej kości. Anabelle powinna spocząć w spokoju rękami kogoś, kto ją kochał. To jedyny sposób, aby zdjąć klątwę, która trzyma Fyke Isle.",0.4525106488991333,0.06893826633458067,0.8192619681358337,0.7554148435592651
Makes no difference. You'll find me.,Znajdziesz jakiś sposób.,Nie ma znaczenia. Znajdziesz mnie.,0.3868696710031974,0.05372849659117709,0.8155601620674133,0.7641786932945251
Thanks. I'd like to know who's congratulating me.,Dzięki. Od kogo te gratulacje?,"Dzięki. Chciałbym wiedzieć, kto mnie gratuluje.",0.40547999073287194,0.040824829046386304,0.727337121963501,0.8688519597053528
You daft? That was a witcher!,Coś ty ogłupiał?! To był wiedźmin!,Czy ty jesteś głupi? To był wiedźmin!,0.5527130396426642,0.17567205239427922,0.905653715133667,0.9311838150024414
Thanks!,Dzięki!,Dzięki!,1.0,0.1778279410038923,1.0,0.9944583773612976
Why? How many distressed damsels have you rescued of late? I believed I was special!,"A co, ile żeś tu dam ratował z opałów, hę? Chyba jedną!","Dlaczego? Ile zrozpaczonych dam ostatnio uratowałeś? Myślałam, że jestem wyjątkowa!",0.2389455528420311,0.01727959142950042,0.7244374752044678,0.690052330493927
Think I don't know you as the holy terror you are?,"Myślisz że nie wiem, co z ciebie za hultaj?","Myślisz, że nie wiem, jakim świętym postrachem jesteś?",0.4070909460383729,0.12131756417616475,0.8160225749015808,0.599662721157074
"Aye. You pulled me from under a pile o' stiffs. I was sure the scourge'd never touch me. So sure, so foolish…","Tak, wyciągnęliście mnie spod sterty trupów. A ja byłem wtedy taki pewny, że mnie zaraza ominie, taki pewny...","Tak. Wyciągnąłeś mnie spod sterty trupów. Byłem pewien, że plaga nigdy mnie nie dotknie. Tak pewien, tak głupi...",0.4017853669430261,0.1487964117124549,0.8366063833236694,0.7970088124275208
"What, then?",A czym?,"Co, w takim razie?",0.07246376811594213,0.0,0.6939663887023926,0.9000868201255798
"They choose the guards from among witch hunters - the worst dregs, rabid fanatics! if you only knew what they do to folk…","Dobierają strażników spośród łowców czarownic... Same najgorsze męty, cholerni fanatycy... Żebyście wiedzieli, co oni z ludźmi wyczyniali...","Wybierają strażników spośród łowców czarownic - najgorszych szumowin, rozwścieczonych fanatyków! Gdybyś tylko wiedział, co oni robią ludziom…",0.5050140915586553,0.07158561577277536,0.7900511622428894,0.8608987927436829
"Still here, witcher? Cut the beast down, have ye?","Ciągle tutaj, wiedźminie? Nie zasiekłeś jeszcze tego potwora?","Ciągle tu jesteś, wiedźminie? Udało ci się zabić bestię?",0.37127823024344164,0.028517539529041507,0.8482685089111328,0.8282151222229004
See you later.,Do zobaczenia.,Do zobaczenia później.,0.8567015268318557,0.11362193664674995,0.9175108075141907,0.9460498690605164
"Does, uh, Geralt fish?",A czy Geralt wędkuje?,"Czy, eh, Geralt wędkował?",0.5112889227524438,0.08034284189446518,0.8722126483917236,0.8839462995529175
"Geralt of Rivia at my doorstep? Surely, this is no chance encounter?",Geralt z Rivii pod moim domem? To nie może być przypadek.,Czyżby Geralt z Rivii u moich drzwi? Na pewno nie jest to przypadkowe spotkanie.,0.4087738298488926,0.07596458453655348,0.8311668634414673,0.8572161793708801
"And sometimes you're a real blowhard. But dammit… I'd go to hell and back for you. Come here, you oaf!","A ty... Jesteś bufon... Ale, kurwa... W ogień bym za tobą skoczył. Chodź no tu, bracie!","A czasami jesteś prawdziwym bufonem. Ale do diabła... Poszedłbym dla ciebie do piekła i z powrotem. Chodź tu, ty osiołku!",0.28367231995921943,0.012673718536830811,0.7751286625862122,0.7403865456581116
"We started building that home for Bernie, but ran out of coin and had to stop. Do you think the phantom's hiding in there?","Zaczęliśmy tam stawiać dom dla Berniego, ale funduszy zabrakło i budowa stanęła. Myślisz, że widziadło się tam zalęgło?","Rozpoczęliśmy budowę tego domu dla Berniego, ale skończyły nam się pieniądze i musieliśmy przerwać. Myślisz, że duch ukrywa się w środku?",0.38786274432014384,0.06183522915385178,0.8132783770561218,0.7770352959632874
"I can certainly try to help. But I'll need to clear my head first. After those deranged dreams, I feel it's full of cobwebs. Find me at the Golden Sturgeon. I rent a room there.",Spróbuję ci pomóc. Tylko najpierw muszę zmazać opary tych obłąkanych snów... Znajdziesz mnie w karczmie Złoty Jesiotr. Tam wynajmuję pokój.,"Mogę na pewno spróbować pomóc. Ale muszę najpierw oczyścić głowę. Po tych szalonych snach czuję, że jest pełna pajęczyn. Znajdź mnie w Złotym Szczupaku. Wynajmuję tam pokój.",0.3722678195126725,0.02019074850994527,0.7931846380233765,0.7760399580001831
Sure. Only diversion we get in this wasteland.,A pewnie. Tyle mam rozrywki na tym pustkowiu.,"Tak. To jedyna rozrywka, jaką mamy w tej pustyni.",0.27814621335141876,0.0,0.7509758472442627,0.8352365493774414
Oh my!,Och!,Och mój!,0.3285126288159655,0.0,0.8484352827072144,0.8218466639518738
"Ah, the portal.",Jest i portal.,"Ach, portal.",0.4604641041530799,0.09069748827745895,0.758513331413269,0.6662895083427429
"What, shithead?","Co, kurwa, no co?","Co, gówniarzu?",0.14775906458729837,0.05501080739920602,0.7588108777999878,0.7156580090522766
Begone I say!,"Odejdź, mówię!!!","Idź precz, mówię!",0.3928904428904429,0.0,0.8765738606452942,0.8778608441352844
I'll cast a spell and the rats will leave.,Rzucę zaklęcie i szczury same wyjdą.,Rzucę zaklęcie i szczury odejdą.,0.7163694032993265,0.5475182535069453,0.9402135014533997,0.9545372128486633
Why would he do that?,Dlaczego niby?,Dlaczego miałby to zrobić?,0.5267343767343767,0.08034284189446518,0.8288184404373169,0.8962869048118591
Thanks. Though showing me the way outta here'd be thanks enough.,"Dzięki. Chociaż wystarczyłoby, gdybyś pokazał mi, jak się stąd wychodzi.",Dzięki. Chociaż pokazanie mi drogi wyjścia stąd byłoby wystarczającym podziękowaniem.,0.4740708162218256,0.04939382737115371,0.7647742629051208,0.8864681124687195
You've known many?,A poznałeś ich dużo?,Czy poznałeś wiele?,0.3900950764921354,0.0814136751754278,0.8635604381561279,0.9287653565406799
Get 'im from behind.,Od pleców go zajdę.,Weź go od tyłu.,0.06483432853295874,0.08034284189446518,0.7283253073692322,0.6812924146652222
A fine kettle of fish!,A to heca!,Co za piękna historia!,0.13272735494957724,0.0,0.6714091897010803,0.6775276064872742
Are you mad? Had your fill of hemlock?,Szaleju się najadłeś?,Czyś ty oszalał? Czy już ci wystarczy cykuty?,0.12963775019668525,0.0,0.7154924869537354,0.6079421639442444
Will you run away from home with me?,"Uciekam z domu, uciekasz ze mną?",Uciekniesz ze mną z domu?,0.4095831970548547,0.05231223689135342,0.8882571458816528,0.9308650493621826
Just go.,Idźcie już.,Po prostu idź.,0.09981528843421435,0.0,0.7457008361816406,0.8813145160675049
He needs a worthy successor.,I potrzebuje godnego następcy.,Potrzebuje godnego następcy.,0.9217464007275646,0.17216896116316355,0.9551963806152344,0.9647874236106873
Thank ye! Was a hair away from givin' up my soul out of fright itself…,"Dziękuję! Mało brakowało, a z samego strachu bym ducha wyzionął...",Dzięki! Byłem o włos od oddania mojej duszy ze strachu...,0.2361888753737544,0.0,0.7462690472602844,0.7233039140701294
"Only blood can clear one of shame. Words change nothin'. Not his, not yours.","Hańbę można zmazać tylko krwią. Słowa niczego nie zmienią. Ani jego, ani twoje.","Tylko krew może oczyścić z hańby. Słowa nic nie zmieniają. Nie jego, nie twoje.",0.4162783326099226,0.020200106912694155,0.8289250135421753,0.8914470076560974
What?,Co?,Co?,0.5,0.1778279410038923,0.9999998211860657,0.9946805834770203
Temeria!,Za Temerię!,Temeria!,0.4819443752905068,0.0,0.8187553882598877,0.9125389456748962
Strange bird. Who's that?,Co to za jeden?,Dziwny ptak. Kto to jest?,0.1735863963678068,0.05372849659117709,0.7470843195915222,0.7533248662948608
"Begone, witcher. And you can keep your coin.","Odejdź stąd, wiedźminie. Możesz zatrzymać pieniądze.","Idź precz, czarodzieju. A monetę możesz sobie zatrzymać.",0.2838379903751963,0.0,0.7923107743263245,0.8191765546798706
The Wild Hunt? Are you certain? So… you've found Ciri?,Dziki Gon? Jesteś tego pewien? Czyli... Znalazłeś Ciri?,Czy na pewno jest mowa o Dzikim Gonie? Więc... odnalazłeś Ciri?,0.40891838755771515,0.018850319022747353,0.8231406211853027,0.8521935939788818
"Hear that? I'll give 'em hell, I will!",Słyszysz? Ja im dam szurać!,"Usłyszałeś? Dam im popalić, dam!",0.18221331842215008,0.05372849659117709,0.841685950756073,0.6136671900749207
And?,No i?,I?,0.043859649122807105,0.0,0.8603510856628418,0.9176040887832642
Our lads would return from the Continent with captive wenches. I took no interest in 'em. At my age one woman under me roof is too much already.,"Młodzi wrócili z Kontynentu z jakimiś brankami... Ale ja się nie interesowałem, w moim wieku i jedna baba pod dachem to już nadto.",Nasi chłopcy wracali z Kontynentu z brankami. Nie interesowało mnie to. W moim wieku jedna kobieta pod moim dachem to już za dużo.,0.5120979260684748,0.08282282660969602,0.8472928404808044,0.8432998657226562
"Silver, pearl-encrusted cutlery… Ship belonged to someone awfully wealthy.","Srebra, sztućce wysadzane perłami... Ten statek należał do kogoś majętnego.","Srebrne, perłami zdobione sztućce... Statek należał do kogoś niezwykle bogatego.",0.513311985898062,0.10445522730720382,0.8561277985572815,0.9325413703918457
"Its armies, I'd wager.","Wojsko, jak mniemam.",Stawiam na jego armie.,0.12132079738942207,0.0,0.692122757434845,0.6461260914802551
Everyone's got their style.,Każdy ma swój styl.,Każdy ma swój styl.,1.0,1.0,1.0,0.9928410649299622
Happiness will come today.,Szczeście przyjdzie dziś.,Radość przyjdzie dzisiaj.,0.48138431828363176,0.11362193664674995,0.830118715763092,0.9117709994316101
"Skidi, see how little ye know of the world? But don't fret, you're safe with me.","Widzisz, Skidi, jak ty mało wiesz o świecie! Ale bez obaw, ze mną nie zginiesz.","Skidi, widzisz jak mało znasz świata? Ale nie martw się, jesteś bezpieczny ze mną.",0.3186436788125493,0.020813995118775932,0.8049819469451904,0.8613839745521545
What about upstairs? Anything unusual happen in the bathhouse the day of the break-in?,"A czy w dniu ataku działo się coś podejrzanego na górze, w samych łaźniach?",Co z górą? Czy cokolwiek niezwykłego wydarzyło się w łaźni w dniu włamania?,0.24231582258877757,0.0361808203044872,0.7718387842178345,0.7100316286087036
"Eh, uhm...",Hmpf.,Niezrozumiałe mruknięcie lub niepewna reakcja,0.03875968992248072,0.0,0.5844141840934753,0.570956826210022
"Sir, what don't I got! Somethin' for everyone, seek and ye shall find! Cheap, too!",Czego ja nie mam! U mnie każdy coś dla siebie znajdzie! I tanio!,"Panie, czego ja nie mam! Coś dla każdego, szukajcie a znajdziecie! A do tego tanie!",0.48426861690364625,0.07029695662739609,0.8185548782348633,0.8222745656967163
"Oh, fuck!",O kurwa!,Cholera!,0.09774493958285237,0.0,0.7673431634902954,0.7781391143798828
"Note that I said ""almost."" Now don't interrupt.","Zwróć uwagę, że powiedziałam „prawie”. I nie przerywaj.","Zauważ, że powiedziałem ""prawie."" Teraz nie przerywaj.",0.573478287670573,0.0670144447096575,0.8281728029251099,0.9237087965011597
Fine… I can't force you.,Cóż... Ja cię do tego nie zmuszę.,Nie mogę cię zmusić.,0.1514130434782609,0.037951271263104894,0.7883451581001282,0.8843035101890564
The wraiths of Mörhogg? Hjalmar and I've bested worse buggers than that.,Upiory z Mörhoggu? Nie takich czynów dokonywaliśmy z Hjalmarem.,Widma Mörhogga? Ja i Hjalmar pokonaliśmy gorsze paskudztwa niż to.,0.32856301618049627,0.0,0.776287853717804,0.6161506175994873
"Ah well. It seems I shall need a new trade anyway. I'm compromised in Novigrad, so… Ehh.","No cóż. Chyba będę musiała się przekwalifikować, bo jeśli jestem spalona w Novigradzie, to... ehh.","No cóż. Wygląda na to, że potrzebuję nowej pracy tak czy inaczej. Jestem spalony w Novigradzie, więc... Ech.",0.3653584605948457,0.03230645681297444,0.810499370098114,0.6869500875473022
"Aye, who built you a monument more lasting than any of bronze. When next you see him, White Wolf, please convey the great esteem in which I, Sigurd, hold his many achievements.","Ano, pomnik zbudował trwalszy niż ze spiżu. Jak go spotkasz, Biały Wilku, przekaż wyrazy uznania od Sigurda, największego wielbiciela jego twórczości.","Tak, który zbudował ci pomnik trwalszy niż jakikolwiek ze spiżu. Kiedy następnym razem go spotkasz, Biały Wilku, proszę przekaż mu wielki szacunek, jakim ja, Sigurd, darzę jego liczne osiągnięcia.",0.5049962815934026,0.12045422179467957,0.7761785387992859,0.8273218870162964
There are more and more!,Jest ich coraz więcej!,Jest ich coraz więcej!,1.0,1.0,1.0,0.99537593126297
Wanted you to visit him.,"Chciał, żebyś do niego przyjechała.","Chciała, żebyś go odwiedził.",0.3219993168184278,0.06257106818159155,0.8979196548461914,0.8773965835571289
No need to worry. I'm not out to hurt your witch.,"Nic nie zrobię waszej czarownicy, możecie być spokojni.",Nie ma potrzeby się martwić. Nie zamierzam skrzywdzić twojej czarownicy.,0.3333626652092121,0.0,0.7741458415985107,0.8539654612541199
Because it suits Radovid. You've not heard the story?,Bo Radowidowi tak było na rękę. Nie słyszałeś tej historii?,Bo to odpowiada Radovidowi. Nie słyszałeś tej historii?,0.5979458325717333,0.2846946938149361,0.8649081587791443,0.8304264545440674
"It hasn't and never will. Ye awaitin' a letter from your lover, or is it a fat pouch o' coin from family o'erseas? Well, either way you're waitin' in vain.","Nie przypłynął i pewno nigdy nie przypłynie. Jak czekasz na list od lubej albo grubszą gotówkę od krewnych zza morza, to się nie doczekasz.","Nie dotarł i nigdy nie dotrze. Czekasz na list od ukochanej, czy może na gruby mieszek monet od rodziny za morzem? Tak czy inaczej czekasz na próżno.",0.36161850290869096,0.05406964703993758,0.7852614521980286,0.7612642645835876
"Ah, at your service.","A, kłaniam się.","Ach, do usług.",0.06459948320413446,0.0,0.7173023223876953,0.38031235337257385
Fuck…,Kurwa...,Kurwa...,1.0,0.1778279410038923,1.0,0.9912902116775513
Along with the mutt gnawin' a bone beneath it!,"I psa, co pod tą ławą kości gryzł!",Razem z tym kundlem gryzącym kość pod spodem!,0.18199488674577766,0.02777619034011792,0.6966872811317444,0.4994739592075348
Not how Muggs sees it. Claims he was… mugged.,"Muggs twierdzi, że został napadnięty.","Nie tak widzi to Muggs. Twierdzi, że został... okradziony.",0.5457642749215528,0.023980296761827107,0.8160145878791809,0.7052494883537292
Helpful. Thanks.,Dzięki za pomoc.,Pomocny. Dzięki.,0.4258278179496841,0.0,0.7758804559707642,0.9237688779830933
"Can't be sure if you've attended many performances, but Novigrad crowds can be particularly… difficult.","Nie wiem, czy często bywasz na przedstawieniach, ale publiczność w Novigradzie uchodzi za wyjątkowo... trudną.","Nie jestem pewien, czy uczestniczyłeś w wielu przedstawieniach, ale publiczność z Novigradu może być szczególnie... trudna.",0.5180066467231794,0.07239768078888709,0.8673699498176575,0.897312343120575
You didn't answer my question. How's Yen?,Nie odpowiedziałeś na moje pytanie. Co u Yen?,Nie odpowiedziałeś na moje pytanie. Jak się ma Yen?,0.8356725807786688,0.4671379777282001,0.9632377028465271,0.9428569674491882
"Mmmm. When I look at you… why, I almost regret I'm no longer on active duty.","Ehh, kiedy tak na ciebie patrzę, zaczynam żałować, że już nie jestem w czynnej służbie.","Kiedy patrzę na ciebie... dlaczego, prawie żałuję, że nie jestem już na służbie czynnej.",0.4566596448549855,0.03536389861883236,0.8519963622093201,0.8048880100250244
Where'd you get this idea? What's gotten into you?,Skąd ci to w ogóle przyszło do głowy?,Skąd ci to przyszło do głowy? Co się z tobą dzieje?,0.670261476930099,0.15690219308813547,0.8713560700416565,0.9333248734474182
Begone. And don't ever come back.,Odejdź stąd. I nie wracaj. Nigdy.,Idź stąd. I nie wracaj już nigdy.,0.6692016142633266,0.16348126556655487,0.8791951537132263,0.9762640595436096
Rumor happen to mention where to find the locks these keys open?,"A wspomina może, gdzie znajduje się zamek, do którego owe klucze pasują?","Czy pogłoski wspominają, gdzie można znaleźć zamki, które te klucze otwierają?",0.37606448311895857,0.0204689180374571,0.8199235796928406,0.7511835694313049
Can't you talk to him yourself?,Nie możesz sam z nim pogadać?,Nie możesz porozmawiać z nim samemu?,0.45521675167264886,0.12209471671615688,0.8537470102310181,0.9566642642021179
"Oh, I beg to differ! Huh? Why even say that? Have I insulted you?","O, wypraszam to sobie. Czy ja ciebie obraziłem?","Cóż, nie zgadzam się! Co? Dlaczego w ogóle tak mówić? Czy cię obraziłem?",0.3084760319997804,0.018476860420522198,0.7871285080909729,0.739037036895752
This mornin'.,Rano.,Dziś rano.,0.4045768138905394,0.0,0.7235001921653748,0.6620404124259949
"Got so fucked up once, blood came out me ears.","Raz tak się najebałem, że z uszu mi krew poszła.","Dostał takiego pierdolca raz, że krew poszła mi uszami.",0.34340603914466933,0.028240990488565418,0.805313229560852,0.7052581310272217
"The trail in Velen is most promising. You should make that your first stop. Ask for a merchant named Hendrik at the Inn at the Crossroads. One of the emperor's agents, he should get in touch with you.","Ślad w Velen jest najbardziej obiecujący, pojedź tam w pierwszej kolejności. W Karczmie na Rozstajach spytaj o kupca Hendrika. To agent cesarza, skontaktuje się z tobą.","Szlak w Velen jest najbardziej obiecujący. Powinieneś to uczynić swoim pierwszym celem. Zapytaj o kupca imieniem Hendrik w Karczmie na Rozstajach. Jeden z agentów cesarza, powinien się z tobą skontaktować.",0.6113128722051421,0.1216411062125622,0.8403818011283875,0.8933601379394531
Why? That a threat or somethin'?,Bo? Grozisz nam czy jak?,Dlaczego? To groźba czy coś takiego?,0.15287099732061843,0.040824829046386304,0.7511876225471497,0.9452484250068665
Jeweler's widow gave her whole inheritance to the priests!,Jubilerowa cały spadek po mężu kapłanom oddała!,Wdowa po jubilerze oddała cały swój spadek kapłanom!,0.5252945767681667,0.03655552228545124,0.8416697978973389,0.9171871542930603
Hm?,Hm?,Hm?,0.5,0.1778279410038923,1.0000001192092896,0.992595374584198
"Take care of yourself, Dudu.",Uważaj na siebie.,"Dbaj o siebie, Dudu.",0.3066971768429615,0.0,0.7701437473297119,0.8076891303062439
Know when the mad bard's place'll open? If it'll open at all?,"Nie wiesz, kiedy otworzą przybytek tego zwariowanego barda? I czy w ogóle go otworzą?",Kiedy otworzą się występy szalonego barda? Czy w ogóle się otworzą?,0.42558461319215457,0.0381607811464067,0.830200731754303,0.6720181107521057
"His daughter has returned. The emperor wants to abdicate, give her the throne.",Jego córka wróciła. Cesarz chce abdykować na jej rzecz.,"Jego córka wróciła. Cesarz chce abdykować, oddać jej tron.",0.7829442410316586,0.4671379777282001,0.9256932735443115,0.9398496747016907
"You'll dance in a row, away from the dawn towards the dark lands…",I ruszy korowód od wschodu ku ciemności...,"Będziesz tańczyć w rzędzie, od świtu w stronę ciemnych krain...",0.21093610067038052,0.021105340631872645,0.7228974103927612,0.6218098998069763
Heard a witch lived out here. Never would've guessed it was King Foltest's former advisor.,"Słyszałem, że w okolicy mieszka czarownica, ale nigdy bym się nie spodziewał, że jest nią była doradczyni króla Foltesta.","Słyszałem, że tu mieszkała czarownica. Nigdy bym nie zgadł, że to była dawna doradczyni króla Foltesta.",0.5583359428783768,0.07350892442748631,0.9037667512893677,0.9184455275535583
Shut it. Jests like that could land you in prison. Or on a pyre.,"Stul pysk. Za takie żarty możesz wylądować w więzieniu, albo i na stosie.",Zamknij się. Takie żarty mogłyby cię wpędzić do więzienia. Albo na stos.,0.3738012435108043,0.018636406807066564,0.7391132116317749,0.814657986164093
Ke?,Ke?,Co?,0.05555555555555564,0.0,0.8991210460662842,0.9188075661659241
"No worries, he's alone!","Bez strachu, on jest sam!","Nie martw się, jest sam.",0.285805335864826,0.05372849659117709,0.7936551570892334,0.8569138050079346
"I'm sorry, but I refuse to answer the question.",Nie wiem.,"Przepraszam, ale odmawiam odpowiedzi na pytanie.",0.16661218263048932,0.0,0.657494068145752,0.6913121342658997
"To dream of raven locks entwisted, stormy. Of violet eyes, glistening as you weep","Chcę śnić czarne loki splątane, fiołkowe oczy mokre od łez.","Śnić o splątanych, ciemnych włosach, burzliwych. O fiołkowych oczach, lśniących gdy płaczesz.",0.2985928792269404,0.0,0.7222429513931274,0.6643823981285095
I talked to your friends! Come down!,Spotkałem twoich przyjaciół! Chodź!,Rozmawiałem/am z twoimi przyjaciółmi! Zejdź na dół!,0.38513804143662117,0.0,0.8250928521156311,0.7775704264640808
"Ye blind? Storm's aragin', waves as big as huts, and to top it all, there's lightnin' crashin' all about!","Nie widzisz? Sztorm szaleje, fale wielkie jak chałupy, a do tego piorunami trzaska!","Czyżbyś był ślepy? Szaleje burza, fale są tak duże jak domy, a na dodatek pioruny uderzają wszędzie dookoła!",0.2894703282387258,0.014216645907653848,0.7468618154525757,0.7559682726860046
That scoundrel playin' cutpurse 'stead o' stickin' to honest beggin'?,"A tamten cwaniaczek zamiast uczciwie żebrać, to na rynku sakiewki kroi?",Ten łotr zajmuje się kradzieżami kieszonkowymi zamiast trzymać się uczciwego żebractwa?,0.3089445814005696,0.018850319022747353,0.7470238208770752,0.6345040798187256
"Our rivalry's one thing, but we share the same blood - that's what really counts.","Rywalizacja rywalizacją, ale tak naprawdę liczy się to, że jesteśmy z jednej krwi.","Rywalizacja to jedna rzecz, ale mamy wspólną krew - to naprawdę się liczy.",0.38444015986671376,0.021972813874997166,0.7765401005744934,0.898053765296936
