en_text,pl_text,default,dialog,dialog2,dialog3,dialog4,chrf_default,bleu_default,bertscore_default,comet_default,chrf_dialog,bleu_dialog,bertscore_dialog,comet_dialog,chrf_dialog2,bleu_dialog2,bertscore_dialog2,comet_dialog2,chrf_dialog3,bleu_dialog3,bertscore_dialog3,comet_dialog3,chrf_dialog4,bleu_dialog4,bertscore_dialog4,comet_dialog4
Wha… What's happenin'?,C... co się dzieje?,Co się dzieje?,Co jest grane?,Co się dzieje?,Co się dzieje?,Wiedźmin. Musi umrzeć.,0.653388938099033,0.17216896116316355,0.8778866529464722,0.9250026941299438,0.09761737501463537,0.0,0.7739576101303101,0.7731655836105347,0.653388938099033,0.17216896116316355,0.8778866529464722,0.9250028133392334,0.653388938099033,0.17216896116316355,0.8778866529464722,0.9250028133392334,0.11310843627916807,0.0,0.7141916155815125,0.4997812807559967
Witches've conjured rain again.,Czarownicy znów deszcz zesłali.,Czarownice znów przywołały deszcz.,Czarownice znów przywołały deszcz.,Czarownice znów przywołały deszcz.,Czarownice znów przywołały deszcz.,Czarownice znów przywołały deszcz.,0.4830524103502265,0.08034284189446518,0.8710595369338989,0.9413512349128723,0.4830524103502265,0.08034284189446518,0.8710595369338989,0.9413512349128723,0.4830524103502265,0.08034284189446518,0.8710595369338989,0.9413512349128723,0.4830524103502265,0.08034284189446518,0.8710595369338989,0.9413512349128723,0.4830524103502265,0.08034284189446518,0.8710595369338989,0.9413512349128723
And come evenin' the barons men had ruined everythin'.,A z wieczora baronowi wszystkie stratowali.,A wieczorem ludzie baronów zrujnowali wszystko.,A przychodzi wieczór i ludzie barona zniszczyli wszystko.,"A przychodzi wieczór, a ludzie barona zniszczyli wszystko.",I tak o zmierzchu ludzie barona zniszczyli wszystko.,"I oto tłumaczenie drugiej wypowiedzi:

""A gdy nadszedł wieczór, ludzie barona zniszczyli wszystko.""",0.45356203901135533,0.040824829046386304,0.8204893469810486,0.7848933935165405,0.3442026296554866,0.02777619034011792,0.7715402841567993,0.7864891886711121,0.35188469740640244,0.02777619034011792,0.7645599842071533,0.7939578890800476,0.30791580201166596,0.0,0.7268180847167969,0.7508164644241333,0.35751362094679767,0.0,0.6935796141624451,0.7270309329032898
"Just as I thought. Which is why I think we should first try another, less invasive method.","Właśnie. Dlatego wpierw warto spróbować innej, łagodniejszej metody.","Tak jak myślałem. Dlatego uważam, że powinniśmy najpierw spróbować innej, mniej inwazyjnej metody.","Tłumaczenie drugiej wypowiedzi:

Dokładnie tak, jak myślałem. Dlatego uważam, że powinniśmy najpierw spróbować innej, mniej inwazyjnej metody.","Tłumaczenie drugiej wypowiedzi na język polski:

""Jak sądziłem. Dlatego myślę, że powinniśmy najpierw spróbować innej, mniej inwazyjnej metody.""","Właśnie tak myślałem. Dlatego uważam, że powinniśmy najpierw spróbować innej, mniej inwazyjnej metody.","""To jest metoda mniej inwazyjna.""",0.5060003738543877,0.039073802494525016,0.7945148348808289,0.8895187973976135,0.5084115461705089,0.028927969316143217,0.759907066822052,0.8354653120040894,0.4974957470648773,0.025281168697394947,0.7135676741600037,0.7185980081558228,0.5622224734129683,0.039073802494525016,0.8134902715682983,0.9232972264289856,0.12565237944861857,0.0,0.6536636352539062,0.8181350231170654
"I'm ninety-three years old, madam. So no, I'm not too young.","Mam dziewięćdziesiąt trzy lata, szanowna pani. Więc nie, raczej nie za młody.","Mam dziewięćdziesiąt trzy lata, proszę pani. Więc nie, nie jestem za młody.","Mam dziewięćdziesiąt trzy lata, proszę pani. Więc nie, nie jestem za młody.","Mam dziewięćdziesiąt trzy lata, proszę pani. Więc nie, nie jestem za młody.","- Jestem dziewięćdziesięciotrzyletnim mężczyzną, proszę pani. Więc nie, nie jestem za młody.","Jestem dziewięćdziesięciotrzyletnim gnomem, proszę pani. Więc nie, nie jestem za młody.",0.6895962967239826,0.35084396956386854,0.8980039358139038,0.9352619051933289,0.6895962967239826,0.35084396956386854,0.8980039358139038,0.9352619051933289,0.6895962967239826,0.35084396956386854,0.8980039358139038,0.9352619051933289,0.5315392277659464,0.11094660471566163,0.8022571802139282,0.9001970291137695,0.5298380759036437,0.11211288136839621,0.8164257407188416,0.7620841264724731
"No, da's been keepin' my dear brother's feet on the ground.","Nie, ojciec skutecznie hamuje jego zapędy.","No, to trzymało mojego drogiego brata na ziemi.","Nie, dziadek trzyma stopy mojego drogiego brata na ziemi.","Nie, dziadek trzyma stopy mojego drogiego brata na ziemi.","Nie, dziadek pilnuje, żeby mój drogi brat miał stopy na ziemi.","Nie, dziadek stara się trzymać mojego drogiego brata przy ziemi.",0.14015222189741616,0.0,0.7157859802246094,0.46727362275123596,0.18600953099678721,0.023980296761827107,0.7586236596107483,0.4508426785469055,0.18600953099678721,0.023980296761827107,0.7586236596107483,0.4508426785469055,0.1706012580255297,0.018850319022747353,0.75799161195755,0.6263939142227173,0.18749802119528017,0.021105340631872645,0.7597327828407288,0.5945076942443848
Hahahahahahahahahaha…,Ha aha ahaha.,Hahahahahahahahahaha…,Śmiech (długi),Śmiech (długi),Śmiech (długi),Hahahahahahahahahaha…,0.369486531986532,0.0,0.7673677206039429,0.9536930918693542,0.014880952380952462,0.0,0.6246873736381531,0.5210272073745728,0.014880952380952462,0.0,0.6246873736381531,0.5210272073745728,0.014880952380952462,0.0,0.6246873736381531,0.521027147769928,0.369486531986532,0.0,0.7673677206039429,0.9536929726600647
We still need it?,A są nam jeszcze potrzebne?,Nadal tego potrzebujemy?,Ciągle tego potrzebujemy?,Ciągle tego potrzebujemy?,Nadal tego potrzebujemy?,Nadal go potrzebujemy?,0.26633696165132814,0.0,0.8256298899650574,0.9580356478691101,0.27232975940069765,0.0,0.806094229221344,0.9378017783164978,0.27232975940069765,0.0,0.806094229221344,0.9378017783164978,0.26633696165132814,0.0,0.8256298899650574,0.9580356478691101,0.2615381238604803,0.0,0.8043498396873474,0.9514651894569397
"No need to be clever, witcher. Just gotta know the right people.","Nie filozofuj, wiedźminie. Trzeba znać właściwych ludzi.","Nie musisz być sprytny, wiedźminie. Musisz po prostu znać odpowiednich ludzi.","Nie musisz być sprytny, wiedźminie. Musisz tylko znać odpowiednich ludzi.","Nie musisz być taki sprytny, czarodzieju. Wystarczy znać odpowiednich ludzi.","Nie musisz być sprytny, wiedźminie. Wystarczy znać odpowiednich ludzi.","Nie musisz być taki sprytny, czarodzieju. Wystarczy znać odpowiednich ludzi.",0.3940013352699376,0.026658376817028855,0.8269187211990356,0.8381838798522949,0.40293585520843583,0.02984745896009824,0.8316835165023804,0.824288547039032,0.2703604193016411,0.02777619034011792,0.7813883423805237,0.8216511607170105,0.4045030444256322,0.03391326091030751,0.8476405739784241,0.8608936667442322,0.2703604193016411,0.02777619034011792,0.7813883423805237,0.8216511607170105
I don't know. That doesn't mean I'm givin' up. I'd never do that.,"Nie wiem. Co nie znaczy, że się poddaję. Nie ma mowy.","Nie wiem. To nie znaczy, że się poddaję. Nigdy bym tego nie zrobił.","Nie wiem. To nie znaczy, że się poddaję. Nigdy bym tego nie zrobił (lub ""nigdy bym tego nie zrobiła"", w zależności od płci mówiącego).","Nie wiem. To nie znaczy, że się poddaję. Nigdy bym tego nie zrobiła.","Nie wiem, czy mam szansę. To nie znaczy, że się poddaję. Nigdy bym tego nie zrobił.","Nie wiem. To nie znaczy, że się poddaję. Nigdy bym tego nie zrobiła.",0.7159608369329763,0.33260249505555045,0.8827800154685974,0.9040595889091492,0.6414847564097776,0.169398499987232,0.7938452363014221,0.5814511179924011,0.7180155869394557,0.33260249505555045,0.87566077709198,0.8940168023109436,0.6934006680170159,0.23961829057131984,0.8510699272155762,0.866474986076355,0.7180155869394557,0.33260249505555045,0.87566077709198,0.8940168023109436
Well? What was wrong that time?,No? Co tym razem ci nie pasuje?,No cóż? Co było wtedy nie tak?,No więc? Co było nie tak tym razem?,No więc? Co było nie tak tym razem?,No cóż? Co było nie tak tym razem?,No cóż? Co było nie tak wtedy?,0.14313171024098714,0.039281465090051315,0.8220067620277405,0.8931460976600647,0.36458009317820766,0.03655552228545124,0.8689796328544617,0.93534255027771,0.36458009317820766,0.03655552228545124,0.8689796328544617,0.93534255027771,0.3595138217939308,0.03655552228545124,0.8443697690963745,0.9288920760154724,0.14313171024098714,0.039281465090051315,0.8102901577949524,0.8862325549125671
An amulet? A bezoar? Some tortoiseshells?,Amulecik? Bezoar? Może żółwi kamień?,Amulet? Bezoar? Kilka muszelek?,Amulety? Bezoary? Muszle żółwi?,Amulet? Bezoar? Kilka muszelek żółwia?,- Amulet? Bezoar? Kilka żółwiich skorup?,Amulet? Bezoar? Muszle żółwi? Coś jeszcze?,0.3331012932774588,0.06257106818159155,0.8171519637107849,0.6679890751838684,0.37294945972409077,0.0,0.8576249480247498,0.7672438621520996,0.40234467339264374,0.05372849659117709,0.8491939306259155,0.7607054710388184,0.39020779210312,0.040824829046386304,0.821893036365509,0.7710062265396118,0.4287602939538418,0.040824829046386304,0.8512139320373535,0.834018886089325
What do you mean?,Co masz na myśli?,Co masz na myśli?,Co masz na myśli?,Co masz na myśli?,"- Dzięki mojemu zawodowi znam półświatek Novigradu lepiej niż większość ludzi. Na moim stole operacyjnym gościło dziesiątki najemników, gangsterów, bandytów i płatnych morderców. Same szumowiny.","Dzięki mojemu zawodowi znam półświatek Novigradu lepiej niż większość ludzi. Dziesiątki najemników, gangsterów, bandytów i płatnych morderców trafiły na mój stół operacyjny. Łotry, jeden po drugim.",1.0,1.0,1.0,0.9927389025688171,1.0,1.0,1.0,0.9927389025688171,1.0,1.0,1.0,0.9927389025688171,0.10922054972398226,0.0,0.5811813473701477,0.4688892066478729,0.10847155525437746,0.0072658577559704465,0.5744117498397827,0.44856134057044983
"You get the urge to fight Stan again, come back any time.","Gdybyś chciał znowu walczyć ze Stachem, możesz wrócić w każdej chwili.","Masz ochotę znów walczyć ze Stanem, wróć kiedy chcesz.","Jeśli znów zachce ci się walczyć ze Stanem, wróć kiedy chcesz.","Jeśli znów zachce ci się walczyć ze Stanem, możesz wrócić w każdej chwili.","Jeśli znów zachce ci się walczyć ze Stanem, możesz wrócić w każdej chwili.","Jeśli znów zachce ci się walczyć ze Stanem, możesz wrócić w każdej chwili.",0.28896849050792484,0.04060711798538472,0.8068450093269348,0.7418832778930664,0.31154257443084404,0.03986357128268015,0.8279529809951782,0.792755126953125,0.6701988904412124,0.33260249505555045,0.8953248858451843,0.884127676486969,0.6701988904412124,0.33260249505555045,0.8953248858451843,0.884127676486969,0.6701988904412124,0.33260249505555045,0.8953248858451843,0.884127676486969
Wish I could help.,"Nie wiem, jak ci pomóc.",Chciałbym móc pomóc.,Chciałbym pomóc.,Chciałbym móc pomóc.,Chciałbym pomóc.,Chciałbym móc pomóc.,0.2493053882674963,0.05833544737207805,0.8052846193313599,0.8235253095626831,0.2537217933958649,0.03336574130316504,0.7826496958732605,0.8020113110542297,0.2493053882674963,0.05833544737207805,0.8052846193313599,0.8235253095626831,0.2537217933958649,0.03336574130316504,0.7826496958732605,0.8020110130310059,0.2493053882674963,0.05833544737207805,0.8052846193313599,0.8235253095626831
Nobody expects you to risk your life.,"Nikt nie wymaga od ciebie, żebyś się narażała.","Nikt nie oczekuje od ciebie, że będziesz ryzykować swoim życiem.","Nikt nie oczekuje od ciebie, że będziesz ryzykować swoje życie.","""Nikt nie oczekuje od ciebie, że będziesz ryzykować swoim życiem.""","Nikt nie oczekuje od ciebie, że będziesz ryzykować życie.","Nikt nie oczekuje od ciebie, że będziesz ryzykować swoim życiem.",0.40931838990375585,0.06311969078225892,0.8334503769874573,0.9076029062271118,0.4062661959338018,0.06311969078225892,0.8399820327758789,0.9211789965629578,0.407208794936941,0.04939382737115371,0.7974165678024292,0.8873225450515747,0.4116140070087439,0.07171781507224269,0.849291205406189,0.914368748664856,0.40931838990375585,0.06311969078225892,0.8334503769874573,0.9076029062271118
"Silence, Birna! And you, Cerys… How do you aim to prove your accusation?","Zamilknij, Birna! A ty, Cerys... Jak zamierzasz dowieść prawdziwości swego oskarżenia?","Milcz, Birno! A ty, Cerys... Jak zamierzasz udowodnić swoje oskarżenie?","Milcz, Birno! A ty, Cerys... Jak zamierzasz udowodnić swoje oskarżenie?","Milcz, Birno! A ty, Cerys… Jak zamierzasz udowodnić swoje oskarżenie?","Milcz, Birno! A ty, Cerys... Jak zamierzasz udowodnić swoje oskarżenie?","Milcz, Birno! A ty, Cerys... Jak zamierzasz udowodnić swoje oskarżenie?",0.509926888682144,0.355433394487517,0.9004315733909607,0.9562671184539795,0.509926888682144,0.355433394487517,0.9004315733909607,0.9562671184539795,0.4342340373157569,0.057113058034647314,0.8598793148994446,0.9562671184539795,0.509926888682144,0.355433394487517,0.9004315733909607,0.9562671184539795,0.509926888682144,0.355433394487517,0.9004315733909607,0.9562671184539795
Till next time!,Do zobaczenia!,Do następnego razu!,Do następnego razu!,Do następnego razu!,Do zobaczenia!,Do zobaczenia!,0.1253811587225165,0.11362193664674995,0.7961761355400085,0.9265744686126709,0.1253811587225165,0.11362193664674995,0.7961761355400085,0.9265744686126709,0.1253811587225165,0.11362193664674995,0.7961761355400085,0.9265744686126709,1.0,0.316227766016838,1.0,0.9938280582427979,1.0,0.316227766016838,1.0,0.9938280582427979
She took the children! 'Twas her!,To ona zabrała dzieci! To ona!,Ona wzięła dzieci! To była ona!,Ona zabrała dzieci! To była ona!,"""Zabrała dzieci! To była ona!""",Zdrajca! Ona zabrała dzieci! To była ona!,Ona zabrała dzieci! To była ona!,0.48190282074307694,0.09554427922043669,0.8803286552429199,0.8171547055244446,0.749997776436676,0.21711852081087685,0.9385661482810974,0.9770004153251648,0.6264387225621008,0.09302577375697234,0.8544886708259583,0.9631044864654541,0.7245362125796908,0.17567205239427922,0.8920853137969971,0.8187570571899414,0.749997776436676,0.21711852081087685,0.9385661482810974,0.9770004153251648
"Bound to be a notice posted for the griffin anyway. Could kill two beasts with one stone. Fine, I'll see what I can do.",Czyli i tak będzie na niego zlecenie... Równie dobrze mogę go zabić już teraz i upiec dwie pieczenie na jednym ogniu.,"Na pewno zostanie opublikowane ogłoszenie o gryfie w każdym razie. Można by załatwić dwie sprawy jednym kamieniem. Dobrze, zobaczę, co mogę zrobić.","Musi być ogłoszenie o nagrodzie za grifina. Mogę zabić dwa stwory jednym kamieniem. Dobrze, zobaczę, co mogę zrobić.","""Musi być ogłoszone polowanie na gryfa w każdym razie. Mógłbym zabić dwa ptaszki jednym kamieniem. No dobrze, zobaczę, co da się zrobić.""","Przynieś mi kwas, a udowodnię, że jestem lepszy od Fergusa. I zrobię dla ciebie zbroję, dużo zbroi, takiej, której żaden inny płatnerz nie potrafi wykonać.","Geralt: Będę musiał zgłosić się po nagrodę za griffina. Mogę przy okazji upolować dwa ptaszki jednym kamieniem. W porządku, zajmę się tym.",0.27782154584326063,0.011433361115787456,0.6862257122993469,0.6048671007156372,0.24076507411687234,0.012034130950069917,0.6993192434310913,0.6530208587646484,0.25542203775159794,0.011433361115787456,0.6781302094459534,0.6707383394241333,0.19988960365807495,0.0,0.6420316696166992,0.4947766959667206,0.19148838011240651,0.008687475782716616,0.6794373989105225,0.5665858387947083
To the last drop of blood!,Do ostatniej kropli!,Do ostatniej kropli krwi!,Do ostatniej kropli krwi!,Do ostatniej kropli krwi!,Do ostatniej kropli krwi!,Do ostatniej kropli krwi!,0.9295495975146572,0.16990442448471224,0.9368826150894165,0.9689041972160339,0.9295495975146572,0.16990442448471224,0.9368826150894165,0.9689041972160339,0.9295495975146572,0.16990442448471224,0.9368826150894165,0.9689041972160339,0.9295495975146572,0.16990442448471224,0.9368826150894165,0.9689041972160339,0.9295495975146572,0.16990442448471224,0.9368826150894165,0.9689041972160339
Her wounds will heal. But it's her voice that concerns me.,"Rany się zagoją. Ale... Nie wiem, co będzie z głosem.",Jej rany się zagoją. Ale to jej głos mnie martwi.,Jej rany się zagoją. Ale to jej głos mnie niepokoi.,Jej rany się zagoją. Ale to jej głos mnie martwi.,Jej rany się zagoją. Ale to jej głos mnie martwi.,"Jej rany się zagoją. Ale martwi mnie jej głos. Na pewno rozumiesz, jakim ciosem byłoby to dla trubadurki. Wystarczająco silnym, by odebrać jej chęć do życia.",0.4204194949382634,0.0446323613785333,0.7697398066520691,0.8642780184745789,0.410524382220381,0.0446323613785333,0.7627440690994263,0.8718128204345703,0.4204194949382634,0.0446323613785333,0.7697398066520691,0.8642780184745789,0.4204194949382634,0.0446323613785333,0.7697398066520691,0.8642780184745789,0.41447713259924096,0.015365418390819783,0.7110938429832458,0.7627917528152466
We'd like to talk.,Chcemy porozmawiać.,Chcielibyśmy porozmawiać.,Chcielibyśmy porozmawiać.,Chcielibyśmy porozmawiać.,Chcielibyśmy porozmawiać.,Chcielibyśmy porozmawiać.,0.7758286017894922,0.1495348781221221,0.9157484173774719,0.9691299200057983,0.7758286017894922,0.1495348781221221,0.9157484173774719,0.9691299200057983,0.7758286017894922,0.1495348781221221,0.9157484173774719,0.9691299200057983,0.7758286017894922,0.1495348781221221,0.9157484173774719,0.9691299200057983,0.7758286017894922,0.1495348781221221,0.9157484173774719,0.9691299200057983
Rid the isles of this fearsome foe.,Wypędził z Undvik potwory krwiożercze!,Oczyść wyspy z tego straszliwego wroga.,Oczyść wyspy z tego straszliwego wroga.,Oczyść wyspy z tego straszliwego wroga.,- Oczyśćcie wyspy z tego straszliwego wroga.,"Rozpraw się z tymi wyspami, oczyść je z tego straszliwego wroga.",0.0932857991681522,0.040824829046386304,0.6741024851799011,0.7931460738182068,0.0932857991681522,0.040824829046386304,0.6741024851799011,0.7931460738182068,0.0932857991681522,0.040824829046386304,0.6741024851799011,0.7931460738182068,0.09704428352597139,0.033031643180138064,0.665846049785614,0.7586095929145813,0.11124338624338632,0.018850319022747353,0.6537392139434814,0.6506615877151489
I certainly hope this gas will work.,"Mam nadzieję, że ten gaz zadziała.","Mam nadzieję, że ten gaz zadziała.","Mam nadzieję, że ten gaz zadziała.","""Mam nadzieję, że ten gaz zadziała.""","Mam nadzieję, że ten gaz zadziała.","Mam nadzieję, że ten gaz zadziała.",1.0,1.0,1.0,0.9865970015525818,1.0,1.0,1.0,0.9865970015525818,0.9924784977734652,0.5081327481546147,0.9318739175796509,0.9624813795089722,1.0,1.0,1.0,0.9865970015525818,1.0,1.0,1.0,0.9865970015525818
Now you'll tell me why you need this mask.,A teraz opowiesz mi do czego potrzebna ci maska Uroborosa.,"Teraz powiesz mi, dlaczego potrzebujesz tej maski.","Teraz powiesz mi, dlaczego potrzebujesz tej maski.","Teraz powiesz mi, dlaczego potrzebujesz tej maski.","Teraz powiesz mi, dlaczego potrzebujesz tej maski.","Teraz powiesz mi, dlaczego potrzebujesz tej maski.",0.4433863681164844,0.0,0.7851684093475342,0.8943609595298767,0.4433863681164844,0.0,0.7851684093475342,0.8943609595298767,0.4433863681164844,0.0,0.7851684093475342,0.8943609595298767,0.4433863681164844,0.0,0.7851684093475342,0.8943609595298767,0.4433863681164844,0.0,0.7851684093475342,0.8943609595298767
To Velen. Bald Mountain. But a few days till the witches' sabbath.,"Do Velen, za parę dni na Łysej Górze będzie sabat czarownic.",To Velen. Góra Białowieszczańska. Ale kilka dni do sabatu czarownic.,Do Velen. Góra Sowa. Ale za kilka dni sabat czarownic.,Do Velen. Góra Sowiego Szczytu. Ale za kilka dni sabat czarownic.,Do Velenu. Góra Sowa. Ale kilka dni przed sabatem czarownic.,"Do Velen. Góra Sępów. Ale kilka dni przed sabatem czarownic. A zgadnij, kto jest gościem honorowym.",0.3615257022744247,0.022710171642664416,0.770825207233429,0.6642020344734192,0.4241377477532344,0.050781487573685676,0.8183286786079407,0.752854585647583,0.43195875743575374,0.05012578715739066,0.7997415661811829,0.6965770721435547,0.38845955891896455,0.025132936350227657,0.782241702079773,0.6829004287719727,0.39188899315023423,0.01618861356572822,0.7496920228004456,0.6842873096466064
I will give you such a lashing…!,Bo cię nahajem...!,Dam ci takie lanie...!,Dam ci takie lanie...!,Dam ci takie lanie...!,"- Ahh, Alba musi wyglądać pięknie o tej porze roku...",Dam ci takie lanie...!,0.19188877400809248,0.0,0.8263733983039856,0.6022288203239441,0.19188877400809248,0.0,0.8263733983039856,0.602230429649353,0.19188877400809248,0.0,0.8263733983039856,0.602230429649353,0.15325874951143903,0.0,0.6774280667304993,0.5333582162857056,0.19188877400809248,0.0,0.8263733983039856,0.6022288203239441
He's castin' hexes!,Uroki rzuca!,On rzuca uroki!,On rzuca uroki!,Rzuca klątwy.,On rzuca uroki.,On rzuca uroki!,0.4378920768260173,0.0,0.8917760848999023,0.7842888236045837,0.4378920768260173,0.0,0.8917760848999023,0.7842888236045837,0.18178619388740402,0.0,0.6958045959472656,0.5182358026504517,0.42301112444506495,0.0,0.765348494052887,0.6629877686500549,0.4378920768260173,0.0,0.8917760848999023,0.7842892408370972
"No. I'm concerned. In Novigrad, they had us, we were here… But who'll save those in Rinbe? Ban Ard? Ard Carraigh? Gulet? You know damn well that daft bastard Radovid won't rest till he's killed them all. Every last one. Yennefer and Triss included.","Nie. Martwię się. W Novigradzie byliśmy my... Ale kto uratuje czarodziejów z Rinbe? Ban Ard? Ard Carraigh? Gulety? Wiesz przecież, że Radowid nie spocznie, póki ich wszystkich nie pozabija. Wszystkich. Łącznie z Yennefer i Triss.","Nie. Jestem zaniepokojona. W Novigradzie mieli nas, byliśmy tutaj... Ale kto uratuje tych w Rinbe? Ban Ard? Ard Carraigh? Gulet? Doskonale wiesz, że ten durny skurwysyn Radovid nie spocznie, dopóki ich wszystkich nie pozabija. Każdego jednego. Wliczając Yennefer i Triss.","Nie. Jestem zaniepokojony. W Novigradzie mieli nas, byliśmy tu... Ale kto uratuje tych w Rinbe? Ban Ard? Ard Carraigh? Gulet? Wiesz dobrze, że ten durny skurwysyn Radovid nie spocznie, dopóki ich wszystkich nie zabije. Każdego jednego. Yennefer i Triss również.","Nie. Martwię się. W Novigradzie mieli nas, byliśmy tu... Ale kto uratuje tych w Rinbe? Bana Arda? Arda Carraigha? Guleta? Doskonale wiesz, że ten durny skurwysyn Radovid nie spocznie, dopóki ich wszystkich nie zabije. Każdego jednego. W tym Yennefer i Triss.","Nie robię spisu ludności. Jestem zaniepokojony. W Novigradzie mieli nas, byliśmy tu... Ale kto uratuje tych w Rinbe? Bana Arda? Arda Carraigha? Guleta? Przecież dobrze wiesz, że ten durny skurwysyn Radovid nie spocznie, dopóki ich wszystkich nie pozabija. Każdego jednego. Yennefer i Triss również.","Nie. Jestem zaniepokojony. W Novigradzie mieli nas, byliśmy tu... Ale kto uratuje tych w Rinbe? Bana Arda? Arda Carraigha? Guleta? Przecież dobrze wiesz, że ten durny Radovid nie spocznie, dopóki ich wszystkich nie pozabija. Każdego jednego. W tym Yennefer i Triss.",0.6214041855245821,0.22875408180767512,0.8630292415618896,0.7934809923171997,0.6056772394284864,0.18014636992642138,0.8609267473220825,0.7849320769309998,0.5949172131489788,0.1792292428459456,0.8705702424049377,0.7819523215293884,0.5803215990338261,0.10419436597078413,0.848483681678772,0.7318311333656311,0.5875893594496395,0.1277823110790415,0.8682279586791992,0.783569872379303
"Vesemir, would you mind preparing something for me?","Vesemir, czy mógłbyś mi coś ugotować?","Vesemirze, czy mógłbyś przygotować coś dla mnie?","Vesemir, czy mógłbyś przygotować coś dla mnie?","Vesemir, czy mógłbyś przygotować coś dla mnie?","Vesemirze, czy mógłbyś przygotować coś dla mnie?","Yennefer: Vesemir, czy mógłbyś przygotować coś dla mnie?
Vesemir: Coś, oczywiście... Tylko nie spodziewaj się pasztetu i grzanek... Bardziej prawdopodobne jest dostać zupę fasolowo-pomidorową... Albo -",0.612217880376946,0.07730551756939454,0.8891434669494629,0.9092574715614319,0.7021668672061289,0.17567205239427922,0.9029700756072998,0.9169394373893738,0.7021668672061289,0.17567205239427922,0.9029700756072998,0.9169394373893738,0.612217880376946,0.07730551756939454,0.8891434669494629,0.9092574715614319,0.49314802463636614,0.03864198149136354,0.722078263759613,0.7282474040985107
You thief..!,Ty złodzieju...!,Ty złodzieju...!,Jesteś złodziejem..!,Ty złodzieju...!,Ty złodzieju!...,Ty złodzieju...!,1.0,0.316227766016838,1.0,0.9953446984291077,0.4840397186471357,0.0,0.8723046183586121,0.9553108215332031,1.0,0.316227766016838,1.0,0.9953446984291077,0.7549006549006548,0.1495348781221221,0.9554029107093811,0.9876992702484131,1.0,0.316227766016838,1.0,0.9953446984291077
No one's removed the coin from the premises. All those leaving were searched.,Nikt stąd nie wyszedł z pieniędzmi. Sprawdziliśmy każdego.,Nikt nie usunął monety z terenu. Wszyscy opuszczający byli przeszukiwani.,Nikt nie usunął monety z terenu. Wszyscy odchodzący byli sprawdzani.,Nikt nie usunął monety z terenu. Wszyscy opuszczający byli sprawdzani.,Nikt nie usunął monety z miejsca zdarzenia. Wszyscy opuszczający byli sprawdzani.,Nikt nie usunął monety z miejsca zdarzenia. Wszyscy opuszczający byli przeszukiwani.,0.17346573463115098,0.02777619034011792,0.7313888072967529,0.7273083925247192,0.22244489520656877,0.02777619034011792,0.7399805188179016,0.8176084756851196,0.21510151632939045,0.02777619034011792,0.7403151988983154,0.7605449557304382,0.24290876897445,0.024808415001701823,0.7309972047805786,0.7448006868362427,0.19875078568871998,0.024808415001701823,0.7209532856941223,0.731106698513031
