en_text,pl_text,dialog_prototype1,dialog_prototype2,default,chrf_dialog_prototype1,bleu_dialog_prototype1,bertscore_dialog_prototype1,comet_dialog_prototype1,chrf_dialog_prototype2,bleu_dialog_prototype2,bertscore_dialog_prototype2,comet_dialog_prototype2,chrf_default,bleu_default,bertscore_default,comet_default
You underestimate me.,Nie doceniasz mnie.,Nie doceniasz mnie.,Nie doceniasz mnie.,Nie doceniasz mnie.,1.0,0.5623413251903491,1.0000001192092896,0.9862276911735535,1.0,0.5623413251903491,1.0000001192092896,0.9862276911735535,1.0,0.5623413251903491,1.0000001192092896,0.9862276911735535
"Hm, all right. I'll look at the others.","Hmm... No dobra, obejrzę pozostałe lalki.","Hm, no dobrze. Przyjrzę się pozostałym.","Hm, no cóż. Przyjrzę się pozostałym.","Hm, w porządku. Przyjrzę się pozostałym.",0.35579982905453494,0.0,0.7505704760551453,0.8677945137023926,0.29037998691563954,0.0,0.752429723739624,0.854876697063446,0.29626728226059185,0.0,0.7396705746650696,0.8548339009284973
Gremist wanted me to summon you. Needs you to help him perform a ritual.,"Gremista wzywa cię do siebie. Chce, żebyś odprawił z nim jakiś rytuał.","Gremist chciał, żebym cię wezwał. Potrzebuje twojej pomocy, by odprawić rytuał.","Gremist chciał, żebym cię wezwał. Potrzebuje twojej pomocy, by odprawić rytuał.","Gremist chciał, żebym cię wezwał. Potrzebuje twojej pomocy w przeprowadzeniu rytuału.",0.3530816163817794,0.0204689180374571,0.8068300485610962,0.8365293145179749,0.3530816163817794,0.0204689180374571,0.8068300485610962,0.8365293145179749,0.2943978622239554,0.017212239801819764,0.7871842980384827,0.8441818356513977
"They'll come after us, attack, and we'll need to respond with strength. Can I count on you?","Będą nas ścigać. Zaatakują nas, a my będziemy musieli odpowiedzieć siłą. Mogę na ciebie liczyć?","Będą nas ścigać, atakować, i będziemy musieli odpowiedzieć siłą. Czy mogę na ciebie liczyć?","Będą nas ścigać, atakować, i będziemy musieli odpowiedzieć siłą. Czy mogę na ciebie liczyć?","Nadciągną za nami, zaatakują, a my będziemy musieli odpowiedzieć siłą. Czy mogę na ciebie liczyć?",0.7398927112170579,0.2668064899634279,0.9222171306610107,0.952155590057373,0.7398927112170579,0.2668064899634279,0.9222171306610107,0.952155590057373,0.7160973954765298,0.4121183751323027,0.902055561542511,0.9257455468177795
"As for forktails, bait them thusly: pound a stake in the soil, bind a goat to it, then hide ye in nearto shrubbery posthaste.","„Ażeby widłogona zwabić, do palika kozę powrozem przywiąż i wśród listowia czem prędzej skryj się”.","Wab tak ogony jeleni: wbij palik w ziemię, przywiąż do niego kozła, a potem szybko schowaj się w krzakach.","Wbij palik w ziemię, przywiąż do niego kozła, a potem szybko schowaj się w krzakach.","Co do pętli, zwab je w ten sposób: wbij kołek w ziemię, przywiąż kozę, a potem szybko ukryj się w pobliskiej krzewinie.",0.2608452730398341,0.012109013026441871,0.7062034606933594,0.5430701971054077,0.24029298493947512,0.015718877363021206,0.7073636054992676,0.5614016652107239,0.27582531530127513,0.010331208012220438,0.6857892274856567,0.5174527764320374
You're exhausted. Always happens with compression. Get some rest.,Jesteś wyczerpany – musisz odpocząć.,Jesteś wyczerpany. Zawsze tak się dzieje przy kompresji. Odpocznij trochę.,"Tak, powinienem.",Jesteś wyczerpany. Zawsze tak się dzieje przy kompresji. Odpocznij trochę.,0.52645409888884,0.021105340631872645,0.8053447008132935,0.8782066106796265,0.06069378268884915,0.0,0.6575357913970947,0.4189503788948059,0.52645409888884,0.021105340631872645,0.8053447008132935,0.8782066106796265
"Hahah, your word? You give me your word?","Haha, słowo? Możesz dać słowo?","Haha, twoje słowo? Dajesz mi swoje słowo?","Haha, twoje słowo? Dajesz mi swoje słowo?","Hahah, twoje słowo? Dajesz mi swoje słowo?",0.42698750675245867,0.043472087194499145,0.8670759201049805,0.8562396764755249,0.42698750675245867,0.043472087194499145,0.8670759201049805,0.8562396764755249,0.398037782131985,0.039281465090051315,0.8515600562095642,0.8515446782112122
The old signal tower. It'll be nothing but a pile of rubble soon.,Stara wieża sygnałowa... Jeszcze trochę i całkiem się rozleci.,Stara wieża sygnałowa. Wkrótce pozostanie z niej tylko sterta gruzu.,To stara wieża sygnałowa. Wkrótce pozostanie z niej tylko kupa gruzu.,Stara wieża sygnałowa. Wkrótce pozostanie z niej tylko kupka gruzu.,0.4062721931503394,0.0446323613785333,0.7445434331893921,0.8727657794952393,0.3839625378724589,0.018850319022747353,0.7415688633918762,0.8825415968894958,0.4009208306369037,0.0446323613785333,0.729684054851532,0.8751793503761292
And I overestimated you. If I'd known it'd be that easy I'd 'ave bet something on it…,"A ja przeceniłem ciebie. Gdybym wiedział, że tak łatwo pójdzie, to bym się o coś założył...","I przeceniłem ciebie. Gdybym wiedział, że to takie proste, postawiłbym na to coś.",A ja cię przeceniłem... Albo raczej Skorpiona. Jedno szybkie wskoczenie.,"I przeceniłem cię. Gdybym wiedział, że to będzie takie proste, postawiłbym na to coś...",0.5512766773968744,0.24029210317584693,0.8405524492263794,0.7370404601097107,0.23603260813344495,0.024494759270892695,0.7109732627868652,0.4730991721153259,0.509521099103444,0.06963003305718092,0.8465842008590698,0.78639817237854
Oh!,O!,Oh!,Oh!,Och!,0.1587301587301588,0.0,0.9053789377212524,0.958069384098053,0.1587301587301588,0.0,0.9053789377212524,0.958069384098053,0.1515151515151516,0.0,0.905627429485321,0.8863688111305237
All we need now is a storm.,Jeszcze tylko burzy brakowało.,"Wszystko, czego teraz potrzebujemy, to burza.","Wszystko, czego teraz potrzebujemy, to burza.","Wszystko, czego teraz potrzebujemy, to burza.",0.23599673780625233,0.0,0.6939272880554199,0.81181401014328,0.23599673780625233,0.0,0.6939272880554199,0.81181401014328,0.23599673780625233,0.0,0.6939272880554199,0.81181401014328
In what way?,W jaki sposób?,W jaki sposób?,"Oni nazywają je Cronami, to bezlitosne głupki. Dziewice Lasu od wieków strzegły tej ziemi.",W jaki sposób?,1.0,0.5623413251903491,1.0000001192092896,0.9917799234390259,0.10913770913770922,0.0,0.5939769744873047,0.4239928722381592,1.0,0.5623413251903491,1.0000001192092896,0.9917799234390259
My kind has its ways. We just have to know where to look.,"Tacy jak ja mają swoje sposoby. Tylko muszą wiedzieć, gdzie szukać.","Moja rasa ma swoje sposoby. Musimy tylko wiedzieć, gdzie szukać.","Moja rasa ma swoje sposoby. Musimy tylko wiedzieć, gdzie patrzeć.","Mój gatunek ma swoje sposoby. Musimy tylko wiedzieć, gdzie szukać.",0.6068271829556134,0.11884631831419354,0.8702995777130127,0.8420161604881287,0.4945414302105798,0.057113058034647314,0.8474640250205994,0.815931499004364,0.5927059012254313,0.11884631831419354,0.8600713014602661,0.8396585583686829
"That means we need pesticide, I know. But it doesn't grant you the right to act like a pest yourself.","To znaczy, że potrzebujesz trutek, wiem. Ale to nie powód, żebyś sam się zachowywał jak szkodnik.","To nie jest czas na sarkazm, Vilmarze. Chrząszcze i korniki opanowały każdy sosnowy las na Spikeroog, a ty--","To nie czas na sarkazm, Vilmarze. Chrząszcze i korniki opanowały każdy sosnowy las na Spikeroog, a ty--","To oznacza, że potrzebujemy środka owadobójczego, wiem. Ale to nie daje ci prawa do zachowywania się jak szkodnik.",0.1838902499841514,0.01284618972676772,0.6535229086875916,0.5719490051269531,0.17256552122503796,0.013679192123121896,0.6478679776191711,0.5648524165153503,0.5604193246786477,0.17694975149532557,0.8465356826782227,0.8265550136566162
Hiding in a place overrun by monsters - good idea.,Miałeś niezły pomysł. Zaszyć się w miejscu pełnym potworów.,Ukrywanie się w miejscu pełnym potworów - świetny pomysł.,Ukrywanie się w miejscu pełnym potworów - świetny pomysł.,Ukrywanie się w miejscu opanowanym przez potwory - dobry pomysł.,0.6142860519550749,0.3155984539112945,0.8362269997596741,0.9307143092155457,0.6142860519550749,0.3155984539112945,0.8362269997596741,0.9307143092155457,0.4334455105166277,0.1122444464861146,0.7828117609024048,0.9000049233436584
"Most humbly beg your pardon, but I-I'm in quite a predicament, see. I'm a wandering juggler from occupied Temeria and--","Najmocniej przepraszam, ale znalazłem się w bardzo trudnej sytuacji. Jestem wędrownym kuglarzem z okupowanej Temerii i...","Najpokorniej proszę o wybaczenie, ale znalazłem się w nie lada tarapatach. Jestem wędrownym żonglerem z okupowanej Temerii i...",Temeria? Jesteś pewien? Nie Novigrad?,"Najpokorniej proszę o wybaczenie, ale jestem w dość trudnej sytuacji. Jestem wędrownym kuglarzem z okupowanej Temerii i...",0.5751306226430458,0.2955043237121875,0.8507381677627563,0.8491107225418091,0.09218876185867997,0.0,0.6072372794151306,0.3117615580558777,0.6699086902739645,0.5043545474510804,0.9100466370582581,0.9085968732833862
Nice day.,Ładny dzień.,Ładny dzień.,Ładny dzień.,Piękny dzień.,1.0,0.316227766016838,1.0,0.9912103414535522,1.0,0.316227766016838,1.0,0.9912103414535522,0.6242663663313371,0.1495348781221221,0.8848869204521179,0.9579402804374695
Old coot's been eating dirt since last winter! Couldn't have been here the day of the break-in!,Staruch gryzie ziemię od zimy! Nie mogło go tu być w dniu napadu.,Stary dziadyga żre ziemię od ostatniej zimy! Nie mógł tu być w dniu włamania!,Stary dziadyga żre ziemię od ostatniej zimy! Nie mógł tu być w dniu włamania!,Stary kaczor je ziemię od ostatniej zimy! Nie mógł tu być w dniu włamania!,0.48482882484395146,0.24022110864391533,0.8036040663719177,0.6457263827323914,0.48482882484395146,0.24022110864391533,0.8036040663719177,0.6457263827323914,0.47494415203324225,0.24022110864391533,0.8006334900856018,0.7799356579780579
"You can run from a storm, but not from Skellige pirates.","Możesz uciec przed sztormem, ale nie przed piratami ze Skellige.","Możesz uciec przed burzą, ale nie przed piratami ze Skellige.","Możesz uciec przed burzą, ale nie przed piratami ze Skellige.","Możesz uciec przed burzą, ale nie przed piratami ze Skellige.",0.8094096121788188,0.6580370064762462,0.9634040594100952,0.9572152495384216,0.8094096121788188,0.6580370064762462,0.9634040594100952,0.9572152495384216,0.8094096121788188,0.6580370064762462,0.9634040594100952,0.9572152495384216
Whaaa! A fighter!,Ha! Ale zabijaka!,Co za wojownik!,Ach! Jeden z walczących!,"Whaaa! Fighter!

(Uwaga: W tym przypadku ""fighter"" oznacza osobę walczącą lub wojownika. Wykrzyknik ""Whaaa!"" jest onomatopeją wyrażającą zaskoczenie lub ekscytację.)",0.07964486225355798,0.0,0.7503765225410461,0.7058081030845642,0.07478632478632488,0.0,0.7869993448257446,0.6682291030883789,0.10207231040564381,0.0,0.5990239977836609,0.5223955512046814
"Hjort, the pain returns to my head. Once again, it starts.","Hjort, znowu boli mnie głowa. Zaczyna się.","Hjort, znowu czuję ból głowy. Zaczyna się od nowa.","Hjort, znowu czuję ból głowy. Zaczyna się od nowa.","Hjort, ból wraca do mojej głowy. Znowu się zaczyna.",0.5928852091848372,0.056122223243057295,0.8624091148376465,0.8486664295196533,0.5928852091848372,0.056122223243057295,0.8624091148376465,0.8486664295196533,0.37614179768384387,0.023980296761827107,0.8403798341751099,0.7790253162384033
I missed you. A lot.,Brakowało mi ciebie.,Tęskniłem za tobą. Bardzo.,Tęskniłem za tobą. Bardzo.,Tęskniłem za tobą. Bardzo.,0.1171171171171172,0.0,0.7244723439216614,0.8565240502357483,0.1171171171171172,0.0,0.7244723439216614,0.8565240502357483,0.1171171171171172,0.0,0.7244723439216614,0.8565239906311035
Aaa! Aaa!,Aaa!,Aaa! Aaa!,Aaa! Aaa!,Aaa! Aaa!,0.5565104829810713,0.1495348781221221,0.8913100957870483,0.9883329272270203,0.5565104829810713,0.1495348781221221,0.8913100957870483,0.9883329272270203,0.5565104829810713,0.1495348781221221,0.8913100957870483,0.9883329272270203
"Specter crept in their hut the night, made nary a sound.","Nocą zmora do dom im sfrunęła, bez szmeru ni szustu.",Specter zakradł się do ich chaty nocą i nie narobił żadnego hałasu.,Specter zakradł się do ich chaty nocą i nie narobił żadnego hałasu.,"Widmo zakradło się do ich chaty nocą, ledwie wydając dźwięk.",0.14786461565744746,0.017033186037639283,0.7053453326225281,0.6697317957878113,0.14786461565744746,0.017033186037639283,0.7053453326225281,0.6697317957878113,0.12266316855324266,0.021105340631872645,0.6985875964164734,0.6236317753791809
Thank you.,Dziękujemy.,Dziękuję.,Dziękuję.,Dziękuję.,0.5366653377495646,0.0,0.9219138622283936,0.880397617816925,0.5366653377495646,0.0,0.9219138622283936,0.880397617816925,0.5366653377495646,0.0,0.9219138622283936,0.880397617816925
Fine… I can't force you.,Cóż... Ja cię do tego nie zmuszę.,Dobrze... nie mogę cię zmusić.,Dobrze... Nie mogę cię zmusić.,Dobrze... Nie mogę cię zmusić.,0.22227149805294585,0.04282963710525157,0.8363707065582275,0.9195079803466797,0.2029472643246274,0.036015288308423515,0.8423635363578796,0.9236783385276794,0.2029472643246274,0.036015288308423515,0.8423635363578796,0.9236783385276794
Dare start with me?! The Wild Boar of the Sea?!,Ze mną zaczynasz?! Z Dzikiem Morskim?!,Czy chcesz zacząć ze mną? Dzik Morski!,Czy chcesz zacząć ze mną? Dzik Morski!?,Chcesz zacząć ze mną?! Dzik Morski?!,0.31006510312336083,0.0,0.7901524901390076,0.8168307542800903,0.3141393676154521,0.0,0.8075412511825562,0.7785772085189819,0.3213699318233865,0.0,0.8368274569511414,0.8238165974617004
Grrr…,Wrr...,Grrr...,Grrr...,Grrr...,0.5761741567039941,0.0,0.9173123240470886,0.9308615326881409,0.5761741567039941,0.0,0.9173123240470886,0.9308615326881409,0.5761741567039941,0.0,0.9173123240470886,0.9308615326881409
"Come again, eh?! Great things're bound to happen 'ere. Mark my words!","Zajrzyj do nas jeszcze! Będą się tu dziać wielkie rzeczy, wspomnisz moje słowa!","Powtórz to jeszcze raz, co?! Wielkie rzeczy mają tu miejsce. Zapamiętaj moje słowa!","Powtórz to jeszcze raz, co? Wielkie rzeczy mają tu miejsce. Zapamiętaj moje słowa!","Powtórz, co? No cóż! Wielkie rzeczy się tu wydarzą. Zapamiętaj moje słowa!",0.4039117204758842,0.036362270465000714,0.7781503200531006,0.7049030661582947,0.4020522402072604,0.036362270465000714,0.7752154469490051,0.7119283080101013,0.3649731961864087,0.04686808185675222,0.7837851643562317,0.6682565212249756
Ours is a decent village!,To porządna wieś!,Nasza wieś to porządne miejsce!,Nasza wieś to porządne miejsce!,Nasza wieś jest przyzwoita!,0.5716134661709776,0.0,0.8959630727767944,0.9618401527404785,0.5716134661709776,0.0,0.8959630727767944,0.9618401527404785,0.23656683311225293,0.0,0.7793537378311157,0.8796184659004211
Oy!,Ejże!,Hej!,Hej!,Oy!,0.10204081632653071,0.0,0.8830714821815491,0.7481824159622192,0.10204081632653071,0.0,0.8830714821815491,0.7481822371482849,0.034722222222222314,0.0,0.7691685557365417,0.851638913154602
Thanks.,Dzięki.,Dzięki.,Dzięki.,Dziękuję.,1.0,0.1778279410038923,1.0,0.9824774861335754,1.0,0.1778279410038923,1.0,0.9824774861335754,0.47401802946157784,0.0,0.711614191532135,0.9343937635421753
Hey! Grab him!,Ej! Brać go!,Hej! Złap go!,Chwyć go!,Cześć! Złap go!,0.17453108762239677,0.11362193664674995,0.8960012793540955,0.8729863166809082,0.1920902393591469,0.09069748827745895,0.8227232098579407,0.8374850153923035,0.15300999383272734,0.11362193664674995,0.8408159017562866,0.8372111320495605
What was that?,Słucham?,Co to było?,"Powiedziałem, że Soren Stary walczył tak samo jak inni. Tylko przeżyłem, bo cios minął moje organy.",Co to było?,0.041152263374485694,0.0,0.7787314057350159,0.755029559135437,0.06483432853295874,0.0,0.6293002367019653,0.40542012453079224,0.041152263374485694,0.0,0.7787314057350159,0.755029559135437
Maybe you'd care to go up top? See if you're still there?,"Może pójdziesz na górę zobaczyć, czy cię tam nie ma?","Może chciałbyś wejść na górę? Sprawdzić, czy nadal tam jesteś?","Może chciałbyś wejść na górę? Sprawdzić, czy nadal tam jesteś?","Może chciałbyś pójść na górę? Sprawdź, czy jeszcze tam jesteś?",0.2871577412629596,0.02984745896009824,0.8083211779594421,0.8844563364982605,0.2871577412629596,0.02984745896009824,0.8083211779594421,0.8844563364982605,0.28280200293813457,0.02984745896009824,0.818639874458313,0.8340281248092651
Eveigh Aine!,Eveigh Aine!,Eveigh Aine!,Eveigh Aine!,Ave Aine!,1.0,0.316227766016838,1.0,0.9879121780395508,1.0,0.316227766016838,1.0,0.9879121780395508,0.3205818503821414,0.1495348781221221,0.8451108932495117,0.8786925673484802
"Congratulations! A beautiful fight. Your reward, as promised.",Gratuluję! Rozegrałeś to wspaniale. Oto obiecana nagroda.,"Gratulacje! Piękna walka. Twoja nagroda, tak jak obiecałem.","Gratulacje! Piękna walka. Twoja nagroda, tak jak obiecałem.","Gratulacje! Piękna walka. Twoja nagroda, tak jak obiecano.",0.329282111139297,0.0,0.7770577669143677,0.798045814037323,0.329282111139297,0.0,0.7770577669143677,0.798045814037323,0.3372561315614744,0.0,0.7771402597427368,0.7788548469543457
Right! I'm comin'!,Dobra! Już schodzę!,Dobra! Już schodzę!,Dobra! Już idę!,Dobrze! Już idę!,1.0,0.5623413251903491,1.0,0.9949409365653992,0.4936826919338644,0.24028114141347542,0.9499257206916809,0.967843234539032,0.2637528319767052,0.11362193664674995,0.9122503995895386,0.9640200734138489
You again?! Get outta here!,Znowu ty?! Zabieraj się stąd!,Znowu ty?! Wynoś się stąd!,"Won't pay us in gold, pay us in blood!",Znowu ty?! Wynocha stąd!,0.5318137877861586,0.16068568378893033,0.9472095966339111,0.9529851078987122,0.10510871015072705,0.0,0.6742118000984192,0.3139263391494751,0.4044037814806864,0.14643803168582153,0.9285136461257935,0.8539851903915405
I serve the Eternal Fire!,Służę Wiecznemu Ogniowi!,Służę Wiecznemu Ognisku!,Służę Wiecznemu Ognisku!,Służę Wiecznemu Ognio!,0.8008529195835697,0.24028114141347542,0.9745017290115356,0.9527621865272522,0.8008529195835697,0.24028114141347542,0.9745017290115356,0.9527621865272522,0.8614159098275124,0.24028114141347542,0.9704779982566833,0.9302706718444824
Why? See an elven manuscript there? 'Cause I sure as hell didn't.,Niby po co? Widziałeś tam jakiś elfi manuskrypt?,Dlaczego? Widziałeś tam manuskrypt elficki? Bo ja na pewno nie.,Może lubi czytać przed snem i trzyma je pod poduszką?,Dlaczego? Widziałem tam elficki manuskrypt? Bo ja na pewno nie.,0.5584855791977751,0.0446323613785333,0.7979475259780884,0.8114916086196899,0.13367259676718404,0.0,0.6496660113334656,0.4923550486564636,0.5242882846878102,0.025098621243978974,0.7849453687667847,0.7526525855064392
I'm Geralt of Rivia. I'm a witcher.,Jestem Geralt z Rivii. Wiedźmin.,Jestem Geralt z Rivii. Jestem wiedźminem.,Jestem Geralt z Rivii. Jestem wiedźminem.,Jestem Geralt z Rivii. Jestem wiedźminem.,0.7991623387552643,0.5081327481546147,0.9204966425895691,0.961161196231842,0.7991623387552643,0.5081327481546147,0.9204966425895691,0.961161196231842,0.7991623387552643,0.5081327481546147,0.9204966425895691,0.961161196231842
No.,Nie.,Nie.,Nie.,Nie.,0.6666666666666666,0.1778279410038923,1.0,0.975537121295929,0.6666666666666666,0.1778279410038923,1.0,0.9755370020866394,0.6666666666666666,0.1778279410038923,1.0,0.9755370020866394
"They breakfasted well after noon, more often than not in bed, and passed the days on lazy strolls and long conversations.","Dni upływały im na leniwych spacerach i długich rozmowach, śniadanie jedli dobrze po południu, oczywiście najczęściej w łóżku.","Śniadaliśmy dobrze po południu, często w łóżku, i spędzaliśmy dni na leniwych spacerach i długich rozmowach.","Śniadaliśmy dobrze po południu, często w łóżku, i spędzaliśmy dni na leniwych spacerach i długich rozmowach.","Śniadali dobrze po południu, często w łóżku, a dni spędzali na leniwych spacerach i długich rozmowach.",0.5558535895326097,0.27830016834556404,0.8449438214302063,0.8798404932022095,0.5558535895326097,0.27830016834556404,0.8449438214302063,0.8798404932022095,0.5641477401454039,0.27830016834556404,0.864429235458374,0.8950698375701904
Shall we dance?,Zatańczymy?,Czy możemy zatańczyć?,Czy możemy zatańczyć?,Czy zatańczymy?,0.5556202920063719,0.0,0.7821497321128845,0.9236224889755249,0.5556202920063719,0.0,0.7821497321128845,0.9236223697662354,0.8463165515981159,0.0,0.8695138692855835,0.9771198630332947
Tis a miracle you came back at all.,"Cud, że w ogóle wróciliście.","To cud, że wróciłeś w ogóle.",Nie wszyscy wróciliśmy.,"To cud, że w ogóle wróciłeś.",0.4884411382017624,0.048549177170732344,0.8695176243782043,0.9672400951385498,0.30441934333572085,0.0,0.7844455242156982,0.7115172743797302,0.6563577584835492,0.20205155046766235,0.885914146900177,0.9691129922866821
"Oh, Geralt! What a pleasant surprise!","O, Geralt! Jaka miła niespodzianka!","Och, Geralt! Co za miła niespodzianka!","Oh, Geralt! Co za miła niespodzianka!","Och, Geralt! Co za miła niespodzianka!",0.7674978207516051,0.09554427922043669,0.9382497072219849,0.9797083735466003,0.770173883737859,0.09554427922043669,0.9353510141372681,0.9820439219474792,0.7674978207516051,0.09554427922043669,0.9382497072219849,0.9797083735466003
"Got hit, with something heavy.",Oberwałaś czymś ciężkim.,Dostałaś czymś ciężkim.,Dostałaś czymś ciężkim w głowę.,Dostałem czymś ciężkim.,0.7454386144661181,0.24028114141347542,0.9162967801094055,0.6666529774665833,0.6874146652932813,0.05372849659117709,0.8571051955223083,0.7999012470245361,0.5684389336724013,0.24028114141347542,0.8856468796730042,0.6271868348121643
Fuck yeaaaaah!,"Taaak, kurwa!",Fuck yeaaaaah!,Fuck yeaaaaah!,Jeb się!,0.14295041297741573,0.0,0.7849655747413635,0.6735369563102722,0.14295041297741573,0.0,0.7849655747413635,0.673535943031311,0.01449275362318849,0.0,0.7560907602310181,0.5110997557640076
It's never been this bad.,Tak źle jeszcze nigdy nie było.,Nigdy nie było tak źle.,Nigdy nie było tak źle.,Nigdy nie było tak źle.,0.4804456259267063,0.0439891724758422,0.8779039978981018,0.9748733639717102,0.4804456259267063,0.0439891724758422,0.8779039978981018,0.9748733639717102,0.4804456259267063,0.0439891724758422,0.8779039978981018,0.9748733639717102
I'd say it worked. You've gone all red in the face just talking about it.,"Chyba skutecznie, bo od razu cała się zapaliłaś.","Powiedziałabym, że to zadziałało. Zrobiłaś się cała czerwona na twarzy już od samego mówienia o tym.","Myślę, że się udało. Zrobiłaś się cała czerwona na twarzy już tylko mówiąc o tym.","Powiedziałbym, że zadziałało. Zrobiłeś się cały czerwony na twarzy już od samego mówienia o tym.",0.20434918125293255,0.01618861356572822,0.7311870455741882,0.8162791132926941,0.2010681784107414,0.015718877363021206,0.7336440682411194,0.7727605104446411,0.18251531501650745,0.015718877363021206,0.7128007411956787,0.8001540303230286
You craven?,Tchórzysz?,Ty tchórzu?,Ty tchórzu?,Ty tchórzu?,0.3453042328042328,0.0,0.8491162061691284,0.7372534871101379,0.3453042328042328,0.0,0.8491162061691284,0.7372534871101379,0.3453042328042328,0.0,0.8491162061691284,0.73725426197052
C'mon! What ye waitin' for? Kill the fucker!,Kurwa! Na co czekacie?! Zajebać go!,No dalej! Na co czekasz? Zabić skurwysyna!,No dalej! Na co czekasz? Zabić skurwysyna!,No dalej! Na co czekasz? Zabij skurwysyna!,0.37422792768450414,0.06985342056580097,0.8233520984649658,0.8538001775741577,0.37422792768450414,0.06985342056580097,0.8233520984649658,0.8538001775741577,0.3687813045908222,0.06985342056580097,0.8281283378601074,0.8871637582778931
"Just round the corner, in Novigrad's port. And for your sake, I hope he's in a good mood when you look in on him.","Za rogiem, w novigradzkim porcie... Obyś zastał Radowida w dobrym humorze.",Tylko w nawiasach kwadratowych:,Tylko w nawiasach kwadratowych:,"Za rogiem, w porcie Nowigradu. A dla twojego dobra mam nadzieję, że będzie w dobrym nastroju, kiedy się z nim przywitasz.",0.07758787284173606,0.013961492464016846,0.5931009650230408,0.28421905636787415,0.07758787284173606,0.013961492464016846,0.5931009650230408,0.28421905636787415,0.38257927149926996,0.05684653076227407,0.7428641319274902,0.7854517102241516
You know I'm looking for Ciri.,"Wiesz, że szukam Ciri.","Wiesz, że szukam Ciri.",Wiem o tym.,"Wiesz, że szukam Ciri.",1.0,1.0,0.9999999403953552,0.9753475785255432,0.07632080610021791,0.0,0.7346498966217041,0.6044934988021851,1.0,1.0,0.9999999403953552,0.9753475785255432
Change is coming.,Znowu idą zmiany.,Nadchodzą zmiany.,Nadchodzą zmiany.,Zmiana nadchodzi.,0.4478890045567427,0.09069748827745895,0.8328546285629272,0.9283692240715027,0.4478890045567427,0.09069748827745895,0.8328546285629272,0.9283692240715027,0.196093193743871,0.0,0.7723166942596436,0.9004244804382324
A bit of respect. You're not talkin' to Geralt.,Trochę szacunku. Nie rozmawiasz z Geraltem.,A trochę szacunku. Nie mówisz do Geralta.,A trochę szacunku. Nie mówisz do Geralta.,Trochę szacunku. Nie rozmawiasz z Geraltem.,0.556835987499369,0.06985342056580097,0.8738222718238831,0.7574227452278137,0.556835987499369,0.06985342056580097,0.8738222718238831,0.7574227452278137,1.0,1.0,1.0,0.9773938655853271
And never come back!,I lepiej nie wracaj!,I nigdy nie wracaj!,I nigdy nie wracaj!,I nigdy nie wracaj!,0.5336485212872264,0.1880301546543197,0.9415358304977417,0.9691006541252136,0.5336485212872264,0.1880301546543197,0.9415358304977417,0.9691006541252136,0.5336485212872264,0.1880301546543197,0.9415358304977417,0.9691006541252136
Watch out!,Uważaj!,Uważaj!,Uważaj!,Uważaj!,1.0,0.1778279410038923,0.9999999403953552,0.9923185706138611,1.0,0.1778279410038923,0.9999999403953552,0.9923185706138611,1.0,0.1778279410038923,0.9999999403953552,0.9923185706138611
