en_text,pl_text,dialog_prototype1,dialog_prototype2,default,chrf_dialog_prototype1,bleu_dialog_prototype1,bertscore_dialog_prototype1,comet_dialog_prototype1,chrf_dialog_prototype2,bleu_dialog_prototype2,bertscore_dialog_prototype2,comet_dialog_prototype2,chrf_default,bleu_default,bertscore_default,comet_default
"Oof, place reeks of mould…",Ale tu cuchnie grzybem.,"Uff, to miejsce cuchnie pleśnią...","Uff, to miejsce cuchnie pleśnią...","Uff, to miejsce cuchnie pleśnią...",0.2926497207069962,0.05372849659117709,0.7596600651741028,0.7753402590751648,0.2926497207069962,0.05372849659117709,0.7596600651741028,0.7753404378890991,0.2926497207069962,0.05372849659117709,0.7596600651741028,0.7753402590751648
Shut up for a moment and look at me.,Zamknij się na moment i popatrz na mnie.,Przymknij się na chwilę i spójrz na mnie.,Zamknij się na chwilę i spójrz na mnie.,Zamilcz na chwilę i spójrz na mnie.,0.4627560789664303,0.08783602619713961,0.9152998328208923,0.9621884822845459,0.5317709511429687,0.18092176081223305,0.9292061924934387,0.9786748290061951,0.29602772787006376,0.07201170728284921,0.8420922160148621,0.9503797292709351
Greetings. Got anything in stock besides hoes and horseshoes?,Witaj. Masz na sprzedaż coś poza podkowami i motykami?,Witaj. Masz coś w sprzedaży oprócz wideł i podków?,Witaj. Masz coś w sprzedaży oprócz wideł i podków?,Dzień dobry. Czy macie coś w magazynie oprócz motyk i podków?,0.38783962582551346,0.06030725360407769,0.854320228099823,0.8390228748321533,0.38783962582551346,0.06030725360407769,0.854320228099823,0.8390228748321533,0.19638156752656447,0.022416933501922302,0.7433688640594482,0.8467084169387817
Where're my young'uns?! Aaargh!,Gdzie moje dzieci?! Aaaa!,Gdzie są moje dzieciaki?! Aaargh!,Gdzie są moje dzieciaki?! Aaargh!,Gdzie są moje maluchy?! Aaargh!,0.6587828822427754,0.06389431042462725,0.9081965088844299,0.9703462719917297,0.6587828822427754,0.06389431042462725,0.9081965088844299,0.9703462719917297,0.34474289289944426,0.06389431042462725,0.8877126574516296,0.966496467590332
"If these boys are here to help us kill rats, they're late. You paid up front and got what you paid for. Not half a rodent left in the granary.","Jeżeli przyprowadziłeś tych panów, żeby nam pomogli tępić szczury, to się spóźnili. Zapłaciłeś z góry i nie zawiedziesz się. W magazynie nie ma ani pół gryzonia.","Jeśli ci chłopcy są tu, żeby nam pomóc zabić szczury, to spóźnili się. Zapłaciłeś z góry i dostałeś to, za co zapłaciłeś. Nie ma już prawie ani jednego szczura w spichlerzu.","Jeśli ci chłopcy są tu, żeby nam pomóc zabić szczury, to spóźnili się. Zapłaciłem z góry i dostałem to, za co zapłaciłem. Nie ma już prawie ani jednego szczura w spichlerzu.","Jeśli ci chłopcy są tu po to, aby pomóc nam zabić szczury, spóźnili się. Zapłaciłeś z góry i dostałeś to, za co zapłaciłeś. Nie została nawet połowa szczura w spichlerzu.",0.4185611232576704,0.10985970458010323,0.8388890027999878,0.8227825164794922,0.38733766222197197,0.047973925170118475,0.8254746794700623,0.8207395672798157,0.34202896404589866,0.08939270118279458,0.8162854313850403,0.805891752243042
"Has she mentioned anything? A possible advisory position? Beside a young, promising empress?","Czyżby chciała w swoim czasie zostać doradczynią młodej, obiecującej cesarzowej?","Czy wspominała coś o możliwej pozycji doradcy, obok młodej, obiecującej cesarzowej?","Czy wspominała coś o możliwej pozycji doradcy? Oprócz młodej, obiecującej cesarzowej?","Czy wspomniała o czymkolwiek? Możliwe stanowisko doradcze? Oprócz młodej, obiecującej cesarzowej?",0.5133300046795003,0.09329460218997072,0.8282538056373596,0.8933155536651611,0.5165504874917208,0.09329460218997072,0.8207289576530457,0.7739062905311584,0.5477101781947622,0.09329460218997072,0.7885717153549194,0.7543463110923767
Strange. Never heard of anythin' similar.,Dziwne. Nigdy o czymś takim nie słyszałem.,Nigdy nie słyszałem o czymś takim.,Nigdy nie słyszałem o czymś takim.,Dziwne. Nigdy nie słyszałem o niczym podobnym.,0.6281113675747997,0.08690744034581972,0.9100564122200012,0.9598535299301147,0.6281113675747997,0.08690744034581972,0.9100564122200012,0.9598535299301147,0.6269447247053935,0.08307018474412793,0.9081769585609436,0.9749744534492493
"Once it was bread, then a fish, then apples… Might not seem like much, but add it together and the business suffers! And I'm hardly alone in being pestered. It's nicked something from every stand in the square!","Raz chleb, raz rybę, to znowu jabłka. No niby nic... Ale ziarnko do ziarnka i interes zaczyna przynosić straty! Zresztą, nie tylko mnie nachodzi, o nie, z każdego stoiska już coś zwinął!","Raz to był chleb, potem ryba, jabłka... Może nie wydaje się dużo, ale sumując, interes cierpi! A ja nie jestem jedynym, którego to spotyka. Zabrało coś od każdego straganu na placu!","Raz brało chleb, potem rybę, jabłka... Może nie wydaje się dużo, ale suma sumarum interes cierpi! A ja nie jestem jedynym, który ma ten problem. Ukradło coś ze wszystkich straganów na placu!","Raz to był chleb, potem ryba, potem jabłka... Może się wydawać, że to niewiele, ale zsumuj to wszystko, a interes cierpi! I nie jestem jedyny, którego to dręczy. Ukradło coś z każdego straganu na placu!",0.2736083644043749,0.009500692592350651,0.7428029179573059,0.7287660837173462,0.24924332944613514,0.009131246806741877,0.730478048324585,0.6776813864707947,0.2975192212719779,0.01588436203293868,0.7459360957145691,0.7469875812530518
So what's our plan?,Więc jaki jest plan?,Co robimy?,Co robimy?,No to jaki jest nasz plan?,0.020576131687242875,0.0,0.6645315885543823,0.8561720252037048,0.020576131687242875,0.0,0.6645315885543823,0.8561716675758362,0.5172424419757592,0.09554427922043669,0.8612408638000488,0.9643741250038147
From Simun Brambling. He promised to forget if you take me to see the jarl.,"Od Simuna Zięby. Który obiecuje, że jeśli puścisz mnie przed jarla, zapomni o całej sprawie.","Od Simuna Bramblinga. Obiecał zapomnieć, jeśli weźmiesz mnie do jarla.","Od Simuna Bramblinga. Obiecał zapomnieć, jeśli weźmiesz mnie do jarla.","Od Simuna Bramblinga. Obiecał zapomnieć, jeśli zabierzesz mnie do jarla.",0.3185291838852136,0.03219290164685344,0.816714882850647,0.6364562511444092,0.3185291838852136,0.03219290164685344,0.816714882850647,0.6364562511444092,0.3265104937995104,0.03219290164685344,0.8149800896644592,0.6546034216880798
Not bad.,Nieźle.,Nieźle.,niezrozumiałe,Niezłe.,1.0,0.1778279410038923,0.9999998807907104,0.9887509346008301,0.09104199893673585,0.0,0.7521911263465881,0.659683883190155,0.23571428571428568,0.0,0.9209669828414917,0.9410452246665955
No.,Nie.,Nie.,Nie.,Nie.,0.6666666666666666,0.1778279410038923,1.0,0.975537121295929,0.6666666666666666,0.1778279410038923,1.0,0.9755370020866394,0.6666666666666666,0.1778279410038923,1.0,0.9755370020866394
I'm not one to lie. Nor do I kill without reason.,Nie zwykłam kłamać. Nie zwykłam też zabijać bez powodu.,Nie mam zwyczaju kłamać. Ani nie zabijam bez powodu.,Nie mam zwyczaju kłamać. Ani nie zabijam bez powodu.,"Nie jestem kimś, kto kłamie. Ani nie zabijam bez powodu.",0.4334701000326992,0.06030725360407769,0.8426419496536255,0.9483630061149597,0.4334701000326992,0.06030725360407769,0.8426419496536255,0.9483630061149597,0.35617490071752916,0.04939382737115371,0.771260678768158,0.9058722853660583
Good. You'll need to tell me more when we have some time.,"Dobrze. Wrócimy do tematu, gdy będziemy mieli więcej czasu.","Dobrze. Opowiesz mi więcej, gdy będziemy mieć trochę czasu.","Dobrze. Opowiesz mi więcej, gdy będziemy mieć trochę czasu.","Dobrze. Musisz mi powiedzieć więcej, kiedy będziemy mieli trochę czasu.",0.5340097937108855,0.06030725360407769,0.8664308190345764,0.8978089094161987,0.5340097937108855,0.06030725360407769,0.8664308190345764,0.8978089094161987,0.5116835729111513,0.05307712171072445,0.8525988459587097,0.884859025478363
And you believe me to be such?,"A ty uwierzyłeś, że ja to potrafię.",Czy uważasz mnie za takiego?,Czy ty jesteś taką?,I uważasz mnie za takiego?,0.1126157302919965,0.0,0.6855884194374084,0.6627290844917297,0.0849119106531998,0.037951271263104894,0.707729160785675,0.6354758143424988,0.08898639640689117,0.0,0.7028967142105103,0.7204955220222473
"Exactly. A Sage. As the name suggests, she should know a great deal. I'd like to ask her for advice about Uma. Satisfied?","Właśnie. Wiedząca, jak sama nazwa wskazuje, dużo wie – więc poradzę się jej w sprawie Umy. Zadowolony?","Dokładnie. Czarodziejka. Jak sama nazwa wskazuje, powinna wiedzieć sporo. Chciałabym poprosić ją o radę w sprawie Umy. Zadowolony?","Dokładnie. Czarodziejka. Jak sugeruje nazwa, powinna wiedzieć sporo. Chciałabym poprosić ją o radę w sprawie Umy. Zadowolony?","Dokładnie. Mędrzec. Jak sugeruje jej imię, powinna wiedzieć bardzo dużo. Chciałbym poprosić ją o radę dotyczącą Umy. Zadowolony?",0.5576934733927732,0.19445278057635548,0.8118510246276855,0.7720105051994324,0.43092485844104594,0.1431712315455507,0.786379337310791,0.7534359693527222,0.35007366631279896,0.025281168697394947,0.7756252288818359,0.7175490856170654
So Dandelion knows what happened to Ciri?,Czyli Jaskier wie co z Ciri?,"Więc Jaskier wie, co stało się z Ciri?","Więc Dandelion wie, co stało się z Ciri?","Czy Dandelion wie, co stało się z Ciri?",0.5351052251915626,0.06985342056580097,0.8532101511955261,0.914297342300415,0.27039985503944314,0.06500593260343691,0.786653459072113,0.853248119354248,0.3146825444548711,0.06500593260343691,0.8186222314834595,0.8327245712280273
We will. We have to.,Musi nam się udać.,My tak. Musimy.,"Myślę, że tak. Musimy to zrobić.",My zrobimy. My musimy.,0.1552266733387773,0.0,0.7128866314888,0.4088379740715027,0.18284074858903954,0.0,0.7803360819816589,0.7267753481864929,0.11134353485099759,0.0,0.6644235849380493,0.6532058119773865
All together!,Kupą!,Wszyscy razem!,Wszyscy razem!,Wszyscy razem!,0.02873563218390814,0.0,0.8017890453338623,0.717901885509491,0.02873563218390814,0.0,0.8017890453338623,0.7179014086723328,0.02873563218390814,0.0,0.8017890453338623,0.717901885509491
Guess we'll see…,"Ano, zobaczymy...",Chyba zobaczymy…,Przybyłam z daleka... Ja... szukam mojego syna. Służył w kawalerii Nazairi. Muszę go odnaleźć. Po prostu muszę.,Zobaczymy...,0.47646740553165756,0.0,0.7697641253471375,0.9621108174324036,0.12009992027702565,0.0,0.6651923060417175,0.5297867059707642,0.6427051774152722,0.0,0.8723753094673157,0.9582723379135132
No fear!,Nie bać się!,Nie ma się czego bać!,Nie ma się czego bać!,Bez strachu!,0.31632728774836016,0.05372849659117709,0.9045855402946472,0.9549745917320251,0.31632728774836016,0.05372849659117709,0.9045855402946472,0.9549745917320251,0.06600660066006611,0.0,0.8095924258232117,0.8803311586380005
Go. I'll wait here.,"Idź, czekam tutaj.",Idź. Zaczekam tutaj.,Idź. Zaczekam tutaj.,Idź. Poczekam tutaj.,0.7530654763134702,0.11362193664674995,0.861615777015686,0.9378674626350403,0.7530654763134702,0.11362193664674995,0.861615777015686,0.9378674626350403,0.7530654763134702,0.11362193664674995,0.8709148168563843,0.938372790813446
Hide!,Kryć się!,Ukryj się!,Ukryj się!,Ukryj się!,0.3046780510437411,0.1495348781221221,0.8887434601783752,0.8989692330360413,0.3046780510437411,0.1495348781221221,0.8887434601783752,0.8989692330360413,0.3046780510437411,0.1495348781221221,0.8887434601783752,0.8989692330360413
Aaaaaah.,Aaaaaah.,Aaaaaah.,Aaaaaah.,Aaaaaah.,1.0,0.1778279410038923,1.0000001192092896,0.9906850457191467,1.0,0.1778279410038923,1.0000001192092896,0.9906850457191467,1.0,0.1778279410038923,1.0000001192092896,0.9906850457191467
Oaf.,Łamaga.,Gbur.,Gbur.,"Oaf.

(Tłumaczenie dosłowne, ponieważ ""oaf"" to angielskie słowo oznaczające ""prostaka"", ""chama"" lub ""głupka"". W języku polskim nie ma dokładnego odpowiednika tego terminu.)",0.02450980392156872,0.0,0.6161262392997742,0.5205991864204407,0.02450980392156872,0.0,0.6161262392997742,0.5205988883972168,0.07200429663922436,0.0,0.5508706569671631,0.4956788718700409
"Of late, look seaward and you'll see their sun on a sail, starin' right back.",Ostatnio widujemy coraz więcej okrętów ze znakiem słońca na żaglu.,"Ostatnio patrz uważnie na morze i zobaczysz ich słońce na żaglu, gapiące się prosto w ciebie.","Ostatnio spójrz na morze, a zobaczysz ich słońce na żaglu, patrzące prosto w ciebie.","Ostatnio spójrz w morze, a zobaczysz ich słońce na żaglu, gapiące się prosto w ciebie.",0.3173563266336275,0.014628063653657535,0.7495272755622864,0.5923202633857727,0.3242566293420795,0.0169861974906263,0.7522432208061218,0.6098232865333557,0.32358802879617693,0.015718877363021206,0.7380518317222595,0.5863522887229919
"It's dangerous, there are risks involved. Understand that, don't you?",To będzie ryzykowna wyprawa. Zdajesz sobie z tego sprawę?,"To niebezpieczne, są z tym związane ryzyka. Rozumiesz to, prawda?","Rozumiem, nie jestem tchórzem, tym razem nie ucieknę.","To jest niebezpieczne, wiąże się z ryzykiem. Rozumiesz to, prawda?",0.22866012027570062,0.025098621243978974,0.7235752940177917,0.843421459197998,0.09640182312109703,0.0,0.6658257246017456,0.5117419958114624,0.21385675976772722,0.025098621243978974,0.7229844927787781,0.8254719376564026
"Agh. The gold wasn't mine alone. See, I run a members-only savings club, a bank for the initiated.","Widzisz... Te pieniądze nie należały wyłącznie do mnie. Można powiedzieć, że prowadzę taki bank dla wtajemniczonych.","Ach. Złoto nie było tylko moje. Widzisz, prowadzę ekskluzywny klub oszczędnościowy, bank dla wtajemniczonych.","Ach. Złoto nie było tylko moje. Widzisz, prowadzę ekskluzywny klub oszczędnościowy, bank dla wtajemniczonych.","Ach. Złoto nie należało tylko do mnie. Widzisz, prowadzę klub oszczędnościowy dla członków, bank dla wtajemniczonych.",0.37526779137302596,0.06963003305718092,0.7811304926872253,0.8671861290931702,0.37526779137302596,0.06963003305718092,0.7811304926872253,0.8671861290931702,0.4692772376122649,0.08326915667169545,0.8126357793807983,0.8722805976867676
Someone Crach summoned?,Kogóż to Crach sprowadził?,Ktoś wezwał Cracha?,Ktoś wezwał Cracha?,Ktoś przywołał kogoś do kraksy?,0.19420506795906112,0.0,0.785210371017456,0.7285395860671997,0.19420506795906112,0.0,0.785210371017456,0.7285395860671997,0.1508445258445259,0.0,0.732144832611084,0.5760104060173035
Maybe that your wife's with child…?,Że twoja żona jest przy nadziei…,Może twoja żona jest w ciąży…?,Może twoja żona jest w ciąży…?,Może że twoja żona jest w ciąży...?,0.4892834494696727,0.20205155046766235,0.8001993298530579,0.7133445143699646,0.4892834494696727,0.20205155046766235,0.8001993298530579,0.7133445143699646,0.48139317083447114,0.16348126556655487,0.7442078590393066,0.695030689239502
"Greetings, stranger. Have a drink with us.","Witaj, nieznajomy. Napij się z nami.","Witaj, nieznajomy. Napij się z nami.","Witaj, nieznajomy. Napij się z nami.","Cześć, nieznajomy. Napij się z nami.",1.0,1.0,1.0,0.9801293015480042,1.0,1.0,1.0,0.9801293015480042,0.8239274852641557,0.7598356856515925,0.942111074924469,0.9332056641578674
"This is a misunderstanding… but fine, take them. Though I'll need a receipt, wouldn't wanna lose anything.","To jakieś nieporozumienie... No, ale trudno, bierzcie. Tylko chcę jakieś pokwitowanie, żeby nic się nie zgubiło.","To nieporozumienie... ale dobrze, weźcie je. Tylko potrzebuję pokwitowania, nie chciałbym niczego stracić.","To jest nieporozumienie… ale dobrze, weźcie je. Tylko będę potrzebował paragonu, nie chciałbym niczego stracić.","To jest nieporozumienie... ale dobrze, weź je. Chociaż będę potrzebować paragonu, nie chciałbym niczego stracić.",0.4210553102113097,0.018445540119318492,0.8220521211624146,0.8250474333763123,0.3242404556781625,0.017487432819564223,0.7654059529304504,0.7990559935569763,0.3152138093854571,0.017487432819564223,0.7786636352539062,0.745067298412323
Mhm?,Mhm?,Hmm?,Hmm?,Mhm?,0.13888888888888895,0.0,0.8996375799179077,0.9463943243026733,0.13888888888888895,0.0,0.8996375799179077,0.9463943243026733,0.6666666666666666,0.1778279410038923,1.0,0.9934597015380859
I got the look of a Skelliger?,Wyglądam na mieszkańca Skellige?,Czy mam spojrzenie Skellige?,Masz serce an Craite.,Dostałem spojrzenie Skelligera?,0.3103276537718726,0.08034284189446518,0.7849553227424622,0.6304628252983093,0.07190665902741698,0.0,0.6208367943763733,0.31366127729415894,0.26190851613265403,0.0,0.7636063098907471,0.6595720648765564
"You're on everyone's tongues, you know! Coin and fame aplenty now, eh?","Wiesz, ostatnio dostałeś się na języki! Sława i pieniądze, co?","Wszyscy o Tobie mówią! Masz teraz pełno pieniędzy i sławy, co?","Wszyscy o tobie mówią! Teraz masz pewnie sporo pieniędzy i sławy, co?","Jesteś na językach wszystkich, wiesz! Monety i sławy teraz pod dostatkiem, co?",0.20411762457011387,0.022416933501922302,0.755638599395752,0.7635900378227234,0.21138529621991886,0.020255986027125642,0.7526358962059021,0.7607921957969666,0.3067044599347491,0.022416933501922302,0.7881178259849548,0.7228425145149231
The White Wolf.,Biały Wilk.,Biały Wilk.,Biały Wilk.,Biały Wilk.,1.0,0.316227766016838,1.0,0.9878442883491516,1.0,0.316227766016838,1.0,0.9878435730934143,1.0,0.316227766016838,1.0,0.9878442883491516
His debtors have tended to disappear without a trace.,No tak. Jego dłużnicy mieli skłonność do znikania bez śladu.,Jego dłużnicy mają tendencję do znikania bez śladu.,Jego dłużnicy mają tendencję do znikania bez śladu.,Jego dłużnicy mieli tendencję do znikania bez śladu.,0.5795847527545889,0.3201911827891037,0.8886445760726929,0.9594163298606873,0.5795847527545889,0.3201911827891037,0.8886445760726929,0.9594163298606873,0.6553787584752314,0.38940039153570244,0.9044442176818848,0.96461421251297
Eternal Fire which is our hope…,"Wieczny Ogień, który jest nadzieją...","Wieczny ogień, który jest naszą nadzieją...","Wieczny ogień, który jest naszą nadzieją...","Wieczny ogień, który jest naszą nadzieją...",0.8332152003735737,0.10266900960803409,0.9495595693588257,0.9604095220565796,0.8332152003735737,0.10266900960803409,0.9495595693588257,0.9604095220565796,0.8332152003735737,0.10266900960803409,0.9495595693588257,0.9604095220565796
"I've no illusions, witcher. In Velen, you're gone as long as she's been, you don't come back.","Nie mam złudzeń, wiedźminie. Tu w Velen, jak ktoś znika na tyle czasu, to już nie wraca.","Nie mam złudzeń, czarodzieju. W Velen, jeśli nie wróciła tak długo jak ty, to już nie wróci.","Nie mam złudzeń, czarodzieju. W Velen, jeśli nie wróciła tak długo jak ty, to już nie wróci.","Nie mam złudzeń, wiedźminie. W Velen jesteś tak długo, jak ona, nie wrócisz.",0.4555264250312335,0.10288402441827044,0.8362836837768555,0.5885411500930786,0.4555264250312335,0.10288402441827044,0.8362836837768555,0.5885411500930786,0.46693838762096895,0.1573320614126865,0.8547723889350891,0.7040536999702454
And you think this is witchers' work because…?,I to jest według ciebie zlecenie dla wiedźmina?,A dlaczego nie miałoby być?,A dlaczego nie miałoby być?,"I myślisz, że to jest praca wiedźminów, ponieważ...?",0.10550148431174165,0.0,0.7213209271430969,0.49602755904197693,0.10550148431174165,0.0,0.7213209271430969,0.49602755904197693,0.32178795102306,0.06500593260343691,0.7476094365119934,0.8281852006912231
Wanna hop over the village? Remind the bumpkins who we are?,Chcesz ze mną do wsi wyskoczyć? Chłopom się przypomnieć?,Chcesz przejechać przez wieś? Przypomnieć kmiotkom kim jesteśmy?,Chcesz przejechać przez wieś? Przypomnieć kmiotkom kim jesteśmy?,Chcesz przeskoczyć przez wieś? Przypomnieć kmiotkom kim jesteśmy?,0.32031293398189203,0.024512401940754224,0.7943304181098938,0.8214002847671509,0.32031293398189203,0.024512401940754224,0.7943304181098938,0.8214002847671509,0.3947110077503562,0.024512401940754224,0.7942889928817749,0.7348545789718628
"A Changeling Rescued, or the Witcher's Triumph - your performance was mag-ni-fi-cent!","Twoja gra w ""Zmienniku wybawionym albo tryumfie Wiedźmina"" była im-po-nu-jąca!",Twój występ był magiczny!,Twoja gra była magiczna!,Ocalone pacholę lub triumf wiedźmina - twoje przedstawienie było ma-gicz-ne!,0.06776227902254904,0.0,0.6602259278297424,0.6765468120574951,0.1409039659541899,0.04195519852075238,0.7149457335472107,0.7784312963485718,0.2383916175017883,0.0,0.7424446940422058,0.7715293169021606
Hmm… Trying the trick can't hurt.,Hmm... Spróbować nie zaszkodzi.,Spróbować tej sztuczki nie może zaszkodzić.,Hmm... Spróbować nie zaszkodzi.,Hmm... Spróbowanie sztuczki nie zaszkodzi.,0.5632112449066472,0.048549177170732344,0.7770240306854248,0.8409675359725952,1.0,1.0,1.0,0.9890568852424622,0.8252948530822094,0.12574334296829354,0.9181692004203796,0.9442502856254578
"Your father asked me to, but… what if I help her, and she wins, and they crown her queen of Skellige?","Twój ojciec mnie o to prosił, ale... co jeśli dzięki mnie Cerys zwycięży i zostanie królową Skellige?","Twój ojciec poprosił mnie o to, ale... co jeśli jej pomogę, a ona wygra i koronują ją na królową Skellige?","Twój ojciec poprosił mnie o to, ale... co jeśli jej pomogę, a ona wygra i koronują ją na królową Skellige?","Poprosił mnie o to twój ojciec, ale... co jeśli jej pomogę, a ona wygra i koronują ją na królową Skellige?",0.5233914927564952,0.08097785064266204,0.8462721705436707,0.9317929744720459,0.5233914927564952,0.08097785064266204,0.8462721705436707,0.9317929744720459,0.5132506153702301,0.09379601158083607,0.8332136273384094,0.9175310730934143
All right! I'm up!,"No już, już.",Dobra! Obudziłem się!,W porządku! Obudziłem się!,W porządku! Jestem gotowy!,0.03058103975535177,0.0,0.7083380222320557,0.6953276991844177,0.04424778761061956,0.0,0.7057061791419983,0.6947594285011292,0.02949852507374641,0.0,0.7054863572120667,0.7455427050590515
Vintages from 1255 to 1264…,Tu są butelki z lat 1255-1264...,Wina z lat 1255 do 1264...,Wina z lat 1255 do 1264...,Wina z lat od 1255 do 1264...,0.4165752577070449,0.08633400213704504,0.8221191167831421,0.6570623517036438,0.4165752577070449,0.08633400213704504,0.8221191167831421,0.6570613980293274,0.3192801102491876,0.06985342056580097,0.8251562118530273,0.7321386933326721
Got a problem?,Masz jakiś problem?,Masz jakiś problem?,Masz jakiś problem?,Masz problem?,1.0,0.5623413251903491,1.0,0.995955765247345,1.0,0.5623413251903491,1.0,0.995955765247345,0.49157869419802963,0.10785809837243004,0.7964785695075989,0.9872251749038696
A witcher's silver sword…,Srebrny wiedźmiński miecz...,To miecz srebrny czarodzieja...,Czarodziejska srebrna szabla...,Srebrny miecz wiedźmina...,0.3152690128642882,0.0,0.799267590045929,0.8456223607063293,0.19063565632139334,0.0,0.7646626234054565,0.8421103954315186,0.5197933374986798,0.11362193664674995,0.9003793597221375,0.959148645401001
"Toward dawn a storm broke. It was mayhem, so I took advantage and jumped overboard.",Nad ranem rozpętał się sztorm. Wykorzystałam zamieszanie i wyskoczyłam za burtę.,"Wkrótce po zmierzchu rozszalała się burza. Zapanował chaos, więc skorzystałam z okazji i wyskoczyłam za burtę.","Wkrótce po zmierzchu rozszalała się burza. Zapanował chaos, więc skorzystałam z okazji i wyskoczyłam za burtę.","Nadciągnęła burza od dawna. Panował chaos, więc skorzystałem z okazji i wyskoczyłem za burtę.",0.4888152175489285,0.16188613565728213,0.8252400755882263,0.9135242104530334,0.4888152175489285,0.16188613565728213,0.8252400755882263,0.9135242104530334,0.3895086587134838,0.03342866121562732,0.8117216229438782,0.6637446880340576
Nuh-huh! It is too!,"A właśnie, że tak!","Nie, to nie jest prawdziwy ogień...","Nie, to nie jest prawdziwy ogień...",Aha! Tak jest!,0.13605465107133635,0.0,0.737739086151123,0.6738506555557251,0.13605465107133635,0.0,0.737739086151123,0.6738506555557251,0.09153052948673394,0.0,0.7983188629150391,0.9410339593887329
Watch it. And leave the woman alone.,Zmień ton. I zostaw tę kobietę w spokoju.,Uważaj. I zostaw kobietę w spokoju.,Uważaj. I zostaw kobietę w spokoju.,Popatrz na to. I zostaw kobietę w spokoju.,0.6067216761043877,0.18204651199034363,0.875552237033844,0.9123217463493347,0.6067216761043877,0.18204651199034363,0.875552237033844,0.9123217463493347,0.621745105090172,0.17286039232097053,0.8930003643035889,0.9193800091743469
"Same thing each time - snares sprung, earth trampled, blood, bits o' flesh… But no game in sight.","Wszędzie to samo. Wnyki zatrzaśnięte, zryta ziemia, krew, resztki skóry... A zwierzyny nie ma.","To samo za każdym razem - sidła wystrzelone, ziemia stratowana, krew, kawałki mięsa... Ale żadnej zwierzyny w zasięgu wzroku.","To samo za każdym razem - sidła wystrzeliły, ziemia stratowana, krew, strzępy mięsa… Ale żadnej zwierzyny w zasięgu wzroku.","To samo za każdym razem - potrzaski się zatrzaskują, ziemia jest stratowana, krew, kawałki mięsa... Ale ani śladu zwierzyny.",0.3401945313599017,0.012109013026441871,0.7809012532234192,0.6893210411071777,0.3186979296726707,0.012109013026441871,0.7560796737670898,0.6464933156967163,0.3693474787779494,0.010182425646195498,0.806175708770752,0.628910481929779
