en_text,pl_text,dialog_extracted,chrf_dialog_extracted,bleu_dialog_extracted,bertscore_dialog_extracted,comet_dialog_extracted
"Ever since, Edric's lived in the outhouse, and he's got hardened pustules all over him!",I od tej jarzębiny Edric teraz prawie w wychodku zamieszkał i cały jest w krostach!,"Od tego czasu Edric mieszka w wygódce, a ma twarde krosty na całym ciele.",0.26616833835363213,0.015815216252224023,0.7364514470100403,0.5724429488182068
Still?!,Jeszcze?!,Nadal?,0.019157088122605442,0.0,0.7514121532440186,0.8322682976722717
"Same thing each time - snares sprung, earth trampled, blood, bits o' flesh… But no game in sight.","Wszędzie to samo. Wnyki zatrzaśnięte, zryta ziemia, krew, resztki skóry... A zwierzyny nie ma.","To samo za każdym razem - sidła zerwane, stratowana ziemia, krew, kawałki mięsa... Ale ani śladu zwierzyny.",0.35836200475256597,0.02432542569851428,0.8161373138427734,0.72695392370224
"Novigrad proper, and still not safe at night.","Niby Novigrad, a strach nocą wychodzić.","Novigrad w pełnej krasie, a nadal niebezpieczny po zmroku.",0.25797194798654144,0.023980296761827107,0.724051833152771,0.7549602389335632
I -... I didn't know.,Nie... Nie wiedziałem.,Nie wiedziałem.,0.6771514587913389,0.19180183554164504,0.852043628692627,0.9528623223304749
Help!,Ratujcie!,Pomocy!,0.03787878787878797,0.0,0.7813526391983032,0.8835179209709167
How could she? She didn't know anything.,Ona o niczym nie wiedziała.,Jak mogła się ze mną skontaktować? Nie wiedziała nic.,0.4717431592270181,0.0,0.7594293355941772,0.8210812211036682
No idea what you're talking about…,"Nie wiem, o czym mówisz...","Nie mam pojęcia, o czym mówisz...",0.6953287824431031,0.21711852081087685,0.9106139540672302,0.9803662896156311
Daddy says you killed the beast that was eatin' folk!,"Tata mówił, że zabiłeś potwora, co zjadał ludzi!","Tatuś mówi, że zabiłeś bestię, która pożerała ludzi!",0.3939015361219016,0.06500593260343691,0.8586105704307556,0.9382659196853638
"She wore a turkey mask to the last ball, can you imagine?","Na poprzednim balu miała maskę indyka, wyobrażasz sobie?","Ubrała się w maskę indyka na ostatni bal, możesz sobie wyobrazić?",0.4382498558967529,0.018850319022747353,0.8336455225944519,0.9024324417114258
Oo! Coppin' a feel?,Boćkać mnie chcecie?,Co? Łapiesz mnie za ramię?,0.1509836294501889,0.05372849659117709,0.731856644153595,0.6065893173217773
"No chance! Both legs in perfect order. And me arms - look, like a windmill's wings.",A gdzie tam! Obie nogi władne. A ręce – jak wiatraki.,"Nie ma szans! Obie nogi w idealnym stanie. A moje ręce - patrz, jak skrzydła wiatraka.",0.41446324626553493,0.032709344708772174,0.8047337532043457,0.7224464416503906
Meow…,Miauuu…,Miau...,0.28690476190476194,0.0,0.7701451182365417,0.9230626821517944
No torture till I get there. Got it?,Zabraniam ci zaczynać tortur beze mnie. Rozumiesz?,"Nie ma tortur, dopóki tam nie dotrę. Zrozumiano?",0.24677157723549514,0.0,0.7355030179023743,0.7460513114929199
"Here in Velen, hunger is our greatest foe. What was I to feed those prisoners, eh? Grass and mud? It was an act of mercy.",Tu w Velen naszym największym wrogiem jest głód. Czym miałem karmić tych jeńców? Trawą i błotem? To był akt łaski.,"Tutaj w Velene głód jest naszym największym wrogiem. Co miałem dać tym jeńcom do jedzenia, co? Trawę i błoto? To był akt miłosierdzia.",0.5269523671490689,0.05970228993860437,0.863252580165863,0.913474440574646
So they can save me. As you did.,Żeby mogli mnie obronić. Jak ty.,"Tak, żeby mogli mnie uratować. Tak jak ty to zrobiłaś.",0.4828167516958351,0.0446323613785333,0.8090295195579529,0.8685980439186096
"You, drifter. Where'd you get your scars?","Ty, obcy. Skąd te wszystkie blizny, co?","Ty, wędrowcze. Skąd masz te blizny?",0.3086265154045568,0.045480190470279055,0.8558310270309448,0.7668636441230774
"The fight was tough, we are bruised, this I know. We shall rest here for a time.","Wiem, że walka dała wam w kość, dlatego chwilę tu odpoczniemy.","Walka była trudna, jesteśmy obolali, to wiem. Odpoczniemy tutaj przez pewien czas.",0.29772600390621984,0.0,0.7659955620765686,0.8755351305007935
"Zzzzzz… mheh… hm? Oh, that's good. Heheheh zzzzz…","Hrrrr... Hm? A to dobre... He, he. Hrrr...","Co? Aha, to jest dobre. Haha...",0.1974728137027828,0.02925226826055808,0.7623497247695923,0.7961814403533936
"Shame to let 'em rust there, unused.","Żal żeby tak niszczały, nieużywane.","Szkoda, żeby tak rdzewiały, nieużywane.",0.6045066256422299,0.12574334296829354,0.8495920300483704,0.8970693945884705
I wonder which of the brave jarls sent that tub against the imperial fleet.,"Ciekawe, który to dzielny jarl ruszył tą łupiną na cesarską flotę.",Ciekawe który z odważnych jarlów wysłał tę beczkę przeciw flocie cesarskiej.,0.32622845695503755,0.018850319022747353,0.8138371706008911,0.7840659022331238
"Ehhh… You've no idea who I am, have you?","Echh... Nie wiesz, kim jestem, prawda?","Ehhh… Nie masz pojęcia, kim jestem, prawda?",0.5758717971703678,0.17567205239427922,0.8381335139274597,0.9616643786430359
I'll clatter that pale mug o' yours…,Obiję ci ten biały pysk...,Rozwalę ci ten blady dzbanek...,0.31919140347954866,0.11362193664674995,0.8378876447677612,0.6708726286888123
Didn't see it anywhere… And twenty tons of gold is hard to miss.,W ogóle go tam nie widziałem... A dwadzieścia ton złota jednak ciężko przeoczyć.,Nigdzie go nie widziałem… A dwadzieścia ton złota trudno przeoczyć.,0.5787084935450969,0.22382899458813588,0.8697468638420105,0.9352115988731384
Can't let my jacket get wet again. I'll get lashed…,Jak mi zmoknie kubraczek to znów rzemieniem dostanę.,"Nie mogę pozwolić, żeby moja kurtka znów zmokła. Dostanę lanie...",0.25854061430832237,0.021105340631872645,0.7189310789108276,0.6622456908226013
Ow! What was that?,Au! Co to miało być?,Co to było?,0.21911340608010546,0.12336445138236939,0.8851006031036377,0.8656171560287476
Thanks to you we can live without fear again…,Dzięki tobie znów bez strachu można żyć...,Dzięki tobie możemy znów żyć bez strachu...,0.6044627002606303,0.08307018474412793,0.9382140636444092,0.9836961030960083
Yaaaaaaawn…,Zieew.,Ziewnęłam...,0.2517802246063116,0.0,0.7002792358398438,0.6944183707237244
"Wouldn't scoff, mate. King of Beggars, it's a moniker, yeah, for a man who everyone in Novigrad respects deeply.",Nie śmiej się. Król Żebraków to tylko przezwisko. W Novigradzie wszyscy się z nim liczą.,"Nie śmiałby się, stary. Król Żebraków to jego pseudonim, tak, dla człowieka, którego wszyscy w Novigradzie głęboko szanują.",0.47973364725023004,0.06357877332311639,0.820763885974884,0.7179508805274963
"You might play the great dame now, but before that Baron Edward… something… pulled you from the gutter, you were a common--","Możesz sobie zgrywać wielką panią, ale zanim cię ten baron Edward... jakiś tam... z rynsztoka wyłowił, byłaś zwykłą...","Możesz teraz grać wielką damę, ale zanim baron Edward... coś... wyciągnął cię z rynsztoka, byłaś zwykłą...",0.5389611132027418,0.04517756776656171,0.8954811096191406,0.8694590330123901
Rightly so.,I słusznie.,Słusznie tak.,0.578380940667921,0.0,0.8499819040298462,0.9387245178222656
White One! Taken a peek at my wares yet?,"Białowłosy! Widziałeś już, co mam na straganie?",White One! Sprawdziłeś już moje towary?,0.18649057004559103,0.0,0.7871575951576233,0.712774932384491
"You disappoint me, witcher. Apparently, I thought too highly of you.","Zawiodłem się na tobie, wiedźminie. Myślałem, że jesteś więcej wart.","Rozczarowałeś mnie, wiedźminie. Najwyraźniej za wysoko cię ceniłem.",0.3389943080573788,0.02163211878762423,0.7370156645774841,0.866555392742157
"Who the fuck do you take me for, a murderer?","A co ty, kurwa, masz mnie za mordercę?","Kogo, kurwa, uważasz mnie za mordercę?",0.697563128119386,0.15557221826646012,0.8589568138122559,0.9021127223968506
"Bah! Them's bollocks you're talkin', Edvin.","A tam! Głupoty opowiadasz, Edvin.","Bah! To są bzdury, które opowiadasz, Edvin.",0.5628451629753143,0.06985342056580097,0.8410411477088928,0.892181932926178
Murderers I await… And my forest protects me…,Czekam na morderców... A mój las mnie chroni...,Czekam na morderców… A mój las mnie chroni…,0.7790799604343347,0.4111336169005197,0.878197968006134,0.986919105052948
I don't like this. Shouldn't be riskin' your life for us. But… we'll do as you say.,"Nie podoba mi się to. Nie powinieneś sam za nas karku nadstawiać. Ale... Będzie, jak każesz.","Nie podoba mi się to. Nie powinieneś ryzykować swojego życia dla nas. Ale... zrobimy tak, jak mówisz.",0.5299429718439266,0.3708163623065084,0.8713340759277344,0.8569800853729248
Wha… What's happenin'?,C... co się dzieje?,Co jest grane?,0.09761737501463537,0.0,0.7739576101303101,0.7731655836105347
Witches've conjured rain again.,Czarownicy znów deszcz zesłali.,Czarownice znów wywołały deszcz.,0.48079935223805664,0.08034284189446518,0.8646253943443298,0.9197099804878235
And come evenin' the barons men had ruined everythin'.,A z wieczora baronowi wszystkie stratowali.,A wieczorem ludzie barona zniszczyli wszystko.,0.39555819316829566,0.040824829046386304,0.8116666674613953,0.7941541075706482
"Just as I thought. Which is why I think we should first try another, less invasive method.","Właśnie. Dlatego wpierw warto spróbować innej, łagodniejszej metody.","Dokładnie tak myślałem. Dlatego uważam, że najpierw powinniśmy spróbować innej, mniej inwazyjnej metody.",0.5301764595329275,0.039073802494525016,0.80129075050354,0.9208760857582092
"I'm ninety-three years old, madam. So no, I'm not too young.","Mam dziewięćdziesiąt trzy lata, szanowna pani. Więc nie, raczej nie za młody.","Mam dziewięćdziesiąt trzy lata, proszę pani. Więc nie, nie jestem za młody.",0.6895962967239826,0.35084396956386854,0.8980039358139038,0.9352619051933289
"No, da's been keepin' my dear brother's feet on the ground.","Nie, ojciec skutecznie hamuje jego zapędy.","Nie, dziadek pilnuje, żeby mój drogi brat nie oderwał się od rzeczywistości.",0.20772112212078556,0.017033186037639283,0.7469847798347473,0.7246683239936829
Hahahahahahahahahaha…,Ha aha ahaha.,Śmiech.,0.03144654088050324,0.0,0.6352393627166748,0.5921085476875305
We still need it?,A są nam jeszcze potrzebne?,Czy nadal tego potrzebujemy?,0.28448684216206216,0.0,0.8202829360961914,0.9603261947631836
"No need to be clever, witcher. Just gotta know the right people.","Nie filozofuj, wiedźminie. Trzeba znać właściwych ludzi.","Nie musisz być taki sprytny, czarodzieju. Musisz tylko znać odpowiednich ludzi.",0.27577977792471214,0.024808415001701823,0.7691739201545715,0.7972730994224548
I don't know. That doesn't mean I'm givin' up. I'd never do that.,"Nie wiem. Co nie znaczy, że się poddaję. Nie ma mowy.","Nie wiem. To nie znaczy, że się poddaję. Nigdy bym tego nie zrobił.",0.7159608369329763,0.33260249505555045,0.8827800154685974,0.9040595889091492
Well? What was wrong that time?,No? Co tym razem ci nie pasuje?,Co? Co było nie tak wtedy?,0.14645149065943272,0.041095991233501536,0.8078669905662537,0.8794989585876465
An amulet? A bezoar? Some tortoiseshells?,Amulecik? Bezoar? Może żółwi kamień?,Amulet? Bezoar? Kilka muszelek?,0.3331012932774588,0.06257106818159155,0.8171519637107849,0.6679890155792236
What do you mean?,Co masz na myśli?,Co masz na myśli?,1.0,1.0,1.0,0.9927389025688171
"You get the urge to fight Stan again, come back any time.","Gdybyś chciał znowu walczyć ze Stachem, możesz wrócić w każdej chwili.","Jeśli masz ochotę znów walczyć ze Stanem, możesz wrócić w każdej chwili.",0.6543879451029463,0.3646285861936467,0.8894819617271423,0.899832546710968
Wish I could help.,"Nie wiem, jak ci pomóc.",Chciałbym pomóc.,0.2537217933958649,0.03336574130316504,0.7826496958732605,0.8020113110542297
Nobody expects you to risk your life.,"Nikt nie wymaga od ciebie, żebyś się narażała.","Nikt nie oczekuje od ciebie, żebyś ryzykował swoim życiem.",0.46809738232954706,0.14923729480049117,0.8761120438575745,0.9291383624076843
"Silence, Birna! And you, Cerys… How do you aim to prove your accusation?","Zamilknij, Birna! A ty, Cerys... Jak zamierzasz dowieść prawdziwości swego oskarżenia?","Milcz, Birna! A ty, Cerys… Jak zamierzasz udowodnić swoje oskarżenie?",0.4835049953749466,0.11884631831419354,0.8658477663993835,0.9604825973510742
Till next time!,Do zobaczenia!,Do widzenia!,0.360907541849834,0.1495348781221221,0.8595451712608337,0.8971090316772461
She took the children! 'Twas her!,To ona zabrała dzieci! To ona!,Wzięła dzieci! To była ona!,0.46781564677079185,0.10294994188297393,0.8615225553512573,0.8108863830566406
"Bound to be a notice posted for the griffin anyway. Could kill two beasts with one stone. Fine, I'll see what I can do.",Czyli i tak będzie na niego zlecenie... Równie dobrze mogę go zabić już teraz i upiec dwie pieczenie na jednym ogniu.,"Musi być ogłoszenie za tym gryfem w każdym razie. Mógłby zabić dwa stwory jednym kamieniem. Dobrze, zobaczę, co mogę zrobić.",0.24275229216222402,0.012055613990073604,0.6992543339729309,0.5815469026565552
To the last drop of blood!,Do ostatniej kropli!,Do ostatniej kropli krwi!,0.9295495975146572,0.16990442448471224,0.9368826150894165,0.9689041972160339
Her wounds will heal. But it's her voice that concerns me.,"Rany się zagoją. Ale... Nie wiem, co będzie z głosem.",Jej rany się zagoją. Ale to jej głos mnie niepokoi.,0.410524382220381,0.0446323613785333,0.7627440690994263,0.8718128204345703
We'd like to talk.,Chcemy porozmawiać.,Chcielibyśmy porozmawiać.,0.7758286017894922,0.1495348781221221,0.9157484173774719,0.9691299200057983
Rid the isles of this fearsome foe.,Wypędził z Undvik potwory krwiożercze!,Uwolnij wyspy od tego straszliwego wroga.,0.09761267291387782,0.0,0.6652882695198059,0.7514192461967468
I certainly hope this gas will work.,"Mam nadzieję, że ten gaz zadziała.","Naprawdę mam nadzieję, że ten gaz zadziała.",0.93380614131186,0.6147881529512643,0.9062414169311523,0.9655095934867859
Now you'll tell me why you need this mask.,A teraz opowiesz mi do czego potrzebna ci maska Uroborosa.,"Teraz powiesz mi, dlaczego potrzebujesz tej maski.",0.4433863681164844,0.0,0.7851684093475342,0.8943609595298767
To Velen. Bald Mountain. But a few days till the witches' sabbath.,"Do Velen, za parę dni na Łysej Górze będzie sabat czarownic.",Do Velenu. Na Górę Sowiego Szczytu. Ale za kilka dni sabat czarownic.,0.4359338903246989,0.045293761707938834,0.8002917170524597,0.7484288811683655
I will give you such a lashing…!,Bo cię nahajem...!,Dostaniesz takie lanie...!,0.1654517360351153,0.0,0.786493182182312,0.673815906047821
He's castin' hexes!,Uroki rzuca!,On rzuca uroki!,0.4378920768260173,0.0,0.8917760848999023,0.7842888236045837
"No. I'm concerned. In Novigrad, they had us, we were here… But who'll save those in Rinbe? Ban Ard? Ard Carraigh? Gulet? You know damn well that daft bastard Radovid won't rest till he's killed them all. Every last one. Yennefer and Triss included.","Nie. Martwię się. W Novigradzie byliśmy my... Ale kto uratuje czarodziejów z Rinbe? Ban Ard? Ard Carraigh? Gulety? Wiesz przecież, że Radowid nie spocznie, póki ich wszystkich nie pozabija. Wszystkich. Łącznie z Yennefer i Triss.","Nie. Jestem zaniepokojony. W Novigradzie mieli nas, byliśmy tu... Ale kto uratuje tych w Rinbe? Ban Ard? Ard Carraigh? Gulet? Doskonale wiesz, że ten durny skurwiel Radovid nie spocznie, dopóki ich wszystkich nie zabije. Każdego jednego. Wliczając Yennefer i Triss.",0.6035568848687788,0.19269390012662008,0.861556351184845,0.8058440685272217
"Vesemir, would you mind preparing something for me?","Vesemir, czy mógłbyś mi coś ugotować?","Vesemir, czy mógłbyś mi coś przygotować?",0.8687588234806197,0.7598356856515925,0.9573836326599121,0.9465180039405823
You thief..!,Ty złodzieju...!,Ty złodzieju..!,0.8798644480110022,0.1495348781221221,0.9930323958396912,0.9920893311500549
No one's removed the coin from the premises. All those leaving were searched.,Nikt stąd nie wyszedł z pieniędzmi. Sprawdziliśmy każdego.,Nikt nie usunął monety z terenu. Wszystkie osoby opuszczające miejsce były przeszukiwane.,0.16890721624186386,0.022416933501922302,0.7196032404899597,0.8143239617347717
"I heard, I heard. My lads near came to blows wantin' to be the first to tell me. Made quite an impression on them.","Słyszałem, słyszałem. Chłopcy mi opowiadali i jeden przekrzykiwał drugiego. Zrobiłeś na nich wrażenie.","Słyszałem, słyszałem. Moje chłopaki prawie pobili się, tak chcieli być pierwszymi, którzy mi to powiedzą. Zrobiło to na nich spore wrażenie.",0.47323012210416276,0.030232667130855925,0.8214172720909119,0.7620906233787537
"No, wasn't in her hideout. But I found this crystal there.","Nie, nie było jej w kryjówce. Ale znalazłem tam kryształ.","Nie, nie było jej w kryjówce. Ale znalazłem tam ten kryształ.",0.9373856096244039,0.8070557274927981,0.9837198257446289,0.971990168094635
It's not so bad. I promise.,To nie takie straszne. Daję słowo.,Nie jest tak źle. Obiecuję.,0.14344768752602624,0.0,0.7963418364524841,0.8736735582351685
So Britt spoke true! A beast took Nils!,A więc Britt mówiła prawdę! Nilsa porwał potwór!,Więc Britt miała rację! Bestia porwała Nilsa!,0.39244062383989076,0.028634401465295497,0.8128074407577515,0.9337606430053711
"Quiet, dear, you don't know what you're sayin'. Your brother was a vile man, a criminal. The quicker you forget him, the better.","Cicho, mała, nie wiesz, co mówisz. Twój brat to był podły człowiek, zbrodniarz. Im szybciej o nim zapomnisz, tym lepiej.","Cicho, kochanie, nie wiesz co mówisz. Twój brat był okropnym człowiekiem, przestępcą. Im szybciej go zapomnisz, tym lepiej.",0.6084882072602135,0.20838925800486027,0.9048108458518982,0.9298122525215149
Uh-huh.,Aha.,Hmm.,0.04166666666666676,0.0,0.7597336173057556,0.8687780499458313
"Witchers don't usually kill dragons, but I'll look into it. You said something about victims, right?","Wiedźmini nie mają w zwyczaju zabijać smoków, ale przyjrzę się tej sprawie. Mówiłeś coś o ofiarach, zgadza się?","Czarodzieje nie zwykle zabijają smoki, ale zajrzę do tej sprawy. Mówiłeś coś o ofiarach, prawda?",0.4356684279527459,0.1549235545895005,0.8545842170715332,0.8604186177253723
Baroness fired her?,Baronowa ją zwolniła?,Czy baronowa ją zwolniła?,0.9218047857687449,0.16990442448471224,0.9140326976776123,0.9679001569747925
"Yes, I missed you, too.","Tak, ja też się za tobą stęskniłam.","Tak, też za tobą tęskniłam.",0.5148036008427846,0.09057365499736145,0.9160274863243103,0.9491799473762512
"Going after Ge'els is proving quite a trek, but I still don't know why he's so important.","Idziemy po Ge’elsa, ale właściwie ciągle nie wiem, czemu jest taki ważny.","Ściganie Ge'elsów okazuje się dość uciążliwe, ale nadal nie rozumiem, dlaczego jest on tak ważny.",0.2953311298647905,0.018693000799960027,0.7561994194984436,0.8009873628616333
Thanks for your help. Take care.,Dziękuję za pomoc.,Dzięki za pomoc. Uważajcie na siebie.,0.5200370960834249,0.08633400213704504,0.778889000415802,0.856640100479126
"See, one of us, Egill, went mute all of a sudden. No spell or potion helps him. But it is said strong emotions and experiences can restore speech. So, I thought perhaps you might… I'll pay you, of course! Give you an e-excellent gwent card!","Widzisz, jeden z nas, Egil, nagle zaniemówił. Żadne zaklęcia i eliksiry nie pomagają. Ale ponoć głos mogą przywrócić też silne emocje, przeżycia. Więc myślałem, że może ty... Oczywiście zapłacę! Dam ci świetną kartę do gwinta!","Egill nagle stracił głos. Żaden czar ani eliksir mu nie pomaga. Mówią jednak, że silne emocje i przeżycia mogą przywrócić mowę. Pomyślałem więc, że może ty... Zapłacę ci, oczywiście! Dam ci świetną kartę gwentową!",0.5231103335229111,0.1169242155717308,0.8426239490509033,0.8227691650390625
"Grant my plea, bring my husband back to health.","Wysłuchaj mnie i spraw, żeby mój mąż wyzdrowiał.","Wysłuchaj mojej prośby, spraw, aby mój mąż odzyskał zdrowie.",0.5303924045974289,0.06030725360407769,0.8509572744369507,0.9443475008010864
Maybe not. And maybe you'll just stay forever.,Może i nie. A może zostaniesz tu na zawsze.,Może nie. A może po prostu zostaniesz tu na zawsze.,0.7977685575847188,0.392814650900513,0.9428004026412964,0.9754695892333984
Is it true elves make soup outta kids?,"To prawda, że elfy robią z dzieci zupę?","Czy to prawda, że elfy robią zupę z dzieci?",0.787390912872055,0.3155984539112945,0.941548764705658,0.9580219388008118
Aaaah!,Aaa!,Ach!,0.08333333333333343,0.0,0.9005858898162842,0.8953759074211121
Aaaand you lost. Get you a hankie for your tears?,I przegrałeś. Chusteczkę na otarcie łez?,A teraz straciłeś. Chcesz chusteczkę na swoje łzy?,0.43557266674850315,0.02777619034011792,0.8136846423149109,0.6434904932975769
Avallac'h has tricked us both.,Avallac'h oszukał nas obu.,Avallac'h oszukał nas oboje.,0.9001716387937738,0.3976353643835253,0.965447187423706,0.9489049911499023
Emhyr var Emreis. On parade. Completely naked.,Wyobraź sobie Emhyra bez ubrań.,Emhyr var Emreis. Na paradzie. Całkowicie nagi.,0.17515496319326854,0.0,0.6661680340766907,0.48231756687164307
What's this?! Did you undress me?!,"Hola, hola! Rozebrałeś mnie?!",Co to?! Czy mnie rozebrałeś?!,0.3798087269113144,0.0,0.8115312457084656,0.8980537056922913
This is none of my concern. Won't interfere.,"To nie moja sprawa, nie wtrącam się.",To jest dla mnie żadnym problemem. Nie zamierzam się wtrącać.,0.32694449229692646,0.021105340631872645,0.7852308750152588,0.9342718720436096
"Once it was bread, then a fish, then apples… Might not seem like much, but add it together and the business suffers! And I'm hardly alone in being pestered. It's nicked something from every stand in the square!","Raz chleb, raz rybę, to znowu jabłka. No niby nic... Ale ziarnko do ziarnka i interes zaczyna przynosić straty! Zresztą, nie tylko mnie nachodzi, o nie, z każdego stoiska już coś zwinął!","Raz było chlebem, potem rybą, potem jabłkami... Może nie wydaje się dużo, ale sumując wszystko, interes cierpi! A ja nie jestem jedyny, który jest nękany. Ukradło coś od każdego straganu na placu!",0.26450087304049175,0.008724383945340666,0.7367790937423706,0.7199051380157471
"Best hurry, then. Some other bloke's already after it.","To musisz się pośpieszyć, bo ktoś już się zgłosił.","Lepiej się pospiesz, bo inny gość już za tym goni.",0.2357313678578278,0.02777619034011792,0.7861027121543884,0.7345349192619324
You lost a marble? Turn around!,Ugryzło cię co? Wracaj!,Straciłeś kulkę? Odwróć się!,0.11636777490436034,0.0,0.8002235889434814,0.6231404542922974
Bless ye.,Bądźcie pozdrowieni.,Niech cię Bóg błogosławi.,0.12278565833309746,0.0,0.7217563986778259,0.8116036057472229
Didn't find any of your folk inside. Just a mage and some monsters.,"W środku nie było nikogo oprócz mnie, czarodzieja i kilku potworów.",Nie znalazłem żadnego z twoich ludzi wewnątrz. Tylko czarodzieja i parę potworów.,0.3653761711748224,0.03986357128268015,0.8100723624229431,0.8897843956947327
You know what might've happened?,"Wiesz, co mogło się stać?!",Wiesz co mogło się stać?,0.7674954776331141,0.26591479484724945,0.9392133951187134,0.9816367626190186
"You again? I've changed the code word, but you're still entitled to a hefty discount.","To znowu ty? Zmieniłem już hasło, ale dalej masz u mnie duży rabat.","Ciągle ty? Zmieniłem hasło, ale nadal masz prawo do sporej zniżki.",0.4153843379578434,0.04969996369966718,0.8215870261192322,0.8711326122283936
You arrogant arsehole!,Ty arogancki łobuzie!,Ty arogancki dupku!,0.5338476826363463,0.24028114141347542,0.8522738218307495,0.9335158467292786
"A megascope… scorched, covered in soot…",Megaskop... Osmolony i nadpalony...,"Megaskop... przypalony, pokryty sadzą...",0.45714866971063867,0.08034284189446518,0.8115649819374084,0.8215522170066833
What're the symptoms?,Jakie są objawy?,Co to za objawy?,0.3925909659766835,0.08034284189446518,0.864919126033783,0.9644957780838013
Achoo!,Apsik!,Ach!,0.05747126436781618,0.0,0.891226589679718,0.8174724578857422
"Drinks it down in greedy slurps,","Co u-pę-dzi, to wy-pi-je,","Pije je chciwie, siorbiąc.",0.06858813521763069,0.0,0.609390139579773,0.4582425057888031
How'd he make his fortune? Honest raidin' and plunderin'?,A on jak się dorobił? Uczciwym rabunkiem i napadami?,Skąd on zdobył swój majątek? Uczciwe rabowanie i grabienie?,0.24389639273032135,0.028517539529041507,0.7974055409431458,0.8004825711250305
Where're you rushing off to?,Dokąd tak pędzicie?,Dokąd się tak spieszysz?,0.29369237468511905,0.09554427922043669,0.871640145778656,0.8253694176673889
Thing that attacked - how big was it?,"Jak wielkie było to, co was zaatakowało?",Co zaatakowało - jak duże było?,0.3889725171933127,0.0,0.84018874168396,0.7613232731819153
Yeah…,Taaa...,No cóż...,0.15774708251652855,0.0,0.8356455564498901,0.762097179889679
"Not enough he's a heretic, he's also a liar! What'll we do with 'im?","Nie dość, że heretyk, to jeszcze łgarz! Co z nim zrobimy?","Nie wystarczy, że jest heretykiem; on też jest kłamcą! Co zrobimy z nim?",0.36214606718555903,0.021972813874997166,0.8409510254859924,0.9364267587661743
So did I. But I changed my mind.,Ja też. Ale zmieniłam zdanie.,Tak samo myślałam. Ale zmieniłam zdanie.,0.7497301973388931,0.20205155046766235,0.8902143836021423,0.9702321887016296
