en_text,pl_text,dialog_prototype1,dialog_prototype2,default,chrf_dialog_prototype1,bleu_dialog_prototype1,bertscore_dialog_prototype1,comet_dialog_prototype1,chrf_dialog_prototype2,bleu_dialog_prototype2,bertscore_dialog_prototype2,comet_dialog_prototype2,chrf_default,bleu_default,bertscore_default,comet_default
"Head gone gray, but still gallivantin' about with a sword.","Łeb już siwy, ale ganiać z mieczami dalej się zachciewa.","Głowa posiwiała, ale nadal pałęta się z mieczem.","Głowa posiwiała, ale nadal pałęta się z mieczem.","Głowa posiwiała, ale wciąż szaleje z mieczem.",0.23879301042247159,0.02846946938149362,0.7824059128761292,0.6395101547241211,0.23879301042247159,0.02846946938149362,0.7824059128761292,0.6395101547241211,0.2470625855214439,0.02558948059670209,0.760888397693634,0.7181108593940735
"But I could use a prince charming… It just so happens you're the only decent candidate in all Velen. So, what do you say to a moonlight ride on horseback… and dinner?","Ale przydałby się ktoś na miejsce księcia – a tak się składa, że jesteś jedynym facetem na poziomie w całym Velen. Więc co powiesz na konną przejażdżkę w świetle księżyca... I kolację?",Ale mogłabym skorzystać z księcia z bajki… Przypadkowo jesteś jedynym porządnym kandydatem we wszystkim Velen. Więc co powiesz na romantyczną przejażdżkę konną podczas pełni księżyca… i kolację?,Ale potrzebuję księcia z bajki... Przypadkowo jesteś jedynym porządnym kandydatem we wszystkim Velen. Więc co powiesz na romantyczną przejażdżkę konną podczas pełni księżyca... i kolację?,"Ale przydałby mi się książę z bajki... Tak się składa, że jesteś jedynym porządnym kandydatem w całym Velen. Więc co powiesz na przejażdżkę konną o zmierzchu... i kolację?",0.47060925827346695,0.14207858739156087,0.8092154860496521,0.7628072500228882,0.4887283579990962,0.14308307170965834,0.8331243395805359,0.8215121626853943,0.5655108621797235,0.32327770180679505,0.8592188358306885,0.8390231132507324
He'll make an exception for me. He'll have to. I have something he wants.,Dla mnie zrobi wyjątek. Będę miała kartę przetargową...,On zrobi dla mnie wyjątek. Musi.,"On nie zrobi dla mnie wyjątku. Musi. Mam coś, czego on chce.","Zrobi dla mnie wyjątek. Będzie musiał. Mam coś, czego on chce.",0.27162366948044186,0.03849815007763549,0.8166993856430054,0.7150272727012634,0.27936402066290045,0.020255986027125642,0.7663329839706421,0.661842942237854,0.3531818325037021,0.022416933501922302,0.7957981824874878,0.7269640564918518
That's 'cause you're about as good a cook as a goat's arse is a clarinet. Just recenterly I took some fresh thyme--,"Bo taki z ciebie kucharz jak z koziej rzyci klarnet. Ja, uważasz, zeszłą razą wziąłem świeżego tymianku...","To dlatego, że jesteś tak samo dobrym kucharzem jak odbyt kozy jako klarnet. Dopiero co wziąłem świeży tymianek...","Haha, i smakowało jak gówno o smaku tymianku! Hahahaa…","To dlatego, że jesteś tak dobrym kucharzem jak tyłek kozy jest klarnetem. Właśnie niedawno wziąłem świeży tymianek -",0.36466444220857697,0.014216645907653848,0.7365164160728455,0.5680930614471436,0.1361147776325163,0.009858594728796832,0.6689898371696472,0.41301876306533813,0.34696903766593934,0.01284618972676772,0.7246257066726685,0.5495089888572693
You two-faced whoreson… I will not allow this.,Ty dwulicowy sukinsynu... Nie pozwolę na to!,Ty dwulicowa kanalio… Nie pozwolę na to.,"W rzeczywistości, ty, Roche, powinieneś pierwszy zrozumieć, że nie mam wyboru.",Ty dwulicowa kurwo... Nie pozwolę na to.,0.5555735071452877,0.17567205239427922,0.8466039896011353,0.8579075336456299,0.14308943089430903,0.0,0.6283290386199951,0.5213586091995239,0.632381520010639,0.17567205239427922,0.9023914933204651,0.8940691351890564
"Ahh, it all started with a storm - you see, then came the blasted sirens. I had a hornwall horn to drive them off, but one night it just disappeared.","Ehh, najpierw był sztorm, potem te cholerne syreny... Miałem róg hornwala, żeby je odpędzać, ale w nocy się zapodział.","Ahh, wszystko zaczęło się od burzy - widzisz, potem przyszły te przeklęte syreny. Miałem róg z rogu jednorożca, żeby je odstraszyć, ale pewnej nocy po prostu zniknął.","Ahh, wszystko zaczęło się od burzy - widzisz, potem przyszły te przeklęte syreny. Miałem róg z rogu jednorożca, żeby je odstraszyć, ale pewnej nocy po prostu zniknął.","Ahh, wszystko zaczęło się od burzy - widzisz, potem przyszły te przeklęte syreny. Miałem róg z rogu nosorożca, żeby je przepędzić, ale jednej nocy po prostu zniknął.",0.3852887681393599,0.02556795749489219,0.7804498076438904,0.6763840913772583,0.3852887681393599,0.02556795749489219,0.7804498076438904,0.6763840913772583,0.3708426627509385,0.02556795749489219,0.7937431931495667,0.6813675761222839
How can I be of service?,W czym mogę służyć?,W czym mogę pomóc?,W czym mogę pomóc?,W czym mogę pomóc?,0.4869495858251586,0.3976353643835253,0.9216518402099609,0.962813675403595,0.4869495858251586,0.3976353643835253,0.9216518402099609,0.962813675403595,0.4869495858251586,0.3976353643835253,0.9216518402099609,0.962813675403595
"Temeria remains a wild land, it seems. Insubordination of this kind is not something we Nilfgaardians allow.",Temeria to ciągle dziki kraj. U nas taka samowola podwładnych jest niedopuszczalna.,"Temeria pozostaje dzikim lądem, jak się wydaje. Taki rodzaj niesubordynacji nie jest czymś, na co my, Nilfgaardianie, pozwalamy.","Temeria pozostaje dzikim lądem, jak się wydaje. Taki rodzaj niesubordynacji nie jest czymś, na co my, Nilfgaardianie, pozwalamy.","Temeria pozostaje dzikim krajem, jak widać. Takiego rodzaju niesubordynacja nie jest czymś, na co my, Nilfgaardczycy, pozwalamy.",0.28458140590024666,0.01284618972676772,0.6960940361022949,0.7212768197059631,0.28458140590024666,0.01284618972676772,0.6960940361022949,0.7212768197059631,0.2910775018191724,0.013679192123121896,0.6997507810592651,0.8267493844032288
I sense your pain. I see your fear…,"Czuję twój ból, widzę strach...",Czuję twój ból. Widzę twój strach...,Czuję twój ból. Widzę twój strach...,Czuję twój ból. Widzę twój strach...,0.7054391046550655,0.09554427922043669,0.9437633752822876,0.9793087840080261,0.7054391046550655,0.09554427922043669,0.9437633752822876,0.9793087840080261,0.7054391046550655,0.09554427922043669,0.9437633752822876,0.9793087840080261
Eternal Fire light your path.,Niech Wieczny Ogień oświetli ci drogę,Niech wieczny ogień oświetli twoją drogę.,Niech wieczny ogień oświetli twoją drogę.,Ogień wieczny oświetla twoją drogę.,0.5908578631932548,0.048549177170732344,0.8205174207687378,0.9585189819335938,0.5908578631932548,0.048549177170732344,0.8205174207687378,0.9585189819335938,0.4301008608795309,0.0439891724758422,0.7941031455993652,0.9377307891845703
I'll think about it.,Zastanowię się.,Pomyślę o tym.,Pomyślę o tym.,Pomyślę o tym.,0.04830917874396145,0.0,0.7659346461296082,0.8189239501953125,0.04830917874396145,0.0,0.7659346461296082,0.8189239501953125,0.04830917874396145,0.0,0.7659346461296082,0.8189239501953125
What do you think?,A jak myślisz?,Co pani myśli?,Co pani myśli?,Co myślisz?,0.2656986531986532,0.0,0.8698663115501404,0.9604359269142151,0.2656986531986532,0.0,0.8698663115501404,0.9604359865188599,0.5767563248988022,0.09069748827745895,0.9293137788772583,0.9805884957313538
It's no common monster. It's Morkvarg.,Nie z jakimś – tylko z Morkvargiem.,To nie jest zwykły potwór. To Morkvarg.,To nie jest zwykły potwór. To Morkvarg.,To nie jest zwykły potwór. To Morkvarg.,0.26378970250345596,0.0,0.7402710318565369,0.7673164010047913,0.26378970250345596,0.0,0.7402710318565369,0.7673165798187256,0.26378970250345596,0.0,0.7402710318565369,0.7673165798187256
Mariella! Will you wait for me?,Mariella! Będziesz na mnie czekać?,Mariello! Czy poczekasz na mnie?,Mariello! Czy poczekasz na mnie?,Mariello! Czy zaczekasz na mnie?,0.464637527402755,0.05372849659117709,0.8752008080482483,0.9227332472801208,0.464637527402755,0.05372849659117709,0.8752008080482483,0.9227332472801208,0.47023036856606604,0.05372849659117709,0.8634763956069946,0.9015921354293823
Wait. I wanna thank you.,Najpierw chcę ci podziękować.,Chciałbym ci podziękować.,Dzięki. Każdy by tak zrobił...,Poczekaj. Chcę ci podziękować.,0.5256189063326969,0.17216896116316355,0.8648415803909302,0.9508593678474426,0.11805834262356006,0.0,0.639968752861023,0.5644813179969788,0.6445519093553557,0.16990442448471224,0.8737384080886841,0.923638641834259
The woman who cares for the kids…,"Kobieta, która opiekowała się dziećmi...",Kobieta opiekująca się dziećmi…,Ona nosi znak. Należy do nas.,"Kobieta, która opiekuje się dziećmi...",0.4930133320487419,0.06257106818159155,0.8571696281433105,0.9472934603691101,0.07691174136797486,0.0,0.668999433517456,0.3670680522918701,0.7775592388518567,0.16068568378893033,0.9803105592727661,0.9587312936782837
Bound who?,Kogo?,Kogo związali?,Pomóż mi!,Kogo związać?,0.39508793535563047,0.0,0.7127272486686707,0.65143221616745,0.03144654088050324,0.0,0.7052292227745056,0.5748031735420227,0.40440029428457946,0.0,0.7433145046234131,0.5477147102355957
Coming!,Idę!,Idę!,Idę!,Nadchodzę!,0.6666666666666666,0.1778279410038923,1.0,0.9857706427574158,0.6666666666666666,0.1778279410038923,1.0,0.9857706427574158,0.15499194847020942,0.0,0.8439156413078308,0.6685090661048889
Druids aren't any good with wraiths…,Druidzi raczej słabo sobie radzą z upiorami...,Druidzi nie są dobrzy w radzeniu sobie ze zjawami...,Lepiej?,Druidzi nie są dobrzy z widmami...,0.3675602668297766,0.028517539529041507,0.8345058560371399,0.8436278104782104,0.036712232576954565,0.0,0.6053146123886108,0.3863588869571686,0.2717708431429788,0.041095991233501536,0.8484278917312622,0.8271956443786621
"What mood would you be in if you'd lost your son…? So, I'm askin' - what d'ye want?","Ciekawe, w jakim ty byś był nastroju, jakbyś syna stracił... Czego chcesz, pytam?","Co byś chciał zobaczyć, jeśli straciłbyś syna? Więc pytam - czego chcesz?",Co byś chciał zobaczyć?,"W jakim byłbyś nastroju, gdybyś stracił syna...? No więc pytam - czego chcesz?",0.3352374768012039,0.015671287677272196,0.7800714373588562,0.7817791104316711,0.0706175231449773,0.008468073234773096,0.7083215117454529,0.5015252232551575,0.4600143375477992,0.018476860420522198,0.8676840662956238,0.9138363599777222
Come on. We'll talk outside.,"Chodź, porozmawiamy na zewnątrz.",Chodźmy.,Chodźmy stąd. Porozmawiamy na zewnątrz.,Chodźmy. Porozmawiamy na zewnątrz.,0.12304667015278474,0.0,0.745753824710846,0.6441016793251038,0.807056577400167,0.11362193664674995,0.9148796796798706,0.9289118051528931,0.819124150434035,0.16990442448471224,0.9359856247901917,0.9455544948577881
You lifted the curse?,Odczarowaliście go?,Podniosłeś klątwę?,Czekając w Kaer Morhen z pozostałymi.,Zdjąłeś klątwę?,0.08379888268156434,0.0,0.7564717531204224,0.5601682662963867,0.0859106529209623,0.0,0.6171472072601318,0.3805168569087982,0.05681818181818191,0.0,0.7421919703483582,0.7038058638572693
Triss? Everything all right?,Triss? Coś się stało?,Triss? Wszystko w porządku?,Wszystko w porządku?,Triss? Wszystko w porządku?,0.2716429403492699,0.08034284189446518,0.8452774286270142,0.9218900203704834,0.07461873638344234,0.0,0.728667676448822,0.7994216084480286,0.2716429403492699,0.08034284189446518,0.8452774286270142,0.9218900203704834
For Temeria!,Za Temerię!,Dla Temerii!,Dla Temerii!,Dla Temerii!,0.5860073735004165,0.0,0.8570986986160278,0.8786976337432861,0.5860073735004165,0.0,0.8570986986160278,0.8786976337432861,0.5860073735004165,0.0,0.8570986986160278,0.8786978125572205
Hmmmm...,Hmmmm...,Hmmmm...,Hmmmm...,Hmmmm...,1.0,0.1778279410038923,1.0,0.9904594421386719,1.0,0.1778279410038923,1.0,0.9904594421386719,1.0,0.1778279410038923,1.0,0.9904594421386719
"You'll die, scum.","Zginiesz, łajzo.","Umrzesz, szumowino.","Umrzesz, szumowino.","Umrzesz, szumowino.",0.1949270661042918,0.0,0.7502097487449646,0.7650316953659058,0.1949270661042918,0.0,0.7502097487449646,0.7650306224822998,0.1949270661042918,0.0,0.7502097487449646,0.7650316953659058
"All right, had enough of this charade.","Dobra, starczy tej maskarady.","Dobra, mam już dosyć tej szopki.","Dobra, mam już dosyć tej szopki.","Dobrze, mam dość tej szopki.",0.24726839733983955,0.048549177170732344,0.7793617248535156,0.7554317116737366,0.24726839733983955,0.048549177170732344,0.7793617248535156,0.7554317116737366,0.16554015033317523,0.05372849659117709,0.7610303163528442,0.7533133029937744
"Hey there! Come, take a gander.",Ejże! Rzuć no okiem tutaj.,"Cześć! Chodź, rzuć okiem.","Cześć! Chodź, rzuć okiem.","Cześć! Chodź, rzuć okiem.",0.1986645907698539,0.0,0.8329558372497559,0.8799505829811096,0.1986645907698539,0.0,0.8329558372497559,0.8799505829811096,0.1986645907698539,0.0,0.8329558372497559,0.8799505829811096
"Shut your gob, ginger whore! And you spit it out - where's Eilhart?!","Zamknij pysk, ruda kurwo! A ty mów, gdzie ona jest?!","Zamknij swój pysk, ruda dziwko! A ty wypluj to - gdzie jest Eilhart?!","Zamknij dziób, ruda dziwko! A ty pluj - gdzie jest Eilhart?!","Zamknij mordę, ruda dziwko! I wypluj to - gdzie jest Eilhart?!",0.4835576246742559,0.051424016050282635,0.862633466720581,0.8078643679618835,0.3700523728324574,0.05012578715739066,0.8550211191177368,0.7580094337463379,0.33619182788004043,0.024808415001701823,0.8347317576408386,0.8131417632102966
"Really expected me to show up in a lacework collar, ruffles on my trousers?","Naprawdę oczekiwałaś, że pojawię się tu w koronkowym kołnierzu i z falbanami przy spodniach?","Naprawdę spodziewałaś się, że przyjdę w koronkowym kołnierzu i falbankach na spodniach?","Naprawdę spodziewałaś się, że przyjdę w koronkowym kołnierzu i falbankach na spodniach?","Naprawdę spodziewałeś się, że pojawię się w koronkowej obroży, z falbankami na spodniach?",0.5731955290548375,0.20640765449620033,0.9013264775276184,0.9191921353340149,0.5731955290548375,0.20640765449620033,0.9013264775276184,0.9191921353340149,0.5093770040581157,0.0880025831437708,0.8880508542060852,0.8974958658218384
"Geralt, go fetch us another bottle.","Geralt, skocz no po następną flaszkę.","Geralt, przynieś nam kolejną butelkę.","Geralt, przynieś nam kolejną butelkę.","Geralt, przynieś nam jeszcze jedną butelkę.",0.2542097088937922,0.0439891724758422,0.7896517515182495,0.8901639580726624,0.2542097088937922,0.0439891724758422,0.7896517515182495,0.8901638388633728,0.26052765012144,0.040824829046386304,0.7653417587280273,0.8641340732574463
Britt wasn't lying.,A więc Britt nie kłamała.,Britt nie kłamała.,Britt nie kłamała.,Britt nie kłamała.,0.7477137700583807,0.288715663092199,0.951349139213562,0.9642863273620605,0.7477137700583807,0.288715663092199,0.951349139213562,0.9642863273620605,0.7477137700583807,0.288715663092199,0.951349139213562,0.9642863273620605
I know.,Wiem.,Wiem.,Wiem.,Wiem.,0.8333333333333334,0.1778279410038923,1.0,0.9684513807296753,0.8333333333333334,0.1778279410038923,1.0,0.9684513211250305,0.8333333333333334,0.1778279410038923,1.0,0.9684513807296753
"No, it's just kinda…","Nie, tylko jest jakoś tak...","Nie, to po prostu...","No, to takie...","No, to po prostu takie...",0.19450864512321167,0.06257106818159155,0.8109142184257507,0.8223888874053955,0.1562253286939472,0.0,0.8569189310073853,0.7887836694717407,0.17224122251257304,0.0,0.8220619559288025,0.8690391182899475
Aaaach… Aaaaaach!,Aaaach... Aaaaaach!,Ach... Ach!,Aaaach… Aaaaaach!,Aaaach... Aaaaaach!,0.2978652421590115,0.0,0.8798116445541382,0.8472984433174133,0.636448028264713,0.1495348781221221,0.9168038368225098,0.9954439997673035,1.0,0.316227766016838,1.0,0.9954439997673035
This is it!,Jesteśmy na miejscu.,To jest to!,To jest to!,To jest to!,0.07072781611705951,0.0,0.7735933065414429,0.7486588358879089,0.07072781611705951,0.0,0.7735933065414429,0.7486588358879089,0.07072781611705951,0.0,0.7735933065414429,0.7486593127250671
How'd you get ahold of these? Never heard of a mage willingly parting with his treasures.,"Jak zdobyłeś ten zbiór? Nie słyszałem jeszcze o czarodzieju, który chętnie rozstałby się ze swoimi rzeczami.","Skąd je masz? Nigdy nie słyszałem o czarodzieju, który dobrowolnie oddaje swoje skarby.",Nikt nie pytał Aeramasa o jego wolę. Został spalony na stosie dwa tygodnie temu.,Skąd wziąłeś te rzeczy? Nigdy nie słyszałem o czarodzieju dobrowolnie oddającym swoje skarby.,0.36922956257964135,0.06560264840246194,0.8177375793457031,0.8666793704032898,0.1352722632510065,0.012382165410591436,0.6542438268661499,0.5573669075965881,0.34926382459486693,0.014669198133192292,0.8126193881034851,0.8794221878051758
What now?,Co teraz...?,Co teraz?,Co teraz?,Co teraz?,0.5431753004339641,0.1495348781221221,0.7786802053451538,0.9839842915534973,0.5431753004339641,0.1495348781221221,0.7786802053451538,0.9839842915534973,0.5431753004339641,0.1495348781221221,0.7786802053451538,0.9839842915534973
"No such thing - just as there's no dry water, no cold fire. But if you'll not help, very well, I shall tend to her myself.","Nie ma nieszkodliwych potworów – tak jak nie ma suchej wody ani zimnego ognia. Ale jeśli nie chcesz mi pomóc, sam się nią zajmę.","Nie ma czegoś takiego - tak samo jak nie ma suchej wody, zimnego ognia. Ale jeśli mi nie pomożesz, sam zajmę się nią.","Nie ma takiej rzeczy - tak samo jak nie ma suchej wody, zimnego ognia. Ale jeśli mi nie pomożesz, sam zajmę się nią.","Nie ma takiej rzeczy - podobnie jak nie ma suchej wody, zimnego ognia. Ale jeśli mi nie pomożesz, trudno, sam się nią zajmę.",0.5028904540610016,0.24006978356462588,0.8836297988891602,0.8809787034988403,0.5066075324885037,0.24006978356462588,0.8844623565673828,0.8751389384269714,0.5699035054772742,0.32667492596847564,0.8712942004203796,0.8316904306411743
"Run, run! If you value your life!","Uciekaj, uciekaj! Jeśli ci życie miłe!","Uciekaj, uciekaj! Jeśli cenisz swoje życie!","Uciekaj, uciekaj! Jeśli cenisz swoje życie!","Uciekaj, uciekaj! Jeśli cenisz swoje życie!",0.7257941221771186,0.20205155046766235,0.9255491495132446,0.9128230214118958,0.7257941221771186,0.20205155046766235,0.9255491495132446,0.9128230214118958,0.7257941221771186,0.20205155046766235,0.9255491495132446,0.9128230214118958
All right.,Dobrze.,Dobrze.,Dobrze.,W porządku.,1.0,0.1778279410038923,1.0,0.9812998175621033,1.0,0.1778279410038923,1.0,0.9812998175621033,0.11777922736826853,0.0,0.7435075044631958,0.8724886178970337
Gods guide you.,Niech cię bogi prowadzą.,Niech bogowie cię prowadzą.,Niech bogowie cię prowadzą.,Niech bogowie cię prowadzą.,0.5708720905150596,0.10573712634405641,0.9571067094802856,0.9692948460578918,0.5708720905150596,0.10573712634405641,0.9571067094802856,0.9692948460578918,0.5708720905150596,0.10573712634405641,0.9571067094802856,0.9692948460578918
Sergeant Ardal said I could.,Sierżant Ardal zezwolił.,"Sergeant Ardal powiedział, że mogę.","Sergeant Ardal powiedział, że mogę.","Sierżant Ardal powiedział, że mogę.",0.366982824607955,0.05372849659117709,0.7817589044570923,0.8361999988555908,0.366982824607955,0.05372849659117709,0.7817589044570923,0.8361999988555908,0.5622089756123676,0.11362193664674995,0.8601862788200378,0.8887989521026611
Who's next?!,Który następny?,Kto następny?!,Co teraz?,Kto następny?!,0.5970373403485242,0.0,0.8859158158302307,0.9452836513519287,0.04975124378109461,0.0,0.718632698059082,0.8095657229423523,0.5970373403485242,0.0,0.8859158158302307,0.9452836513519287
And what's wrong with that?,I co w tym złego?,A co jest nie tak z tym?,A co jest z tym nie tak?,A co w tym złego?,0.1532581857219539,0.033031643180138064,0.8114851713180542,0.888714611530304,0.1532581857219539,0.039281465090051315,0.8153737187385559,0.899199903011322,0.9021205646205646,0.668740304976422,0.98013836145401,0.9857953190803528
"Very well, but hurry, please.","Dobrze, ale pospiesz się.","Bardzo dobrze, ale pospiesz się, proszę.","Bardzo dobrze, ale pospiesz się, proszę.","Bardzo dobrze, ale pospiesz się, proszę.",0.8548908435941129,0.08633400213704504,0.8450995087623596,0.9300023317337036,0.8548908435941129,0.08633400213704504,0.8450995087623596,0.9300023317337036,0.8548908435941129,0.08633400213704504,0.8450995087623596,0.9300023317337036
So long as they're women.,Tylko u kobiet.,"Tak długo, jak są to kobiety.","Tak długo, jak są to kobiety.",Dopóki są kobietami.,0.35691698560624724,0.0,0.6793438196182251,0.6827203631401062,0.35691698560624724,0.0,0.6793438196182251,0.6827200055122375,0.3380634023250795,0.0,0.7117866277694702,0.6380168795585632
Could've corrected him yourself.,Też mogłaś zaprzeczyć.,Mogłeś sam go poprawić.,Mogłeś sam go poprawić.,Mogłeś sam go poprawić.,0.14434697855750492,0.0,0.8031591176986694,0.6437118649482727,0.14434697855750492,0.0,0.8031591176986694,0.6437118053436279,0.14434697855750492,0.0,0.8031591176986694,0.6437118053436279
We can meet her in two days if we hurry.,"Jeśli się uwiniemy, spotkamy się z nią za dwa dni.","Możemy spotkać się z nią za dwa dni, jeśli się pospieszymy.","Możemy się z nią spotkać za dwa dni, jeśli się pospieszymy.","Możemy ją spotkać za dwa dni, jeśli się pospieszymy.",0.5776308711096374,0.3672056269893592,0.8486663103103638,0.8363675475120544,0.5426574677797961,0.12278260149096115,0.85076504945755,0.8391953706741333,0.40795680623816555,0.05022037190492093,0.8159297108650208,0.8175473213195801
a great feast tonight will be.,Dzisiaj wielki bal wyprawisz.,Dziś wieczorem będzie wielka uczta.,Dziś wieczorem będzie wielka uczta.,Dziś wieczorem będzie wielka uczta.,0.20147256190490825,0.0,0.750748872756958,0.8882386088371277,0.20147256190490825,0.0,0.750748872756958,0.8882386088371277,0.20147256190490825,0.0,0.750748872756958,0.8882386088371277
For some this might be a chance to bathe.,Dla poniektórych to jedyna szansa na kąpiel.,To może być szansa na odpoczynek.,Może to być szansa na odświeżenie się dla niektórych.,Dla niektórych może to być okazja do kąpieli.,0.2252946390814038,0.07308015504567583,0.7539675235748291,0.740697979927063,0.4203919306322841,0.056122223243057295,0.7336525917053223,0.7548618316650391,0.38998297783127506,0.03303164318013808,0.7926018238067627,0.918380081653595
"Good to see you again, master.",Dobrze cię znów wiedzieć.,"Dobrze cię widzieć ponownie, mistrzu.","Dobrze cię widzieć ponownie, mistrzu.","Dobrze cię widzieć ponownie, mistrzu.",0.4916082120528773,0.11362193664674995,0.8652404546737671,0.8733574748039246,0.4916082120528773,0.11362193664674995,0.8652404546737671,0.8733574748039246,0.4916082120528773,0.11362193664674995,0.8652404546737671,0.8733575940132141
Somebody's damn desperate to bring our investigation to a quick end.,"Komuś zależy na tym, żeby nasze śledztwo szybko się skończyło.","Ktoś jest cholernie zdesperowany, żeby szybko zakończyć nasze śledztwo.","Ktoś jest cholernie zdesperowany, żeby szybko zakończyć nasze śledztwo.","Ktoś jest cholernie zdesperowany, aby szybko zakończyć nasze śledztwo.",0.44318689922886323,0.028240990488565418,0.7951368093490601,0.9092077612876892,0.44318689922886323,0.028240990488565418,0.7951368093490601,0.9092077612876892,0.41197054806385086,0.025518615589394285,0.7809584736824036,0.8884543776512146
"None. He looked like he had… frostbite. Blue lips, frost in his hair. And dead bees lay all around him.","Raczej po odmrożeniach. Sine wargi, szron na włosach. A wokół leżało pełno martwych pszczół.","Nie ma żadnych ukłuć. Wyglądał jakby miał odmrożenia. Niebieskie usta, szron we włosach. A wokół niego leżały martwe pszczoły.","Nic nie ma. Wyglądał, jakby miał odmrożenia. Sine usta, szron we włosach. A wokół niego leżały martwe pszczoły.","Nie miałem żadnego wpływu na treść podanego tekstu. Oto tłumaczenie na język polski:

Żaden. Wyglądał jakby miał... odmrożenia. Niebieskie usta, szron we włosach. A wokół niego leżały martwe pszczoły.",0.43447332220418294,0.05415315253510895,0.8227837085723877,0.8287392854690552,0.45918752885595765,0.060745880708766846,0.8446913361549377,0.8233990669250488,0.4218584772950331,0.036393742223820025,0.7589210271835327,0.6262580156326294
Reading my mind again?,Znów czytasz mi w myślach?,Czytasz mi w myślach znowu?,Czytasz mi w myślach?,Czytając w moich myślach ponownie?,0.7090054908538578,0.11362193664674995,0.9000011682510376,0.9141114354133606,0.7572097150927775,0.3096787331587729,0.9266652464866638,0.8758707642555237,0.35153116887523655,0.05372849659117709,0.8311046957969666,0.5672850608825684
Somebody's notes on the first page.,Na pierwszej stronie są odręczne notatki.,Czyjeś notatki na pierwszej stronie.,,Czyjeś notatki na pierwszej stronie.,0.588930965419472,0.0439891724758422,0.8232846260070801,0.8428081274032593,1.0000000000000001e-16,0.0,0.0,0.47579023241996765,0.588930965419472,0.0439891724758422,0.8232846260070801,0.8428080081939697
"Beware o' them, witcher. They're the dangerous type, truly.","Uważaj na nich, wiedźminie. Są naprawdę groźni.","Uważaj na nich, czarodzieju. To niebezpieczny typ, naprawdę.","Uważaj na nich, czarodzieju. To niebezpieczny typ, naprawdę.","Strzeż się ich, wiedźminie. To niebezpieczny typ, naprawdę.",0.46777837743710976,0.1374708101760565,0.8103551268577576,0.8706876039505005,0.46777837743710976,0.1374708101760565,0.8103551268577576,0.8706876039505005,0.4873875030367445,0.02777619034011792,0.798041045665741,0.9151875972747803
