en_text,pl_text,dialog_prototype,chrf_dialog_prototype,bleu_dialog_prototype,bertscore_dialog_prototype,comet_dialog_prototype
"No such thing - just as there's no dry water, no cold fire. But if you'll not help, very well, I shall tend to her myself.","Nie ma nieszkodliwych potworów – tak jak nie ma suchej wody ani zimnego ognia. Ale jeśli nie chcesz mi pomóc, sam się nią zajmę.","Nie ma czegoś takiego - tak samo jak nie ma suchej wody czy zimnego ognia. Ale jeśli mi nie pomożesz, trudno, zajmę się nią sam.",0.5031828887606007,0.290427673556309,0.8718233704566956,0.8699259757995605
Got any witchers' work for me?,Masz dla mnie jakieś zlecenie?,Czy masz dla mnie jakąś pracę od czarodzieja?,0.4654558482864166,0.05873949094699214,0.8379690647125244,0.7745909094810486
Not just yet.,Jeszcze nie teraz.,Jeszcze nie teraz.,1.0,0.5623413251903491,1.0,0.9893589019775391
I know where she is. And the Wild Hunt'll also learn that as soon as I find her.,"Wiem, gdzie jej szukać. I wiem, że gdy ją znajdę, Dziki Gon natychmiast się o tym dowie.","Wiem, gdzie ona jest. A Dziki Gon też się o tym dowie, jak tylko ją odnajdę.",0.41981447635058844,0.08691073685908533,0.8548821806907654,0.9122300148010254
What is it? Hm?,"Czego, no?",Co to jest? Hm?,0.0896057347670252,0.0,0.7679542303085327,0.7773793935775757
Depends who's askin'.,"Zależy, kto pyta.","Zależy od tego, kto pyta.",0.741700842201611,0.11362193664674995,0.9089314341545105,0.9601691365242004
"Hm, a nekker hunting alone? You rarely see that.","Hm, nekkery prawie nigdy nie polują samotnie...",Rzadko się to widuje.,0.0735554504600215,0.0,0.6424779295921326,0.549572765827179
Course. The noble White Wolf never abandons a man in need. He's more saint than witcher!,"Oczywiście – szlachetny Biały Wilk nigdy nie zostawiłby człowieka w potrzebie. No święty, nie wiedźmin!",Oczywiście. Szlachetny Biały Wilk nigdy nie porzuci człowieka w potrzebie. Jest raczej świętym niż wiedźminem!,0.6800760444154434,0.23793665482062612,0.8655663132667542,0.9270745515823364
"Specter crept in their hut the night, made nary a sound.","Nocą zmora do dom im sfrunęła, bez szmeru ni szustu.","Specter zakradł się do ich chaty nocą, nie wydając żadnego dźwięku.",0.13626769104553652,0.018850319022747353,0.6978392601013184,0.6765207648277283
"Hm, far more interesting than a ghost, that's certain. The cellar you mentioned - is it in a state to be furnished?","Hm, to dużo lepsze niż duchy. A te podziemia da się jakoś – bo ja wiem – umeblować?","Hm, znacznie ciekawsze niż duch, to pewne. Piwnica, o której mówisz - czy jest w stanie, żeby można było ją urządzić?",0.25259841493795415,0.012021577610863726,0.7151641845703125,0.69691401720047
"Seems they sat us with the sons of jarls, exclusively.","Widzę, że posadzono nas z samymi synami jarlów.","Wydaje się, że posadzili nas z synami jarli, wyłącznie.",0.4939669607785371,0.06030725360407769,0.8334699869155884,0.5206043124198914
Thanks for your help. Farewell.,Dzięki za pomoc. Bywaj.,Dziękuję za pomoc. Żegnaj.,0.4859419553256194,0.16990442448471224,0.7936408519744873,0.7505494356155396
Grrr…,Wrr...,Grrr...,0.5761741567039941,0.0,0.9173123240470886,0.9308615326881409
My comrade - your agent.,Mój druh. A wasz agent.,Mój kompan - twój agent.,0.2741269905575095,0.06389431042462725,0.7789662480354309,0.9146279692649841
Ambassador var Attre?,Ambasador var Attre?,Czy ambasador Vattel?,0.40042675227117,0.0,0.7650805115699768,0.7402858138084412
With a wagon axle.,Dyszlem od wozu.,Z oślą nogą.,0.04901960784313735,0.0,0.7061513662338257,0.3916168510913849
Cause I decided to solve this the witchers' way.,Bo postanowiłem to załatwić po wiedźmińsku.,Dlatego postanowiłem rozwiązać to po wiedźmińsku.,0.6673171828995517,0.10266900960803409,0.8832667469978333,0.9257100224494934
Whoo-hoo… then Olaf's gonna do some killin'.,Uhuhu... No to będzie Olaf mordował.,"Ach, no to Olaf będzie mordował.",0.44500696997720907,0.05773502691896258,0.8330197930335999,0.9021535515785217
"Hm, Could chew through a mace with them choppers. Maybe even Nilfgaardian plate.",Tymi zębami to i kolczugę by przegryzł. Może nawet nilfgaardzkie blachy.,"Hm, Mógłby przeżuć maczugę tymi szczękami. Może nawet pancerz nilfgaardzki.",0.4509120355550849,0.04038503063059995,0.7602338790893555,0.5821987390518188
Get up.,Wstawaj.,Wstawaj.,1.0,0.1778279410038923,1.0000001192092896,0.9869858622550964
Know you well enough to know what matters: results… So I lied. Still say I can lead you to your treasure.,"Znam cię jednak na tyle dobrze, żeby wiedzieć, że interesują cię rezultaty... Skłamałem, zgoda. Ale i tak doprowadzę cię do skarbu.","Znam cię wystarczająco dobrze, by wiedzieć, co się liczy: rezultaty... Więc skłamałem. Nadal twierdzę, że mogę cię poprowadzić do twojego skarbu.",0.48060920841962984,0.02813466693559086,0.812570333480835,0.9067680239677429
I have a right? Thank you kindly. So good to have the approval of his hired thug! And my father worries only about what to get soused on next.,"Mam prawo? O, dziękuję bardzo, jak dobrze zyskać aprobatę najemnika! A mój ojciec martwi się wyłącznie o to, czy ma się czym uchlać.","Dziękuję za życzliwość. Cóż za wspaniałe uznanie ze strony jego wynajętego zbira! A mój ojciec martwi się tylko o to, co będzie pił jako następne.",0.3557195878203034,0.1621733103782632,0.7847278714179993,0.5995380282402039
"Dah, it's a shame our hunters perished in the war.","Ech, szkoda że myśliwi nie wrócili z wojny.","Szkoda, że nasi myśliwi zginęli w wojnie.",0.3465964253714071,0.034052233956373766,0.8433390259742737,0.8642106652259827
I'll see you below.,Widzimy się na dole.,Zobaczymy się na dole.,0.6510591584624638,0.3976353643835253,0.9000687599182129,0.8585477471351624
"What? Smartass, eh?","No, cwaniaczku, he?","Co? Myślisz, że jesteś cwaniakiem, co?",0.2895640873026749,0.0,0.7439422607421875,0.6933545470237732
"You go your way, I'll go mine.","Idźcie w swoją stronę, ja pójdę w swoją.","Idź swoją drogą, ja pójdę swoją.",0.4231604878420912,0.07356556000975763,0.9097608923912048,0.9205321073532104
And I shall provide it… in Vizima. Ready your horses.,Udzielę ich... Ale już w Wyzimie. Szykujcie konie.,Yennefer - Dostarczę go... w Vizimie. Przygotujcie swoje konie.,0.30794791931811977,0.028517539529041507,0.7731795907020569,0.7872635722160339
"Yeah, gladly take it.",A my chętnie przyjmiemy.,Chętnie wezmę to zaproszenie.,0.248049453267831,0.0,0.7524489760398865,0.7701320648193359
"Oh, no.",Nie no.,"Och, nie.",0.1395781637717122,0.0,0.7572866678237915,0.7952213883399963
Jumped out of the undergrowth so fast my medallion didn't have time to give me so much as one twitch. Won't show you the scar – too big a boy for that.,"Nawet mi medalion nie zdążył drgnąć, jak wyskoczyła z zarośli. Blizny nie będę pokazywał, bo już za duży na to jestem.","Wyskoczyłem z zarośli tak szybko, że mój medalion nie zdążył mi dać nawet jednego drgnięcia. Nie pokażę ci blizny – za duży ze mnie chłopak na to.",0.4532181966781644,0.04885744139976472,0.8018445372581482,0.7901206016540527
On whose orders?,Z czyjego rozkazu?,Na czyje polecenie?,0.2016462355767861,0.0,0.8295736312866211,0.8685091137886047
"Sleep, sleep, sleep… Aaaah yaaawn.","Spać, spać, spać... Zieeeew","Sen, sen, sen... Ach, ziewam.",0.15456596125378166,0.0,0.7692756056785583,0.543397843837738
Red clay and the tracks of an exceptionally large nekker. Definitely a warrior.,Czerwona glina i ślady wyjątkowo dużego nekkera. To na pewno wojownik.,Czerwona glina i ślady niezwykle dużego nekkera. Na pewno wojownik.,0.7187487551386046,0.3211703274087688,0.9386430978775024,0.9026340842247009
Eternal Fire which is our hope…,"Wieczny Ogień, który jest nadzieją...","Wieczny ogień, który jest naszą nadzieją...",0.8332152003735737,0.10266900960803409,0.9495595693588257,0.9604095220565796
Novigrad's hierarchs have taken great care to eradicate any and all memories of the city's elven roots.,"Hierarchowie Novigradu zadbali o to, żeby zabić pamięć o elfickich korzeniach miasta.","Hierarchowie Nowigradu zrobili wszystko, co w ich mocy, aby wymazać wszelkie ślady elfickich korzeni miasta.",0.5333642504980483,0.017395797375642234,0.8121518492698669,0.9016361236572266
"You mean, do I have a favorite? Nay. They're as different as fire and water. But an Craite blood flows in both.","W sensie, czy mam faworyta? Nie. Różni są jak ogień i woda... Ale w obu płynie krew an Craite.","Pytasz, czy mam faworyta? Nie. Są różne jak ogień i woda. Ale płynie w nich krew Craite.",0.5799802875581084,0.21063357946200129,0.8779874444007874,0.9092358946800232
"Don't have any food, but maybe this'll help.","Nie mam jedzenia, ale może to wam się przyda.","Nie mam jedzenia, ale może to ci pomoże.",0.6477826072873123,0.6004287712485592,0.9014860987663269,0.9271883964538574
Not a bad idea - on condition it's a ghost we're dealing with. But something doesn't add up…,Całkiem niegłupia myśl – gdyby rzeczywiście chodziło o ducha. Ale coś mi się tu nie zgadza...,"Niezła myśl - pod warunkiem, że mamy do czynienia z duchem. Ale coś tu nie pasuje...",0.26743917533657674,0.03889818545474848,0.8007754683494568,0.8515615463256836
"Ugh, well, the prick just popped our pumpkin.",No i chuj bombki strzelił...,"Ech, no cóż, ten dupek właśnie popsuł naszą dynię.",0.09715970659331506,0.0,0.6536576151847839,0.5534560680389404
Whoreson around or not?,Zastałem Skurwiela czy nie zastałem?,Czy ten skurwysyn jest tutaj?,0.13564190064312623,0.0,0.7022524476051331,0.5211070775985718
"What of it? Do you expect me to shed a tear? Observe a minute of silence? They were dregs, they got they deserved!","I co? Mam uronić nad nimi łzę? Uczcić minutą ciszy? Dostali, na co zasłużyli. Gnidy!","Co z tego? Spodziewasz się, że uronię łzę? Będę obserwować minutę ciszy? To były męty, dostali to, na co zasłużyli!",0.3998956151521777,0.024218026052883736,0.8092502355575562,0.7682203650474548
"Thanks for your help, witcher. I've a distinct sensation, won't say where, that we'll meet again.","Dzięki za pomoc, wiedźminie. Wiesz co? Mam przeczucie, że jeszcze się spotkamy.","Dziękuję za pomoc, wiedźminie. Mam wyraźne przeczucie, nie powiem gdzie, że spotkamy się ponownie.",0.5662426741223451,0.08737167851715878,0.852195143699646,0.8128052353858948
Shove off.,Nie kręć się tu.,Odczep się.,0.10968315037782995,0.0,0.7672195434570312,0.5526412129402161
"Oi, witcher! Your mum not want you?","Te, wiedźmin! Matka cię nie chciała?","Hej, Wiedźminie! Twoja mama cię nie chce?",0.45742766886417385,0.06985342056580097,0.870033323764801,0.8862797617912292
Ah! A customer!,Ha! Klient!,Ach! Klient!,0.7083748448401096,0.1495348781221221,0.9220796823501587,0.9673222899436951
No one apart from Madame Serenity and your lackey.,Tylko Madame Serenity i twój przydupas.,Nikt poza Madame Serenity i twoim lokajem.,0.4948168001989009,0.16348126556655487,0.7867178916931152,0.5138187408447266
Found her in the Crones' village. Transformed into a monster. Any idea how that happened?,"Znalazłem ją w wiosce wiedźm, zamienioną w potwora. Wiesz, co jej się stało?","Znalazłem ją we wsi Kruków. Przemieniona w potwora. Masz pomysł, jak to się stało?",0.4794094121695549,0.05231868220107226,0.8177988529205322,0.8961411714553833
"Course. I'm no coward, I'll not run this time.","Tak, oczywiście. Ale tym razem nie okażę się tchórzem.","Oczywiście. Nie jestem tchórzem, nie ucieknę tym razem.",0.48161899682606674,0.02915032279375143,0.8448906540870667,0.714201807975769
"Oh, you darling girl. Kids are so sweet.",Moje ty kochanie. Dzieci są takie słodkie.,"Oh, ty kochana dziewczyno. Dzieci są takie słodkie.",0.7439405216104915,0.3655552228545123,0.889788806438446,0.9430666565895081
Why're you here?,Czego tu?,Po co tu jesteś?,0.16812468577174458,0.0,0.8093621730804443,0.9162251353263855
You…,Ty...,Ty...,0.8333333333333334,0.1778279410038923,1.0,0.9859636425971985
"The baron and his wife. Hm, look happy enough.","Baron i jego żona. Hmm, wyglądają na szczęśliwych.","Ten baron i jego żona. Hm, wyglądają na wystarczająco szczęśliwych.",0.81407077161731,0.13747081017605653,0.9056612849235535,0.9363982677459717
Been waitin' for this my whole life.,Czekałem na to całe życie...,Czekałem na to całe życie.,0.91494355647334,0.668740304976422,0.9193979501724243,0.9814877510070801
"If the jarls feuded and fought under King Bran, why should they stop now his son's on the throne?","Skoro jarlowie i za króla Brana się kłócili, to czemu mieli by przestać, jak jego syn na tronie?","Jeśli jarlowie walczyli i toczyli spory za czasów króla Brana, dlaczego teraz mieliby przestać, skoro jego syn siedzi na tronie?",0.5579468737632266,0.03527295712700593,0.8302610516548157,0.8712994456291199
It's not the gods.,To nie bogowie.,To nie są bogowie.,0.7142776144820467,0.1880301546543197,0.9406968951225281,0.9690797924995422
Junior was right! Someone's after him!,Junior miał rację! Ktoś po niego przyszedł!,Junior miał rację! Ktoś go ściga!,0.542805399706691,0.43012508513132625,0.9000281095504761,0.9260808825492859
Akh akh. Horses! Gotta let 'em out! Open the main door!,Konie trzeba uwolnić! Otwórzcie główne wrota!,"Ach, ach. Konie! Muszę je wypuścić! Otwórz główną bramę!",0.3440994443466563,0.0,0.8077285885810852,0.8870067000389099
Deal we made means I need to find Tamara and Anna first. Just so happens your unborn daughter might help us do that.,"Wedle naszej umowy najpierw muszę znaleźć Tamarę i Annę. A tak się składa, że pomoże nam w tym twoja nienarodzona córka.","Umowa, którą zawarliśmy, oznacza, że muszę najpierw odnaleźć Tamarę i Annę. Przypadkiem wasza nienarodzona córka może nam w tym pomóc.",0.5577303077638245,0.08663263357746259,0.8281906247138977,0.8867564797401428
"Wouldn't hit a halfling, would you?",Chyba nie uderzysz niziołka?,"Nie uderzyłbyś hobbita, prawda?",0.30307625343354083,0.0,0.7884640097618103,0.764363706111908
Wanted to talk to you.,Chcę jeszcze z wami porozmawiać.,"Nie wiem, kto jest zdrajcą, czarodzieju. Ale powiem ci, że to żaden z nas. Wszyscy straciliśmy bliskich.",0.1631108882947119,0.011502783619900045,0.6421911716461182,0.43991219997406006
That's gotta be him.,To chyba on.,To musi być on.,0.1890521143063093,0.09554427922043669,0.7533499598503113,0.9114642143249512
"No, it's impossible!","Nie, to niemożliwe...","Nie, to niemożliwe!",0.8262984770911342,0.24028114141347542,0.8747442364692688,0.9919105768203735
"You died for a good cause, sheep. Rest in peace.","Zginęłaś w słusznej sprawie, owco. Niech ci ziemia lekką będzie.","Umarłaś za dobrą sprawę, owco. Spoczywaj w spokoju.",0.18297017376616534,0.025725069574826766,0.7746590375900269,0.855617880821228
Wha-- What's happenin'?,Co się dzieje?,Co się dzieje?,1.0,0.5623413251903491,1.0,0.9901319146156311
I certainly hope this gas will work.,"Mam nadzieję, że ten gaz zadziała.","Naprawdę mam nadzieję, że ten gaz zadziała.",0.93380614131186,0.6147881529512643,0.9062414169311523,0.9655096530914307
And lovage?,A lubczyk?,A co z lubczykiem?,0.6449377759862167,0.08034284189446518,0.8707262277603149,0.7972539663314819
"So when the bloke comes round the corner, we do the wounded man bit.",Gość wejdzie w ciemną ulicę i robimy numer z rannym.,"Kiedy gość wyjdzie zza rogu, robimy scenę rannego człowieka.",0.2803369554125428,0.02145851237135921,0.7917811870574951,0.6560920476913452
That's right.,Zgadza się.,To prawda.,0.06734006734006744,0.0,0.7611629366874695,0.774210512638092
Tavern?! 'T'ain't no tavern! 'Tis the House of Warriors!,"Gospoda?! To żadna gospoda, tylko Dom Wojowników!",To nie żadna karczma! To Dom Wojowników!,0.41178233775390244,0.08307018474412793,0.8460999131202698,0.8858546614646912
Sigh…,Ech...,Ech...,1.0,0.1778279410038923,1.0,0.9894007444381714
Cart tracks lead into the woods.,Ślady wozu wiodą w las.,Ślady kół prowadzą w głąb lasu.,0.26599295650695026,0.048549177170732344,0.8278864026069641,0.7534893155097961
"Soon after, Tamara was born, and after that they sent me to Cidaris. A warlord had risen against King Ethain, and Foltest sent help.","Niedługo potem urodziła się Tamara, a mnie wysłali do Cidaris – król Ethain miał problem z jakimś watażką, a Foltest posłał mu wojska z pomocą.","Niebawem po tym urodziła się Tamara, a potem wysłali mnie do Cidaris. Jeden z baronów wszczął rebelię przeciwko królowi Ethainowi, i Foltest posłał tam pomoc.",0.48591488191901205,0.13048038402447693,0.8249920010566711,0.8423720002174377
"Gets you nothin', that!",Nic ci to nie da!,Nie dostaniesz nic z tego!,0.23649557977225802,0.0,0.7623134255409241,0.7986321449279785
"Oh, that's something.","O, to ciekawe.","Oh, to coś.",0.18572040672369253,0.11362193664674995,0.7631375789642334,0.8052466511726379
That's unthinkable!,W głowie się nie mieści!,To jest nie do pomyślenia!,0.12595825173176664,0.05372849659117709,0.7519931793212891,0.9339219927787781
"Heheh. Cleaver, Bedlam and Junior, well, I'd call them my partners if we'd built a mill to grind flour for the folk of nearby hamlets.","Gdybym razem z Tasakiem, Bedlamem i Juniorem zbudował młyn i mełł mąkę dla okolicznych chłopów, to bylibyśmy wspólnikami.","Heheh. Clevver, Bedlam i Junior, no cóż, nazwałbym ich partnerami, gdybyśmy zbudowali młyn do mielenia mąki dla ludności pobliskich wiosek.",0.3192661792893858,0.012673718536830811,0.7658186554908752,0.752907931804657
Akh akh akh akh akh…,Khe! Khe!,"Ach, ach, ach...",0.03875968992248071,0.0,0.6966027021408081,0.6593618392944336
Never rains but it pours.,"Jak nie urok, to sraczka.","Nigdy nie ma lekko, zawsze pod górkę.",0.13784271284271285,0.033031643180138064,0.7271877527236938,0.5202698707580566
I look forward to having friends in Kovir. Especially among King Tancred's entourage.,Dobrze jest mieć w Kovirze przyjaciół. Zwłaszcza na dworze króla Tankreda.,Z niecierpliwością czekam na nawiązanie nowych znajomości w Kovirze. Szczególnie w otoczeniu króla Tancreda.,0.3244850566016678,0.018798317647335087,0.7311440110206604,0.8005185127258301
"I'm certain there's an energy source nearby, generating disturbances, making the crystals malfunction. We must find it and neutralize it… quickly - I must contact someone, it's urgent.","Gdzieś niedaleko musi być źródło energii, które zakłóca pracę kryształów. Trzeba je dezaktywować... I to szybko. Muszę pilnie z kimś porozmawiać.","Jestem pewna, że w pobliżu znajduje się źródło energii generujące zakłócenia, przez co kamienie szlachetne nie działają prawidłowo. Musimy je znaleźć i szybko zneutralizować... muszę skontaktować się z kimś, to pilne.",0.3811978132592851,0.008531104334876973,0.7743149995803833,0.8708924055099487
Thanks for everything.,Dziękuję za wszystko.,Dzięki za wszystko.,0.6600168232744648,0.24028114141347542,0.8242200613021851,0.9778804183006287
Wait! What're you doing?!,"Zaraz, co ty robisz?",Czekaj! Co ty robisz?!,0.5228141717053315,0.08034284189446518,0.8488969206809998,0.9042078852653503
Will you ever lay off Yen?,Odczepisz się kiedyś od Yen?,Czy kiedykolwiek odpuścisz Yen?,0.28401437084768316,0.06257106818159155,0.7745884656906128,0.9235503673553467
…,...,…,1.0000000000000001e-16,0.0,0.6813901662826538,0.9868125319480896
"Gotta toss some mistletoe in the fire, too. Wraith won't come out otherwise.",Do ogniska trzeba jeszcze wrzucić jemiołę. Inaczej nie wyjdzie.,Muszę wrzucić trochę jemioły do ognia. Inaczej Duch nie wyjdzie.,0.4922759444143092,0.05307712171072445,0.8778352737426758,0.7439001202583313
You'd tell him that? What if he doesn't believe you?,"O jaaaa, powiesz mu tak? A jak ci nie uwierzy?",Czy naprawdę byś mu to powiedział? A co jeśli ci nie uwierzy?,0.4209009645193869,0.09578464408619825,0.8124244213104248,0.870317280292511
Key should be around here somewhere…,Klucz na pewno gdzieś tu jest...,Klucz powinien być gdzieś tutaj...,0.4070819461625508,0.05231223689135342,0.848127007484436,0.9746460318565369
See you soon.,Niedługo wracam.,Do zobaczenia wkrótce.,0.10826844642195042,0.0,0.6978735327720642,0.7290878295898438
It's not your fault.,To nie twoja wina.,To nie twoja wina.,1.0,1.0,1.0,0.991891622543335
Who's next?!,Który następny?,Kto następny?!,0.5970373403485242,0.0,0.8859158158302307,0.9452836513519287
Sheathe your weapon.,Schowaj broń.,Schowaj broń.,1.0,0.316227766016838,0.9999998211860657,0.9880782961845398
I wonder if the river's rising.,"Ciekawe, czy rzeka przybierze?","Ciekawe, czy rzeka wzbiera.",0.6268238902585048,0.3976353643835253,0.8762181997299194,0.9097015261650085
Giddy-up! Haa!,Galop!,Ruszaj się! Hej!,0.04901960784313735,0.0,0.7688084244728088,0.6152563691139221
Now to find Eredin and kill him.,Teraz powinniśmy odnaleźć Eredina i zabić go.,Teraz muszę znaleźć Eredina i go zabić.,0.4756557593326279,0.07730551756939454,0.8807050585746765,0.9531941413879395
Unlike his wife.,W przeciwieństwie do jego żony.,W przeciwieństwie do jego żony.,1.0,1.0,1.0,0.9763633608818054
Dying of boredom.,Najczęściej się nudzą.,Umieramy z nudów.,0.10492690492690498,0.0,0.7295845746994019,0.8127114176750183
Don't bother me.,Nie przeszkadzaj.,Nie zawracaj mi głowy.,0.14725253628176768,0.08034284189446518,0.8185365796089172,0.8253305554389954
"Ha, I believe I see a rainbow.","Ha, chyba widzę tęczę.","Ha, widzę tęczę.",0.5819772909873021,0.19053627645285995,0.9436782598495483,0.9671396017074585
Greetings. You know me?,Witaj. Znasz mnie?,Dzień dobry. Znasz mnie?,0.6112425659658495,0.16990442448471224,0.8491441011428833,0.9681033492088318
We'd never have known Ciri had returned if not for Emhyr and his agents. We owe him this.,"Gdyby nie Emhyr i jego agenci, nie wiedzielibyśmy nawet, że Ciri wróciła... Jesteśmy mu to winni.","Gdyby nie Emhyr i jego agenci, nigdy byśmy się nie dowiedzieli, że Ciri wróciła. Jesteśmy mu za to winni.",0.7557613194639403,0.3403336518440549,0.907406747341156,0.9548555016517639
"We'd call together some lads, grab our swords and cut the beast to pieces!","Skrzyknęłoby się paru chłopa, wzięło miecze i porąbało bestię na kawałki!","Zwołamy paru chłopaków, weźmiemy nasze miecze i posiekamy bestię na kawałki!",0.4925016966226572,0.12278260149096115,0.8273698687553406,0.8606835007667542
"Ehh, uh, uhh.","Ech, yh, yyh.","Ech, eee, eee.",0.19680120890241906,0.11362193664674995,0.8457698225975037,0.803287148475647
"It's not about sleeping. You've gotta draw the hym out. It has to emerge from the shadows, show itself.",Na samym nocowaniu się nie skończy. Trzeba wypłoszyć Hima. Musi wyjść z cienia i pokazać swoją postać.,"To nie chodzi o spanie. Musisz go wywabić. Musi wyjść z cienia, pokazać się.",0.3436077432716864,0.06482993212910186,0.7860843539237976,0.7146387696266174
I'm not about to justify what Yennefer did…,Nie chcę usprawiedliwiać Yennefer...,"Nie zamierzam usprawiedliwiać tego, co zrobiła Yennefer…",0.5891331246977735,0.039281465090051315,0.8241772651672363,0.941297709941864
He's surrounded by splendid virgins who ply him with sparkling wine and pastries stuffed with nightingales' tongues.,"Siedzi otoczony hurysami, które karmią go pasztecikami ze słowiczych języków i poją młodym winem.","On otoczony jest wspaniałymi dziewicami, które częstują go musującym winem i ciastkami nadzianymi językami słowików.",0.39099372668812366,0.018693000799960027,0.7736941576004028,0.6291384696960449
I'll try to find it. Come.,Spróbuję go znaleźć. Chodźmy.,Spróbuję to znaleźć. Chodźmy.,0.8449397341788646,0.1880301546543197,0.9555145502090454,0.9549548625946045
Name-calling's not allowed.,Nie wolno się przezywać.,Nazywanie kogoś obraźliwie nie jest dozwolone.,0.20803218520609826,0.0,0.7147989273071289,0.7382643818855286
Get to the point.,Do rzeczy.,Przejdźmy do rzeczy.,0.7281566689521646,0.11362193664674995,0.8360021114349365,0.8567893505096436
"And unlike Avallac'h, we can promise you this.",I w przeciwieństwie do Avallac’ha możemy to obiecać.,"W przeciwieństwie do Avallac'ha, możemy ci to obiecać.",0.7686780729657666,0.08783602619713961,0.8982046842575073,0.9237738847732544
Maybe that your wife's with child…?,Że twoja żona jest przy nadziei…,Może że twoja żona jest w ciąży...?,0.48139317083447114,0.16348126556655487,0.7442078590393066,0.6950306296348572
"Claimed to have spotted a lantern out to sea, so he said he'd climb the highest peak to look out for ships.","Widział latarnię i powiedział, że wejdzie na szczyt, by wypatrywać statków.","Twierdził, że widział latarnię daleko na morzu, więc powiedział, że wejdzie na najwyższe wzniesienie, aby wypatrywać statków.",0.7427257648834589,0.17694975149532557,0.8856977224349976,0.8887599110603333
"This is between the two of you. I refuse to meddle. But cross my path again, and I will kill you.",To sprawa między wami... Nie będę się wtrącał. Ale jeśli jeszcze raz staniesz mi na drodze – zabiję cię.,"To jest między wami dwoma. Nie zamierzam się wtrącać. Ale jeśli znów staniesz mi na drodze, zabiję cię.",0.5815355502608156,0.08322475605730908,0.8691984415054321,0.9593737125396729
Makes sense. Found agates covered in blood in her hideout.,"To by się zgadzało, w jej kryjówce znalazłem okrwawione agaty.",Znalazłem agaty pokryte krwią w jej kryjówce.,0.3989459329935768,0.04550524645870584,0.7926405668258667,0.8532594442367554
Hmm… Something cut this basket exactly in half.,Hmm... Coś przecięło ten kosz równiutko na pół.,Hmm... Coś dokładnie przecięło ten koszyk na pół.,0.6392830214629109,0.10173978273092252,0.8932823538780212,0.8837108016014099
