|speaker|prev_text|prev_speaker|next_text|next_speaker|en_text|pl_text|dialog_prototype
1456|Geralt|Oof… Good to be back above ground.|Lambert|Mean the trolls? They're in for trouble, not us.|Lambert|Mhm… Still trouble ahead.|Mhm... Ale to nie koniec kłopotów.|Mhm... Nadal kłopoty przed nami.
1457|Redanian Soldier 01|Fine, I'll pay.|Geralt|I catch you extorting coin again, you'll go straight to the front. The eastern front.|Redanian Officer 01|That I understand. Exemplary patriotism, mate.|No, to rozumiem. Wzorowa patriotyczna postawa.|To rozumiem. Wzorowy patriotyzm, kolego.
1458|Keira Metz|Gotta look for it alone. I should go to Crookback Bog. Think you can manage?|Geralt|I'll stop by. You can be sure.|Geralt|Of course I can. Best of luck to you.|Oczywiście, że sobie poradzę. I tobie też życzę powodzenia.|Oczywiście, że mogę. Powodzenia.
1459|Geralt|You always say that.|Triss|Well, except for that one time.|Geralt|Haven't killed me yet.|I jak do tej pory mnie nie zabili.|Jeszcze mnie nie zabiłeś.
1460|Redanian Soldier 02|Calm down, Piet. They're just witches.|Redanian Soldier 03|You hear our latest orders?|Witch Hunter 01|Maybe. But they scream like you and me.|Może. Ale krzyczą jak zwykli ludzie.|Może tak. Ale one krzyczą tak samo jak ty i ja.
1461|Geralt|||Greetin's to you.|Verden Old Man 02|Greetings.|Witaj.|Pozdrawiam was.
1462|Novigrad Thug Strong 02|You all right, darlin'?|Novigrad Prostitute 02|Ugh, see what you've done?! He's broken character now.|Novigrad Prostitute 02|This masquerade… just not a good idea, I don't think.|Ta przebieranka to chyba nie był dobry pomysł.|Ten maskaradowy bal... nie wydaje mi się dobrym pomysłem, myślę.
1463|Dudu Biberveldt|I've assumed many forms over the years, and in spite of all, life as a human has proven most interesting. After all, you humans rule the world.|Dudu Biberveldt|You've been Menge, now you're Whoreson Junior.|Geralt|Greetings.|Witaj.|Witaj.
1464|Dwarf Man 02|||||My forge! Burnt to the ground!|Moja kuźnia! Spłonęła!|Moja kuźnia! Spalona do fundamentów!
1465|Holger Blackhand|Why? Wherefore?|Lady Bran|You will. Later.|Lady Bran|Can't remember. But I knows he deserves it. I got to kill 'im.|Nie pamiętam. Ale na pewno sobie zasłużył. Muszę go zabić.|Nie mogę sobie przypomnieć. Ale wiem, że na to zasługuje. Muszę go zabić.
1466|Redanian Soldier 02|||You're to sift through every inch, is that clear?! Every fucking mole hole!|Redanian Soldier 02|Deeper, now! Dig deeper!|Głębiej kopać, głębiej!|Musisz przeszukać każdy cal, czy to jasne?! Każdą pierdoloną norę!
1467|Radovid|I have placed Junior in a mansion in Oxenfurt. Very few know this.|Radovid|Junior constantly requests fresh women. I hear he doesn't treat them well.|Radovid|They'll not let you in unannounced. Thus, you must tell them you've come about the new whores.|Nie będą chcieli cię tam wpuścić. Ale powiedz im, że przychodzisz w sprawie nowych dziwek.|Nie wpuszczą cię bez zapowiedzi. Dlatego musisz im powiedzieć, że przyszedłeś w sprawie nowych dziwek.
1468|Geralt|||You're a wizard, right? Gonna show us some tricks when we get to the cottage?|Verden Girl 02|No one left hiding.|Nikt więcej już się nie chowa.|Nikt nie został w ukryciu.
1469|Geralt|Geralt… Do all you witchers have such nerve?|Dijkstra|Quite the opposite. Your reward… Earned it, all the same. Triss will get her coin as well, have her chance to fritter it away on foolish ideals.|Dijkstra|Whaddaya mean?|O co ci chodzi?|Co masz na myśli?
1470|Scoiatael Dwarf 01|Roamed the forests of Kaedwen, Vergen, and now the mouth of the Pontar. Wonder what's next.|Scoiatael Dwarf 01|Wanna whiff of me axe?|Scoiatael Dwarf 01|Fuckin' shit!|Kurwa żesz!|Cholerna kupa gówna!
1471|Novigrad Peasant 32|What's the hurry?|Novigrad Peasant 32|Hey, now!|Novigrad Peasant 32|What's going on there?|Co się dzieje?|Co tam się dzieje?
1472|Novigrad Nobleman 13|Oh, my. Greetings.|Novigrad Nobleman 13|Hard finding work here, you know. With the Eternal Fire burning and all that.|Novigrad Nobleman 13|Your reputation precedes you, Geralt.|Twoja sława cię wyprzedza, Geralt|Twoja reputacja Cię poprzedza, Geralt.
1473|Yennefer|Mind if we, uh, never mention this again?|Geralt|Door's open. We'll proceed as soon as you've collected trophies of your kills.|Yennefer|Naturally.|Oczywiście.|Naturalnie.
1474|Geralt|||||Fresh footprints. Johnny ran through here - fleeing something.|Świeże ślady... Janek tędy uciekał.|Świeże ślady. Johnny przebiegł tędy - uciekając przed czymś.
1475|Skellige Woman 04|I'd rather… not talk about myself.|Cirilla|Someone might come looking for me. I wouldn't want to cause you any trouble.|Cirilla|Why's that?|Dlaczego?|Dlaczego tak jest?
1476|Geralt|||Silence. It's completely still.|Cirilla|Follow me. The Naglfar must be nearby.|Za mną. Naglfar musi być gdzieś blisko.|Pójdź za mną. Naglfar musi być gdzieś blisko.
1477|Geralt|Your arms.|Redanian Soldier 02|Never seen better steel in my life. Blade must strike true, no?|Redanian Soldier 02|Thanks.|Dziękuję.|Dzięki.
1478|Navigator|I'm the one to ask! Me or Axel an Tordarroch. He's over there. What can a bloke from Ard Skellig know about Undvik?|Skellige Fisherman 02|Bahumum…|Skellige Fisherman 02|Heard you trillin' a different tune when Hjalmar was gatherin' his crew… Your love for the an Craite fade that quick?|Inaczej gadałeś, kiedy Hjalmar załogę zbierał... Już ci przeszła miłość do rodu an Craite, co?|Słyszałem, że śpiewałeś zupełnie inaczej, gdy Hjalmar kompletował swoją załogę... Twoja miłość do an Craite zgasła tak szybko?
1479|Yennefer|At least that's what Rita implied.|Yennefer|Come, they're all waiting for us.|Yennefer|I don't like it. That was not our deal. When it's all over, I'll need to have a candid discussion with the emperor.|Nie podoba mi się to, nie tak się umawialiśmy. Jak to wszystko się skończy, będę musiała odbyć z cesarzem szczerą rozmowę.|Nie podoba mi się to. To nie była nasza umowa. Kiedy wszystko się skończy, będę musiała mieć szczerą rozmowę z cesarzem.
1480|Skellige Fisherman 04|||||Next time squeeze your mount 'tween your knees and hold the reins short. Horse's gotta feel who's in charge.|Następnym razem mocniej konia kolanami ściśnij i krótko uzdę trzymaj. Musi czuć, kto tu rządzi.|Następnym razem ściśnij swojego wierzchowca między kolanami i trzymaj wodze krótko. Koń musi czuć, kto tu rządzi.
1481|Cirilla|||||The peasant folk of Velen call this night the Feast of Gifts. I've no idea why.|Chłopi z Velen nazywają tę noc Świętem Darów. Nie wiem dlaczego.|Ludzie ze wsi w Velen nazywają tę noc Ucztą Darów. Nie mam pojęcia dlaczego.
1482|Geralt|Aye, you got that righteous frown on you. Definitely.|Dwarf Sneezy|Aheheheh! Look at him, all offended! You'd think we showed him a picture of a naked lass.|Dwarf Doc|I don't want your coin.|Nie chcę waszych pieniędzy.|Nie chcę twojej monety.
1483|Geralt|So what am I supposed to think about?|Triss|Ah, Geralt. You're so charming when you try to be funny.|Triss|Emhyr var Emreis. On parade. Completely naked.|Wyobraź sobie Emhyra bez ubrań.|Emhyr var Emreis. Na paradzie. Całkowicie nagi.
1484|Geralt|||||They were looking for something…|Widać, że czegoś tu szukali...|Oni czegoś szukali...
1485|Hallgrim|Strong blood? What're you talking about?|Geralt|We've talked enough.|Hjalmar|I speak of the she-bear and her cub.|O niedźwiedzicy i jej młodym.|Mówię o niedźwiedzicy i jej młodym.
1486|Yennefer|No wench'll teach me how to fight.|Lugos The Mad|Come, Geralt, I believe this discussion's run its course.|Yennefer|That was not my intention.|Faktycznie. Nie było to moim zamiarem.|To nie było moim zamiarem.
1487|Baron Bandit Weak 01|Drinks enough for a whole platoon since his family disappeared.|Baron Bandit Weak 01|Horsefeathers!|Baron Bandit Weak 01|Slurps a jug o' charred spirit and don't even wince!|Na głodzie potrafi wyżłopać garniec przepalanki i nawet sie nie skrzywi!|
1488|Dandelion|Geralt… I know I owe you, a hundred times over. But I need to ask you another favor. Find the bastard who did this.|Dandelion|Don't need any convincing.|Geralt|Find him and kill him.|Znajdź i zabij.|Znajdź go i zabij go.
1489|Geralt|Proof, Geralt. Give me proof.|Radovid|To the dungeon with him.|Radovid|Don't have any.|Nie mam.|Nie mam żadnych.
1490|Geralt|Hjalmar kept blowin' his horn, but we'd come too close to the hillside and he brought an avalanche down on us.|Folan|We found that daft bugger in the ship, then pitched camp near the guard tower.|Folan|Not your lucky day, it seems. What happened next?|Rzeczywiście mieliście pecha. I co było potem?|Nie twój szczęśliwy dzień, jak się zdaje. Co stało się potem?
1491|Elf Female 02|Akh akh akh…|Elf Female 02|Don't those swords poke you in the arse when you run?|Elf Female 02|Brrr.|Brrr.|Brrr.
1492|Novigrad Peasant 03|What's the problem?|Geralt|Shut it, Gottard. He could help.|Novigrad Peasant 01|Oh, nothin', on your way now, good man.|O nic, idź swoją drogą.|Oh, nic takiego, ruszaj już, dobry człowieku.
1493|Geralt|Whatever you want to do…|Lambert|You know, Vesemir's right. You do poke the damn hive, almost always. Fine. Let's go.|Lambert|We'll investigate. Just in case.|Sprawdźmy to. Na wszelki wypadek.|Będziemy śledztwo prowadzić. Na wszelki wypadek.
1494|Redanian Soldier 04|The war has caused damages that must be repaired. Taxes shall henceforth be doubled.|Redanian Soldier 04|Bow before your new lord…|Nilfgaardian Soldier 01|All who remit payment to the treasury shall receive a note for the equivalent sum.|Za wszystkie opłaty na rzecz państwa ludność otrzyma ich równowartość w talonach.|Wszyscy, którzy dokonają wpłaty do skarbca, otrzymają pokwitowanie równoważnej sumy.
1495|Lambert|Next time you get the feeling I'm about to piss off Merigold, make sure and knock me upside the head.|Lambert|He's through!|Lambert|Bastard wants to break through, get inside!|Ten skurwiel chce się przebić siłą do środka!|Skurwiel chce się przedrzeć, wejść do środka!
1496|Cirilla|Perhaps… But if so, it will be a very, very long time from now…|Cirilla|Hope you're right…|Geralt|And I'm certain whatever it is, he'll give me a choice. I will have the option to refuse.|I jestem pewna, że cokolwiek to będzie, da mi wybór. Będę mogła odmówić.|Jestem pewna, że cokolwiek to będzie, da mi wybór. Będę miała możliwość odmowy.
1497|Redanian Officer 01|Put away your weapon.|Redanian Officer 01|Go away.|Redanian Officer 11|You've been warned.|Ostrzegałem.|Jesteś ostrzeżony.
1498|Skellige Druid 03|||||…!|!!!|nan
1499|Novigrad Old Man 18|Wine's more expensive, whores're more expensive…|Novigrad Old Man 18|Oh, the fear we all suffered… But, Rejk's turned up his toes now and that's prime!|Novigrad Old Man 18|Not now, graygob.|Nie teraz, siwy.|Nie teraz, szary goblinie.
1500|Geralt|Apart from which, I knew by then the curse was progressing, so instead of looking for Avallac'h, I decided to find you and Yen.|Cirilla|Right. Conventional means of travel. They're just better.|Cirilla|Got a boat on the beach. Once we land, we'll head for Kaer Morhen. On horseback.|Na brzegu czeka łódka, a potem musimy dotrzeć do Kaer Morhen. Konno.|Mam łódź na plaży. Jak wylądujemy, ruszymy do Kaer Morhen konno.
1501|Nilfgaardian Soldier 01|One, two, three - one, two, three - wayhey!|Baron|I don't care how you do it, but the deliveries must be weekly.|Nilfgaardian Soldier 01|Enough.|Dość.|Wystarczy.
1502|Chamberlain Emhyr|Please, this is neither the time nor the place for such antics.|Chamberlain Emhyr|This might come as news to the gentleman, but a towel wrapped around one's waist is not fitting attire for an audience.|Chamberlain Emhyr|The gentleman will watch carefully.|Niech waszmość patrzy uważnie.|Panowie, proszę uważnie obserwować.
1503|Novigrad Nobleman 01|I've a mind to let you win some back if you bring more coin.|Novigrad Nobleman 01|||I have no more money. Not a single crown…|Nie mam więcej pieniędzy. Ani korony...|Nie mam już pieniędzy. Ani jednej korony...
1504|Letho|"""Them""? You know I work alone. Question is, what're you doing here?"|Geralt|Bravo, Geralt. Avoided all my traps.|Letho|Waiting for them. The ones trying to kill me.|Czekam na tych, którzy chcą mnie zabić.|Czekam na nich. Tych, którzy próbują mnie zabić.
1505|Succubus 01|You don't know what you're saying. She's cast a spell on you!|Skellige Druid 05|I see through your lies - your wretched charm won't work on me! I shall kill you here and now, monster!|Skellige Druid 05|Nonsense. I need no spell. These boys come 'ere themselves. In fact, I must use magic to drive them away, make them go home! Only Ramund was nice, so I let him stay.|Bzdura. Nie muszę rzucać uroku, żeby ci chłopcy do mnie przychodzili... Ja rzucam urok, żeby stąd poszli! Tylko Ramund był na tyle miły, że pozwoliłam mu zostać.|Nonsens. Nie potrzebuję żadnego zaklęcia. Ci chłopcy przychodzą tu sami. W rzeczywistości muszę używać magii, aby ich odpędzić, wysłać do domu! Tylko Ramund był miły, więc pozwoliłam mu zostać.
1506|Verden Old Man 03|Got what you asked for.|Geralt|I see a wolf, strivin' forward towards a solitary tower, 'midst a blizzard.|Verden Old Man 03|Thank ye, now I need a moment.|Dziękuję, dajcie mi chwilę.|Dzięki, teraz potrzebuję chwili.
1507|Dwarf Man 02|||Be sure and tell us when the rammy's due to start, eh?|Dwarf Man 02|Hey! White-hair!|Ej, białowłosy!|Upewnij się, że nas zawiadomisz, gdy ramię zacznie się obracać, co?
1508|Geralt|Is that so? Nice to hear. But… is there any particular reason you're telling me this?|Keira Metz|Ah… this is awkward. I mean, I'd gladly help, but I have a few more things to tend to in this charming dung hole.|Keira Metz|Well, the Wild Hunt'll know I've found her when I do. They'll attack. Want you to help me repel them.|Dziki Gon dowie się, że ją znalazłem i zaatakują nas. Chcę, żebyś pomogła mi w obronie.|No cóż, Dziki Gon dowie się, że ją znalazłem, gdy to zrobię. Będą atakować. Chcę, żebyś mi pomogła ich odpierać.
1509|Redanian Soldier 03|||My grandad once returned from his travels with a book. Fetched enough to buy him a home.|Redanian Townsman 03|A book? You mean to patch a henhouse?|Księga? Kurnik będziecie uszczelniać?|Moje dziadek raz wrócił ze swoich podróży z książką. Wystarczyło, żeby kupić mu dom.
1510|Baron|No thanks. Didn't come here to drink.|Geralt|Before the war, there was a distillery nearby, best in Velen. But the whoresons burnt it to the ground.|Baron|Hmph. As you will. But I'll not sit here adry, if you don't mind.|Jak chcesz. Ja tam nie lubię siedzieć o suchym pysku.|Hmph. Jak sobie chcesz. Ale nie zamierzam siedzieć tu bezczynnie, jeśli nie masz nic przeciwko.
1511|Geralt|||||Sverre and his crew were attacked here. Should look around.|Tutaj zaatakował Sverrego i jego ludzi. Trzeba się rozejrzeć.|Sverre i jego załoga zostali zaatakowani tutaj. Powinniśmy się rozejrzeć.
1512|Geralt|An illusion… Who woulda thunk?|Lambert|No, I will not. In fact, whole world should hear about the time the famed Geralt of Rivia was duped like a child. Think we oughta get Dandelion to write a ballad about it. How's that sound?|Lambert|You're not gonna let this drop anytime soon, are you?|Ech... Coś mi mówi, że prędko nie odpuścisz.|Nie zamierzasz odpuścić tego tematu, co nie?
1513|Verden Peasant 01|Mercy…|Verden Peasant 01|Reckon you'll ever have any grain to sell?|Verden Peasant 01|Merciful Verna!|Verno Miłosierna!|Łaskawa Verna!
1514|Geralt|Is there anything to be done, a remedy for this?|Novigrad Nobleman 03|Truly? Why, the estate's price just spiked sharply. What precisely was the problem?|Novigrad Nobleman 03|House shouldn't give you any more trouble. A little renovation and it should be fit for you to move into.|Nie powinno być więcej problemów z tym domem. Mały remont i można się wprowadzać.|Dom nie powinien już sprawiać ci żadnych problemów. Trochę renowacji i powinien być gotowy do zamieszkania.
1515|Cerys|They've seated us here.|Yennefer|We've met. Don't remember?|Geralt|I asked them to. Wanted to meet the notorious witcher Geralt.|Sama o to poprosiłam – chciałam poznać sławetnego wiedźmina Geralta.|Poprosiłam ich, żeby nas tu posadzili. Chciałam spotkać sławnego wiedźmina Geralta.
1516|Geralt|Horses have always fascinated me. I've always longed to extoll their noble beauty… Did you see any of my work at Dandelion's? Mere exercises, true, but I'd be curious to know what you thought of them.|Marabella|"""Gee-up! Her snakely whip rose skyward. Gee-haw! Crack! She reined the beast in!"""|Marabella|Uhh… No, no, didn't see any.|Yyy... nie, nie widziałem.|Uhh... Nie, nie widziałem żadnych.
1517|Baron Bandit Strong 03|Ploughin' wizard!|Baron Bandit Strong 03|Grrr…|Baron Bandit Strong 03|Son of a whore!|Kurwi syn!|Syn kurwy!
1518|Chamberlain Emhyr|Feels more like I'm being readied for a wedding.|Geralt|That an ongoing alliance? What's Letho up to?|Geralt|Were that so, I would have prepared the gentleman a frock, a tailcoat, or possibly a dinner jacket. In point of fact, the gentleman will choose from these garments.|Wtedy przygotowałbym waszmości surdut, frak bądź ewentualnie tużurek. Tymczasem waszmość ma do wyboru te szaty.|Gdyby tak było, przygotowałbym dla pana sukienkę, frak lub może smoking. W rzeczywistości pan sam wybierze jeden z tych strójów.
1519|Geralt|How might I serve the gentleman?|Chamberlain Emhyr|Citrus and cloves. The fragrance will keep the gentleman's robes fresh somewhat longer.|Chamberlain Emhyr|By returning my things.|Oddając moje rzeczy.|By oddając moje rzeczy.
1520|Geralt|Hah… What're my chances? With these wounds?|Novigrad Rich Man 02|No. Rather make sure this was our last meeting.|Geralt|Not high. So long.|Niewielkie. Żegnam.|Nie są wysokie. Żegnaj.
1521|Geralt|Thanks.|Geralt|Help? Casting my babe in an oven?!|Udalryk|What Cerys did - don't hold it against her. She wanted to help, banish the voices that haunt you.|Nie miej Cerys za złe tego, co zrobiła. Chciała ci pomóc odegnać głosy, które cię prześladują.|Co zrobiła Cerys - nie miej jej tego za złe. Chciała ci pomóc, pozbyć się głosów, które cię prześladują.
1522|Skellige Warrior 03|I hear Olaf's been off meat for two days.|Skellige Warrior 02|But he's had a helluva lotta mead.|Skellige Warrior 02|And when he's hungry, he's angry.|A on jak głodny, to zły.|A gdy jest głodny, robi się zły.
1523|Redanian Soldier 01|Right, what do I know. I'm just a witcher.|Geralt|Brave soldiers, don't push, or it'll-- Whoa, watch out!|Novigrad Thug Strong 01|Hold on, now! If that's no basilisk, but some weevern, what did I pay for? Give me back my coin, cheat!|Hola, hola! Jak to nie bazyliszek, tylko jakaś wiwerna, to za co ja płaciłem? Oddawaj pieniądze, oszuście!|Poczekaj chwilę! Jeśli to nie jest bazyliszek, ale jakiś weevern, za co ja zapłaciłem? Oddaj mi moją monetę, oszuście!
1524|Geralt|Wake up.|Geralt|C'mon, get up.|Geralt|Wake up.|Wstawaj.|Obudź się.
1525|Geralt|Darling, when I'm able to make use of someone, I always do. It's convenient.|Dijkstra|Of course I'm scared… Bloody dangerous whoreson. Triss would concur, I think.|Dijkstra|And safe… Come on, admit you're scared of Menge.|I bezpieczne... Może przyznasz, że boisz się Mengego?|I bezpieczne... No dalej, przyznaj się, że boisz się Menge.
1526|Geralt|I'm quite alive and extraordinarily well, Geralt of Rivia. Better than I've ever been in this rotten life of mine. And now that you've seen me, I bid you farewell.|Tamara|We've nothing more to talk about.|Tamara|Wait…|Zaczekaj...|Czekaj...
1527|Skellige Villager 02|If Sven's father were alive, he'd give that boy's rump a good strappin'.|Skellige Old Woman 01|What's he know? Used to be youngsters knew their place and kept quiet.|Skellige Old Man 01|What if Sven's talkin' sense? Maybe the elders are to blame for this?|A może Sven ma rację? Może to wina starszyzny?|A co jeśli Sven mówi z sensem? Może winę ponoszą starsi za to wszystko?
1528|Geralt|Bring our young damsel to the lower courtyard. She wants to practice? She'll get to practice.|Vesemir|Why the hell not? The whippersnapper refuses to do as she's told.|Vesemir|Don't get mad at her.|Nie wściekaj się na nią.|Nie złość się na nią.
1529|Novigrad Thug Strong 32|Wise guy, eh?|Novigrad Thug Strong 32|Not jarred-off easily, eh?|Novigrad Thug Strong 33|Bloody hell.|Kurwa mać.|Cholera jasna.
1530|Verden Bandit 05|Bloody hell! You fucking dimwit! I hadn't time to exchange two words with the man!|Nilfgaardian Soldier 03|We have no quarrel with you, but one false move and--|Nilfgaardian Soldier 03|He provoked me!|Sprowokował mnie!|On mnie sprowokował!
1531|Yennefer|I might've waited until you found me, but… you know me. Patience has never been my strong suit.|Yennefer|Sorry… Wasn't expecting to see you. To be honest, this isn't at all how I imagined we'd meet.|Geralt|It's… good to see you, Geralt. I… I'd even embrace you… were you not covered in blood.|Dobrze cię widzieć, Geralt. Jeszcze lepiej byłoby cię uścisnąć... Gdyby nie to, że jesteś cały we krwi.|To... dobrze cię widzieć, Geralt. Ja... ja nawet bym cię objęła... gdybyś nie był pokryty krwią.
1532|Novigrad Thug Weak 01|D'you get that?|Novigrad Thug Weak 02|Die, you ploughin' bastard!|Novigrad Thug Weak 02|Got it, all right. He threatened us and reached for his weapon.|Słyszałem. Groził i sięgnął po broń.|Dostałem to. Groził nam i sięgnął po broń.
1533|Novigrad Thug Weak 31|A warlock.|Novigrad Thug Weak 31|Going somewhere, friend?|Novigrad Thug Weak 32|Blooood!|Kreeew!|Blooood!
1534|Dudu Biberveldt|You've been Menge, now you're Whoreson Junior.|Geralt|||Apparently, you must be a rogue to survive in this city.|Widocznie w tym mieście najłatwiej przeżyć udając bydlaka.|Wygląda na to, że musisz być szelmą, żeby przetrwać w tym mieście.
1535|Eternal Fire Guard 01|Over my dead body.|Geralt|Remember the preacher who spoke of witches and witchers? A man you humiliated before his faithful? He asked that we administer a sacrament on his behalf - your last rites.|Eternal Fire Guard 02|Told you we wouldn't fool him. Well, you're due a beating. It'll just be more of a challenge.|A mówiłem ci, nie nabierze się. No, trudno... I tak się go ubije. Tylko wyzwanie będzie większe.|Powiedziałem ci, że go nie oszukamy. No cóż, zasłużyłeś sobie na lanie. To po prostu będzie większe wyzwanie.
1536|Novigrad Citizen Man 20|They say some witchers spy for the Black Ones…|Novigrad Citizen Man 19|A whole day wasted.|Novigrad Citizen Man 20|What's that you wanted?|Co chciałeś?|Czego chciałeś?
1537|Geralt|||||Found a good place for their nest.|Znalazły sobie dobre miejsce na gniazdo.|Znalazły dobre miejsce na gniazdo.
1538|Elf Man 02|Dh'oine or not, death awaits us all.|Elf Man 02|Help…|Elf Man 02|Nooo!|Nieee!|Nooo!
1539|Yennefer|This'll come in handy.|Geralt|Sure the guards don't know about the passage through the ruins, haven't planted sentries there?|Geralt|Catch him!|Złap go!|Łap go!
1540|Crach|Something tells me there's a purpose to your hospitality.|Geralt|If that's true, you can rest easy about how the vote'll turn out.|Geralt|Aye, there is. In the Isles, mead and meat stand to gain you as much support as feats accomplished blade in hand.|Ano, nie jest. Na wyspach poparcie zdobywa się nie tylko mieczem, ale też miodem i pieczystym.|Ach, tak. Na Wyspach miód i mięso zdobywają ci tyle samo poparcia, co czyny dokonane mieczem w ręku.
1541|Geralt|Don't have any food, but maybe this'll help.|Geralt|||Come out! I'm not gonna hurt you.|Możecie wyjść, nic wam nie zrobię.|Wyjdź! Nie zamierzam cię skrzywdzić.
1542|Geralt|I thought Aki's ghost would want it back…|Cerys|Long as I remember, folk've said Udalryk's the chosen one, the one the gods speak to.|Cerys|The brother's ghost?|Duch brata?|Czyj brat?
1543|Dijkstra|The bridge must be clear.|Roche|Guards round the temple - what about them? Won't they bloody congregate when they see the fightin'?|Talar|My lads'll make sure of that.|Moi chłopcy się tym zajmą.|Moje chłopaki dopilnują, żeby tak było.
1544|Novigrad Nobleman 01|May I join you?|Geralt|Heard Junior comes here sometimes.|Geralt|I've never seen you here before.|Nigdy cię tu nie widziałem.|Nigdy wcześniej cię tu nie widziałem.
1545|Rosa Var Attre|Aye, but Nilfgaardian ones do… Come to the wrong tavern, birdie. Black Ones aren't welcome here.|Novigrad Drunk 01|||Get your filthy hands off me, you wretch!|Zostaw mnie, brudasie! Łapy przy sobie!|Zabierz swoje brudne łapy, ty potworze!
1546|Hjalmar|Think everyone'll see it that way?|Geralt|And they all believed in me, laid their trust in me.|Hjalmar|I'm prepared to take responsibility for their deaths. I was in charge of the expedition.|Jestem gotowy wziąć na siebie odpowiedzialność za ich śmierć. To ja zorganizowałem tę wyprawę.|Jestem gotów wziąć odpowiedzialność za ich śmierć. Byłem dowódcą ekspedycji.
1547|Scoiatael Dwarf 33|Wait till I push you!|Scoiatael Dwarf 32|Death liberates!|Scoiatael Dwarf 33|Raise your axes!|W górę topory!|Podnieście topory!
1548|Baron Bandit Strong 02|Ou-ou-outta the w-w-way, m-m-maggots! M-m-matko's c-c-comin'!|Baron Bandit Strong 01|Yeeeeh-haaah!|Baron Bandit Strong 02|Faster, Beecher, faster! Got a ripe apple for you when we're through!|Szybciej, Buczek, szybciej! To jabłka potem dostaniesz!|Szybciej, Beecher, szybciej! Mam dla Ciebie dojrzałe jabłko, gdy skończymy.
