|speaker|prev_text|prev_speaker|next_text|next_speaker|en_text|pl_text|dialog_prototype
915|Geralt|How was the water?|Keira Metz|A swallow. Seems we're headed the right way.|Keira Metz|Refreshing. Don't know what you're missing.|Bardzo orzeźwiająca. Żałuj, że się nie zdecydowałaś.|Ożywcze. Nie wiem, czego ci brakuje.
916|Verden Old Woman 01|{Esse’gràin bloede moeras... Mire, n'esse creasa aep caer. } [I hate these bloody swamps… You will see, not one of us will return home alive.]|Nilfgaardian Soldier 01|All right, gran.|Verden Girl 02|Told you not to gaze in the well, Yanna!|Mówiłam ci, Janna, do studni nie zerkaj!|Powiedziałam ci, żebyś nie patrzyła do studni, Yanna!
917|Novigrad Rich Man 01|You can say that again.|Geralt|Anyone follow you?|Triss|… but I'm sure we'll make up for it another time. I absolutely must show you my alchemical formulae…|...ale na pewno to nadrobimy. Muszę koniecznie pokazać pani moje receptury alchemiczne...|... ale jestem pewien, że nadrobimy to innym razem. Absolutnie muszę pokazać ci moje formuły alchemiczne...
918|Temerian Merchant 01|Mhm. A little wet, but intact.|Geralt|No dryads in these swamps, and never known a drowner or a water hag to use a bow. So lacking any other suspects, I'm guessing--|Geralt|At last, fortune smiles my way! Yours as well, witcher. Here, the gold I promised you. Happy trails, now.|Wreszcie uśmiechnęło się do mnie szczęście! I do ciebie też, wiedźminie... Masz. To obiecane złoto! Szerokiej drogi!|Nareszcie szczęście mi sprzyja! Twoje również, czarodzieju. Oto obiecane złoto. Miłej drogi.
919|Novigrad Thug Strong 01|You daft?|Novigrad Thug Strong 01|Ptooey!|Novigrad Thug Strong 01|Watch it, tramp. Novigrad's not your stomping ground.|Zachowuj się przybłędo, tu Novigrad, nie twoja wichura.|Uważaj, laska. Nowigrad nie jest twoim terenem.
920|Scoiatael Dwarf 31|Like that, you bitch?!|Scoiatael Dwarf 01|Rotten times.|Scoiatael Dwarf 31|Nothing good in store for us, nothing good.|Nic dobrego nas nie czeka, nic dobrego.|Nic dobrego nas nie czeka, nic dobrego.
921|Geralt|Glad you're here - we're one short of startin' the race. You up for it?|Skellige Warrior 01|||Maybe later. So long.|Może później. Bywaj.|Może później. Do widzenia.
922|Cirilla|Think he wants to meet you because he missed you? As I see it, he's got plans for you.|Geralt|Geralt, I'm fed up. I won't have others deciding for me behind my back. We ride for Velen.|Cirilla|Ugh. Might've expected it…|Można się było tego spodziewać...|Ugh. Mogłam się tego spodziewać...
923|Novigrad Trader 02|Any needs, master?|Novigrad Trader 02|Master… what're you planning with that sword?|Novigrad Trader 02|Beg your pardon!|Wybaczcie!|Przepraszam najmocniej.
924|Hattori|Too late now. King of Beggars'll get you supplies and then what? You'll have to pay him.|Geralt|No, I won't. I'm a witcher, not a bodyguard.|Geralt|What have I done...? Geralt, you must help me.|W co ja się wpakowałem... Geralt, musisz mi pomóc.|Co ja narobiłam...? Geralt, musisz mi pomóc.
925|Yennefer|Guess this means we need to split up again. Not my preference, but I understand. Clock's ticking.|Geralt|Not gonna happen. I'll go on horseback. Soon as I can get changed.|Geralt|It is indeed. So, why don't I teleport you to Velen, get you there at once?|Goni, prawda... Więc może od razu teleportuję cię do Velen?|Rzeczywiście. Więc dlaczego nie miałabym cię przenieść do Velenu od razu?
926|Geralt|Oooh… You're not Coral. Some succubus, a delusion… Where am I?|Temerian Merchant 01|Mmm?|Temerian Merchant 01|What is your name?|Jak się nazywasz?|Jak masz na imię?
927|Vesemir|Don't see any Nilfgaardians.|Geralt|||They'll find another foe.|Kogoś sobie znajdą.|Oni znajdą innego wroga.
928|Witch Hunter 02|||||Strong fucker…!|Silny, skurwiel...!|Silny skurwysyn...!
929|Novigrad Citizen Man 02|Have you heard? They've opened a cabaret at the old Rosemary and Thyme.|Novigrad Citizen Man 01|No, the kind where ladies in feathers and fishnet stockings swing their legs about.|Novigrad Citizen Man 01|A cabaret? What, the kind where they walk out on stage to tell questionable jests?|Kabaret? Ale taki, że ktoś wychodzi na scenę i opowiada słabe żarty?|Cabaret? Cóż, taki, gdzie panie wychodzą na scenę w piórach i pończochach samonośnych?
930|Vesemir|I don't know what you want to do with him - you haven't deigned to inform us. But it's not safe, is it?|Vesemir|What's this method?|Geralt|Just as I thought. Which is why I think we should first try another, less invasive method.|Właśnie. Dlatego wpierw warto spróbować innej, łagodniejszej metody.|Właśnie tak myślałem. Dlatego uważam, że najpierw powinniśmy spróbować innej, mniej inwazyjnej metody.
931|Skellige Warrior 03|What's this offer? Got a contract for me?|Geralt|Usually work alone.|Geralt|Might do… if you're willin' to partner with me.|Mógłbym mieć... gdybyś chciał ze mną współpracować.|Może tak być... jeśli będziesz chciał ze mną współpracować.
932|Skellige Guard 05|Hey!|Skellige Guard 05|Dead tired, eh?|Skellige Guard 05|Hmm?|Hmm?|Hmm?
933|Geralt|||||Dropped down into the moat. Trail ends here.|Zeskoczył do fosy. Ślad się urywa.|Spadła do fosy. Ślad się tu kończy.
934|Skellige Woman 04|You're a witcher, right?|Skellige Woman 04|Will ye stay long?|Skellige Woman 04|Hm?|Hm?|Hm?
935|Donar An Hindar|That's just it. It was unjust of you to strip him of his name. He didn't run away, flee out of fear, he--|Geralt|Greetings, Geralt.|Donar An Hindar|Only blood can clear one of shame. Words change nothin'. Not his, not yours.|Hańbę można zmazać tylko krwią. Słowa niczego nie zmienią. Ani jego, ani twoje.|Tylko krew może oczyścić jednego z hańby. Słowa niczego nie zmieniają. Nie jego, nie twoje.
936|Sorceress 01|You're dead already.|Scoiatael Elf Woman 36|*Heavy sigh* Ugh…|Sorceress 01|Witcher?|Wiedźminie?|Wiedźmin?
937|Geralt|Aye, who built you a monument more lasting than any of bronze. When next you see him, White Wolf, please convey the great esteem in which I, Sigurd, hold his many achievements.|Skellige Blacksmith Helper 01|It would be a disgrace to censor such an artist. Though a smith by trade, I too do my best work in words.|Skellige Blacksmith Helper 01|Oh, I'll be sure to tell him exactly what I think of his... tales.|Jak go spotkam, to powiem mu, co myślę o jego fantazjach.|Oh, na pewno mu dokładnie przekażę, co myślę o jego... opowieściach.
938|Geralt|||||Not too late to surrender.|Możesz jeszcze się poddać.|Nie za późno, by się poddać.
939|Redanian Townsman 03|Heresies? How's that? I don't remember anything…|Redanian Townsman 02|But that's for laughs… Frock-wearing idiots. Not an ounce of humor in them!|Redanian Townsman 02|Bleeding out his heart-blood's warmth, 'Fire, save me!' the student cried. Thrusting his stump into the hearth, he found heat, but still died.|„Zakrwawiony żak zakwiczał, trzeba mi świętego znicza! Wsadził kikut w palenisko i przekręcił się, chłopisko”.|"Krwawiąc z serca ciepło krwi, ""Ogień, uratuj mnie!"" - krzyknął student. Wpychając swój kikut do paleniska, poczuł ciepło, ale i tak umarł."
940|Roche|Roche, I--|Geralt|Where the bloody hell did you go?! Berry picking?!|Roche|I've no desire to talk to you, Geralt. Goodbye.|Nie chce mi się z tobą teraz gadać, Geralt. Bywaj.|Nie mam ochoty z tobą rozmawiać, Geralt. Żegnaj.
941|Margarita Laux Antille|Vilgefortz did it. I'm employing the same method - cultivating tissue on precious stones.|Philippa Eilhart|||It's madness… …need… ...ower… ...ut your…. …reat dange…|To szaleństwo... ...otrzeba... ...mocy... ..rdzo niebezpieczne...|To szaleństwo... potrzebujesz... mocy... użyj twojej... stworzyć niebezpieczeństwo...
942|Yennefer|We must hurry and find the Sunstone. Seems we've plenty to do in Skellige after that.|Cirilla|||Fringilla Vigo - we need her here.|Musimy też ściągnąć tu Fringillę Vigo.|Fringilla Vigo - potrzebujemy jej tutaj.
943|Geralt|||||It figured out something was up. Gotta search blind, now.|Zorientował się, że coś jest nie tak. Teraz szukaj wiatru w polu.|Domyśliło się, że coś jest nie tak. Teraz musi szukać po omacku.
944|Dijkstra|Why the fuck you let him in here?|Karl Varese|Good to see you again.|King Beggar|Because I want to talk to him. This is Geralt of Rivia.|Bo chciałem z nim porozmawiać. To Geralt z Rivii.|Bo chcę z nim porozmawiać. To jest Geralt z Rivii.
945|Novigrad Rich Man 03|Tis an offence to nature! Does the Temple Guard know what goes on there?|Novigrad Old Man 03|Hmm… And you say the price is reasonable?|Novigrad Old Man 03|Shh! The Guard is well aware.|Ćsii! Straż wie bardzo dobrze...|Cicho! Straż dobrze wie.
946|Yennefer|I'm going to see the baron. Collect Uma from him, then ride for Kaer Morhen.|Geralt|You sure this mage actually had a djinn?|Geralt|I shall join you as soon as I can.|Dołączę, jak tylko będę mogła.|Dołączę do ciebie tak szybko, jak to możliwe.
947|Geralt|Won't find much else here.|Geralt|What's this? Ah. Gotta wonder who wanted to hide the hole… and what's on the other side.|Geralt|The baron and his wife. Hm, look happy enough.|Baron i jego żona. Hmm, wyglądają na szczęśliwych.|Baron i jego żona. Hm, wyglądają na szczęśliwych.
948|Geralt|By orders of our gracious and merciful ruler, the good king…|Redanian Soldier 03|One on the right's a pellar from a village nearby. Gave some bloke the wrong advice, bloke's mates informed on him.|Redanian Soldier 03|What was their crime?|Czym zawinili?|Co było ich przestępstwem?
949|Geralt|Incidentally, interesting choice of allies. Do you think Avallac'h is honest with you? Just curious…|Geels|Shut your mouth or I'll shove a gag in it.|Geralt|No. But honesty's not a facet of your species. So quit spewing bile, won't gain you anything.|Nie. Ale to wasza cecha gatunkowa. Więc skończ sączyć jad, bo to nic nie da.|Nie. Ale uczciwość nie jest cechą twojego gatunku. Więc przestań pluć jadem, bo nic ci to nie da.
950|Priscilla|Are you crazy? Who do you think I am?|Dandelion|Oh, you chose it! Well, I'm not saying it's bad, just different, not exactly what I'd envisaged…|Dandelion|Don't you like it? But I thought a boudoir would be right in line with your tastes…|Nie podoba ci się? A ja myślałam, że właśnie buduar przypadnie ci do gustu...|Nie podoba ci się? Ale myślałam, że buduar będzie idealnie pasować do twoich gustów…
951|Scoiatael Woman 01|Neeeeeeen!|Scoiatael Woman 01|Who wishes to die?|Scoiatael Woman 01|Vedrai! Enn'le!|Vedrai! Enn'le!|Ujrzysz! Przyjacielu!
952|Geralt|||Feeble. But I expected as much.|Gremista|Fine, your choice.|Jak nie, to nie.|Fine, your choice.
953|Fugas|||||A grave error, witchman!|To był błąd, wiedźmaku.|A grave error, witchman!
954|Geralt|Fyke Isle's free of its curse.|Geralt|I'll check the area.|Geralt|Why not. If he was coming here from Novigrad, he must've passed through Blackbough.|Czemu nie. Jeśli jechał z Novigradu, to musiał mijać Konary...|Czemu nie? Jeśli przybywał tu z Novigradu, musiał przechodzić przez Czarnobrzeg.
955|Novigrad Old Woman 01|Oh, so be it… I can toss in that bit.|Novigrad Old Woman 01|||"You tryin' to fleece me? I'm a simple woman, but it don't mean I can't count. We've ""bargained"" enough. You'll get what's offered and that's that."|Myślicie, że oskubiecie prostą kobietę? Że ja liczyć nie umiem? Koniec tych targów! Tyle dostaniecie i basta!|"Czy próbujesz mnie oszukać? Jestem prostą kobietą, ale to nie znaczy, że nie potrafię liczyć. Wystarczająco już ""negocjowaliśmy"". Dostaniesz to, co zostało zaoferowane, i tyle."
956|Ermion|||||Come, we should not stay here.|Chodź, nie możemy tu zostać.|Chodźmy stąd, nie powinniśmy tu zostać.
957|Novigrad Poor Man 02|See the empty ship in port?|Novigrad Poor Man 01|No one knows how it got there, who it belongs to…|Novigrad Poor Man 01|Mmhhhmmm…|Taaa...|Mmhhhmmm...
958|Geralt|Mhm. I know the one. Hansel, Gretel, burning witches. Very fitting for Novigrad.|Dijkstra|Yes, a cart drawn by sewer rats does seem unlikely. And since boats don't leave trails… it amounts to fuck all.|Dijkstra|Trail leads to the river where the sewer lets out… Breaks off there. My bet - they loaded the treasure onto a boat.|Ślad prowadził aż do wyjścia z kanałów – i tam się urwał. Stawiam, że załadowali skrzynię na jakąś barkę.|Ślad prowadzi do rzeki, gdzie wypływa ściek... Kończy się tam. Moja obstawiam - załadowali skarb na łódź.
959|Yennefer|||||Move, Geralt! I won't wait!|Ruchy, Geralt! Nie będę czekać!|Ruszaj się, Geralt! Nie będę czekać!
960|Verden Scavenger 03|You can't hurt the woman… or take the child. I won't let you.|Geralt|Dima chi, alst!|Verden Scavenger 03|Felli, gadael iddo fold.|Felli, gadael iddo fold.|Felli, gadael iddo fold.
961|Voorhis|Exceptional. I've not lost a race in a while. I congratulate you.|Voorhis|I had hoped to have a contest between gentlemen.|Voorhis|That… is yours.|Należy do ciebie.|To... jest twoje.
962|Geralt|Naye, don't say it. It's clear from your face. Please, take this coin.|Verden Woman 05|Might I at least fetch his body?|Verden Woman 05|Thanks. And I truly am sorry.|Dziękuję. I... bardzo mi przykro.|Dzięki. Naprawdę mi przykro.
963|Godling Johnny|||||The thirty-three thieves thought they thrilled the throne throughout Thursday. Hah!|Szelestnym szemrzą brzozy szeptem, ha!?|Trzydziestu trzech złodziei myślało, że zachwycali tron przez cały czwartek. Ha!
964|Witch Hunter 04|They went to shackle the devil's spawn and he cast a spell…|Witch Hunter 04|Pff, don't give a shit.|Witch Hunter 04|Blew himself to fuckin' bits! Blood splattered, a hundred paces around!|I jak nie pierdolnął! Rozsadził się! Jucha na sto kroków bryzgała!|Rozpierdolił się na jebane kawałki! Krew rozbryznęła się na sto kroków wokół!
965|Redanian Officer 01|Vile in appearance and reeking of dead men's bile, it's rotting flesh they truly crave.|Redanian Officer 01|I don't think you know what you're doing.|Redanian Officer 01|To kill one or the other is a service to mankind.|Zabić jednego czy drugiego, to dla ludzkości przysługa.|To zabić jednego lub drugiego jest usługą dla ludzkości.
966|Geralt|I still don't believe everything that happened.|Ves|Take care of the girl. Don't let anyone harm her.|Ves|Thanks for coming. Thanks for risking your lives for me.|Dziękuję, że przyjechaliście i narażaliście dla mnie życie.|Dzięki za przybycie. Dzięki za ryzykowanie swoimi życiami dla mnie.
967|Skellige Woman 01|They smear your arse with honey yet, hero?|Skellige Warrior 05|Wonder if his little sword's still got what it takes…|Skellige Woman 01|White at the temples, but wields a mighty sword.|Skroń niby biała, ale mieczyk niczego sobie.|Białe skronie, ale dzierży potężny miecz.
968|Novigrad Dockworker 31|Whaddaya want? Eh?|Novigrad Dockworker 31|How are you?|Novigrad Dockworker 31|Bah, I've seen better.|E, wielkie mi mecyje.|Bah, widziałem lepsze.
969|Skellige Woman 01|Arike… Storm's comin', take the wash down.|Skellige Warrior 05|Hey, now… what's this about bein' 'old'…?|Skellige Warrior 05|I can see that. Might be old, but I'm not blind yet…|Widzę przecież. Może jestem stara, ale jeszcze nie oślepłam.|Widzę to. Może jestem stara, ale nie jestem ślepa jeszcze…
970|Geralt|And adored for the lavish balls she throws at the family estate outside town.|Triss|||Though the balls probably serve her business interests in some way.|Takie imprezy to zapewne jeden ze sposobów prowadzenia interesów.|Chociaż te bale prawdopodobnie służą jej interesom biznesowym w jakiś sposób.
971|Geralt|What about?|Lambert|Mhm. Just missing Ciri.|Lambert|Nice to be together again, wouldn't you say?|Miło być znowu w komplecie, co?|Miło cię znowu widzieć, nie sądzisz?
972|Skellige Guard 03|Thicket was swallowin' folk. Whosoever ventured in never returned!|Skellige Guard 03|All healed, wounds licked? You better now?|Skellige Guard 03|Not the first time I'm hearin' that.|Już nie pierwszy raz o tym słyszę.|Nie pierwszy raz słyszę coś takiego.
973|Skellige Villager 01|Cowards! Weaklings! Not about to play with you anymore!|Skellige Boy 01|More. If the legends're true, they've been swimmin' here to die for ages.|Skellige Villager 03|Whales in the hundreds…|Tu musi być z setka wielorybów...|Wieloryby w setkach...
974|Skellige Villager 03|Cheers!|Skellige Villager 03|Crikey!|Skellige Villager 03|Good day.|Dzień dobry.|Dzień dobry.
975|Geralt|Feather, troll not hold, not piss…|Troll_2|Bad! It troll! Whale no step, idgit! Him in pot!|Troll_2|Snow?|To ślimak.|Snow?
976|Novigrad Trader 01|Junior doesn't believe in miracles.|Novigrad Trader 01|Work him over. Once you're done, wrap a nice thick chain around his legs and drop him in the Pontar.|Novigrad Trader 01|This is where cheats learn just how much he dislikes being robbed.|W tym pokoju wyjaśniamy oszustom, jak bardzo nie lubi być okradany.|To tutaj oszuści uczą się, jak bardzo on nie lubi być okradany.
977|Mirror|Get to the point.|Geralt|Where?|Geralt|A Nilfgaardian scout from the local garrison saw her.|Zwiadowca z nilfgaardzkiego garnizonu ją widział.|Jeden z nilfgaardzkich zwiadowców z lokalnego garnizonu widział ją.
978|Novigrad Noblewoman 02|"Then I said, ""Perhaps you should not remove your mask."" And she said…"|Novigrad Old Woman 01|Are you listening to me, Ingrid?|Novigrad Old Woman 01|Mhm, mhm.|Mhm, mhm.|Mhm, mhm.
979|Cirilla|Think you can outrun me on an 'orse? Hahahah, naturally! What's the stake?|Baron Bandit Strong 02|Oh, that won't do at all…|Baron Bandit Strong 02|Black mare. The one in the stable.|O tę karą klacz, co stoi w stajni.|Czarna klacz. Ta w stajni.
980|Geralt|And you, Geriatric, or whatever your ploughin' name is - wanna find Whoreson? Find me first.|Karl Varese|Sigi?|King Beggar|Any clue on Junior's whereabouts? Be grateful for any lead.|Jakieś pomysły, gdzie odszukam Juniora? Będę wdzięczny za każdą wskazówkę.|Czy masz jakikolwiek trop dotyczący miejsca pobytu Juniora? Będę wdzięczny za każdy ślad.
981|Godling Johnny|You've seen him?|Cirilla|Why're you looking for him?|Godling Johnny|Saw him in the bog first. Water froze beneath his horse's hooves. Then I saw him again yesterday, heading up this path.|Tak, po raz pierwszy na moczarach. Woda zamarzała pod kopytami jego konia. A wczoraj drugi raz widziałem jak zmierzał tą drogą.|Widziałem go najpierw na bagnach. Woda zamarzła pod kopytami jego konia. Potem widziałem go wczoraj, gdy szedł tą ścieżką.
982|Yennefer|I know.|Yennefer|Now, Geralt!|Yennefer|Agored, teirgane agored!|Agored, teirgane agored!|Agored, teirgane agored!
983|Temerian Peasant 02|No offense, but… many a soldier's dropped his shield. Especially if he was on the losing side.|Geralt|||If we find the shield alone, Hussar'll catch the scent and lead us to Bastien. Come on. Sooner we get this done the better.|Sama tarcza też wystarczy. Wtedy Huzar zwietrzy ślad i nas poprowadzi. No, chodź. Im szybciej to załatwimy, tym lepiej.|Jeśli znajdziemy tarczę samą, Husarz zwietrzy trop i poprowadzi nas do Bastiena. Chodźmy. Im szybciej to zrobimy, tym lepiej.
984|Geralt|||{Faeve'te, larenna luned. } [I await you, Daughter of the Gull.]|Avallach|Think that's a… swallow.|To chyba... jaskółka.|Czekam na ciebie, Córko Mewy.
985|Geralt|Excellent! Then I'll see you at the Rosemary and Thyme!|Dandelion|So did I. Merely goes to show just how much we have yet to learn about women…|Dandelion|Hm, kind of expected her to get hysterical, fly into a rage.|Spodziewałem się raczej wybuchu gniewu i histerii.|Hm, spodziewałem się, że dostanie histerii, wpadnie w szał.
986|Molly|You do realize Dandelion doesn't have a sister.|Geralt|Mhm. Different mothers, too.|Geralt|Sure he does! Saw her meself! Funny, she don't look like him at all… blonde, for starters. Maybe they've different fathers?|Ależ ma! Widziałam ją przecież! Zabawne, bo wcale do niego niepodobna... Taka blondynka. Może mają różnych ojców?|No pewnie, że ma siostrę! Widziałam ją sama! Zabawne, zupełnie nie przypomina brata... Blondynka, żebyś wiedział. Może mają różnych ojców?
987|Geralt|Go out the back. More o' the baron's men in the village.|Verden Peasant 05|I'd rather you not make any more trouble - for yourself, for us both.|Verden Peasant 05|No need to worry about me.|Niepotrzebna troska.|Nie musisz się o mnie martwić.
988|Geralt|||Walkin', walkin', always behind me walkin'. What the fuck.|Novigrad Thug Weak 02|All right. Wasting my time here.|Dobra. Szkoda mojego czasu.|Wszystko w porządku. Marnuję tu czas.
989|Geralt|We can borrow the coin from her.|Dandelion|"Thank you, Geralt, but I refuse to take a single crown from you. You know what they say - ""Fastest way to lose a friend's to loan him some coin."""|Dandelion|How much d'you need? Maybe I can lend you the coin.|Ile potrzebujesz? Mogę ci pożyczyć.|Ile potrzebujesz? Może mógłbym ci pożyczyć monetę.
990|Eternal Fire Guard 02|Oh, you prick!|Eternal Fire Guard 02|You'll burn, devil's brood!|Eternal Fire Guard 02|Calm down, or I'll arrest you both!|Uspokoić się bo was zaaresztuje!|Uspokójcie się, bo was oboje aresztuję!
991|Dijkstra|Wild Hunt's gonna attack Kaer Morhen soon. It's a sure thing. Looking for people, resources, anything that'll help me repel them.|Geralt|Hardly nonsense. Got a taste of it, a painful taste, on my own skin.|Geralt|The Wild Hunt? Don't tell me you believe that nonsense.|Dziki Gon? No, nie mów mi, że wierzysz w te brednie.|Dziki Gon? Nie mów mi, że wierzysz w te bzdury.
992|Baron Bandit Strong 01|You do.|Geralt|Arrrgh!|Baron Bandit Strong 01|Well… let's go, then.|No... To idziemy.|No cóż... chodźmy więc.
993|Hjalmar|||||Argh. Skellige gets colder'n that.|Na Skellige bywa zimniej.|Argh. Skellige staje się zimniejsze niż to.
994|Yennefer|Ciri's our concern, and only ours.|Geralt|||At heart, perhaps. But it's not what we agreed with Emhyr. We must see him.|Możliwe, ale nie tak się umawialiśmy z Emhyrem. Musimy się z nim spotkać.|W głębi serca może tak. Ale to nie jest to, co uzgodniliśmy z Emhyrem. Musimy go zobaczyć.
995|Novigrad Peasant Woman 35|Outrageous!|Novigrad Peasant Woman 35|Brrr.|Novigrad Peasant Woman 36|Help!|Ratunku!|Pomocy!
996|Witch Hunter 03|Fire! The bucket! Grab the buckets!|Witch Hunter 01|||It's the witch! She did this!|To ta wiedźma... To ona zrobiła!|To czarownica! Ona to zrobiła!
997|Redanian Soldier 01|How much I gotta pay to have important state business?|Geralt|Which ones are they?|Geralt|No need to be clever, witcher. Just gotta know the right people.|Nie filozofuj, wiedźminie. Trzeba znać właściwych ludzi.|Nie musisz być taki sprytny, czarodzieju. Musisz tylko znać odpowiednich ludzi.
998|Skellige Priestess 02|||Didn't see him in the garden… Doesn't bode well. Don't know if there's much point in going there.|Geralt|I know… Craven went there before you but has yet to return.|Wiem... Ale Tchórz był tam przed tobą – i do tej pory nie wrócił.|Nie widziałem go w ogrodzie... Nie wróży to dobrze. Nie wiem, czy jest sens tam iść.
999|Eternal Fire Priest 19|Fall upon your knees before the Eternal Fire!|Eternal Fire Priest 18|*Sigh* Horrid times, horrid times.|Eternal Fire Priest 19|Hm.|Hm.|Hm.
1000|Geralt|And don't get killed, witcher.|Yennefer|Let us hope.|Avallach|Telling Ciri she can't do something is counter-productive. Speaking from experience there… Ultimately, she does what she wants.|Z doświadczenia mogę powiedzieć, że stawianie Ciri zakazów mija się z celem. Koniec końców robi swoje.|Mówienie Ciri, że czegoś nie może robić, jest kontrproduktywne. Mówię z doświadczenia... Ostatecznie ona i tak robi to, co chce.
1001|Novigrad Thug Strong 16|I'll gut you, scumsucker.|Novigrad Thug Strong 16|Kill, maim, bury.|Novigrad Thug Strong 16|Argh, fuck.|Ech, kurwa.|Argh, kurwa.
1002|Dijkstra|Rightly so - I'm terrible with eggs. But think on this: Radovid hears that you've captured me… Will he not throw caution to the wind? Will he not jump at the chance to kill me… personally… with his bare hands?|Philippa Eilhart|And then… then we must meet. With our friends. I've leased a warehouse portside. Be sure to come.|Dijkstra|Out of the question! Geralt, get her out of here before I burst a testicle!|Mowy nie ma! Zabieraj ją stąd, Geralt, bo mnie szlag trafi!|Wykluczone! Geralt, zabierz ją stąd, zanim rozerwę jądro!
1003|Geralt|So a band of trained assassins ambushed Aiden, murdered him. Our dear supervisor was one of them.|Lambert|The assassins' leader. And the one to deal the mortal blow.|Lambert|And Jad Karadin?|A Bertram Tauler?|I co z Jad Karadinem?
1004|Redanian Soldier 02|But--|Temerian Peasant 03|||Off you go! And be sure to stay in the village. We'll want a word with you.|Wynocha mi stąd! Ale nie oddalaj się od wioski.|Idź stąd! A upewnij się, że zostaniesz we wsi. Będziemy chcieli z tobą porozmawiać.
1005|Geralt|This is no feast. It's a farmers' market where votes are bought and sold like sheepskins.|Lady Bran|Bran's son will not haggle for a crown that is his by right.|Lady Bran|Svanrige's not gonna vie for support?|Svanrige nie zamierza walczyć o poparcie?|Czy Svanrige nie będzie zabiegał o poparcie?
1006|Skellige Old Man 01|Tis madness, such a young lass…|Skellige Old Woman 01|Silence. 'Tis her decision.|Ermion|Birna should be the one goin', they shared a bed longer.|Birna powinna była za nim pójść, dłużej łoże dzielili.|Birna powinna być tą, która idzie, spali razem dłużej.
