;meta[language=pl]
    517311|00000000||Geata’ar ligen!
   1055110|231374e3||Skelligijczyk
    556520|00000000||{Aen iarean nyald aep kroofeir...} [Szukanie igły w stogu siana...]
    519932|00000000||Słyszysz to?
    519933|00000000||Mhm.
    534052|00000000||Zejdź z drogi, dziadku... A daruję ci życie.
    534726|00000000||Może lepiej spróbuj je zabrać.
    534728|00000000||Jak wolisz.
    534778|00000000||Aaaaach!
    534051|00000000||Jakieś ostatnie słowa?
    534721|00000000||Jeszcze mnie nie zabiłeś.
    534723|00000000||Nie. Bo się tobą bawię.
    534050|00000000||Żałosne... Po prostu żałosne.
    534772|00000000||Nie baw się ze mną... Walcz!
    534774|00000000||Chciałbyś honorowej śmierci, prawda? To się zawiedziesz.
    534776|00000000||Aaaargh!
    566083|00000000||Może powinnaś z nim jednak porozmawiać.
    566085|00000000||To nie ma sensu... a już na pewno nie teraz.
    566087|00000000||A później? Nie skreślaj swojego ojca tylko dlatego, że jest najbogatszym i najbardziej wpływowym...
    566089|00000000||...apodyktycznym draniem, któremu nie można ufać.
    566091|00000000||Myślę, że akurat ty jedna – ze wszystkich ludzi – możesz mu ufać.
    566093|00000000||A co z apodyktycznym draniem?
    566095|00000000||Można się przyzwyczaić.
    548880|00000000||Wielkie dzięki.
    533642|00000000||Myślałam, że będziesz chciała zobaczyć się z Crachem.
    533645|00000000||Po prostu chodzi o to, że... A co, jeśli jutro znowu zniknę? Tym razem na dobre, jak moja matka?
    534678|00000000||Mam wrażenie, że nie powinnam spotykać nikogo, kto mnie... lubi, zanim nie pokonamy Dzikiego Gonu.
    534679|00000000||Zawsze możemy cię odstawić z powrotem na Wyspę Mgieł.
    534066|00000000||Rozejrzeliśmy się trochę po twoim laboratorium.
    534067|00000000||Nie wątpię. A po co tam w ogóle poszliście? Nie wystarczyło mnie zapytać?
    544423|00000000||A ty byś nam wszystko opowiedział o zabawianiu się genem Starszej Krwi?
    544425|00000000||Nie zataiłem przed wami niczego, co mogłoby być przydatne w walce z Eredinem.
    544426|00000000||A co do Starszej Krwi... Wszyscy zdajecie sobie sprawę, że Ciri jest wyjątkowa. Ja po prostu jako jedyny wiem, jak bardzo.
    544440|00000000||A może po prostu masz na jej punkcie obsesję?
    544442|00000000||Ja?
    559125|00000000||Chcesz być królem z nilfgaardzkiego nadania?
    559129|00000000||Chcesz być królem z nilfgaardzkiego nadania?
    559142|00000000||Ujadasz, zanim zaczniesz kąsać?
    559149|00000000||Crach przysłał cię po moją głowę? No to spróbuj ją sobie wziąć!
    561116|00000000||Brać ich!
    559127|00000000||A jakbyś to nazwał, jeśli nie zdradą?
    559124|00000000||A jakbyś to nazwał, jeśli nie zdradą?
    558553|00000000||Nie będę klękać przed an Craite! Nigdy, rozumiesz?!
    558554|00000000||Wolisz się bratać z Czarnymi?
    559089|00000000||Prędzej zbratam się z upiorami z samego Mörhoggu niż pozwolę, żeby Crach rządził całym Skellige!
    558555|00000000||A co na to twoi ludzie? Pójdą za tobą, kiedy wszyscy jarlowie nazwą cię zdrajcą?
    559120|00000000||Jesteś na mojej ziemi, druidzie! Bacz na słowa!
    558886|00000000||Birna wszystko załatwiła za naszymi plecami! I nawet się nie wypiera!
    558872|00000000||Co się tam dzieje?
    558868|00000000||Co się tam dzieje?
    558870|00000000||Jeśli chcesz zobaczyć, jak ta zdzira sprzedaje nas Czarnym, idź tam! Proszę!
    558888|00000000||Nie będę patrzyć na tę hańbę!
    558891|00000000||A Svanrige? W końcu to on jest królem.
    558893|00000000||Taki z niego król jak z rybiej rzyci gwizdek!
    558878|00000000||Szukam Myszowora.
    558880|00000000||Jest tam z nimi, blady jak śnięta ryba. Jeśli on nie postawi smarkacza do pionu, to kto?
    558882|00000000||Ale nie, powiada, bogowie dali nam króla, musimy go wspierać! A przecież zamiast Svanrige kukła mogłaby tam stać i spokojnie patrzyć, jak ta baba sprzedaje nas Czarnym!
    558871|00000000||Szukam Myszowora.
    558874|00000000||Gdyby żył Bran, sam poderżnąłby gardło tej zdradzieckiej suce!
    558876|00000000||A tego szczeniaka trzeba było utopić w słonej wodzie, kiedy się tylko urodził!
   1070432|00000000||Zjadłbym tłuczonych kartofli z gęstym sosem. Albo twardego sera z Gemmery.
   1070452|00000000||Wolałbym gulasz wołowy. Moja matka dodaje do niego prażoną cebulkę, taką chrupką.
   1070454|00000000||Ech... Ile można żreć same ryby i suchary?
   1063162|00000000||Cisza. Zupełna cisza.
   1063164|00000000||Wpadli w pułapkę... Musimy uciekać. Teraz.
   1063166|00000000||Nie tym razem.
   1063168|00000000||Nie, Zireael. Nie jesteś gotowa. Nie kontrolujesz swojej mocy.
   1063170|00000000||Dam sobie radę. Zejdź mi z drogi.
   1063172|00000000||Ciri.
   1063174|00000000||Ciri!
   1063176|00000000||Ten lód... To zaklęcie. Musisz zniszczyć kostur czarodzieja, który je rzucił.
   1063178|00000000||Nie skończy się na kosturze.
   1063094|00000000||Za mną. Naglfar musi być gdzieś blisko.
    557050|00000000||Arhaaam shinaaaz!
    557045|00000000||Co ona powiedziała?
    557046|00000000||Nie spodobałeś jej się.
   1069328|00000000||Nocą będzie łatwiej przekraść się na okręt.
   1031236|00000000||I co teraz? Planujesz wyhodować sobie nowe oczy jak Vilgefortz?
   1056344|00000000||Kiedy go zabijałem, proces nie był zakończony i wyglądało to mocno makabryczne, ale...
   1031237|00000000||Jak rozumiem, skojarzenie z tym zwyrodnialcem było czysto przypadkowe?
   1056346|00000000||Oczywiście.
   1056348|00000000||Słyszałem też o pewnym ślepym krasnoludzkim bogaczu z Mahakamu...
   1056350|00000000||...który kazał sobie wprawić w oczodoły dwa wielkie rubiny.
   1056352|00000000||Dalej nic nie widział, ale ponoć prezentował się bardzo gustownie.
