en_text|pl_text|google_translation|bielik_translation_0.0|mixtral-8x22B_translation_0.0|llama3.1_translation_0.0|bielik_translation_0.1|mixtral-8x22B_translation_0.1|llama3.1_translation_0.1|bielik_translation_0.2|mixtral-8x22B_translation_0.2|llama3.1_translation_0.2|bielik_translation_0.3|mixtral-8x22B_translation_0.3|llama3.1_translation_0.3|bielik_translation_0.4|mixtral-8x22B_translation_0.4|llama3.1_translation_0.4|bielik_translation_0.5|mixtral-8x22B_translation_0.5|llama3.1_translation_0.5|bielik_translation_0.6|mixtral-8x22B_translation_0.6|llama3.1_translation_0.6|bielik_translation_0.7|mixtral-8x22B_translation_0.7|llama3.1_translation_0.7|bielik_translation_0.8|mixtral-8x22B_translation_0.8|llama3.1_translation_0.8|bielik_translation_0.9|mixtral-8x22B_translation_0.9|llama3.1_translation_0.9|bielik_translation_1.0|mixtral-8x22B_translation_1.0|llama3.1_translation_1.0
Now we walk only as far as the tree the goddess planted. We place our offerings and make our pleas before it.|A teraz możemy przejść tylko do drzewa, które zasiała sama bogini. Tam składamy nasze dary i prośby.|Teraz idziemy tylko tak daleko, jak drzewo zasadziła bogini. Składamy nasze ofiary i błagamy przed nim.|Teraz chodzimy tylko tak daleko, jak drzewo, które zasadziła bogini. Składamy nasze ofiary i wypowiadamy nasze prośby przed nim.| Teraz chodzimy tylko tak daleko, jak drzewo, które zasadziła bogini. Składamy nasze ofiary i wznosimy nasze prośby przed nim.|Teraz idziemy tylko tak daleko jak drzewo zasadzone przez boginię. Składamy nasze ofiary i przedstawiamy nasze prośby przed nim.|Teraz chodzimy tylko tak daleko, jak drzewo, które zasadziła bogini. Składamy nasze ofiary i wypowiadamy nasze prośby przed nim.| Teraz chodzimy tylko tak daleko, jak drzewo, które zasadziła bogini. Składamy nasze ofiary i wznosimy nasze prośby przed nim.|Teraz idziemy tylko tak daleko jak drzewo zasadzone przez boginię. Składamy nasze ofiary i przedstawiamy nasze prośby przed nim.|Teraz chodzimy tylko tak daleko, jak do drzewa, które zasadziła bogini. Składamy nasze ofiary i wypowiadamy nasze prośby przed nim.| Teraz chodzimy tylko tak daleko, jak drzewo zasadzone przez boginię. Składamy nasze ofiary i zanosimy nasze prośby przed nim.|Teraz idziemy tylko tak daleko jak drzewo zasadzone przez boginię. Składamy nasze ofiary i przedstawiamy nasze prośby przed nim.|Teraz chodzimy tylko tak daleko, jak drzewo, które zasadziła bogini. Składamy nasze ofiary i wypowiadamy nasze prośby przed nim.| Teraz chodzimy tylko tak daleko, jak drzewo, które zasadziła bogini. Składamy nasze ofiary i wznosimy nasze prośby przed nim.|Teraz chodzimy tylko tak daleko, jak drzewo zasadzone przez boginię. Składamy nasze ofiary i przedstawiamy swoje prośby przed nim.|Teraz chodzimy tylko tak daleko, jak do drzewa, które bogini zasadziła. Składamy nasze ofiary i wypowiadamy nasze prośby przed nim.| Teraz chodzimy tylko tak daleko, jak drzewo zasadzone przez boginię. Składamy nasze ofiary i wznosimy nasze prośby przed nim.|Teraz idziemy jedynie tak daleko jak drzewo zasadzone przez boginię. Składamy nasze ofiary i przedstawiamy prośby przed nim.|Teraz chodzimy tylko tak daleko, jak do drzewa, które zasadziła bogini. Składamy nasze ofiary i zanosimy nasze prośby przed nim.| Teraz chodzimy tylko tak daleko, jak drzewo zasadzone przez boginię. Umieszczamy nasze ofiary i składamy nasze prośby przed nim.|Teraz idziemy tylko tak daleko, jak drzewo zasadzone przez boginię. Składamy nasze ofiary i składamy prośby przed nim.|Teraz chodzimy tylko tak daleko, jak drzewo, które zasadziła bogini. Składamy nasze ofiary i przedstawiamy nasze prośby przed nim.| Teraz chodzimy tylko tak daleko, jak drzewo, które zasadziła bogini. Składamy nasze ofiary i składamy nasze prośby przed nim.|Teraz chodzimy tylko tak daleko, jak drzewo zasadzone przez boginię. Składamy ofiary i wypowiadamy nasze prośby przed nim.|Teraz chodzimy tylko tak daleko, jak drzewo, które zasadziła bogini. Składamy nasze ofiary i zanosimy nasze prośby przed nim.| Teraz chodzimy tylko tak daleko, jak drzewo zasadzone przez boginię. Składamy nasze ofiary i wznosimy nasze prośby przed nim.|Teraz idziemy tak daleko, jak drzewo zasadzone przez boginię. Składamy ofiary i składamy prośby przed nim.|Teraz chodzimy tylko tak daleko, jak drzewo, które zasadziła bogini. Składamy nasze ofiary i wypowiadamy nasze prośby przed nim.| Teraz chodzimy tylko tak daleko, jak drzewo, które zasadziła bogini. Umieszczamy nasze ofiary i składamy nasze prośby przed nim.|Teraz idziemy tylko tak daleko, jak drzewo posadzone przez boginię. Składamy ofiary i wysławiamy się przed nim.|Teraz chodzimy tylko tak daleko, jak do drzewa, które zasadziła bogini. Składamy przed nim nasze ofiary i wypowiadamy swoje prośby.| Teraz chodzimy tylko tak daleko, jak drzewo, które posadziła bogini. Składamy nasze ofiary i składać prośby przed nią.|Teraz idziemy tylko w taką odległość jak drzewa które posadziła bogini, kładziemy nasze ofiary i składamy błagania przed nią.|Teraz chodzimy tylko tak daleko, jak do drzewa, które zasadziła bogini. Składamy nasze ofiary i zanosimy nasze prośby przed nim.| Teraz chodzimy tylko tak daleko, jak do drzewa zasadzonego przez boginię. Składamy nasze ofiary i modlimy się przed nim.|Teraz idziemy tylko tak daleko, jak drzewo zasadzone przez boginię. Składamy ofiary i przedstawiamy swe prośby przed nim.
So her becoming queen of all Skellige - it's changed nothing?|Czyli nic się nie zmieniło po tym, jak została królową całego Skellige?|Czyli to, że została królową całego Skellige, niczego nie zmieniło?|Więc jej zostanie królową całego Skellige - nic się nie zmieniło?| Więc jej zostanie królową całego Skellige - to nic nie zmieniło?|Czyli jej zostanie królową całego Skellige niczego nie zmieniło?|Więc jej zostanie królową całego Skellige - nic się nie zmieniło?| Tak więc jej zostanie królową całego Skellige - to nic nie zmieniło?|Czyli jej zostanie królową całego Skellige niczego nie zmieniło?|Więc jej zostanie królową całego Skellige - nic się nie zmieniło?| Tak więc jej zostanie królową całej Skellige - to nic nie zmieniło?|Więc to że została królową całego Skellige niczego nie zmieniło?|Więc jej zostanie królową całego Skelligu - nic się nie zmieniło?| Tak więc jej zostanie królową całego Skellige - to nic nie zmieniło?|Czy więc to że została królową wszystkich Skellige niczego nie zmieniło?|Więc jej zostanie królową wszystkich Skelligów - nic się nie zmieniło?| Tak więc jej zostanie królową całego Skellige - to nic nie zmieniło?'|Czyż więc to, że została królową wszystkich Skelligów niczego nie zmieniło?|Więc jej zostanie królową całego Skellige - nic się nie zmieniło?| Więc jej zostanie królową całych Skellige - to nic nie zmieniło?|Czyż więc jej zostanie królową całego Skellige niczego nie zmieniło?|Więc jej zostanie królową wszystkich Skelligów - nic się nie zmieniło?| Więc jej zostanie królową całej Skellige - to nic nie zmieniło?|Czyż więc jej zostanie królową całego Skellige niczego nie zmieniło?|Więc jej zostanie królową całego Skellige - nic się nie zmieniło?| Więc jej zostanie królową całego Skellige - to nic nie zmieniło?|Czy więc jej zostanie królową całego Skellige niczego nie zmieniło?|Więc jej zostanie królową całego Skelligu - nic się nie zmieniło?| Tak więc jej zostanie królową całej Skellige - to nic nie zmieniło?|Więc jej koronacja jako królowa całego Skellige niczego nie zmieniła?|Więc jej zostanie królową całego Skelligu - nic się nie zmieniło?| Więc jej zostanie królową całej Skellige - to nic nie zmieniło?'|I tak jej zostanie królową całego Skellige - nic to nie zmienia?|Więc jej zostanie królową wszystkich Skelligów - nic się nie zmieniło?| Więc jej zostanie królową całego Skellige - to nie zmieniło nic?|"""Czyli to że została królową całego Skellegi - nic tak naprawdę się nie zmieniło?"""
What do I do to complete the Path of Warriors? Remind me.|Przypomnij mi, co trzeba zrobić, żeby zakończyć próbę na szlaku wojowników?|Co mam zrobić, aby ukończyć Path of Warriors? Przypomnij mi.|Co muszę zrobić, aby ukończyć Ścieżkę Wojowników? Przypomnij mi.| Co muszę zrobić, aby ukończyć Ścieżkę Wojowników? Przypomnij mi.|Co muszę zrobić, aby ukończyć Ścieżkę Wojowników? Przypomnij mi.|Co muszę zrobić, aby ukończyć Ścieżkę Wojowników? Przypomnij mi.| Co muszę zrobić, aby ukończyć Ścieżkę Wojowników? Przypomnij mi.|Co muszę zrobić, aby ukończyć Ścieżkę Wojowników? Przypomnij mi.|Co muszę zrobić, aby ukończyć Ścieżkę Wojowników? Przypomnij mi.| Co muszę zrobić, aby ukończyć Ścieżkę Wojowników? Przypomnij mi.|Co muszę zrobić, aby ukończyć Ścieżkę Wojowników? Przypomnij mi.|Co muszę zrobić, aby ukończyć Ścieżkę Wojowników? Przypomnij mi.| Co muszę zrobić, aby ukończyć Ścieżkę Wojowników? Przypomnij mi.|Co muszę zrobić, aby ukończyć Ścieżkę Wojowników? Przypomnij mi.|Co muszę zrobić, aby ukończyć Ścieżkę Wojowników? Przypomnij mi.| Co muszę zrobić, aby ukończyć Ścieżkę Wojowników? Przypomnij mi.|Co muszę zrobić, aby ukończyć Ścieżkę Wojowników? Przypomnij mi.|Co muszę zrobić, aby ukończyć Ścieżkę Wojowników? Przypomnij mi.| Co muszę zrobić, aby ukończyć Ścieżkę Wojowników? Przypomnij mi.|Co muszę zrobić, aby ukończyć Ścieżkę Wojowników? Przypomnij mi.|Co muszę zrobić, aby ukończyć Ścieżkę Wojowników? Przypomnij mi.| Co muszę zrobić, aby ukończyć Ścieżkę Wojowników? Przypomnij mi.|Co muszę zrobić aby dokończyć Ścieżkę Wojownika? Przypomnij mi.|Co muszę zrobić, aby ukończyć Ścieżkę Wojowników? Przypomnij mi.| Co muszę zrobić, aby ukończyć Ścieżkę Wojowników? Przypomnij mi.|Co muszę zrobić, aby ukończyć ścieżkę wojowników? Przypomnij mi.|Co muszę zrobić, aby ukończyć Ścieżkę Wojownika? Przypomnij mi.| Co muszę zrobić, żeby ukończyć Ścieżkę Wojowników? Przypomnij mi.|Co muszę zrobić, aby ukończyć Ścieżkę Wojowników? Przypomnij mi.|Co muszę zrobić, aby ukończyć Ścieżkę Wojowników? Przypomnij mi.| Co powinienem zrobić, aby ukończyć Ścieżkę Wojowników? Przypomnij mi.|Co muszę zrobić, aby ukończyć Ścieżkę Wojowników?. Przypomnij mi.|Co muszę zrobić, aby ukończyć Ścieżkę Wojowników? Przypomnij mi.| Co muszę zrobić, aby ukończyć Ścieżkę Wojowników? Przypominam.|Co muszę zrobić, aby ukończyć Ścieżkę Wojowników? Przypomnij mi.
Fine… We'll do as you say. If the need arises, I can cast spells from up here.|Dobrze. Zrobimy, jak mówisz. Jakby co, będę cię wspierać zaklęciami z murów.|Dobrze… Zrobimy, jak mówisz. Jeśli zajdzie taka potrzeba, mogę rzucać czary stąd.|Dobrze... Zrobimy tak, jak mówisz. Jeśli zajdzie potrzeba, mogę rzucać zaklęcia stąd.| Dobrze... Postąpimy zgodnie z twoją wolą. Jeśli zajdzie taka potrzeba, mogę rzucać zaklęcia stąd z góry.|Dobrze... Zrobimy jak mówisz. Jeśli zajdzie potrzeba, mogę rzucić czary stąd.|Dobrze... Zrobimy tak, jak mówisz. Jeśli zajdzie potrzeba, mogę rzucać zaklęcia stąd.| Dobrze... Postąpimy zgodnie z twoimi słowami. Jeśli zajdzie taka potrzeba, mogę rzucać zaklęcia stąd.|Dobrze... Zrobimy jak mówisz. Jeśli zajdzie potrzeba, mogę rzucić czary stąd.|Dobrze... Zrobimy tak, jak mówisz. Jeśli zajdzie potrzeba, mogę rzucać zaklęcia stąd.| Dobrze... Zrobimy tak, jak mówisz. Jeśli zajdzie taka potrzeba, mogę rzucać zaklęcia stąd.|Dobrze... Zrobimy jak mówisz. Jeśli zajdzie potrzeba, mogę rzucić czary stąd.|Dobrze... Zrobimy jak mówisz. Jeśli zajdzie potrzeba, mogę rzucać zaklęcia stąd.| Dobrze... Postąpimy zgodnie z twoją wolą. Jeśli zajdzie taka potrzeba, mogę rzucać zaklęcia stąd z góry.|Dobrze... Zrobimy jak mówisz. Jeśli zajdzie potrzeba, mogę rzucić zaklęcia stąd.|Dobrze... Zrobimy, jak mówisz. Jeśli zajdzie potrzeba, mogę rzucać zaklęcia stąd.| Dobrze... Postąpimy zgodnie z twoją wolą. Jeśli zajdzie taka potrzeba, mogę rzucać czary z góry.|Dobrze... Zrobimy jak mówisz. Jeśli zajdzie potrzeba, mogę rzucić czary stąd.|Dobrze... Zrobimy tak, jak mówisz. Jeśli zajdzie potrzeba, mogę rzucać zaklęcia stąd.| Dobrze… Postąpimy zgodnie z Twoimi sugestiami. Jeśli zajdzie taka potrzeba, mogę rzucać zaklęcia z góry.|Dobrze… Zrobimy jak mówisz. Jeśli zajdzie potrzeba, mogę rzucać czary stąd.|Dobrze... Zrobimy tak, jak mówisz. Jeśli zajdzie potrzeba, mogę rzucać zaklęcia stąd.| Dobrze... Postąpimy zgodnie z twoją wolą. Jeśli zajdzie taka potrzeba, mogę rzucać zaklęcia stąd z dachu.|Dobrze... Zrobimy tak jak mówisz. Jeśli zajdzie potrzeba, mogę rzucić czary stąd.|Dobrze... Zrobimy jak mówisz. Jeśli będzie taka potrzeba, mogę rzucać zaklęcia stąd.| Dobrze... Postępujemy według Twych słów. Jeśli zajdzie taka potrzeba, mogę rzucać zaklęcia z góry.|W porządku... Zrobimy jak mówisz. Jeśli zajdzie potrzeba, mogę rzucić czary stąd.|Dobrze... Zrobimy tak, jak mówisz. Jeśli zajdzie potrzeba, mogę rzucać zaklęcia stąd.| Dobrze… Postąpimy zgodnie z twoją wolą. Jeśli zajdzie taka potrzeba, mogę rzucać zaklęcia stąd nie wdając się w bezpośrednią walkę.|Dobrze… Zrobimy tak jak mówisz. Jeśli zajdzie potrzeba, mogę rzucić zaklęcie stąd z góry.|Dobrze... Zrobimy tak, jak mówisz. Jeśli zajdzie potrzeba, mogę rzucać zaklęcia stąd.| Dobrze… Zrobimy tak, jak pan powiedział. Jeśli zajdzie taka potrzeba, mogę rzucać zaklęcia stąd góry.|W porządku… Zrobimy jak mówisz. Jeśli zajdzie potrzeba, mogę rzucić czary stąd.|Dobrze... Zrobimy tak, jak mówisz. Jeśli zajdzie potrzeba, mogę rzucać zaklęcia stąd.| Dobrze… Zrobimy tak, jak mówisz. Jeśli zajdzie taka potrzeba, mogę rzucać zaklęcia stąd z góry.|W porządku… Zrobimy jak mówisz. Jeśli zajdzie potrzeba, mogę tu rzucić zaklęcia.
Just make sure you stay vigilant, listen to what I say.|Ważne, żebyś był czujny i słuchał moich poleceń.|Tylko zachowajcie czujność, posłuchajcie, co mówię.|Tylko upewnij się, że pozostaniesz czujny, słuchaj tego, co mówię.| 'Tylko upewnij się, że pozostaniesz czujny i będziesz słuchał, co mówię.'|Tylko uważaj, słuchaj tego co mówię.|Tylko upewnij się, że pozostaniesz czujny, słuchaj tego, co mówię.| 'Tylko upewnij się, że pozostaniesz czujny i będziesz słuchał, co mówię.'|Tylko uważaj, słuchaj tego co mówię.|Upewnij się, że pozostaniesz czujny. Słuchaj tego, co mówię.| 'Tylko upewnij się, że pozostaniesz czujny i będziesz słuchał, co mówię.'|Tylko upewnij się, że pozostajesz czujny, słuchaj tego co mówię.|Tylko upewnij się, że pozostaniesz czujny i słuchasz tego, co mówię.| Pamiętaj tylko, abyś był czujny i słuchał, co mówię.|Tylko uważaj, słuchaj tego co mówię.|Tylko upewnij się, że jesteś czujny i słuchasz, co mówię.| 'Upewnij się tylko, że pozostaniesz czujny i będziesz słuchał tego, co mówię.'|Po prostu uważaj, słuchaj tego co mówię.|Upewnij się, że zachowujesz czujność. Słuchaj, co mówię.| 'Proszę, tylko upewnij się, że pozostajesz czujny i słuchasz, czego ci mówię.'|Tylko uważaj, słuchaj tego co mówię.|Tylko upewnij się, że pozostaniesz czujny, słuchając tego, co mówię.| Pamiętaj tylko, abyś był czujny i wierzył w to, co mówię.|Tylko uważaj, słuchaj co mówię.|Po prostu upewnij się, że zachowujesz czujność. Słuchaj, co mówię.| Po prostu upewnij się, że pozostajesz czujny i słuchasz, czego mówię.|Tylko uważaj dobrze, słuchaj tego co mówię.|Upewnij się tylko, że pozostaniesz czujny i słuchasz tego, co mówię.| 'Zadbaj jedynie o to, żebyś był czujny i wierzył czego mówię.'|Tylko uważaj dobrze i słuchaj mnie.|Upewnij się, że pozostajesz czujny i słuchasz tego, co mówię.| Proszę jedynie o to, abyś zawsze był czujny i słuchał moich słów.|Tylko uważaj, słuchaj tego co mówię.|Upewnij się, że pozostajesz czujny, słuchaj tego, co mówię.| Proszę tylko zadbać, byś był czujny i po prostu po prostu wyśluchać, co mówię.|Tylko uważaj dobrze, słuchaj tego co mówię.
What do I look for? Did Aki have anything that'll help me recognize him? Something he was wearing that could survive all this time under water?|Aki miał przy sobie coś, po czym mógłbym go rozpoznać? Coś, co wytrzymałoby pod wodą tyle czasu?|Czego mam szukać? Czy Aki miał coś, co pomoże mi go rozpoznać? Coś, co miał na sobie i co mogło przetrwać cały ten czas pod wodą?|Czego szukam? Czy Aki miał coś, co pomoże mi go rozpoznać? Coś, co mogło przetrwać tak długi czas pod wodą?| Co powinienem szukać? Czy Aki miał coś, co pomoże mi go rozpoznać? Czy coś, co nosił, mogło przetrwać tak długo pod wodą?|Co powinienem szukać? Czy Aki miał coś, co mogłoby mi pomóc go rozpoznać? Coś, co mógł nosić i co mogło przetrwać tak długo pod wodą?|Czego szukam? Czy Aki miał coś, co pomoże mi go rozpoznać? Coś, co mogło przetrwać tak długi czas pod wodą?| Co powinienem szukać? Czy Aki miał coś, co pomoże mi go rozpoznać? Czy był coś, co nosił, co mogłoby przetrwać tak długo pod wodą?|Co powinienem szukać? Czy Aki miał coś, co mogłoby mi pomóc go rozpoznać? Coś, co mógł nosić i co mogło przetrwać tak długo pod wodą?|Czego szukam? Czy Aki miał coś, co pomoże mi go rozpoznać? Coś, co mogło przetrwać tak długi czas pod wodą?| Co powinienem szukać? Czy Aki miał coś, co pomoże mi go rozpoznać? Czy był coś, co nosił, co mogłoby przetrwać tak długo pod wodą?|Co powinienem szukać? Czy Aki miał coś, co mogłoby mi pomóc go rozpoznać? Coś, co nosił i co mogło przetrwać tak długo pod wodą?|Czego szukam? Czy Aki miał coś, co pomoże mi go rozpoznać? Coś, co mogło przetrwać tak długi czas pod wodą?| Co powinienem szukać? Czy Aki miał coś, co pomoże mi go rozpoznać? Coś, co mógł nosić i co mogło przetrwać tak długo pod wodą?|Co powinienem szukać? Czy Aki miał coś, co mogłoby mi pomóc go rozpoznać? Coś, co nosił i co mogło przetrwać tak długo pod wodą?|Czego szukam? Czy Aki miał coś, co pomoże mi go rozpoznać? Coś, co mogło przetrwać tak długi czas pod wodą?| Co powinienem szukać? Czy Aki miał coś, co pomoże mi go rozpoznać? Czy coś, co nosił, mogło przetrwać tak długi czas pod wodą?|Co powinienem szukać? Czy Aki miał coś, co mogłoby mi pomóc go rozpoznać? Coś, co nosił i co mogło przetrwać ten czas pod wodą?|Czego szukam? Czy Aki miał coś, co pomoże mi go rozpoznać? Coś, co mogło przetrwać tak długo pod wodą?| Co powinienem szukać? Czy Aki miał coś, co pomoże mi go rozpoznać? Czy coś, co nosił i co mogło przetrwać tak długo pod wodą?|'Co mam szukać? Czy Aki miał coś, co pomoże mi go rozpoznać? Coś, czego używał, co mogło przetrwać cały ten czas pod wodą?'|Czego szukam? Czy Aki miał coś, co pomoże mi go rozpoznać? Coś, co miał na sobie i mogło przetrwać tak długo pod wodą?| Co powinienem szukać? Czy Aki miał coś, co pomoże mi go rozpoznać? Czy coś, co miał na sobie, mogłoby przetrwać tak długo pod wodą?|"""Czego szukać? Czy Aki miał coś, co pomoże mi go rozpoznać? Coś, co nosił i mogło przetrwać tak długo pod wodą?"""|Czego mam szukać? Czy Aki miał coś, co pomoże mi go rozpoznać? Coś, co mogło przetrwać tak długi czas pod wodą?| Co powinienem szukać? Czy Aki miał coś, co pomoże mi rozpoznać go? Czy było to coś, co nosił, co mogłoby przetrwać przez tyle czasu pod wodą?|Co mam szukać? Czy Aki miał coś, co pomoże mi go rozpoznać? Coś, czego mógł nosić, co mogło przetrwać tyle czasu pod wodą?|Czego szukam? Czy Aki miał coś, co pomoże mi go rozpoznać? Coś, co mogło przetrwać tak długi czas pod wodą?| Co powinienem szukać? Czy Aki miał coś, co pomoże mi go rozpoznać? Czy coś, co nosił i co mogło przetrwać tyle czasu pod wodą?|'Co powinienem szukać? Czy Aki miał coś, co mogłoby mi pomóc go rozpoznać? Coś, co mógł mieć na sobie, aby przetrwało cały ten czas pod wodą?'|Czego szukam? Czy Aki miał coś, co pomoże mi go rozpoznać? Coś, co miał na sobie i mogło przetrwać tak długi czas pod wodą?| Co powinienem szukać? Aki posiadał cokolwiek, co mogłoby mi pomóc w jego rozpoznaniu? Czy jest coś, co mógł nosić i co mogło przetrwać ten czas pod wodą?|Co powinienem szukać? Czy Aki miał coś, co mogło by mi pomóc go rozpoznać? Coś, czego używał i co mogło przetrwać cały ten czas pod wodą?|Na co powinienem zwrócić uwagę? Czy Aki miał cokolwiek, co pomoże mi go rozpoznać? Coś, co mogło przetrwać tak długi czas pod wodą?| Co powinienem szukać? Czy Aki miał coś, co pomoże mi rozpoznać go? Coś, co nosił i co mogło przetrwać ten czas pod wodą?|"""Czego powinienem szukać? Czy Aki miał coś, co mogło by mi pomóc go rozpoznać? Coś, co zakładał i co mogło przetrwać tak dłuższy czas pod wodą?"""
So you don't actually know if it works, how it works?|Czyli właściwie nie wiadomo, czy ona działa?|Więc tak naprawdę nie wiesz czy to działa, ani jak to działa?|Więc tak naprawdę nie wiesz, czy to działa, jak to działa?| Tak naprawdę nie wiesz, czy to działa, jak to działa?|Więc tak naprawdę nie wiesz czy działa i jak działa?|Więc tak naprawdę nie wiesz, czy to działa, jak to działa?| Tak naprawdę nie wiesz, czy to działa, jak to działa?|Więc tak naprawdę nie wiesz czy działa i jak działa?|Więc tak naprawdę nie wiesz, czy to działa, jak to działa?| Tak więc w rzeczywistości nie wiesz, czy to działa, jak to działa?|Więc tak naprawdę nie wiesz czy działa i jak działa?|Więc tak naprawdę nie wiesz, czy to działa, jak to działa?| Tak więc w rzeczywistości nie wiesz, czy to działa, jak to działa?|Czyli tak naprawdę nie wiesz czy działa i jak działa?|Więc tak naprawdę nie wiesz, czy to działa, jak to działa?| Tak naprawdę nie wiesz, czy to działa, jak to działa?|Czyli tak naprawdę nie wiesz czy działa i jak działa?|Więc tak naprawdę nie wiesz, czy to działa, jak to działa?| Tak więc nie wiesz naprawdę, czy to działa, jak to działa?|Czyli tak naprawdę nie wiesz czy to działa i jak to działa?|Więc tak naprawdę nie wiesz, czy to działa, jak to działa?| Tak naprawdę nie wiesz, czy to działa, jak to działa?|Czyli tak naprawdę nie wiesz czy to działa i jak to działa?|Więc tak naprawdę nie wiesz, czy to działa, jak to działa?| Tak naprawdę nie wiesz, czy to działa, jak to działa?|Więc tak naprawdę nie wiesz czy to działa, jak to działa?|Czyli tak naprawdę nie wiesz, czy to działa i jak działa?| Tak naprawdę nie wiesz czy działa, jak działa?|Czyli tak naprawdę nie wiesz czy działa i jak działa?|Więc tak naprawdę nie wiesz, czy to działa, jak to działa?| Tak naprawdę nie wiesz, czy to działa i jak to działa?|Więc tak naprawdę nie wiesz czy działa i jak działa?|Więc tak naprawdę nie wiesz, czy to działa, jak to działa?| Tak naprawdę nie wiesz, czy on działa, jak on działa?|Więc tak naprawdę nie wiesz czy działa i jak działa?
Leave that to me. Go, seek and find your Cirilla.|Ja z nim pogadam. A wy ruszajcie szukać Ciri.|Zostaw to mnie. Idź, poszukaj i znajdź swoją Cirillę.|Zostaw to mnie. Idź, szukaj i znajdź swoją Cirillę.| Zostaw to ze mną. Idź, szukaj i znajdź swoją Cirillę.|Zostaw to mnie. Idź, szukaj i znajdź swoją Ciri.|Zostaw to mnie. Idź, szukaj i znajdź swoją Cirillę.| Zostaw to ze mną. Idź, szukaj i znajdź swoją Cirillę.|Zostaw to mnie. Idź, szukaj i znajdź swoją Ciri.|Zostaw to mnie. Idź, szukaj i znajdź swoją Cirillę.|" ""Zostaw to ze mną. Idź, szukaj i znajdź swoją Ciri."""|Zostaw to mnie. Idź, szukaj i znajdź swoją Ciri.|Zostaw to mnie. Idź, szukaj i znajdź swoją Cirillę.| Zostaw to ze mną. Idź, szukaj i znajdź swoją Ciri.|Zostaw to mnie. Idź, szukaj i znajdź swoją Ciri.|Zostaw to mnie. Idź, szukaj i znajdź swoją Cirillę.| Zostaw to ze mną. Idź, szukaj i znajdź swoją Ciri.|Zostaw to mnie. Idź, szukaj i znajdź swoją Ciri.|Zostaw to mnie. Idź, szukaj i znajdź swoją Cirillę.| Zostaw to ze mną. Idź, szukaj i znajdź swoją Ciri.|Zostaw to mnie. Idź, szukaj i znajdź swoją Ciri.|Zostaw to mnie. Idź, szukaj i znajdź swoją Cirillę.| Zostaw to ze mną. Idź, szukaj i znajdź swoją Cirillę.|Zostaw to mnie. Idź, szukaj i znajdź swoją Ciri.|Zostaw to mnie. Idź, szukaj i znajdź swoją Cirillę.| Zostaw to ze mną. Idź, szukaj i znajdź swoją Ciri.|Zostaw to mnie. Idź, szukaj i znajdź swoją Ciri.|Zostaw to mnie. Idź, szukaj i znajdź swoją Cirillę.| Zostaw to ze mną. Idź, szukaj i znajdź swoją Ciri.|Pozostaw to mnie. Idź, szukaj i znajdź swoją Ciri.|Zostaw to mnie. Idź, szukaj i znajdź swoją Cirillę.| Zostaw to ze mną. Idź, szukaj i znajdź swoją Ciri.|Zostaw to mnie, idź, szukaj swą Ciri.|Zostaw to mnie. Idź, szukaj i znajdź swoją Cirillę.| Zostaw to dla mnie. Idź, szukaj i znajdź swoją Cirielle.|Zostaw to mnie, idź, szukaj i znajdź swoją Cirillę.
