en_text|pl_text|bielik_translation|mixtral-8x22B_translation|llama3.1_translation|google_translation
I shall come back with Avallac'h. Together--|Wrócę z Avallac'hem. Razem...|"""Wrócę z Avallac'hem. Razem--"""| Wracam z Awalchem. Razem--|Wrócę z powrotem z Avallachem. Razem–|Wrócę z Avallac&#39;hem. Razem--
Mff. Here. Mead spiked with some kind of mushroom… and… human blood?|Jest. Miód zaprawiony jakimiś grzybami... I czymś jeszcze... Ludzką krwią?|Tf. Tutaj. Mleczko z makiem nasączone jakimś rodzajem grzyba... i... ludzką krwią?| Mf. Oto. Miód podtopiony nieokreślonym gatunkiem grzybów... i... ludzką krwią?|Cholera... To mniejszy diabeł. Miód z domieszką grzybów… oraz… ludzkiej krwi?|Mff. Proszę. Miód pitny z dodatkiem jakiegoś grzyba... i... ludzkiej krwi?
Then I left myself behind, Drove you from my heart and mind.|Zostawiłem siebie, zostawiłem ciebie.|Wtedy zostawiłem siebie za sobą, Poprowadziłem Cię z mojego serca i umysłu.| 'Potem pozostawiłem/ce sam siebie, Wypędziłem ciebie z serca i umysłu.'|Wówczas zostawiłem siebie samego za sobą, Wygnałęm cię z mojego serca i umysłu.|Potem zostawiłam siebie, Wyrzuciłam cię z mojego serca i umysłu.
Shattered… Udalryk must've been scared of seeing the creature just behind him.|Stłuczone lustro... Pewnie Udalryk bał się zobaczyć Hima za plecami...|Zdruzgotany... Udalryk musiał być przerażony widząc stworzenie tuż za nim.| Rozbity w kawałki... Udalryk musiał być przerażony, widząc jak stwór stoi za jego plecami.|Zniszczony... Udalryk musiał się bać widząc stwora tuż za nim.|Zniszczony… Udalryk musiał się przestraszyć, widząc stworzenie tuż za sobą.
You ssssslew him. A ssssson who killed hissss father.|Zabiłeśśśśśś go. Ssssssyn zabił ojca.|Zabiłeś go. Taki syn, który zabił swojego ojca.| Zabiłeś go. Syn, który zabił swojego ojca.|Tyś go zabił. Syna, który zabił swojego ojca.|Zabiłeś go. Ssssson, który zabił swojego ojca.
Let 'im! I'd cut his belly open from the inside, like this! And then smack 'im in the head - like this!|Niech połknie! Ja go wtedy od środka rozetnę, o tak! I przez łeb go zdzielę – o tak!|Dawaj go! Rozprułbym mu brzuch od środka właśnie tak! A potem strzeliłbym go w głowę - tak!| Niech to robi! Rozciąłbym mu brzuch od wewnątrz, tak! I potem trzasnąłbym mu w głowę - tak!|Pozwól! Rozpruwę mu brzuch od środka, tak! A potem uderzę go po głowie - tak!|Puść go! Rozciąłbym mu brzuch od środka, tak! A potem walnął go w głowę - tak!
The fight for the throne's grown fierce.|Walka o koronę robi się coraz bardziej zacięta...|Walka o tron stała się zacięta.| Walka o tron staje się coraz bardziej zaciekła.|Walka o tron stale się zaostrza.|Walka o tron staje się zacięta.
Heard Cerys dropped in for a visit…|Słyszałam, że Cerys cię odwiedziła...|Słyszano, że Cerys wpadła z wizytą...| 'Słyszałem, że Cerys zagościła na wizycie…'|'Słyszałem że Cerys zrobiła wizytę...'|Słyszałem, że Cerys wpadła z wizytą…
Yippee! The witcher killed the monster!|Jupi! Wiedźmin zabił potwora!|Juhu! Wiedźmin zabił potwora!| Wspaniale! Wiedźmin zabił potwora!|Hurra! Wiedźmin zabił potwora!|Hurra! Wiedźmin zabił potwora!
What's wrong with voting for your king?|Co jest złego w wyborze króla?|Co jest złego w głosowaniu na swojego króla?| Co jest nie tak w głosowaniu na swojego króla?|Co jest złego w głosowaniu na swojego króla?|Co jest złego w głosowaniu na swojego króla?
When'd the gods speak to you? Right after I left?|Kiedy bogowie przemówili? Zaraz jak wypłynąłem?|Kiedy bogowie przemówili do ciebie? Zaraz po tym, jak odszedłem?| Kiedy bóstwa do ciebie przemówiły? Zaraz po tym, jak wyszedłem?|Kiedy do ciebie mówili bogowie? Zaraz po tym jak wyszedłem?|Kiedy bogowie do ciebie przemówili? Zaraz po moim odejściu?
Next raid I'm goin' with 'em!|Następnym razem płynę na rajd z nimi!|W następnym nalocie idę z nimi!| Następny najazd idę z nimi!|Już przy następnym rajdzie idź z nimi!|W następnym rajdzie jadę z nimi!
Wait.|Poczekaj.|Czekaj.| 'Czekaj.'|Zaczekaj.|Czekać.
So? Find out who's mates with the beast?|Wiesz już, kto trzyma z potworem?|Więc? Dowiedz się, kto trzyma z bestią?| No to! Dowiecie się, kto jest kumplem potwora?|No to? Dowiedź się kto kumple z bestią?|Więc? Dowiedz się, kto jest kumplem bestii?
Cerys? She staked a claim to the throne, then? And you'd 'ave rather gone with her?|Cerys... się zgłosiła? I co, pewnie wolałbyś płynąć z nią?!|Cerys? Więc wysunęła roszczenie do tronu, tak? I ty byś raczej poszedł/poszła z nią?| Cerys? Tak więc objęła ona tron, czyż nie? A ty raczej poprzeć byś ją chciał?|Cerys? Ona więc zgłosiła roszczenia do tronu, tak? I wolałbyś iść za nią?|Cerys? Ona rościła sobie prawo do tronu, tak? A ty wolałbyś pójść z nią?
Long live Hjalmar! Long live our new king!|Niech żyje Hjalmar! Niech żyje nowy król!|Niech żyje Hjalmar! Niech żyje nasz nowy król!| Niech żyje Hjalmar! Niech żyje nasz nowy król!|Niech żyje Hjalmar! Niech żyje nasz nowy król!|Niech żyje Hjalmar! Niech żyje nasz nowy król!
Hahaha! True, Arnvald, me and Cerys - we're near twins in that regard.|Ha, ha, ha! Racja, Arnvald, w tym akurat ja i Cerys jesteśmy podobni.|Ha!ha! Prawda, Arvaldzie, ja i Cerys - w tym sensie jesteśmy bliskimi bliźniętami.| Hahaha! Tak naprawdę, Arnvaldzie, Cerys i ja - w tym względzie jesteśmy skorem do bliźniąt.|Hahah! Prawda, Arnvaldzie ja i Cerys jesteśmy niemal bliźniakami w tym względzie.|Hahaha! Prawda, Arnvald, ja i Cerys - jesteśmy prawie bliźniakami pod tym względem.
Farewell.|Bywaj.|Pożegnanie.| Żegnaj.|Żegnaj.|Pożegnanie.
Definitely more to drink.|Na pewno jest więcej do picia.|Zdecydowanie więcej do picia.| Bez wątpienia więcej do wypicia.|Zdecydowanie więcej do picia.|Zdecydowanie więcej do picia.
You've Einar still to fight.|Możesz walczyć jeszcze z Einarem.|Masz jeszcze Einara do pokonania.| Nadal masz do walki z Einarem.|Masz jeszcze Einara do walki.|Musisz jeszcze walczyć z Einarem.
And what's this mixture for?|A ta mieszanka to na co?|A do czego to mieszanie?| A do czego służy ten mieszanek?|A do czego służy ten mikstura?|A do czego służy ta mieszanka?
Hmm… Trying the trick can't hurt.|Hmm... Spróbować nie zaszkodzi.|Hmm... Spróbowanie sztuczki nie zaszkodzi.| Hmm... Spróbujmy podstępu, nie przyniesie to szkody.|'Hmm... spróbowanie tej sztuczki nic nie kosztuje.'|Hmm... Wypróbowanie tej sztuczki nie zaszkodzi.
"As he died, Thormar cursed Ulle: ""May ye lose again and again, for centuries on end."" That's what he said. Ever since, Ulle's haunted the arena, lookin' for a fight, and gettin' a few."|Thormar, umierając, przeklął Ulle: „Obyś po wiek wieków przegrywał”, tak powiedział. No i od tamtej pory Ulle nawiedza arenę i ciągle przegrywa.|"Gdy umierał, Thormar przeklął Ullego: ""Masz przegrywać ciągle od nowa przez setki lat."" Tak powiedział. Od tamtej pory Ulle błąka się po arenie w poszukiwaniu walki, i kilka ich znajduje."|" Gdy umierał, Thormar przeklął Ulle: ""Niech stracisz i stracisz przez wieki"". Tak powiedział. Od tamtej pory Ulle prześladuje arenę, poszukując walki i znajdując trochę."|Gdy umierał, Thormar przeklął Ullego: „Niech stracicie ponownie i znowu, przez wieki.” Tak powiedział. Od tego czasu Ulle nawiedzał areny, szukając walki i dostając ich kilka.|Kiedy umierał, Thormar przeklął Ulle: „Obyś przegrywał raz po raz, przez całe wieki”. Tak powiedział. Od tamtej pory Ulle nawiedza arenę, szukając walki i zdobywając kilka.
I'm withdrawing.|Rezygnuję.|Wycofuję się.| Wycofuję się.|Wypisuję się.|Wycofuję się.
Folmer's right. Shouldn't eat nor drink too much 'fore a raid. After, though, revel till you drop!|Folmer dobrze mówi. Przed rajdem nie można ani za dużo wypić, ani zjeść. Za to potem hulaj dusza!|Prawo Folmera. Nie należy jeść ani pić zbyt dużo przed najazdem. Potem jednak hulaj dusza!| Folmer ma rację. Nie powinno się zarówno nadmiernie jeść, jak i pić przed napaścią. Po niej jednak świętuj, aż upadniesz!|'Ma rację Folmer. Nie powinniśmy jeść ani pić zbyt wiele przed rajdem. Ale potem możemy hucznie świętować, aż będziemy spadali.'|Folmer ma rację. Nie powinno się jeść ani pić za dużo przed rajdem. Później jednak baw się, aż padniesz!
I've never been here before. Guess you could say I've never been fond of Clan Tordarroch.|Nigdy wcześniej tu nie byłem. Powiedzmy, że nie przepadam za klanem Tordarroch.|Nigdy wcześniej tu nie byłem. Można powiedzieć, że nigdy nie przepadałem za Klanem Tordarroch.| Nigdy tu nie byłem. Możesz prawdopodobnie powiedzieć, że nigdy nie byłem zbytnio zafascynowany klanem Tordarroch.|Nigdy wcześniej tu nie byłem. Można powiedzieć, że nigdy mnie nie zainteresował Klan Tordarroch.|Nigdy tu nie byłem. Chyba można powiedzieć, że nigdy nie przepadałem za klanem Tordarroch.
But… but how? I was to lose till the end o' time…|Ale... Ale jak to? Przecież miałem tu przegrywać aż po kres czasów...|Ale... ale jak? Miałem przegrywać aż do końca czasu...| Ale… ale jak? Miałem przegrać aż do końca czasów…|'Ale... ale jak? Miałem przegrać do końca czasu...'|Ale… ale jak? Miałem przegrać aż do końca czasu…
Be glad to tell everyone about your victory.|Chętnie opowiem o twoim zwycięstwie.|Ciesz się, że możesz opowiedzieć wszystkim o swoim zwycięstwie.| 'Będzie mi przyjemność powiedzieć wszystkim o twoim zwycięstwie.'|Ciesz się możesz opowiedzieć każdemu o swoim zwycięstwie.|Z przyjemnością opowiesz wszystkim o swoim zwycięstwie.
Exquisite, the armor… Though the workmanship's unfamiliar. Can't even tell where it's from.|Piękny pancerz... Ale nie rozpoznaję rzemieślnika. Ba! Nie rozpoznaję nawet, skąd pochodzi.|Wykwintna, ta zbroja... Choć kunszt nieznany. Nie mogę nawet powiedzieć, skąd pochodzi.| Jest to wysublimowane opancerzenie... Chociaż rzemiosło jest nieznane. Nawet nie możemy stwierdzić, skąd pochodzi.|Doskonały… zbroja… Chociaż warsztat jest nieznany. Nie mogę się nawet domyślić skąd pochodzi.|Wykwintna, zbroja... Choć wykonanie jest nieznane. Nawet nie można powiedzieć, skąd jest.
Over there, on the ground. Hand's got bite marks on it…|Tam, na ziemi, leży ogryziona ręka...|Tam na ziemi. Na dłoni ma ślady ugryzień...| Właśnie tam, na ziemi. Ręka/dłoń ma ślady ukąszeń…|Tam jest, na ziemi. Ręka ma ślady ugryzień…|Tam, na ziemi. Na dłoniach ślady ugryzień…
Whadda you want, stranger?|Czego chcesz?|Czego chcesz, przybyszu?| Co takiego chcesz, obcy?|Co chcesz, obcy?|Czego chcesz, nieznajomy?
I'm not gonna drink. Why dull my senses when I'm in such pleasant company?|Nie będę pił. Wolę się cieszyć tobą na trzeźwo.|Nie będę pić. Po co przytępiać zmysły, skoro jestem w tak przyjemnym towarzystwie?| Nie będę pił. Dlaczego miałbym tłumić moje zmysły, jeśli jestem w tak przyjemnej towarzyskości?|Nie będę pić alkoholu. Dlaczego mam приглушати swoje zmysły, kiedy jestem w tak przyjemney towarzystwie?|Nie będę pić. Po co przytępiać zmysły, skoro jestem w tak przyjemnym towarzystwie?
Argh, fuck a king like that.|Eee, do dupy z takim królem.|Ach, jebać takiego króla.| 'Argh, niech zostanie przeklęty taki król.' [*uwaga: co do tego tłumaczenia może być odczytany różny sposób, ponieważ pierwotna wersja z angielskiego nie jest neutralna, a przekleństwo może brzmieć inaczej w polskim]|Ach, do diabła z takim królem.|Argh, pieprzyć takiego króla.
In the oven! Throw him in the oven!|Do pieca! Wrzuć je do pieca!|Do pieca! Wsadźcie go do pieca!| 'W piecu! Rzuć go do pieca!'|Wrzuć go do pieca! Do pieca go wrzuć! lub Wrzuć go do piekarnika! Do piekarnika z nim!|Do piekarnika! Wrzuć go do piekarnika!
You insult me once more, Uve Jabberjaw. The first time I left you to punish yourself and retain your honor. But now… now you will die like a thrall, and eels will eat your remains.|Ha! Znów mnie obraziłeś, Uwe Milczku. Za pierwszym razem pozwoliłem, byś sam się ukarał i zachował honor. Ale teraz... Teraz zginiesz jak thrall, a twoje szczątki skarmię węgorzom.|Znieważasz mnie po raz kolejny, Uve Jabberjaw. Po raz pierwszy zostawiłem cię, abyś ukarał siebie i zachował swój honor. Ale teraz... Teraz umrzesz jak niewolnik, a węże będą jeść twoje resztki.| Oto tłumaczenie: 'Jeszcze raz mnie obrażasz, Uve Jabberjaw. Pierwszy raz dałem ci szansę, by sam się ukarzał i zachował honor. Ale teraz… teraz zginiesz jak niewolnik, a węgorze pożrą twoje szczątki.'|'Wyśmiewasz mnie jeszcze raz, Uve Jabberjaw . Za pierwszym razem zostawiłem cię samemu sobie, abyś mógł ponieść karę i zachować honor. Ale teraz... teraz umrzesz jak niewolnik, a węgorze pożrą twoje szczątki.'|Znów mnie obrażasz, Uve Jabberjaw. Pierwszy raz zostawiłem cię, by ukarać samego siebie i zachować honor. Ale teraz… teraz umrzesz jak niewolnik, a węgorze zjedzą twoje szczątki.
Your crew - what happened to them?|Co się stało z twoją załogą?|Twoja załoga - co się z nimi stało?| Twoja załoga - co się z nimi stało?|' Twoza załoga – co się stało z nią? '|Co się stało z twoją załogą?
Pshaw.|Pfff.|"Pshaw. 

(To dźwiękonaśladowcze słowo używane do wyrażenia irytacji, lekceważenia lub zdziwienia.)"| Fe. (źródłowo: fraszka, ale jest to okrzyk zaskoczenia lub rozczarowania, używany także jako wyrażenie sceptycyzmu lub dezaprobaty)|'Fiu'.|Psiakrew.
Hjalmar's a fierce and able warrior, that's clear, but he'll never make a good king.|Hjalmar jest dobrym wojownikiem, ale nigdy nie będzie dobrym królem.|Hjalmar jest dzielnym i sprawnym wojownikiem, to oczywiste, ale nigdy nie będzie dobrym królem.| Hjalmar jest dzielnym i sprawnym wojownikiem, to jest jasne, ale nigdy nie będzie dobrym królem.|Hjalmar to dziki i zdolny wojownik, to oczywiste, ale nigdy nie będzie dobrym królem.|Hjalmar to groźny i utalentowany wojownik, to oczywiste, ale nigdy nie zostanie dobrym królem.
Human scalps… Unusual as decorations go.|Ludzkie skalpy... Nietypowa ozdoba.|Ludzkie skóry... Niezwykłe jako ozdoby.| Ludzkie skalpy... Niecodzienne jako dekoracje.|'Ludzkie skalpy... Niecodzienny rodzaj dekoracji.'.|Ludzkie skalpy… Niezwykłe ozdoby.
And a lone shoe. Unlike him - he paid attention to how he looked.|I but bez pary. To do niego niepodobne – zawsze dbał o strój.|I samotny but. W przeciwieństwie do niego - on zwracał uwagę na swój wygląd.| I pojedynczy but. W przeciwieństwie do niego - on dbał o swój wizerunek.|I buty jedną. W przeciwieństwie do niego - zwracał uwagę na to jak wygląda.|I samotny but. W przeciwieństwie do niego - zwracał uwagę na to, jak wygląda.
Tell me about Faroe.|Opowiedz mi o Faroe.|Powiedz mi o Wyspach Owczych.| Proszę rozpowiedzieć mi o Wyspach Owczych.|Opowiedz mi o Wyspach Owczych.|Opowiedz mi o Wyspach Owczych.
Heard of you. People! Look who's come to fight!|Słyszałem o tobie. Ludzie! Patrzcie, kto przyszedł walczyć!|Słyszeli o was. Ludzie! Spójrzcie kto przyszedł walczyć!| Słyszałem o tobie. Ludzie! Spójrzcie, kto przyszedł walczyć!|Słyszeliśmy o Tobie. Ludzie! Oto kto przyszedł walczyć!|Słyszałem o was. Ludzie! Zobaczcie, kto przyszedł walczyć!
Quick!|Szybko!|Szybko!| Szybko!|Natychmiast!|Szybki!
We're just in time.|Jesteśmy w samą porę.|Jesteśmy w samą porę.| 'Jesteśmy już w porę.'|Dorobiliśmy się Exactly.|Przybyliśmy w samą porę.
Argh, let's leave it be, leave it be.|Ech, po prostu nie wracajmy już do tego.|Ach, zostawmy to, zostawmy to.| Argh, niech to będzie, niech to będzie.|Och, róbmy tak jak mówię, zostawmy to.|Argh, zostawmy to, zostawmy to.
You'd sail with anyone who'd let you aboard - Crach's daughter included.|Ty to byś z każdym wypłynął, kto by cię do załogi wziął, nawet i z Crachową córką.|Popłynąłbyś z każdym, kto pozwoliłby ci wejść na pokład - włączając córkę Cracha.| Milczałbyś z kimkolwiek przez morze, kto pozwoliłby ci wspiąć się na pokład - włącznie z córką Cracha.|Żeglowałbyś z każdym, kto pozwolił ci wejść na pokład – włącznie z córką Cracha.|Płynąłbyś z każdym, kto pozwoliłby ci wejść na pokład – łącznie z córką Cracha.
Wait.|Zaczekaj.|Poczekaj.| Czekaj.|Zaczekaj.|Czekać.
If she'd succeeded, Svanrige would've been left the only claimant to Skellige's throne.|Gdyby jej się udało, Svanrige byłby jedynym kandydatem na władcę Skellige.|Gdyby jej się powiodło, Svanrige pozostałoby jedynym kandydatem do tronu Skelligów.| Jeśli była była się udała, Svanrige był by jedynym pretendentem do tronu Skellige.|"""Gdyby jej się udało, Svanrige zostałaby jedyną pretendentką do tronu Skellige""."|Gdyby jej się to udało, Svanrige zostałby jedynym pretendentem do tronu Skellige.
Dammit, Yen, I saw the foglets. I meant how'd they get here?|Yen, do cholery, przecież widziałem, że to mglaki. Wiesz, o co mi chodzi.|Przekleństwo, Yen, widziałem mgielce. Miałem na myśli, jak się tu dostały?| Cholera, Yennefer, zobaczyłem wiały. Miałem na myśli, jak to w ogóle się stało, że tu są?|Cholera, Yenie, widziałem ich. Pytałem jakim cudem tu wylądowali?|Cholera, Yen, widziałem te mgławice. Chodziło mi o to, jak się tu dostały?
Didn't see him in the garden… Doesn't bode well. Don't know if there's much point in going there.|Nie spotkałem go w ogrodzie... To dobrze nie wróży. Nie wiem, czy mamy tam w ogóle po co iść.|Nie widziałem go w ogrodzie... To nie wróży dobrze. Nie wiem, czy jest sens tam chodzić.| Nie widziałem go w ogrodzie... To nie zapowiada się dobrze. Nie wiem czy jest mocny powód, żeby tam iść.|Nie widziałem go w ogrodzie... Nic dobrego z tego nie wynika. Nie wiem, czy ma sens tam iść.|Nie widziałem go w ogrodzie… Nie wróży to dobrze. Nie wiem, czy jest sens tam iść.
Never jest about my da. Never!|Nigdy nie żartuj z mojego ojca. Nigdy.|"""Nigdy nie chodzi o mnie. Nigdy!"""| Nigdy nie śmiej się z mojego taty. Nigdy!|"""Nigdy nie jest o moim tacie, nigdy!"""|Nigdy nie żartuj o moim ojcu. Nigdy!
A shipwreck and a cavern. I'll look inside.|Szczątki statku i jakaś jaskinię. Sprawdzę ją.|Rozbitek okrętu i jaskinia. Zajrzę do środka.| Rozbite statki i jaskinia. Przejrzyjem wewnątrz.|Wrak statku i jaskinia. Wejdę do środka.'.|Wrak statku i jaskinia. Zajrzę do środka.
Then go to your gran and stop bothering me.|To idź do babki i nie zawracaj mi głowy.|Idź do swojej babci i przestań mnie zadręczać.| Potem idź do babci twojej i przestan mnie niepokoić.|Chodź do swojej babci i przestań mnie niepokoić.|To idź do babci i przestań mnie niepokoić.
Why do you want a djinn?|Po co ci dżinn?|Dlaczego chcesz dżina?| Dlaczego chcesz dżinna?|Dlaczego chcesz dżina?|Po co ci dżin?
Kaer Morhen's got a pretty rich library.|Kaer Morhen też ma całkiem zasobną bibliotekę.|Kaer Morhen ma dość bogatą bibliotekę.| Kajer Morhen posiada bardzo bogatą bibliotekę.|W Kaer Morhen znajduje się całkiem bogata biblioteka.|Kaer Morhen ma całkiem bogatą bibliotekę.
Ah, finally.|Wreszcie.|Ach, wreszcie.| Ah, nareszcie.|'No wreszcie.'|No, nareszcie.
Take care.|Bywaj.|Dbaj o siebie.|" Bądź staranny. (ale też: dbaj o siebie)

Jeśli jednak jako jednoznaczne tłumaczenie angielskiego zdania 'take care' podaję 'bądź staranny', w kontekście pożegnania się używa się częściej 'do zobaczenia', 'do widzenia', 'do jutra', 'do następnego razu' lub po prostu 'papa' lub 'cześć'.
Albowiem 'Take care.' może oznaczać także 'daj sobie radę', 'niewiele jednak ci dozwólę wolności'."|Bądź bardzo ostrożny.|Dbać o siebie.
They're as always - it's pissin' buckets and fuckin' freezin'.|Jak zawsze. Leje i piździ.|Są jak zawsze - leje się wiadrami i pizga lodem.| 'Jak zwykle, pada jak z kubełka, a zimno się na nic nie rzadzi.'|Są jak zawsze - lało gacie i pierdolisz, że mróz.|Jak zwykle - leje się strumieniami i jest cholernie zimno.
When the Sea learned of the Mask, it was quick to respond. It made known its threat that whosoever used the Mask would bring the Sea's wrath down on them. For in vengeance the Sea would rise and flood all the lands and drown the living.|Kiedy Morze dowiedziało się o Masce, zagroziło, że ktokolwiek jej użyje, ściągnie gniew Morza, które w zemście zaleje wszystkie lądy i potopi żyjących.|Gdy morze dowiedziało się o Masce, szybko zareagowało. Ujawniło swoje groźby, że ktokolwiek użyje Maska, sprowadzi na siebie gniew morza. W akcie zemsty morze wzbierze i zaleje wszystkie lądy oraz utopi żywe istoty.| Kiedy Morze dowiedziało się o Maskie, szybko zareagowało. Zadeklarowało swoją groźbę, że ktokolwiek użyje Maski, przywoła na siebie gniew Morza. W zemście Morze bowiem wzejdzie i zaleje wszystkie ziemie, utopiąc żywych.|Gdy Morze dowiedziało się o Masce, szybko zareagowało. Oznajmiło swoje zagrożenie, że każdy, kto używa maski, sprowadzi na siebie gniew morza. W zemście morze podniesie się i zatopi wszystkie lądy oraz utopi żyjących.|Gdy Morze dowiedziało się o Masce, szybko zareagowało. Dało znać o swojej groźbie, że ktokolwiek użyje Maski, sprowadzi na siebie gniew Morza. Bo w zemście Morze podniesie się i zaleje wszystkie ziemie i zatopi żyjących.
A Nithing. A powerful curse. Name carved on the shaft… Tjalve, son of Lothar.|Nithing. Potężna klątwa. Na drzewcu wyryte jest imię... Tjalve, syn Lotara.|Nić uroku. Potężna klątwa. Imię wyryte na drzewcu... Tjalve, syn Lothara.| Niepoważny. Potężna klątwa. Imię wyryte na osi... Tjalve, syn Lothara.|Niting. Potężna klątwa. Imię wyrzeźbione na drzewcu… Tjalve, syn Lothara.|Nithing. Potężna klątwa. Imię wyryte na trzonku… Tjalve, syn Lothara.
I'm off.|Jadę.|Odchodzę.| *Jestem nieobecny*.|Znikam.|Wychodzę.
Aye… But only in the tales told to children as they're put to sleep on cold winter nights.|Tak... Ale tylko w opowieściach, którymi usypia się dzieci w zimowe noce.|Tak... Ale tylko w opowieściach dla dzieci opowiadanych, gdy kładą się spać w zimowe noce.| 'Owszem… Ale tylko w opowieściach opowiadanych dzieciom, gdy położymy je spać w zimne, zimowe noce.'|Och... Ale tylko w opowieściach dla dzieci, które są im czytane tuż przed pójściem spać, zimną nocą.|Tak… Ale tylko w opowieściach opowiadanych dzieciom, gdy kładą je spać w zimne, zimowe noce.
I've asked Freya, begged Hemdall - and nothin'. Maybe Uroboros'll listen.|Prosiłem już Freyję, błagałem Hemdalla i nic. Może Uroboros mnie wysłucha.|Poprosiłem Freję, błagałem Hemdalla - bez skutku. Może Uroboros mnie wysłucha.| Poprosiłem Freję, błagał Hajmdala - i nic. Może Uroboros posłucha.|Poprosiłem Freyę, błagałem Hemdalla – i nic. Może Uroboros mnie wysłucha.|Prosiłem Freyę, błagałem Hemdalla - i nic. Może Uroboros posłucha.
Let's get back to the wake.|W takim razie wracajmy na ucztę.|Wracajmy do tematu.| Wróćmy do czuwania.|Wróćmy do czuwania.|Wróćmy do stypy.
The explosion must have disrupted his teleportation…|Eksplozaja musiała zakłócić teleportację...|Wybuch musiał przerwać jego teleportację...| Eksplozja musiała zakłócić jego teleportację...|Wybuch musiał przerwać jego teleportację.|Eksplozja musiała zakłócić jego teleportację…
But I only wish to pray, pay homage to the gods.|Kiedy ja tylko się chcę pomodlić, oddać cześć bogom.|Ale chcę tylko się modlić i oddawać cześć bogom.| Ale chcę tylko modlić się, oddać hołd bogom.|Ale pragnę jedynie móc modlić się, oddać cześć bogom.|Ale ja chcę się tylko modlić i składać hołd bogom.
Yeah, but… what about the other wolves?|Tak... Ale te wszystkie inne wilki?|Tak, ale... co z pozostałymi wilkami?| Tak, ale... co z tymi innymi wilkami?|Tak, ale co z innymi wilkami?|No tak, ale co z innymi wilkami?
Your friend needs help.|Trzeba się zająć twoim przyjacielem.|Twoj przyjaciel potrzebuje pomocy.| Twoja przyjaciółka potrzebuje pomocy.|Twój przyjaciel potrzebuje pomocy.|Twój przyjaciel potrzebuje pomocy.
The witcher first! Get him!|Najpierw wiedźmin! Na niego!|Wiedźmin pierwszy! Bierz go!| 'Czarodziej najpierw! Dostań go!'|Wiedźmin pierwszy! Zabierz go!|Wiedźmin pierwszy! Łap go!
Jarl, our guests, remember?|Jarlu, to nasi goście, pamiętasz?|Jarl, nasi goście, pamiętasz?| 'Jarl, nasze goście, przypomnij sobie?'|Jarlu, goście nas.|Jarl, nasi goście, pamiętacie?
I've no notion where the others are. Those that survived, that is…|Nie mam pojęcia, gdzie jest reszta. To znaczy ci, którzy przeżyli...|Nie mam pojęcia, gdzie są pozostali. Ci, którzy przeżyli...| Nie mam pojęcia gdzie są pozostali. Ci co przeżyli, o których mówię…|Nie mam pojęcia gdzie są inni. Ci co przeżyli…|Nie mam pojęcia, gdzie są inni. Ci, którzy przeżyli, to znaczy…
Thanks… So long.|Dzięki... Bywaj.|Dziękuję... Tak długo.| Dzięki… Tak więc, na razie.|Dziękuję… Żegnaj.|Dziękuję… Pozdrawiam.
Good. Talkin' tires me.|Dobrze. Gadanie mnie męczy.|Dobrze. Gadanie mnie męczy.| Dobre. Mówienie mnie męczy.|Dobrze, rozmowa mnie męczy.|Dobrze. Gadanie mnie męczy.
