en_text|pl_text|bielik_translation|mixtral-8x22B_translation|llama3.1_translation|google_translation
Hah! Heard him screaming clear over here! Grand work, witcher! Your reward, as promised.|Ha! Tu słyszałem, jak wrzeszczał! Świetna robota, wiedźminie! Oto nagroda – jak obiecałem.|Haha! Słyszałem, jak wrzeszczy z daleka! Dzięki za świetną robotę, wiedźminie! Twoja nagroda, tak jak obiecałem.| Haha! Słyszałeś jego krzyk tutaj łoskotem! Świetna robota, człowieku wiedźminie! Twoja nagroda, jak przyrzekłem.|'Hah! Słyszałem jak wrzeszczy aż tu. Świetna robota, wiedźminie. Twoja nagroda, tak jak obiecałem.'|Ha! Słyszałem, jak krzyczy wyraźnie tutaj! Świetna robota, wiedźminie! Twoja nagroda, jak obiecałeś.
Not the right ship. Come back up.|To nie ten okręt. Wracaj na górę.|Nie ten statek. Wróć na górę.| Nie ten właściwy statek. Wróć na górę.|To nie jest odpowiedni statek. Wróć na górę.|Nie ten statek. Wróć na górę.
Hurraaaaarrgh!|Hurraaa!|Juhuuu-uuuaaa!|" Hej, nie mogę dokładnie przetłumaczyć tego okrzyku emocji, ale prawdopodobnie będzie to najbliższe: ""Hurraaaaaaaargh!"""|Hurraaaaarrgh!|Hurraaaaarrgh!
No way.|Nie ma mowy.|Żaden sposób.| Brak możliwości.|Nie ma szans.|Nie ma mowy.
Played one of your brethren a time ago - Lambert. Sailed here to kill a slyzard. And there's some baron lives in Velen. They say he's got the John Natalis card.|Kiedyś ograłem twojego konfratra Lamberta. Przypłynął tu zabić oszluzga. A w Velen mieszka niejaki Baron, który ponoć ma kartę z Janem Natalisem.|"Oto przetłumaczony ciąg znaków bez dodatkowych wyjaśnień:

""Przełożono jednego z twoich braci przed wiekiem - Lambert. Przypłynąłem tu, aby zabić szylkretowca. I jest jakiś baron, który żyje w Velenu. Mówią, że ma kartę Johna Natalisa."""| 'Zagrałem niegdyś z jednym z Waszych takich jak Ty - Lambertem. Popłynąłem tu, by zabić slyzarda. A jest jakiś baron w Velen. Mówią, że ma kartę Johna Natalisa.'|Zagrałem z jednym z twoich braci trochę czasu temu – Lamberta. Przypłynąłem tu, aby zabić slimyda. I jest jeden baron, który mieszka w Velen. Mówią, że posiada kartę Jana Natalisa.|Grałem kiedyś jednym z twoich braci - Lambert. Przypłynąłem tu, żeby zabić slyzard. A w Velen mieszka jakiś baron. Mówią, że ma kartę Johna Natalisa.
Listen, how about I give you the equivalent in coin instead of my sword? After all, can't really earn a living without it.|Może zamiast dawać ci miecz, zapłacę jego równowartość? Wiesz, to jednak moje narzędzie pracy...|Posłuchaj, może dam ci równowartość w monetach zamiast mojego miecza? Przecież bez niego nie zarobię nawet grosza.| Słuchaj, co byś o tym, że dam ci równowartość w monetach zamiast mojego miecza? W końcu, nie będę mógł utrzymać się bez niego.|Słuchaj, cóż zamiast mojego miecza daję ci równowartość w kruszcu? Przecież rzeczywiście nie można zarabiać bez tego.|Słuchaj, co powiesz na to, żebym dał ci równowartość w monecie zamiast mojego miecza? Przecież bez tego nie da się zarobić na życie.
People change. Men go bald… or grow beards…|Ludzie się zmieniają. Mężczyźni łysieją... Albo zapuszczają brody...|Ludzie się zmieniają. Mężczyźni łysieją... lub zapuszczają brody...| Ludzie zmieniają się. Mężczyźni łysieją… albo wyrastają brody…|Ludzie się zmieniają. Mężczyźni łysieją... albo hodują brody...|Ludzie się zmieniają. Mężczyźni łysieją… albo zapuszczają brody…
You're alive?! And in one piece?!|Żyjesz?! Cały jesteś?!|Żyjesz?! I w jednym kawałku?!| Żyjesz?! I cała?!|Jesteś przy życiu?! I Caldym człowieku?!|Żyjesz?! I w jednym kawałku?!
Hahahahaha!|Hahahaha!|Hahahahaha!|" Hahahahaha!

 Tłumaczenie na polski: Hahahahaha!

Wyjaśnienie: Tłumaczenie wyrazu ""Hahahahaha!"" nie wymaga żadnych zmian, bo jest to śmiech (lub jego obraz), a tak samo brzmi również w języku polskim."|Chachachacha!|Hahahahaha!
Putrefaction's set in… but the vocal cords are intact. We might still get something out of him…|Proces gnilny zaszedł już daleko... Ale struny głosowe są jeszcze całe. Może coś z niego wyciągniemy.|"""Rozkład zaczął się... ale struny głosowe są nienaruszone. Może wciąż uda nam się coś z niego wydobyć..."""| Zapoczątkował się proces rozkładu... ale struny głosowe nie ucierpiały. Możemy wciąż od niego coś uzyskać…|Rozkład zaczyna występować... ale struny głosowe są nienaruszone. Może dalej coś z niego dostaniemy, żeby było ciekawiej...|Gnicie się zaczęło… ale struny głosowe są nienaruszone. Nadal możemy z niego coś wyciągnąć…
Manfred Grossbart|Manfred Grossbart|Manfred Grossbart| Manfred Grossbart (przetłumaczono dosłownie)|'Manfred Groszbart'|Manfred Grossbart
A warrior with two blades? One's more'n enough for any who knows how to fight.|Wojownik z dwoma mieczami...? Jak kto potrafi walczyć, to jeden mu całkiem wystarczy.|Wojownik z dwoma ostrzami? Jedno wystarczy każdemu, kto wie, jak walczyć.| Wojownik z dwoma ostrzami? Jedno jest więcej niż wystarczające dla każdego, kto potrafi walczyć.|"""Wojownik z dwoma ostrzami? Jedna wystarcza każdemu, kto potrafi walczyć."""|Wojownik z dwoma ostrzami? Jedno to więcej niż wystarczająco dla każdego, kto umie walczyć.
Cause you're fat! Hahaaha!|Bo jesteś gruba! He, he!|Dlatego, że jesteś gruby! Ha, ha, ha!| Bo jesteś gruba! Hahaha!|Bo jesteś gruby! Hahaha!|Bo jesteś gruby! Hahaaha!
Bah! Them's bollocks you're talkin', Edvin.|A tam! Głupoty opowiadasz, Edvin.|Ech! To są bzdury, o których mówisz, Edwinie.| Ach, ty mówisz głupstwa, Edvine.|Bez sensu! Gadasz brednie, Edwin.|Bah! Co ty bredzisz, Edvin.
Wham! Bam! Then a wave rolled in so mighty…|Huknęło! Łupnęło! A potem taka fala wezbrała...|Bum! Trzask! A potem wtoczyła się taka fala...| 'Uderzenie! Krzyk! A potem fala rzuciła się tak potężnie…'|Łom, bom... potem fala uderzyła z taką siłą…|Wham! Bam! A potem nadeszła fala tak potężna…
Finally! I was so worried she'd--|Jesteście! A już się martwiłam, że ona...|Wreszcie! Tak się martwiłem, że mogłaby--| 'Nareszcie! Byłem tak zaniepokojony, że ona--'|Wreszcie! Byłem tak zaniepokojony, że ona...|Nareszcie! Tak się martwiłem, że ona...
Yes. I'll cast a spell that will let me see through your eyes.|Tak. A ja rzucę zaklęcie, które pozwoli mi widzieć twoimi oczami.|Tak. Rzucę czar, który pozwoli mi patrzeć twoimi oczami.| Tak. Rzucię zaklęcie, które pozwoli mi widzieć przez twoje oczy.|Tak. Wrzucę czar, który pozwoli mi zobaczyć to, co widzisz twoimi oczami.|Tak. Rzucę czar, który pozwoli mi zobaczyć twoimi oczami.
Let me see what you have.|Pokaż mi swoje towary.|Pokaż mi co masz.| Pozwól mi zobaczyć co masz.|Pokaż mi co masz.|Pokaż co masz.
Young an Craite on the throne - it's like the helm's been handed to a dockside vagrant. This is bad.|Wpuścić młodego an Craite na tron to tak, jakby oddać ster portowemu przybłędzie. Źle się stało.|Młody an Craite na tronie - to jakby ster został oddany w ręce ulicznika przy nabrzeżu. To źle.| Młody Craite na tronie - to jakby dano ster pewnemu włóczędze z nabrzeża. To naprawdę źle.|Młody Criate na tronie to tak jakby oddało się ster w ręce morskiego złoczyńcy z doków. To nie jest dobre.|Young an Craite na tronie - to tak, jakby ster został przekazany włóczędze z doku. To jest złe.
Gotcha. What's his name?|Jasne. Co to za jeden?|Mam cię. Jak on się nazywa?| Rozumiem. Jak on się nazywa?|Rozumiem. Jak on się nazywa?|Złapałem. Jak on się nazywa?
Yennefer… Enough.|Yennefer... Przestań.|Yennefer... Dość.| 'Yennefer... Wystarczy.'|'Yennefer… To wystarczy.'|Yennefer… Dość.
Me clinging to the remains of a bridge for dear life, you gripping my waist, admiring the view. Remember?|Trzymałem się zerwanego mostu, a ty uwiesiłaś mi się na pasie i podziwiałaś widoki, pamiętasz?|Ja przylepiona do resztek mostu za życie, ty chwytający mój pas, podziwiający widok. Pamiętasz?| Ściśle trzymając się resztek mostu dla życia, Ty obejmując moje biodra, podziwiając widok. Pamiętasz?|Ja przytrzymujący się resztek mostu za życie, ty trzymając mnie za biodra, admirując widok. Pamiętasz?|Ja kurczowo trzymam się resztek mostu, ty trzymasz mnie za talię, podziwiając widok. Pamiętasz?
And a witcher. He knows beasts, including those that take on human form.|I wiedźminem. Więc zna się na potworach. Także tych, co potrafią przybrać ludzki kształt.|I czarodziejka. Zna stwory, w tym te przybierające ludzką postać.| I czarownik. Zna potwory, włączając w to te, które przybierają ludzką postać.|I wiedźmin, zna potwory, także te które przyjmują postać ludzką.|I wiedźmin. Zna bestie, także te, które przybierają ludzką postać.
Heheh, not so tough without your blade. Which is too bad, 'cause you just lost it!|No, bez miecza taki twardy nie jesteś. Tym bardziej szkoda, żeś go właśnie przegrał!|Haha, nie takie trudne bez twojego ostrza. Co jest złe, bo właśnie je straciłeś!| Hehe, nie tak trudno bez twojego miecza. Co jest szkoda, bo właśnie go straciłeś!|Heheh, nie jesteś już tak twardy bez swojego ostrza. Co niefortunne, bo właśnie je  straciłeś!|Heheh, nie jest tak trudno bez twojego ostrza. Co jest złe, bo właśnie je zgubiłeś!
What?! Arnvald?!|Co?! Arnvald?!|Co? Arnvald?!| Co?! Arnvald?!|Co?! Arnvald?!|Co?! Arnvald?!
Udalryk…|Udalryku...|Udalryk...|" ""Udalryk...""

Prawdopodobnie to imię, więc nie jest to pełne zdanie do przełożenia. W polskim brzmi jako ""Ulryk"". Jeśli ma być pełniejsze zdanie lub jeśli to część zdania to muszę mieć pełne zdanie do przełożenia."|/Uldarico/|Wyczerpany…
Leif, son of Erik…|Leif, syn Eryka...|Leif, syn Eryka...| „Leif, syn Eryka…”|.. . Leif, syn Erika...|Leif, syn Erika…
Anything new in Fyresdal?|Co nowego w Fyresdal?|"""Czy jest coś nowego w Fyresdal?"""| Czy coś nowego w Fyresdal?|Cokolwiek nowego w Fyresdal?|Coś nowego w Fyresdal?
The tower will surely do everything in its power to stop us.|Wieża na pewno zrobi wszystko, żeby nas powstrzymać.|Wieża z pewnością użyje wszelkich swoich możliwości, aby nas powstrzymać.| Wieża na pewno uczyni wszystko w swojej mocy, aby nas zatrzymać.|Wieża uczyni zapewne wszystko co w jej mocy aby nas powstrzymać.|Wieża na pewno zrobi wszystko, co w jej mocy, żeby nas powstrzymać.
Might not be as simple as it seems. Besides, neither method's perfect.|To może nie być takie proste... Zresztą, żadna z metod nie jest doskonała.|Może nie jest tak proste, jak się wydaje. Poza tym, żadna z metod nie jest idealna.| Może nie jest takie proste jak się wydaje. Ponadto żadna z metod nie jest doskonała.|Może nie jest tak proste jak się wydaje. Poza tym, żaden z tych metod doskonały nie jest.|Może nie jest to takie proste, jak się wydaje. Poza tym żadna z metod nie jest idealna.
Watch it!|Gdzie się pchasz!|Patrz na to!| 'Bądź ostrożny!'|Uważaj!|Uważaj!
Found your dragon's nest. But I'll need bait to kill it. A sheep, for instance.|Znalazłem gniazdo waszego smoka. Ale żeby go ubić, potrzebuję przynęty. Owcy na przykład.|Znalazłem gniazdo twojego smoka. Ale będę potrzebował przynęty, żeby go zabić. Na przykład owca będzie w porządku.| Znalazłem twoje smocze gniazdo. Ale będę potrzebował przynęty, żeby go zabić. Na przykład owcę.|'Znalazłem gniazdo Twojego smoka, lecz potrzebuję przynęty, by go zabić. Jak np. owcy.'|Znalazłem twoje smocze gniazdo. Ale będę potrzebował przynęty, żeby je zabić. Na przykład owcę.
Lemme pay in installments.|Rozłóż płatność na raty.|Pozwól mi płacić w ratach.| Po prostu płacę w ratach.|Pozwól mi zapłacić w ratach.|Pozwól mi zapłacić w ratach.
Hilma? The Ginger Hilma? Olgar, you swine, you clever, clever swine! Give us a hug!|Hilma? Ruda Hilma? Olgar, ty świnio, ty cwana świnio! Niechże cię uściskam!|"""Hilma? Hilma z imbirem? Olgarze, ty świnko, ty sprytna, sprytna świnko! Przytul nas!"""| O Hilma? Czerwona kobyła Hilma? Olgarze, świnio, ty bystry, świne świne! Połóżmy się objęty!|"""Hilma? Ruda Hilma? Olgarze, świnio, ty chytry, chytry świnio. Daj nam przytulić!"""|Hilma? Ginger Hilma? Olgar, ty świnio, ty sprytna, sprytna świnio! Przytul nas!
Why's that?|Dlaczego?|Dlaczego tak jest?| Dlaczego tak?|'Dlaczego?'|Dlaczego?
Heard you're taking on challengers in fistfights.|Podobno chcecie się mierzyć na pięści...|Słyszałem, że podejmujesz się walk z przeciwnikami w boksie na pięści.| Słyszę, że akceptujesz wyzwania w walkach na pięści.|Słyszałem, że przyjmujesz wyzwania w bójce na pięści.|Słyszałem, że będziesz walczyć z przeciwnikami na pięści.
Like to look at your goods.|Pokaż mi swoje towary.|Lubię patrzeć na wasz towar.| Lubię oglądać Twoje produkty.|Lubię oglądać Twoje towary.|Chciałbym obejrzeć Państwa towary.
Ssss-aawwwww hhhh-iii-mmm… aaaa-tt…. Dddd-ooo-nn-aarrrr-sss… Bbb-uttt… hhh-eee… sss-ooo-lllddd… hhh-iii-mmm…|Wwww... Widzi-aaa-łem... Ggg-ggo... Uu.. Ddd... Dddooonara... Alle... Onnn... Sp... Sprzedaaaał gggo...|Syknięcie - Uuu... H-imi... Aaa... Tykanie zegara - Brr... Hej! Sółd... Hi-mi... Ss-u-l... Hii...| To brzmi jak próba powiedzenia: „sałatka z dzika, ale ona sprzedała go, hmm”.|'Czzzzzzz... ach, co za przykrość... Dooooo-noo-naaaaa-rus. Ale on... on jest stary... .'|Ssss-aawwwww hhhh-iii-mmm… aaaa-tt…. Dddd-ooo-nn-aarrrr-sss… Kbb-uttt… hhh-eee… sss-ooo-lllddd… hhh-iii-mmm…
Getting colder… Gotta be close…|Coraz zimniej... Już blisko...|Robię się coraz zimniej... Muszę być blisko...| 'Staje się coraz chłodniej… Muszę być blisko…'|"""Zimniej... Muszę być blisko..."""|Robi się coraz zimniej… Muszę być blisko…
Ye heard? Lonelyboy Svan's won another race! Even though his horse threw a shoe half way in!|Słyszałeś, że Svan Samotnik znowu wygrał wyścig? Mimo że w trakcie gonitwy koń mu okulał!|Słyszałeś? Lonelyboy Svan znów wygrał wyścig! Choć jego koń zgubił podkowę w połowie drogi!| 'Słyszałeś? Samotny chłopak Svan wygrał jeszcze jedne zawody! Mimo że jego koń stracił podkowę po drodze!'|Słyszeliście? Lonelyboy Svan zdobył zwycięstwo w kolejnym wyścigu pomimo, że jego koń stracił podkowę w połowie trasy!|Słyszeliście? Lonelyboy Svan wygrał kolejny wyścig! Mimo że jego koń wyrzucił podkowę w połowie drogi!
Eh?|No?|Eh?| 'He?'|Czy? Aha? O co chodzi?|Co?
Something tells me there's a purpose to your hospitality.|Coś mi mówi, że ta twoja gościnność nie jest zupełnie bezinteresowna.|"""Coś podpowiada mi, że jest w tym cel."""| Coś mi mówi, że jest jakieś przeznaczenie w Twojej gościnności.|Coś mi mówi, że jest powód twojego hojności.|Coś mi mówi, że Twoja gościnność ma jakiś cel.
Freya sees no insiders, no outsiders. Any man can pay her tribute by risking his life in the Pursuits.|Freyja nie dzieli ludzi na swoich i cudzych. Każdy, jeśli zechce, może oddać jej hołd, ryzykując życie w gonitwie.|Freya nie widzi żadnych insiderów ani outsiderów. Każdy mężczyzna może jej oddać hołd, ryzykując swoje życie w Pościgach.| 'Freya nie widzi ani insiderów, ani outsiderów. Każdy mężczyzna może jej oddać hołd ryzykując swoje życie w Pościgu.'|Freja nie widzi wśród nich osób z bliska ani z daleka. Każdy mężczyzna może spełnić jej trybut ryzykując swoje życie w Pościgach.|Freya nie widzi żadnych insiderów, żadnych outsiderów. Każdy mężczyzna może oddać jej hołd, ryzykując życie w Pursuits.
Ye hunted this Brambling a long time, Volund… But come the end, the Brambling bagged you.|Długo polowałeś na Simuna Ziębę, Volund... Ale w końcu to Simun Zięba upolował ciebie.|"""Długo polowaliście na tego Zimorodka, Wolmundzie... Ale ostatecznie to Zimorodek was schwytał."""| Długo ścigałeś to drozdońce Volund… ale w końcu drozdońce uwięził cię.|"""Polowaliście na tego Świergotka przez bardzo długi czas, Volund... Ale gdy już był koniec, to ostatecznie to Świergtek złapał was."""|Długo polowałeś na tego Bramblinga, Volundzie... Ale gdy nadszedł koniec, Brambling cię upolował.
Don't you dare disembark before disposing of every last siren.|Tylko nie waż się wysiadać, póki nie powystrzelasz syren.|Nie ośmielaj się opuszczać statku, dopóki nie pozbędziesz się każdej syreny.| Nie śmiej spuszczać się na ląd, zanim nie rozprawisz się z każdą ostatnią syreną.|Nie śmiejesz się wysiąść zanim rozprawiłeś się z każdym ostatnim sireną.|Nie waż się wysiąść, dopóki nie pozbędziesz się wszystkich syren.
Not interested.|Nie jestem zainteresowany.|Niezainteresowany.| Nie zainteresowany.|Nie interesuje mnie to.|Nie jestem zainteresowany.
Is there another way?|Jest jakiś inny sposób?|Czy jest inny sposób?| Czy jest inny sposób?|Czy jest inny sposób?|Czy jest inny sposób?
Cow's blood… Might lead me to the lair.|Ślady krowiej krwi... Może poprowadzą mnie do leża.|Krowia krew… Może mnie doprowadzić do legowiska.| Krew krów… Może doprowadzi mnie do legowiska.|Krowia krew... To może mnie doprowadzić do kryjówki.|Krew krowy... Może zaprowadzić mnie do kryjówki.
Enough of the natterin'. Let's drink!|Dosyć tego gadania. Napijmy się!|Starczy gadania. Wypijmy!| 'Dosyć paplaniny. Napijmy się!' (dosłownie: Dosyć tchórzyć. Napijmy się!)|Dość gadania. Pijmy!|Dość gadania. Napijmy się!
She's always liked competin' with me.|Zawsze lubiła się ze mną ścigać.|Ona zawsze lubiła ze mną konkurować.||Zawsze ją pchało do rywalizacji ze mną.|Ona zawsze lubiła ze mną rywalizować.
A foreigner, too… I won't let this pass.|Żeby obcy mnie... Tej zniewagi nie odpuszczę.|Cudzoziemiec też... Nie przepuszczę tego.| Obcokrajowiec również... Nie pozwolę, aby to przeszło bez echa.|Obcy również... Nie pozwolę na to.|Również cudzoziemiec... Nie pozwolę temu przejść obojętnie.
Shall we start?|Zaczynamy?|Czy możemy zacząć?| Czy powinniśmy zacząć?|Czy zacząć?|Czy możemy zacząć?
Don't ye go talkin' 'bout the konung's widow like that!|Ty na wdowę po królu nic nie mów!|"""Nie mów tak o królowej wdowie!"""| Nie mów tak o wdowie po królu!|Nie będziecie mówić o wdowie po królu w ten sposób!|Nie gadaj w ten sposób o wdowie po królu!
Nilfgaardbarne. Children of Nilfgaard. 'Cause they're black, cowardly and bloodthirsty.|Nilfgaardbarne. Dzieci Nilfgaardu. Bo czarne, tchórzliwe i żądne krwi.|"""Nilfgaardbarne. Dzieci Nilfgaardu. Bo są czarne, tchórzliwe i krwiożercze."""|" ""Dzieci Nilfgaardu. Ponieważ są czarne, tchórzliwe i krwiożercze."""|'Dzieci Niemniarumu bo są czarne, tchórzliwe i krwiożercze'.|Nilfgaardbarne. Dzieci Nilfgaardu. Ponieważ są czarni, tchórzliwi i krwiożerczy.
I was three years old. I've shown a hundred times since then that I--|Miałem trzy lata. Pokazałem już sto razy, że...|Miałem trzy lata. Od tego czasu stokrotnie pokazałem, że ja--| Miałem trzy lata. Pokazywałem to setki razy od tej pory, że ja--|Miałem trzy lata. Od tego czasu udowodniłem setki razy, że ja –|Miałem trzy lata. Od tego czasu pokazałem setki razy, że ja...
So that's how long a man's gotta wait till someone shows up. C'mon, lads, get to work! Grab 'im!|Tyle to się człowiek musi naczekać, aż wreszcie ktoś się pojawi. No, chłopcy, do roboty! Brać go!|Więc tak długo musi czekać facet, zanim ktoś się pojawi. No dalej, chłopaki, do roboty! Zabierzcie go!| 'Tak długo musi człowiek czekać, aż ktoś pojawi się. Dobrze, chłopaki, zacznijcie pracować! Chwyćcie go!'|Tyle trzeba czekać, aż ktoś się zjawia. No dalej, chłopcy, do roboty! Chwyćcie go!.|Tak więc tyle czasu musi czekać facet, aż ktoś się pojawi. No, chłopaki, do roboty! Złapcie go!
Farewell.|Bywaj.|Dobranoc.| Żegnaj.|Żegnaj.|Pożegnanie.
Been to the ruins. Your son's band - a fiend attacked them. They're all dead. Sorry.|Byłem już tam. Na kompanię twojego syna napadł bies... Z tego, co widziałem, nikt nie przeżył. Przykro mi.|Byłem w ruinach. Twoja synowa - czarny pies zaatakował ich. Wszyscy są martwi. Przepraszam.| Byłem w ruinach. Zespół twego syna - zostali zaatakowani przez demona. Wszyscy nie żyją. Przepraszam.|Byłem w ruinach. Zespół Twojego syna został zaatakowany przez potwora. Wszyscy nie żyją. Przepraszam.|Byłem w ruinach. Banda twojego syna - zaatakował ich jakiś diabeł. Wszyscy nie żyją. Przepraszam.
Every lass would want a man like Udalryk… Devoted to the gods, brave…|Każda by chciała takiego męża jak Udalryk... Oddany bogom, odważny...|Każda dziewczyna chciałaby mieć mężczyznę takiego jak Udalryk... Oddanego bogom, odważnego...| Każda kobieta chciałaby mieć mężczyznę jak Udalryk... Oddany bogom, odważny...|Każda dziewczyna życzyłaby sobie mężczyznę jak Udalryka... oddanego bogom, odważnego…|Każda dziewczyna chciałaby mieć takiego mężczyznę jak Udalryk… Oddany bogom, odważny…
I'm the one to ask! Me or Axel an Tordarroch. He's over there. What can a bloke from Ard Skellig know about Undvik?|Mnie się pytaj! Mnie albo Axela an Tordarroch. Tam siedzi. Co ktoś z Ard Skellig może wiedzieć o Undvik...|Jestem osobą, którą należy zapytać! Mnie lub Axela an Tordarroch. Jest tam. Co może wiedzieć gość z Ard Skellig o Undvik?| Ja jestem do zapytań tu! Ja albo Axel z Tordarroch. On jest tam. Co może wiedzieć face z Ard Skellig o Undviku?|Jasne - pytaj mnie o rady! Mnie lub Axela z Tordarroku. On tam stoi. Czegoś może nauczyć się od kogoś z Ard Skellig w stosunku do Undviku?|Ja jestem tym, który pyta! Ja czy Axel i Tordarroch. On jest tam. Co facet z Ard Skellig może wiedzieć o Undvik?
Aye.|Dobrze.|Tak.| Hej, słuchaj tutaj.|Tak.|Szansa.
I've seen him looking at you.|Widziałam, jak na ciebie patrzył.|Widziałem, jak na ciebie patrzył.| Ja widziałam jak w niego patrzył.|Widziałem jak on cię obserwował.|Widziałem, jak na ciebie patrzył.
He's dead. And I wager it was you who silenced him.|Nie żyje. I założę się, że to ty go uciszyłaś.|Nie żyje. I założę się, że to ty go uciszyłeś.| On nieżywy. A gorąco postawiłbyś, że to ty umilknąłeś go.|On nie żyje. I sądzę, że to ty go uciszyłeś.|On nie żyje. I obstawiam, że to ty go uciszyłeś.
Nay. It was me decided to leave. Time's come to settle some scores. And you're gonna help me.|Nie. To ja postanowiłem wyjść. Nadszedł czas wyrównać rachunki. A ty mi w tym pomożesz.|Nie. To ja zdecydowałem się odejść. Nadszedł czas, by wyrównać rachunki. I pomożesz mi w tym ty.| Nie. To ja postanowiłem odejść. Poproszę mnie o uregulowanie kilku rachunków. I wy będziecie mi towarzyszyć.|Nie. To ja zdecydowałem o odejściu. Nadszedł czas rozliczyć pewne rachunki. I ty będziesz mi w tym pomagać.|Nie. To ja zdecydowałem, że odejdę. Nadszedł czas, aby wyrównać rachunki. A ty mi pomożesz.
You have to tell me what's going on.|Musisz mi wyjaśnić, co tu się dzieje.|Musisz mi powiedzieć, co się dzieje.| Musisz mi powiedzieć, co się dzieje.|Musisz mi powiedzieć, co się właściwie dzieje.|Musisz mi powiedzieć, co się dzieje.
If brawlin's in your nature and ye care to continue, there's Einar still to fight.|Gdybyś chciał dalej stawać do walki na pięści, to możesz walczyć z Einarem.|Jeśli bijatyki są w twojej naturze i chcesz kontynuować, pozostał jeszcze Einar do pokonania.| Jeśli przebijanie się przez swoją naturę i chciałbyś kontynuować, nadal możesz zmierzyć się z Einarem.|Jeśli bijatyka jest twoją naturą i chcesz kontynuować, istnieje jeszcze Einar do walki.|Jeśli bójki leżą w twojej naturze i chcesz to kontynuować, jest jeszcze Einar, z którym musisz walczyć.
Now, I cannot say I'm not tempted to, hm, intervene, but… I believe I'll let it lie this time.|Nie mówię, że nie korci mnie, żeby hm, zainterweniować, ale... tym razem chyba dam spokój.|Teraz nie mogę powiedzieć, że nie jestem skuszony, hm, wtrącić się, ale... sądzę, że tym razem zostawię to tak.| Teraz po prostu nie mogę powiedzieć, że nie jestem zachęcany do, hm, interwencji, ale... wierzę, że pozwolę na to tym razem.|Teraz, nie mogę powiedzieć, że nie kuszę mnie, hmm... interweniowanie, ale... Myślę, że tym razem pozwolę sprawie się toczyć sama.|Cóż, nie mogę powiedzieć, że nie mam ochoty, hm, interweniować, ale… myślę, że tym razem odpuszczę sobie tę decyzję.
True. Least this time she's got a valid reason for it.|Fakt, ale teraz ma przynajmniej uzasadniony powód.|Tak. Tym razem przynajmniej ma ważny powód.| Prawda. Przynajmniej tym razem ma dobre wyjaśnienie na to.|Prawda. Przynajmniej tym razem ma dobrą wymówkę.|To prawda. Przynajmniej tym razem ma ku temu ważny powód.
Long story. Got something to take care of here.|To długa opowieść. Mam tu coś do zrobienia.|Długa historia. Mam coś do załatwienia tutaj.| Długopis. Mam tu coś do załatwienia.|To długa historia. Muszę coś załatwić tu.|Długa historia. Mam tu coś do załatwienia.
Got anythin' for an itch? 'Cause I've had love aplenty of late, and now I've this horrible rash…|A na swędzenie coś masz? Bo ostatnio od tej miłości wszystko mnie świerzbi...|Masz coś na swędzenie? Bo ostatnio miałem aż za dużo miłości, i teraz mam tę okropną wysypkę…| *'Czy masz coś na swędzenie? 'Bo ostatnio miałem mnóstwo miłości, a teraz mam to okropne wysypanie'*|Czy masz coś przeciw swędzeniu? Bo ostatnio miłości miałem mnóstwo , a teraz mam straszną wysypkę…|Masz coś na swędzenie? Bo ostatnio miałam mnóstwo miłości, a teraz mam tę okropną wysypkę...
