en_text|pl_text|bielik_translation|mixtral-8x22B_translation|llama3.1_translation|google_translation
Wait here, I'll look for the key.|Poczekaj tutaj, a ja znajdę klucz.|Czekaj tutaj, poszukam klucza.| Poczekaj tu, poszukam klucza.|Zaczekaj tu, szukam klucza.|Poczekaj tu, poszukam klucza.
Boo hoo hoo! My deepest sympathies! Now get out of my sight, you imbecile!|Bu hu hu! Wyrazy współczucia! A teraz zejdź mi z oczu, baranie!|Ach, ach, ach! Moje najgłębsze kondolencje! A teraz zejdź mi z oczu, ty idioto!| Hejże, hejże! Moje najpogłębniejsze kondolencje! Teraz schód z mojego pola widzenia, ty głupcze!|Ach, och, ach! Przepraszam najszczersze kondolencje. Teraz wynoś się ze swoim głupstwem z mojego oczu !|Boo hoo hoo! Moje najszczersze kondolencje! A teraz zejdź mi z oczu, ty imbecylu!
Hadn't realized ye knew him so well.|Nawet nie wiedziałem, że tak dobrze go znasz.|Nie zdawałem sobie sprawy, że znałeś go tak dobrze.| Nie zdawałem sobie sprawy, że go znasz tak dobrze.|Nie zdawałem sobie sprawy, że go znasz tak dobrze.|Nie zdawałam sobie sprawy, że znasz go tak dobrze.
Behold - who do I spy? Could it be a challenger for Olaf?!|Spójrzcie – czyżbyśmy mieli przeciwnika dla Olafa?!|Spójrzcie - kogo ja tu widzę? Czy to może być rywal dla Olafa?!| Fuj fuj! Kto tam widać?! Czy to może być wyzwanie dla Olafa?!|Oto - kogo ja widzę Przyjdź no, czyżby to nowy rywal dla Olafa?!|Oto - kogo ja szpieguję? Czy to może być pretendent do Olafa?!
Awfully loyal to your patron…|Bardzo jesteś lojalna wobec swojego mocodawcy.|Okropnie lojalny wobec swojego patrona...| Niewiarygodnie wierny swojemu protektorowi...|'Och, tak bardzo lojalny względem swojego mecenasa...'|Strasznie lojalny wobec swojego patrona…
Guessing there's an ulterior motive to your hospitality.|Zgaduję, że twoja gościnność nie jest bezinteresowna.|Przypuszczam, że jest drugie dno w twojej gościnności.| Odpowiadając intuicji, że jest pewny ukryty motyw za Twoją gościnnością.|Podejrzewam, że twoje gościnność ma jakiś ukryty cel.|Podejrzewam, że Twoja gościnność ma jakieś ukryte intencje.
A young woman, ashen hair, green eyes. What happened to her?|Dziewczyna, szare włosy, zielone oczy. Co się z nią stało?|Młoda kobieta, popielate włosy, zielone oczy. Co się z nią stało?| Młoda kobieta, popielate włosy, zielone oczy. Co się z nią stało?|Młoda kobieta, siwe włosy, zielone oczy. Co się stało z nią?|Młoda kobieta, popielate włosy, zielone oczy. Co się z nią stało?
Like you to craft something for me.|Chciałbym, żebyś coś dla mnie wykonał.|Tak jak ty tworzysz coś dla mnie.| Poproszę o zrobienie mi czegoś.|Czy mógłbyś coś ukuć dla mnie.|Chciałbym, żebyś coś dla mnie stworzył.
Into the fire!|W ogień!|W ogień!| 'W ogień!'|Do ognia!|W ogień!
If you're looking to die, that's your problem. So long.|Jeśli chcecie zginąć, to wasza sprawa. Bywajcie.|Jeśli szukasz śmierci, to twój problem. Żegnaj.| Jeśli szukasz śmierci, to twoja sprawa. Do widzenia.|Jeśli chcesz umrzeć, to twój problem. Żegnaj.|Jeśli chcesz umrzeć, to twój problem. Do zobaczenia.
Where did she go?|Dokąd poszła?|Dokąd ona poszła?| Gdzie ona poszła?|'Dokąd poszła?'|Gdzie ona poszła?
Maybe a mug of mead.|Może kielich miodu.|Może kubek miodu pitnego.| Może kubek miodu pitnego.|Może kubek miodu.|Może kufel miodu pitnego.
What's strange about that? See them at sea every few crests…|Co w tym dziwnego? Na morzu co i raz takie się widzi...|Co w tym dziwnego? Widzę ich na morzu co kilka grzbietów...| 'Co w tym dziwnego? Widzę ich na morzu co kilka fal...'|Cóż w tym dziwnego. Widuje je na morzu co kilka grzbietów...|Co w tym dziwnego? Widzimy je na morzu co kilka szczytów…
Now we pay a visit to Ermion's laboratory.|Teraz złożymy wizytę w laboratorium Myszowora.|Teraz składamy wizytę w laboratorium Ermiona.| Teraz odwiedzamy laboratorium Ermiona.|Teraz odwiedzimy laboratorium Ermiona.|Teraz odwiedzimy laboratorium Ermiona.
Get rid of them!|Pozbądź się ich!|Pozbądź się ich!| 'Usuń je!', Ma na myśli 'usuwać ich'!|Rzućcie ich!|Pozbądź się ich!
I take it your suspicions were confirmed.|Rozumiem, że twoje wątpliwości się potwierdziły.|"""Jak rozumiem, twoje podejrzenia się potwierdziły."""|" Oto mój przekład: ""Uważam, że Twoje podejrzenia się potwierdziły."""|Zakładam, że twoje podejrzenia zostały potwierdzone.|Zakładam, że Twoje podejrzenia się potwierdziły.
Cerys speaks true. Birna commanded me to poison the mead. When Cerys and the witcher descended into the cellars--|Ona mówi prawdę. To Birna kazała zatruć miód. Kiedy Cerys i wiedźmin zeszli do piwnicy...|Cerys mówi prawdę. Birna kazała mi zatruć miód. Kiedy Cerys i wiedźmin zeszli do piwnic -|" ""Cerys mówi prawdę. Birna nakazała mi zatruć miód. Kiedy Cerys i wiedźmin schodzili do piwnic--"""|Panie Cerys mówi prawdę. Birna rozkazała mi otruć napój. Kiedy Cerys wraz ze strzygą zeszli do piwnic|Cerys mówi prawdę. Birna kazała mi zatruć miód pitny. Gdy Cerys i wiedźmin zeszli do piwnic...
Fear not, Jarl. I'll not let you perish, I assure you. You need only follow my council.|Nie lękaj się, panie. Na pewno nie dam ci zginąć. Musisz tylko postępować wedle moich wskazówek.|Nie bój się, jarlu. Nie pozwolę ci zginąć, mogę to przysiąc. Musisz tylko podążać za moją radą.| Nie bój się, Jarlu. Nie pozwolę, abyś zginął, to jest pewne. Musisz tylko słuchać moich rad.|Nie bój się, Jarlu. Nie pozwolę byś zginął, zapewniam cię. Musisz jedynie słuchać moich rad.|Nie lękaj się, Jarlu. Nie pozwolę ci zginąć, zapewniam cię. Musisz tylko słuchać mojej rady.
Say that one more time, and eels'll be eatin' your eyes afore the sun sets.|Powtórz to, a nim słońce zajdzie, węgorze ci oczy wyjedzą.|Powiedz to jeszcze raz, a węże zeżrą ci oczy zanim zajdzie słońce.| Powiedz to jeszcze raz, a węgorze zjedzą twoje oczy zanim słońce zajdzie.|Powiedz to jeszcze raz, a węgorze będą jeść twoje oczy, zanim zajdzie słońce.|Powiedz to jeszcze raz, a węgorze wydziobią ci oczy, zanim zajdzie słońce.
Just look - iron ore from the bowels of Mount Ard Faand, where giants once tore up the earth. Then my forge fire, blazin' unbroken for six generations, it's care passed from father to son.|Spójrz. Żelazo wydarte z trzewi góry Ard Faand, gdzie swoje kopalnie miały olbrzymy. Ogień w mojej kuźni nie zgasł od sześciu pokoleń – przechodzi z ojca na syna.|Po prostu spójrz - ruda żelaza z trzewi Góry Ard Faand, gdzie niegdyś olbrzymy rozdzierały ziemię. Następnie mój ogień kuźniczy, płonący bez przerwy przez sześć pokoleń, przekazywany od ojca do syna.| Prostu patrz - ruda żelaza z wnętrza Góry Ard Faand, gdzie kiedyś olbrzymy rozrywały ziemię. Potem mój piec hutniczy, płonący bez przerwy przez sześć pokoleń, jego pieczenie przechodziło z ojca na syna.|Popatrz tylko - ruda żelaza z wnętrza góry Mt. Ard Faand, gdzie giganci kiedyś rozdarli Ziemię. Potem mój ogni wytopowy, płonący bez przerwy przez sześć pokoleń, jego opieka przekazywana była z ojca na syna.|Spójrz tylko - ruda żelaza z wnętrzności Mount Ard Faand, gdzie giganci niegdyś rozrywali ziemię. A potem mój ogień kuźni, płonący nieprzerwanie przez sześć pokoleń, jego opieka przechodziła z ojca na syna.
Hope you know what you're doing…|Mam nadzieję, że wiesz, co robisz...|Mam nadzieję, że wiesz, co robisz…| Mam nadzieję, że wiesz, co robisz…|Mam nadzieję, że wiesz co robisz...|Mam nadzieję, że wiesz, co robisz…
I won! I won!|Wygrałem! Wygrałem!!!|Wygrałem! Wygrałem!| Wygrałem! Wygrałem!|Wygrałem. Wygrałem!|Wygrałem! Wygrałem!
What brings you to me?|Z czym przychodzisz?|Co cię do mnie sprowadza?| Co cię doprowadza do mnie?|Cóż ciebie do mnie sprowadza?|Co cię do mnie sprowadza?
We use sea outings as cures for many things… Sadly, this time it didn't work.|U nas morskie wyprawy są lekiem na wiele rzeczy... Niestety, tym razem stało się inaczej.|Używamy rejsów morskich jako lekarstwa na wiele rzeczy... Niestety tym razem to nie zadziałało.| Posługujemy się rejsami na morze jako lekarstwem na wiele rzeczy ... Niestety, tym razem nie przyniosło to skutku.|Używamy rejsów morskich jako lekarstwo dla wielu rzeczy… Niestety tym razem to nie zadziałało.|Wycieczki morskie są dla nas lekarstwem na wiele dolegliwości… Niestety, tym razem to nie zadziałało.
Did ye know a cow's got two stomachs?|A wiecie, że krowa to ma dwa żołądki?|Czy wiedziałeś, że krowa ma dwa żołądki?| Czy wiedziałeś, że krowa ma dwa żołądki?|Czy wiesz, że krowa ma dwa żołądki?|Czy wiesz, że krowa ma dwa żołądki?
Whaddaya want?|A ty tu czego?|Czego chcesz?| Co chcesz?|Co chcesz?|Czego chcesz?
Spiked gloves… black with dried blood.|Rękawice nabite ćwiekami... Czerwone od zakrzepłej krwi.|Uzbrojone rękawice... czarne z wyschniętą krwią.| Rękawice z kolcami… czarne ze wyschniętą krwią.|Rękawice z kolcami... czarne od zaschniętej krwi.|Kolczaste rękawice… czarne od zaschniętej krwi.
We've offended him, Sven. The Woodland Spirit seeks revenge. This here is him saying we've strayed from the old paths.|Obraziliśmy go, Sven. Duch Lasu mści się na nas. Mówi, że zboczyliśmy ze starej ścieżki.|"""Obraziliśmy go, Sven. Duch Lasu szuka zemsty. To oznacza, że oddaliliśmy się od starych ścieżek."""| 'Znieważyliśmy go, Svniu. Duch lasu pragnie zemsty. To właśnie on mówi, że odeszliśmy od dawnych ścieżek.'|Obraziłeś go Svenie, Duch Lasu żąda zemsty. Tu powiada, że odeszliśmy od starych ścieżek.|Obraziliśmy go, Sven. Duch Lasu szuka zemsty. Oto on, mówiący, że zboczyliśmy ze starych ścieżek.
You died for a good cause, sheep. Rest in peace.|Zginęłaś w słusznej sprawie, owco. Niech ci ziemia lekką będzie.|"""Umarliście za dobrą sprawę, owce. Odpoczywajcie w pokoju.""

---

Wyjaśnienie:
1. ""You died for a good cause"": Odnosi się do ludzi lub istot, które poświęciły swoje życie dla czegoś wartościowego.
2. ""Sheep"" (ang. owce) to często używane we flamandzkim słowo oznaczające anarchistów; tutaj określa osoby, do których mowa.
3. ""Rest in peace"" (łac. requiescat in pace) to tradycyjna formuła żałobna wyrażająca współczucie zmarłym, sugerująca spokój zmarłemu."| Żegnam cię, owco. Umierając, służyłeś dobrej sprawie. Niech spoczywasz w pokoju.|Zmarłeś dla dobrej sprawy, owco. Spoczywaj w pokoju.|Zginąłeś za dobrą sprawę, owieczko. Spoczywaj w pokoju.
Birna should be the one goin', they shared a bed longer.|Birna powinna była za nim pójść, dłużej łoże dzielili.|Birna powinna być tą, która pójdzie. Dzielili łóżko dłużej.| Birna powinna tam iść, dzielili łóżko dużo dłużej.|Powinien to być Birn, skoro on dłużej dzielił z nią łóżko.|Birna powinna iść, bo dłużej spali w jednym łóżku.
Ahem…|Khem...|Ehem...|" Jeśli chodzi o słowo ""Ahem"", nie jest to zdanie i nie ma złożonego znaczenia, które należy przetłumaczyć. ""Ahem"" to raczej dźwięk, który ludzie wydają, aby zwrócić uwagę na siebie lub upewnić się, że ich słuchacze są zaangażowani w rozmowę. W polskim języku możemy to oddać przez ""Ajem"" lub ""Fu,""."|„Hm...”|Eee…
Why rarely?|Dlaczego rzadko?|Dlaczego rzadko?| Dlaczego rzadko?|Czemu rzadko?|Dlaczego rzadko?
My, no, that's not it at all. The golems are but one of the tower's defenses. Part of its Defensive Regulatory Magicon.|Nie, to nie tak. Golemy są jednym z zabezpieczeń wieży. Częścią Defensywnego Regulatora Magicznego.|"""Nie, nie o to chodzi zupełnie. Golemy są tylko jedną z obron wieży. Częścią jej Magikonu Defense Regulation."""| Nie, to nie to właściwie. Golemy to tylko jedna z obron toweru. Część jego Regulatora Obrony Magicznej.|Nie to jest sprawa. Golemy są tylko jednym z mechanizmów obronnych wieży. Częścią jej Obronnego Regulacyjnego Magikonu.|No nie, to nie to. Golemy to tylko jedna z obron wieży. Część jej Defensive Regulatory Magicon.
He didn't expect to be pursued… Might not've managed to take everything.|Nie spodziewał się, że ktoś będzie go ścigał... Może nie zdążył zabrać wszystkiego.|Nie spodziewał się, że będą go ścigać… Może nie zdołałby wszystkiego wziąć.| Nie spodziewał się, że będzie ścigany... Może nie zdołał wziąć wszystkiego.|Nie spodziewał się pościgu... Może i udało by mu się zabrać wszystko.|Nie spodziewał się, że będzie ścigany... Być może nie udałoby mu się zabrać wszystkiego.
Aye.|Tak.|Tak.| Tak.|Tak.|Szansa.
They say the Wild Hunt destroyed this village…|Mówią, że tę wioskę zniszczył Dziki Gon...|Mówią, że Dziki Łów zniszczył tę wieś...| Mówi się, że Dzika Łowa zniszczyła to wioskę...|Oni mówią, że Dzikie Polowanie zniszczyło … tę wieś.|Mówią, że Dziki Gon zniszczył tę wioskę…
Beh! *Cough cough*|A khe khe!|Ha! *Kaszel kaszel*|" Przepraszam! *Wszczekaj się, kichnięcie*

Tłumaczenie „Beh” na samo „przepraszam” może nie być bezpośrednio poprawne, ponieważ „Beh” może być również wypowiadane jako lekko złościwa reakcja. Jednak zazwyczaj „Beh” tłumaczy się jako „przepraszam”, jeśli jest wypowiadane z naprawdę chorobliwym zaniepokojeniem, np. przed głośnym kaszlem."|Och! Kaszel kaszel!|Beh! *Kaszel kaszel*
For the good of the village, Sven.|Dla dobra wsi, Sven.|Dla dobra wioski, Sven.| Dla dobra wsi, Sven.|Dla dobra wioski, Svenie.|Dla dobra wioski, Sven.
I'm ready. Let's start.|Jestem. Zaczynajmy.|Jestem gotowy. Zacznijmy.| Jestem gotowy. Zaczynamy.|"""Jestem gotowy. Zaczynajmy."""|Jestem gotowy. Zaczynajmy.
Think I deserve more. Water hag's significantly more dangerous than drowners.|Należy się więcej. Baba wodna jest znacznie groźniejszym potworem niż utopce.|Myślę, że zasługuję na więcej. Rusałka wodna jest znacznie bardziej niebezpieczna niż utopiec.| Myślę, że zasługuję na więcej. Rusałka jest znacznie bardziej niebezpieczna niż utopce.|'Myślę, że zasługuję na więcej. Wróżka wody jest znacznie groźniejsza niż topielce.'|Myślę, że zasługuję na więcej. Wiedźmy wodne są znacznie bardziej niebezpieczne niż utopce.
What did you say?!|Coś ty powiedziała?|Co powiedziałeś?!| Co ty powiedziałeś?|Coś powiedziałeś?|Co powiedziałeś?!
Listen - it's our arena, got a wraith that haunts it. Damned if we know how to drive it off. Think you could manage?|Upiór nam się na arenie objawił. Nijak go ruszyć. Może byście coś poradzili?|Słuchaj - to jest nasza arena, mamy tu upiora, który ją nęka. Jasny gwint, nie wiemy jak się go pozbyć. Myślisz, że byś sobie poradził?| 'Posłuchaj - to nasz teren, jest tam witraż, który go nawiedza. Przeklęte jest, że wiemy, jak to zeń wypędzić. Myślisz, że potrafisz to załatwić?'|Słuchaj - to nasza arena, ma ducha, który ją nawiedza. Przeklęci, jeśli wiemy jak go przepędzić. Czy uważasz, że możesz sobie z tym poradzić?|Słuchaj - to nasza arena, nawiedza ją widmo. Cholera, jeśli wiemy, jak je odgonić. Myślisz, że dasz radę?
You'll think of something!|Coś wymyślisz!|Wymyślisz coś!| Z pewnością wpadniesz na coś!|Będzie ci się coś/wpomyslisz coś.|Wymyślisz coś!
Pull yourself together, Sinna. How'd they get in?|Weź się w garść, Sinna. Jak tu weszły?|Otrząśnij się, Sinna. Jak udało im się wejść?| Zinieś się, Sinna. Jak się tam wdarli?|Odnów się, Sinna. Jak to im udało się tu wejść?|Weź się w garść, Sinna. Jak oni się tam dostali?
Clan An Craite Elder|Starszy z klanu Craite|Ród An Craite Starszy| 'Starszy Księcia An Craite'|Starszy Klanu An'Craite|Klan An Craite Starszy
Think I'll manage on my own.|Poradzę sobie sam.|Chyba dam sobie radę.| Może się obejdę samodzielnie.|Myślę, że sobie poradzę.|Myślę, że dam sobie radę sam.
Knew you were thick, Brambling, but that thick? To waltz into me… Who the hell's this?|Wiedziałem, że jesteś głupi, Simun, ale żeby aż tak? Pchać się w moje... A ty coś za jeden?|Wiedziałem, że jesteś głupi, Brambling, ale aż tak głupi? Aby tu wejść... Kto to do cholery jest?| Wiedziałem, że jesteś gruby jak opersztyk, Brambling, ale tak gruby? Żeby wpaść do mnie… Kto do cholery to jest?|Wiedziałem, że jesteś ograniczony, Bramblingu, ale aż tak? Wejść do mnie... Kto diabli to jest?|Wiedziałem, że jesteś tępy, Brambling, ale aż tak? Żeby wpaść do mnie... Kim do cholery jest ta osoba?
Mhm. Think the spirits of Skellige favor us.|Mhm. Skelligijskie duchy nam sprzyjają.|Mhm. Myślę, że duchy Skelligu nam sprzyjają.| Hum. Myślę, że duchy Skellige sprzyjają nam.|'Mhm. Myślę, że duchy ze Skellige są po naszej stronie.'|Mhm. Myślę, że duchy Skellige nam sprzyjają.
You and Ciri grew up together…|Ty i Ciri wychowywaliście się razem...|Ty i Ciri dorastaliście razem...| Ty i Ciri dorastaliście razem...|Ty i Ciri wyrastaliście razem…|Ty i Ciri dorastaliście razem…
So do I…|Ja też...|Więc ja też...| Tak samo czuję... (lub: Tak samo mam na myśli...)|Ja też…|Ja też…
Can't do that. Jonna doesn't deserve it.|Nie zrobię tego. Jona na to nie zasłużyła.|Nie można tego zrobić. Jonna nie zasługuje na to.| Nie można tego zrobić. Jonna tego nie zasługuje.|Nie mogę tego zrobić. Jonnie nie należy się to.|Nie możesz tego zrobić. Jonna na to nie zasługuje.
Fine. Let's do it.|Dobrze, zróbmy to.|Dobrze. Zróbmy to.| Dobrze. Zróbmy to.|W porządku. Zróbmy to.|Dobra. Zróbmy to.
Not about to throw the fight.|Nie podłożę się.|Nie zamierzam rzucać walki.| Nie mam zamiaru przegrywać walki.|Nie zamierzam oddać walki.|Nie zamierzam poddać walki.
Neither. And we're not in Kovir. We're in Skellige.|Ani jedno, ani drugie. I nie jesteśmy w Kovirze, tylko na Skellige.|Żaden. I nie jesteśmy w Kovirze. Jesteśmy w Skellige.| Żadna. I nie jesteśmy w Kovirze. Jesteśmy w Skellige.|Nie i nie jesteśmy w Kovirze. Jesteśmy na Wyspach Skellige.|Ani jedno, ani drugie. I nie jesteśmy w Kovir. Jesteśmy na Skellige.
Greetings…|Witaj...|Pozdrowienia...| Witaj...|Witam...|Pozdrowienia…
I asked some of the local folk. Some here still remember him.|Wcześniej popytałam tu trochę o niego. Niektórzy ciągle go pamiętają.|Zapytałem niektórych miejscowych. Niektórzy nadal go pamiętają.| Poprosiłem niektórych mieszkańców. Niewielu tu wciąż pamięta go.|Zapytałem kilku mieszkańców okolicy. Niektórzy tu jeszcze pamiętają go.|Zapytałem kilku miejscowych. Niektórzy tutaj nadal go pamiętają.
So? Ready?|I jak? Gotowy?|Więc? Gotowy?| Tak? Gotowy?|No? Gotowi?|No i co? Gotowy?
Bran - a great king, a great man.|Bran był wielkim człowiekiem.|Bran - wielki król, wielki człowiek.| Bran - wielki król, wielki człowiek.|Bran - wielki król, wielki człowiek.|Bran - wielki król, wielki człowiek.
We're here. The hot springs.|Jesteśmy na miejscu. Gorące źródła.|Jesteśmy tutaj. Gorące źródła.| Jesteśmy tutaj. Gorące źródła.|Jesteśmy tutaj. Źródła termalne.|Jesteśmy tutaj. Gorące źródła.
We should see to your friend.|Trzeba się zająć twoim przyjacielem.|Powinniśmy zająć się twoim przyjacielem.| Powinniśmy pogodzić się z twoim przyjacielem.|Powinniśmy się zająć twoim przyjacielem.|Powinniśmy odwiedzić twojego przyjaciela.
Just warmin' up. Well, what're you waiting for? Go call the next one.|No, dalej, wołaj następnego. Dopiero się rozgrzewam.|Tylko się rozgrzewam. No dobrze, na co czekasz? Zadzwoń do następnego.| 'Po prostu się rozgrzewam. No dobrze, czego się jeszcze spodziewasz? Idź i zadzwoń do następnego.'|Tylko rozgrzewa się. Cóż, czego czekasz? Idź zadzwoń po następne.|Tylko się rozgrzewam. No więc, na co czekasz? Idź i zadzwoń do następnego.
Better sail out on a raid, do some honest lootin'.|Lepiej na jakąś rejzę ruszyć i uczciwie się obłowić.|"Konspirator.info to portal informacyjny o tematyce geopolitycznej w języku polskim, który powstał jako platforma publikująca artykuły z różnych źródeł internetowych dotyczące sytuacji międzynarodowej, spisków, teorii konspiracyjnych oraz wydarzeń politycznych. Tekst powyżej jest przykładowym tłumaczeniem i mojej odpowiedzi:

""Lepiej wyruszyć na łupieżczy rajd"".

Jestem tu, aby pomagać tłumacząc teksty i dostarczać podstawowe informacje o Konspirator.info na podstawie danych publicznych dostępnych do momentu moich informacji (2023). Jeśli potrzebujesz dodatkowych szczegółów lub masz inne pytania, śmiało pytaj!"| Lepiej wyruszyć w korsarską wyprawę i dokonać uczciwego łupiestwa.|Lepiej wyruszyć na rajd i poharować uczciwie.|Lepiej wyruszyć na wyprawę i uczciwie splądrować.
Salty.|Solony.|Solony.| Słone.|Słony.|Słony.
This'll be tough to open.|Trudno będzie to otworzyć.|To będzie trudne do otwarcia.| To będzie trudno to otworzyć.|To będzie trudne do otwarcia.|Trudno będzie to otworzyć.
We are slaves to fear spread by blind fools like you. These woods are ours. High time we put an end to this beast.|Jesteśmy niewolnikami strachu podsycanego przez takich ślepców jak ty. To nasz las i najwyższy czas skończyć z bestią.|Jesteśmy niewolnikami strachu rozprzestrzenianego przez ślepych głupców takich jak ty. Ten las należy do nas. Nadszedł czas zakończyć istnienie tej bestii.| 'Jesteśmy niewolnikami strachu rozsiewanego przez głupców jak ty. Te lasy są nasze. Czas już pokonać tę bestię.'|Jesteśmy niewolnikami strachu rozpowszechnianego przez ślepych głupców takich jak ty. Te lasy są nasze. Najwyższy czas zakończyć ten bestialski stan rzeczy.|Jesteśmy niewolnikami strachu szerzonego przez ślepych głupców takich jak ty. Te lasy są nasze. Najwyższy czas położyć kres tej bestii.
I wanna talk about the past, the Wild Hunt.|Chcę pogadać o przeszłości i Dzikim Gonie.|Chcę porozmawiać o przeszłości, o Dzikiej Łowczyni.| Chcę porozmawiać o przeszłości, o Dzikiej Łownej.|Chcę opowiedzieć o przeszłości, Dzikim Gonie.|Chcę porozmawiać o przeszłości, o Dzikim Gonie.
And an excellent chance of snappin' his leg off at the arse.|...i wyjątkową szansę na obcięcie nogi przy samej rzyci.|I doskonałą szansę złamania mu nogi w dupie.| I znakomita szansa na złamanie mu uda.|I doskonała szansa, by oberwać nogą prosto w tyłek.|I świetna okazja, żeby urżnąć mu nogę.
You Svana? Here about the Heroes' Pursuits.|Ty jesteś Svana? Przychodzę w sprawie Wyścigów Śmiałków.|Czy pani wie? Chodzi o pogonie za bohaterami. (Note: There are no additional explanations provided.)| Ty jestesz Svana? Tu masz na temat Pogoni Herosow.|Czy jesteś Svaną? Tu jest o Pościgach Bohaterów.|Ty Svana? Tutaj o Heroes&#39; Pursuits.
Anybody see how the bears got in?|Nikt nie widział, skąd się wzięły te niedźwiedzie?|Ktokolwiek widział, jak niedźwiedzie się dostały?| Ktoś widział, jak niedźwiedzie dostały się do środka?|Czy ktoś widział jak niedźwiedzie się dostały do środka?|Czy ktoś widział jak niedźwiedzie się tu dostały?
For robbin' the earth of iron, forgin' it into blades that men kill one another with. That Freya would punish us. Mayhaps they spoke the truth…|Że niby żelazo ziemi wybieramy, przekuwamy na pancerze, a potem ludzie w nich śmierć niosą... Że Freyja nas ukarze. Może i prawdę mówiły...|By okradać ziemię z żelaza, przekuwać je w ostrza którymi mężczyźni zabijają się nawzajem. Aby Freya ukarała nas za to. Być może mówili prawdę...| 'Za kradzież żelaza z ziemi, wykuwanie go w ostrza, którymi ludzie mordują się nawzajem. Że Freja nas ukara. Może tak naprawdę mówili prawdę…'|'O skalania ziemi dla zyskania żelaza, którego używają do włóczni, żeby ludzie zabijali się nawzajem. Za to bogini Freyjaka ukara nas. Być może mówili prawdę...'|Za okradanie ziemi z żelaza, przekuwanie jej na ostrza, którymi ludzie zabijają się nawzajem. Że Freya nas ukarze. Może mówili prawdę…
You land rats are all the same - afeard o' your wenches.|Szczury lądowe są wszystkie takie same. Boją się swoich bab.|Wszystkie szczury lądowe są takie same - boją się swoich dam.| Wy jesteście wszyscy tacy sami szczury lądowe, bojące się swoich kobiet.|Wy możecie być lądowymi szczurami - ale wszyscy jesteście tacy sami, boicie się swoich bab.|Wy, szczury lądowe, wszystkie jesteście takie same – boicie się waszych dziewczyn.
Job's done.|Wykonałem zlecenie.|Praca skończona.| Zadanie wykonane.|'Dzieło spełnione.'|Robota wykonana.
What would you say to a few rounds of gwent?|A może nie pogardzisz partyjką gwinta...?|Co powiesz na kilka rundek gwinta?| Co byś powiedział na kilka rund gwinta?|Co powiesz na parę rund Gwinta?|Co powiedziałbyś na kilka rund gwinta?
Ciri… Zireael… Can you hear me?|Ciri... Jaskółko... Słyszysz mnie?|Ciri… Zireael… Czy mnie słyszysz?| 'Ciri... Zireael... Czy słyszysz mnie?'|Ciri… Zireael… Czy mnie słyszysz?|Ciri… Zireael… Czy mnie słyszysz?
Any who drop, I'll leave behind. Ville only wants the strong.|Który padnie, to padnie, reszta zostanie. Villemu zależy tylko na silnych.|Każdego, kto odpadnie, zostawię za sobą. Ville chce tylko silnych.| 'Ktokolwiek osłabi, zostawię w tyle. Ville chce tylko najsilniejszych.'|Ktokolwiek upuści się, zostawię w tyle. Ville chce tylko silnych.|Każdego, kto upadnie, zostawię. Ville chce tylko silnych.
